,company,date,title,content
1284,By Investing.com,"<span>May 22, 2013 09:08PM ET</span>","Oil falls on inventories data, Bernanke comments ","Investing.com - Oil futures traded lower during Thursday’s Asian session as traders focused more on inventories data and comments from Federal Reserve Chairman Ben Bernanke than some decent housing data out of the U.S. On the New York Mercantile Exchange, light, sweet crude futures for July delivery fell 0.33% to USD93.97 per barrel.  In U.S. economic news, the National Association of Realtors said existing home sales rose 0.6% last month to an annual rate of 4.97 million units, the highest level since November 2009. However, that data point went largely ignored by oil traders after the U.S. Energy Information Administration said in its weekly report that U.S. crude oil inventories fell by 338,000 barrels in the week ended May 17, compared to expectations for a decline of 778,000 barrels. Total U.S. crude oil inventories stood at 394.6 million barrels as of last week.The report also showed that total motor gasoline inventories increased by 3.02 million barrels, well above expectations for an increase of 22,000 barrels, which sent crude prices falling on fears less Americans may be traveling this summer. Also on Wednesday, Bernanke said the Fed’s USD85 billion per month bond-buying program, also known as the third version of quantitative easing, will stay in place for now. That is what financial markets wanted to hear, but the Fed chairman threw a curve ball by saying QE could taper off if conditions in the world’s largest economy improve. In prepared testimony in Congress earlier, Bernanke said ultra-loose monetary policy was providing ""significant benefits"" to the economic recovery and reiterated that the bank’s asset-purchasing program will remain in place for now.Bernanke added withdrawing monetary stimulus could prompt interest rates to rise temporarily but could threaten the country's economic recovery as well as price stability down the road.""A premature tightening of monetary policy could lead interest rates to rise temporarily but would also carry a substantial risk of slowing or ending the economic recovery and causing inflation to fall further,"" Bernanke said in prepared remarks of his testimony. Elsewhere, Brent futures for July delivery fell 0.15% to USD102.29 per barrel on the ICE Futures Exchange."
1285,By Investing.com,"<span>May 22, 2013 09:02PM ET</span>",Gold falls on mixed Bernanke comments ,
1286,By Investing.com,"<span>May 22, 2013 02:18PM ET</span>","Crude falls as gasoline supply data disappoints, Bernanke comments weigh",
1287,By Investing.com,"<span>May 22, 2013 12:38PM ET</span>",Natural gas falls as weather models call for cooler weather,
1288,By Investing.com,"<span>May 22, 2013 12:22PM ET</span>","Gold falls as Bernanke says policy stays loose, but under review",
1289,By Investing.com,"<span>May 22, 2013 10:44AM ET</span>","Crude oil futures remain lower after supply data, Bernanke",
1290,By Investing.com,"<span>May 22, 2013 10:03AM ET</span>",Natural gas futures edge lower after hitting 3-week high,
1291,By Investing.com,"<span>May 22, 2013 09:03AM ET</span>","Gold futures rise 1% ahead of Bernanke, Fed minutes",
1292,By Investing.com,"<span>May 22, 2013 07:44AM ET</span>",Soft futures mixed; Coffee falls to lowest since May 2010 ,
1293,By Investing.com,"<span>May 22, 2013 05:43AM ET</span>",Grain futures little changed; Corn steadies after previous day’s slide,
1294,By Investing.com,"<span>May 22, 2013 05:14AM ET</span>",Copper futures rally to 2-week high on Fed easing expectations,
1295,By Investing.com,"<span>May 22, 2013 04:24AM ET</span>","Silver futures edge higher with Bernanke, FOMC minutes in focus",
1296,By Investing.com,"<span>May 22, 2013 03:57AM ET</span>","Crude oil futures edge lower ahead of supply data, Bernanke",
1297,By Investing.com,"<span>May 22, 2013 03:30AM ET</span>","Gold futures gain ahead of Bernanke, U.S. stimulus in focus",
1298,By Investing.com,"<span>May 21, 2013 08:54PM ET</span>",Oil falls following API data,
1299,By Investing.com,"<span>May 21, 2013 08:38PM ET</span>",Gold continues to fall even as dollar loses ground ,
1300,By Investing.com,"<span>May 21, 2013 01:46PM ET</span>",Natural gas extends rally on forecasts for warmer temperatures,
1301,By Investing.com,"<span>May 21, 2013 01:23PM ET</span>",Gold falls as dollar strengthens ahead of Bernanke testimony,
1302,By Investing.com,"<span>May 21, 2013 12:12PM ET</span>", Crude falls amid monetary uncertainty head of Bernanke testimony,
1303,By Investing.com,"<span>May 21, 2013 10:42AM ET</span>",Crude oil futures edge lower with U.S. supply data in focus,
1304,By Investing.com,"<span>May 21, 2013 10:01AM ET</span>",Natural gas futures rally 2% in early trade to hit 3-week high,
1305,By Investing.com,"<span>May 21, 2013 09:01AM ET</span>","Gold under pressure as dollar firms ahead of Bernanke, Fed minutes",
1306,By Investing.com,"<span>May 21, 2013 07:42AM ET</span>",Soft futures decline; Sugar trades at lowest since August 2010,
1307,By Investing.com,"<span>May 21, 2013 06:13AM ET</span>",Grain futures mostly lower; Corn tumbles on U.S. crop progress,
1308,By Investing.com,"<span>May 21, 2013 05:18AM ET</span>","Copper pulls back slightly ahead of Bernanke, FOMC minutes",
1309,By Investing.com,"<span>May 21, 2013 04:41AM ET</span>","Silver futures fluctuate ahead of Bernanke, Fed minutes",
1310,By Investing.com,"<span>May 21, 2013 04:08AM ET</span>",Crude oil futures little changed near 7-week high ,
1311,By Investing.com,"<span>May 21, 2013 03:32AM ET</span>",Gold futures edge higher with Federal Reserve policy in focus,
1312,By Investing.com,"<span>May 20, 2013 08:45PM ET</span>",Oil steady as dollar firms,
1313,By Investing.com,"<span>May 20, 2013 08:27PM ET</span>",Gold continues to rebound in Asia ,
1314,By Investing.com,"<span>May 20, 2013 03:14PM ET</span>",Gold gains as Japanese minister comments on yen weaken dollar,
1315,By Investing.com,"<span>May 20, 2013 03:04PM ET</span>", Crude rises as Japanese official comments weaken dollar ,
1316,By Investing.com,"<span>May 20, 2013 01:44PM ET</span>",Natural gas shoots up as forecasts point to hotter temperatures,
1317,By Investing.com,"<span>May 20, 2013 10:34AM ET</span>",Natural gas futures rally to 2-week high with warm weather in focus,
1318,By Investing.com,"<span>May 20, 2013 10:00AM ET</span>",Crude oil declines as markets await further clues on U.S. economy,
1319,By Investing.com,"<span>May 20, 2013 09:03AM ET</span>","Gold futures fall to 5-week low, silver down 4% with Fed in focus",
1320,By Investing.com,"<span>May 20, 2013 07:39AM ET</span>",Soft futures decline; Coffee falls to 2-week low ,
1321,By Investing.com,"<span>May 20, 2013 06:04AM ET</span>",Grain futures mixed; Soybeans trade at 8-week high,
1322,By Investing.com,"<span>May 20, 2013 05:08AM ET</span>",Copper slumps 1% as investors await further clues on U.S. economy,
1323,By Investing.com,"<span>May 20, 2013 04:32AM ET</span>",Silver plunges more than 5% to hit lowest since September 2010,
1324,By Investing.com,"<span>May 20, 2013 04:00AM ET</span>",Crude oil futures edge lower to trade below USD96 a barrel,
1325,By Investing.com,"<span>May 20, 2013 03:29AM ET</span>",Gold futures fall for eighth day; Silver plunges to 32-month low,
1326,By Investing.com,"<span>May 19, 2013 08:20PM ET</span>",Oil down slightly as other commodities slide,
1327,By Investing.com,"<span>May 19, 2013 08:05PM ET</span>",Gold slides as bearish bets jump,
1328,By Investing.com,"<span>May 19, 2013 06:40PM ET</span>",Gold futures lower during the Asian session,
1329,By Investing.com,"<span>May 19, 2013 10:37AM ET</span>",Natural gas futures - Weekly outlook: May 20 - 24,
1330,By Investing.com,"<span>May 19, 2013 07:14AM ET</span>",Grain futures - Weekly outlook: May 20 - 24,
1331,By Investing.com,"<span>May 19, 2013 06:37AM ET</span>",Crude oil futures - Weekly outlook: May 20 - 24,
1332,By Investing.com,"<span>May 19, 2013 06:16AM ET</span>",Gold / Silver / Copper futures - Weekly outlook: May 20 - 24,
1333,By Investing.com,"<span>May 17, 2013 01:09PM ET</span>",Natural gas gains on forecasts for late-season cool snap,
1334,By Investing.com,"<span>May 17, 2013 12:29PM ET</span>","Gold falls on consumer sentiment data, hawkish Fed comments",
1335,By Investing.com,"<span>May 17, 2013 11:49AM ET</span>","Crude trims gains, remains higher on improving U.S. consumer data",
1336,By Investing.com,"<span>May 16, 2013 08:42PM ET</span>",Gold dips as talk that weak U.S. data will keep Fed policy loose wanes,
1337,By Investing.com,"<span>May 16, 2013 08:21PM ET</span>",Crude dips as Fed officials downplay talk of prolonged stimulus,
1338,By Investing.com,"<span>May 16, 2013 02:35PM ET</span>",Natural gas plunges by more than 3% on U.S. supply data,
1339,By Investing.com,"<span>May 16, 2013 02:23PM ET</span>",Crude gains as weak data sparks talk of prolonged Fed stimulus,
1340,By Investing.com,"<span>May 16, 2013 01:47PM ET</span>",Gold drops despite talk that weak U.S. data will keep Fed policy loose,
1341,By Investing.com,"<span>May 16, 2013 10:39AM ET</span>",Natural gas futures plunge 3% after U.S. supply report ,
1342,By Investing.com,"<span>May 16, 2013 10:04AM ET</span>",Crude oil futures turn higher as dollar weakens after U.S. data,
1343,By Investing.com,"<span>May 16, 2013 09:09AM ET</span>",Gold futures retain bulk of losses in wake of U.S. data,
1344,By Investing.com,"<span>May 16, 2013 07:26AM ET</span>",Soft futures mixed - Sugar trades at lowest since August 2010,
1345,By Investing.com,"<span>May 16, 2013 05:52AM ET</span>",Grain futures mixed; Wheat hovers near 2-week low,
1346,By Investing.com,"<span>May 16, 2013 05:05AM ET</span>",Copper futures fall to 2-week low on global demand concerns,
1347,By Investing.com,"<span>May 16, 2013 04:37AM ET</span>",Silver futures plunge more than 2% to hit 31-month low ,
1348,By Investing.com,"<span>May 16, 2013 04:04AM ET</span>",Crude oil futures under pressure amid global demand concerns,
1349,By Investing.com,"<span>May 16, 2013 03:31AM ET</span>",Gold futures slump to 1-month low as weak technical picture weighs,
1350,By Investing.com,"<span>May 15, 2013 08:45PM ET</span>",Data points weigh on oil,
1351,By Investing.com,"<span>May 15, 2013 08:34PM ET</span>",Gold continues to slide after hitting four-week low,
1352,By Investing.com,"<span>May 15, 2013 03:21PM ET</span>",Natural gas gains as forecasts point to warmer temperatures,
1353,By Investing.com,"<span>May 15, 2013 12:02PM ET</span>","Crude drops on weak eurozone, U.S. data, stockpile numbers support",
1354,By Investing.com,"<span>May 15, 2013 11:45AM ET</span>","Gold hits four-week low on soft eurozone, U.S. data",
1355,By Investing.com,"<span>May 14, 2013 08:51PM ET</span>","Gold gains as dollar cools gains, Japanese stocks support",
1356,By Investing.com,"<span>May 14, 2013 08:28PM ET</span>",Crude rises after bearish stockpile data pushes prices to bargain levels,
1357,By Investing.com,"<span>May 14, 2013 01:36PM ET</span>",Natural gas extends gains on forecasts for rising temps in western U.S.,
1358,By Investing.com,"<span>May 14, 2013 01:20PM ET</span>","Crude dips on fears of rising supplies, fund manager comments support",
1359,By Investing.com,"<span>May 14, 2013 12:15PM ET</span>",Gold falls as mixed European data fuels demand for safe-haven greenback,
1360,By Investing.com,"<span>May 14, 2013 06:33AM ET</span>",Natural gas futures edge higher with weather in focus,
1361,By Investing.com,"<span>May 14, 2013 05:46AM ET</span>",Grains mixed; Soybeans rally to 2-week high on U.S. planting concerns,
1362,By Investing.com,"<span>May 14, 2013 04:45AM ET</span>",Copper futures tumble more than 1% to hit 1-week low ,
1363,By Investing.com,"<span>May 14, 2013 04:17AM ET</span>",Silver futures swing between gains and losses in rangebound trade,
1364,By Investing.com,"<span>May 14, 2013 03:58AM ET</span>",Crude oil futures fluctuate with U.S. demand outlook in focus,
1365,By Investing.com,"<span>May 14, 2013 03:24AM ET</span>",Gold regains strength after three-day slide as dollar weakens,
1366,By Investing.com,"<span>May 13, 2013 08:46PM ET</span>",Oil slightly higher despite China demand disappointment,"Investing.com - Oil futures traded modestly higher in the early part of Tuesday’s Asian session despite news of slowing demand in China last month. On the New York Mercantile Exchange, light, sweet crude futures rose 0.28% to USD95.44 per barrel in Asian trading Tuesday after settling down 0.69% at USD95.38 a barrel on Monday in the U.S. Traders slipped out of oil despite some decent economic news out of the U.S., the world’s largest oil-consuming nation. In U.S. economic news, U.S retail sales rose 0.1% in April following a decline in March. The increase was helped by 1% rise in auto sales. Excluding auto sales, U.S. retail sales fell 0.1% in April. That data was published by the U.S. Commerce Department. April’s retail sales report prompted speculation that the Federal Reserve may be closer to scaling back stimulus programs, especially its USD85 billion monthly bond-buying program, which weaken the dollar to spur recovery. In China, data showed that refinery output there slumped 3% last month while demand rose 3.2% from April 2012 to an average of 9.6 million barrels per day, an eight-month low. China is the world’s second-largest oil consumer. Later Tuesday, the International Energy Agency is slated to release its monthly and medium-term supply and demand outlook. In Brazil an auction for lease rights to some offshore exploration areas attracted bidders such as Exxon Mobil and Chevron, the two largest U.S. oil companies. China’s Cnooc, that country’s largest offshore exploration and production firm, also participated in the Brazilian auction. Meanwhile, Brent futures for June delivery rose 0.25% to USD102.73 per barrel on the ICE Futures Exchange."
1367,By Investing.com,"<span>May 13, 2013 08:20PM ET</span>",Gold slightly lower as ETF outflows continue,"Investing.com - Gold futures traded modestly lower in the early part of Tuesday’s Asian session as traders speculated that physical demand for bullion may be waning. On the Comex division of the New York Mercantile Exchange, gold futures for June delivery inched lower by 0.04% to USD1,433.75 per troy ounce in Asian trading Tuesday after settling down 0.21% at USD1,433.65 a troy ounce in U.S. trading on Monday. Gold futures were likely to test support USD1,418.65 a troy ounce, Friday's low, and resistance at USD1,475.55, Wednesday's high. Despite a lethargic day for U.S. equities, gold came under pressure following a decent April retail sales report. In U.S. economic news, U.S retail sales rose 0.1% in April following a decline in March. The increase was helped by 1% rise in auto sales. Excluding auto sales, U.S. retail sales fell 0.1% in April. That data was published by the U.S. Commerce Department. April’s retail sales report prompted speculation that the Federal Reserve may be closer to scaling back stimulus programs, especially its USD85 billion monthly bond-buying program, which weaken the dollar to spur recovery. Meanwhile, holdings of physical gold at the world’s major gold exchange traded funds fell 0.3% after rising on Friday for the first time in nearly two months. The SPDR Gold Shares, the world’s largest ETF backed by physical gold, was home to 1,051.65 tons of gold on Friday, a four-year low for the ETF. Data from the U.S. Commodity Futures Trading Commission indicate hedge funds and other market participants have scaled back their long bets on gold due in part to the ETF outflows. Elsewhere, Comex silver for July delivery fell 0.26% to USD23.635 per ounce while copper for July delivery rose 0.26% to USD3.365 per ounce."
1368,By Investing.com,"<span>May 13, 2013 01:13PM ET</span>","Natural gas gains on forecasts for hot temps in West, chilly Northeast",
1369,By Investing.com,"<span>May 13, 2013 12:50PM ET</span>",Gold falls as firming U.S. retail sales spark demand for greenback,
1370,By Investing.com,"<span>May 13, 2013 12:34PM ET</span>","Crude falls on firming U.S. retail sales, soft Chinese industrial data",
1371,By Investing.com,"<span>May 13, 2013 10:37AM ET</span>",Natural gas futures bounce off 5-week low with cold weather in focus,
1372,By Investing.com,"<span>May 13, 2013 09:54AM ET</span>","Crude oil futures under pressure after U.S., China data",
1373,By Investing.com,"<span>May 13, 2013 08:55AM ET</span>",Gold futures remain lower after U.S. retail sales data,
1374,By Investing.com,"<span>May 13, 2013 07:35AM ET</span>",Grains rebound from post-USDA losses; Planting prospects in focus,
1375,By Investing.com,"<span>May 13, 2013 06:35AM ET</span>",Copper futures edge lower after disappointing China data,
1376,By Investing.com,"<span>May 13, 2013 03:51AM ET</span>","Crude oil futures lower after weak China data, stronger dollar weighs",
1377,By Investing.com,"<span>May 13, 2013 03:24AM ET</span>",Gold futures under pressure on Fed QE doubts,
1378,By Investing.com,"<span>May 12, 2013 09:28PM ET</span>","Oil falls, extends Friday’s drop",
1379,By Investing.com,"<span>May 12, 2013 09:07PM ET</span>",Gold trades slightly higher in Asia ,
1380,By Investing.com,"<span>May 12, 2013 10:56AM ET</span>",Natural gas futures - Weekly outlook: May 13 - 17,
1381,By Investing.com,"<span>May 12, 2013 07:31AM ET</span>",Grain futures - Weekly outlook: May 13 - 17,
1382,By Investing.com,"<span>May 12, 2013 06:40AM ET</span>",Crude oil futures - Weekly outlook: May 13 - 17,
1383,By Investing.com,"<span>May 12, 2013 06:14AM ET</span>",Gold / Silver / Copper futures - Weekly outlook: May 13 - 17,
1384,By Investing.com,"<span>May 10, 2013 01:24PM ET</span>","Natural Gas extends losses on supply data, mild weather forecasts",
1385,By Investing.com,"<span>May 10, 2013 12:35PM ET</span>",Gold nose dives as investors chase dollars ahead of G7 meet,
1386,By Investing.com,"<span>May 10, 2013 12:15PM ET</span>","Crude plummets on soft U.S. supply data, rising dollar",
1387,By Investing.com,"<span>May 09, 2013 08:40PM ET</span>",Oil falls despite positive U.S. jobs data,
1388,By Investing.com,"<span>May 09, 2013 08:25PM ET</span>",Gold falters on dollar strength,
1389,By Investing.com,"<span>May 09, 2013 01:39PM ET</span>","Natural Gas erases losses from supply data, weather forecasts support",
1390,By Investing.com,"<span>May 09, 2013 01:29PM ET</span>",Gold slides as U.S. jobless claims beat expectations ,
1391,By Investing.com,"<span>May 09, 2013 01:05PM ET</span>","Crude extends losses on soft U.S. supply data, jobless claims support",
1392,By Investing.com,"<span>May 09, 2013 10:54AM ET</span>",Natural gas futures plunge 2% after U.S. supply report,
1393,By Investing.com,"<span>May 09, 2013 09:54AM ET</span>",Crude oil lower as U.S. dollar strengthens after claims data,
1394,By Investing.com,"<span>May 09, 2013 08:54AM ET</span>",Gold drops to session low after upbeat U.S. jobless claims data,
1395,By Investing.com,"<span>May 09, 2013 07:33AM ET</span>",Soft futures lower - Cotton slumps ahead of USDA report,
1396,By Investing.com,"<span>May 09, 2013 06:14AM ET</span>",Grains futures little changed ahead of USDA supply report,
1397,By Investing.com,"<span>May 09, 2013 05:06AM ET</span>",Copper retreats from 3-week high as China inflation data weighs,
1398,By Investing.com,"<span>May 09, 2013 04:26AM ET</span>",Silver futures edge higher after China CPI data,
1399,By Investing.com,"<span>May 09, 2013 03:58AM ET</span>",Crude oil futures decline after China inflation data,
1400,By Investing.com,"<span>May 09, 2013 03:23AM ET</span>",Gold futures edge lower after previous day’s strong gains,
1401,By Investing.com,"<span>May 08, 2013 08:37PM ET</span>",Oil inches lower despite positive data ,"Investing.com - Oil futures traded slightly lower in the early part of Thursday’s Asian session despite some positive data points out Wednesday. On the New York Mercantile Exchange, light, sweet crude futures for June delivery inched lower by 0.03% to USD96.59 per barrel in Asian trading Thursday after up 0.74% at USD96.33 a barrel on Wednesday. Oil and other commodities were propped up by some decent data out of Germany and the U.S. Germany's industrial output, which includes manufacturing, mining, electricity and gas concerns, shot up 1.2% in March, the largest increase in a year and defying expectations for a 0.1% decline. February’s figure was revised up 0.6% from 0.5%. Official data released on Tuesday revealed that German factory orders climbed 2.2% in March, defying expectations for a 0.5% decline. Germany is the euro zone’s largest economy. In U.S. economic news, the Mortgage Bankers Association said the number of mortgage applications filed in the U.S. last week rose 7% while the refinancing index increased 8%. During Wednesday’s Asian session, data showed China’s oil imports rose 3.5% in April and have increased 3.7% on a year-over-year basis. The world’s second-largest oil consumer imported an average of 5.62 million barrels per day last month. Elsewhere, Alberta's Energy Resources Conservation Board said the region in Western Canada could double its output to 3.8 million barrels per day by 2022. Canada’s oil sands region is believed to be home to the world’s third-largest reserves behind OPEC members Saudia Arabia and Venezuela. Meanwhile, Brent crude futures for June delivery rose 0.31% to USD104.53 per barrel on the ICE Futures Exchange."
1402,By Investing.com,"<span>May 08, 2013 08:24PM ET</span>",Gold lower in Asia after U.S. pop ,
1403,By Investing.com,"<span>May 08, 2013 02:22PM ET</span>",Natural Gas gains as weather forecasts point to hotter temperatures,
1404,By Investing.com,"<span>May 08, 2013 01:50PM ET</span>","Crude gains on German data, though U.S. supply figures cap gains",
1405,By Investing.com,"<span>May 08, 2013 01:23PM ET</span>","Gold rebounds on falling dollar, shoots up on coattails of German data ",
1406,By Investing.com,"<span>May 08, 2013 10:43AM ET</span>",Crude oil futures off the highs after U.S. supply report,
1407,By Investing.com,"<span>May 08, 2013 10:01AM ET</span>",Natural gas futures bounce off 5-week low on bargain buying,
1408,By Investing.com,"<span>May 08, 2013 09:04AM ET</span>",Gold futures up more than 1% on surging Chinese demand,
1409,By Investing.com,"<span>May 08, 2013 07:36AM ET</span>",Soft futures lower - Sugar declines for second day,
1410,By Investing.com,"<span>May 08, 2013 06:04AM ET</span>",Grains mixed - Soybeans rally to 1-week high on U.S. planting delays,
1411,By Investing.com,"<span>May 08, 2013 05:26AM ET</span>",Copper futures hold near 3-week high after positive China trade data,
1412,By Investing.com,"<span>May 08, 2013 04:36AM ET</span>",Silver little changed; prices remain vulnerable to further selling,
1413,By Investing.com,"<span>May 08, 2013 04:02AM ET</span>",Crude oil futures little changed ahead of U.S. supply data,
1414,By Investing.com,"<span>May 08, 2013 03:38AM ET</span>","Gold rebounds from previous day’s losses, Chinese demand supports",
1415,By Investing.com,"<span>May 07, 2013 08:53PM ET</span>",Oil trades modestly lower following API report,
1416,By Investing.com,"<span>May 07, 2013 08:40PM ET</span>",Gold inches lower amid buoyant risk appetite,
1417,By Investing.com,"<span>May 07, 2013 01:41PM ET</span>",Natural Gas falls extends losses as warming trend settles in over U.S.,
1418,By Investing.com,"<span>May 07, 2013 01:09PM ET</span>",Gold drops as German data sparks demand for U.S. equities ,
1419,By Investing.com,"<span>May 07, 2013 12:34PM ET</span>",Crude falls as profit-taking wipes out gains from German data,
1420,By Investing.com,"<span>May 07, 2013 10:38AM ET</span>",Natural gas futures tumble to 5-week low on mild weather outlook,
1421,By Investing.com,"<span>May 07, 2013 09:59AM ET</span>",Crude oil trims losses to trade little changed as U.S. equities gain,
1422,By Investing.com,"<span>May 07, 2013 09:02AM ET</span>",Gold’s losses accelerate after Comex open; Silver tumbles 2%,
1423,By Investing.com,"<span>May 07, 2013 07:38AM ET</span>",Soft futures mixed - Cotton lower for first time in 4 days,
1424,By Investing.com,"<span>May 07, 2013 06:05AM ET</span>",Grain futures rebound following previous day’s rout,
1425,By Investing.com,"<span>May 07, 2013 04:57AM ET</span>",Copper futures trade near 3-week high ahead of China data,
1426,By Investing.com,"<span>May 07, 2013 04:20AM ET</span>","Silver futures drop more than 1%, tracking gold lower",
1427,By Investing.com,"<span>May 07, 2013 03:58AM ET</span>",Crude oil futures lower with U.S. demand outlook in focus,
1428,By Investing.com,"<span>May 07, 2013 03:23AM ET</span>",Gold futures under pressure as weak technical picture weighs,
1429,By Investing.com,"<span>May 06, 2013 08:52PM ET</span>",Oil down on profit-taking ,
1430,By Investing.com,"<span>May 06, 2013 08:33PM ET</span>",Gold nudges lower despite WGC comments ,
1431,By Investing.com,"<span>May 06, 2013 01:59PM ET</span>",Natural Gas falls as weather forecasts pointing to lasting warming trend,
1432,By Investing.com,"<span>May 06, 2013 01:19PM ET</span>",Gold gains as market views precious metal as oversold,
1433,By Investing.com,"<span>May 06, 2013 01:02PM ET</span>",Crude gains as conflict escalates in Syria,
1434,By Investing.com,"<span>May 06, 2013 10:46AM ET</span>",Natural gas futures bounce off 5-week low on bargain buying,
1435,By Investing.com,"<span>May 06, 2013 10:05AM ET</span>",Crude oil retreats from 5-week high as investors lock in gains,
1436,By Investing.com,"<span>May 06, 2013 09:03AM ET</span>","Gold moves higher in quiet trade; Fed, ECB stimulus supports",
1437,By Investing.com,"<span>May 06, 2013 07:50AM ET</span>",Soft futures mixed - Sugar little changed near 2-year low,
