,company,date,title,content
875,By Investing.com,"<span>Jul 08, 2013 07:34AM ET</span>",Soft futures edge higher; Sugar bounces off 3-week low ,
876,By Investing.com,"<span>Jul 08, 2013 05:55AM ET</span>",Grain futures mixed; Corn trades near 32-month low,
877,By Investing.com,"<span>Jul 08, 2013 05:20AM ET</span>","Copper futures edge higher with China, Fed in focus",
878,By Investing.com,"<span>Jul 08, 2013 04:31AM ET</span>",Silver futures rebound after Friday’s sell-off,
879,By Investing.com,"<span>Jul 08, 2013 03:54AM ET</span>",Crude oil futures little changed near 14-month high,
880,By Investing.com,"<span>Jul 08, 2013 03:28AM ET</span>","Gold edges higher, but gains capped by Fed stimulus outlook",
881,By Investing.com,"<span>Jul 07, 2013 08:38PM ET</span>",Oil higher amid ongoing Egyptian protests,
882,By Investing.com,"<span>Jul 07, 2013 08:28PM ET</span>",Gold bounces back after Friday’s tumble,
883,By Investing.com,"<span>Jul 07, 2013 10:57AM ET</span>",Natural gas futures - Weekly outlook: July 8 - 12,
884,By Investing.com,"<span>Jul 07, 2013 09:32AM ET</span>",Grain futures - Weekly outlook: July 8 - 12,
885,By Investing.com,"<span>Jul 07, 2013 07:26AM ET</span>",Crude oil futures - Weekly outlook: July 8 - 12,
886,By Investing.com,"<span>Jul 07, 2013 07:03AM ET</span>",Gold / Silver / Copper futures - Weekly outlook: July 8 - 12,
887,By Investing.com,"<span>Jul 05, 2013 12:58PM ET</span>",Natural gas prices drop as weather models point to moderate temperatures,
888,By Investing.com,"<span>Jul 05, 2013 12:29PM ET</span>","Crude gains on U.S. jobs data, rising tensions in Egypt",
889,By Investing.com,"<span>Jul 05, 2013 11:56AM ET</span>",Gold plummets by 3% as U.S. jobs report sparks massive selloff,
890,By Investing.com,"<span>Jul 05, 2013 03:26AM ET</span>",Crude oil futures slip lower on profit-taking ,
891,By Investing.com,"<span>Jul 04, 2013 08:29PM ET</span>",Oil up slightly ahead of U.S. jobs data,
892,By Investing.com,"<span>Jul 04, 2013 08:21PM ET</span>","Gold falls following BoE, ECB meetings","Investing.com - Gold futures traded lower in the early part of Friday’s Asian session as bullion was weighed down in the aftermath of Thursday’s Bank of England and European Central Bank meetings. On the Comex division of the New York Mercantile Exchange, gold futures for August delivery fell 0.43% to USD1,246.55 per troy ounce in Asian trading Friday after trading at USD1,246.25 a troy ounce during U.S. morning hours, down 0.7% on the day. U.S. markets were closed Thursday in observance of the Independence Day holiday. Gold futures were likely to find support at USD1,180.35 a troy ounce, Friday’s low and a 34-month low and near-term resistance at USD1,276.05, the high from June 26. Earlier Thursday, European Central Bank President Mario said that the central bank’s monetary policy will “remain accommodative as long as needed”.He added that rates will stay low for an “extended period of time.” Draghi’s comments came after the ECB held its benchmark interest rate at a record low 0.50% in July, in line with expectations.  Goldman Sachs said the ECB ""is more likely than not to ease further from here."" The bank added that ""more unconventional easing"" is likely from the Bank of England. Research house Capital Economics said it believes both BoE and the ECB will engage in further easing activities later this year. The BoE left its benchmark interest rate unchanged at 0.5% on Thursday and said economic data over the past few months was consistent with the recovery set out by the bank in its May inflation report, but warned that the ""significant upward movement"" in bond yields would weigh on the outlook for growth. “In the Committee’s view, the implied rise in the expected future path of Bank Rate was not warranted by the recent developments in the domestic economy”, the BoE said.The bank took the step of publishing a rate statement following its first meeting under the leadership of new Governor Mark Carney. Elsewhere, Comex silver for September delivery dropped 1.12% to USD19.480 per ounce while copper for September delivery fell 0.14% to USD3.147 per ounce."
893,By Investing.com,"<span>Jul 04, 2013 10:47AM ET</span>",Natural gas futures little changed in holiday-thinned trade,
894,By Investing.com,"<span>Jul 04, 2013 09:51AM ET</span>",Crude oil futures ease off 14-month high; Egypt unrest limits losses,
895,By Investing.com,"<span>Jul 04, 2013 08:54AM ET</span>",Gold drops to session low on Draghi comments ,
896,By Investing.com,"<span>Jul 04, 2013 05:28AM ET</span>",Copper futures retreat from 2-week high ahead of ECB decision,
897,By Investing.com,"<span>Jul 04, 2013 04:22AM ET</span>","Silver futures fluctuate ahead of ECB, U.S. jobs data",
898,By Investing.com,"<span>Jul 04, 2013 04:01AM ET</span>",Crude oil futures little changed as markets monitor Egypt,
899,By Investing.com,"<span>Jul 04, 2013 03:23AM ET</span>",Gold futures higher in rangebound trade with U.S. jobs report in focus,
900,By Investing.com,"<span>Jul 03, 2013 08:27PM ET</span>",Oil jumps as Morsi is dethroned,
901,By Investing.com,"<span>Jul 03, 2013 08:13PM ET</span>",Gold gets a lift as dollar slides,
902,By Investing.com,"<span>Jul 03, 2013 02:14PM ET</span>","Natural gas moves up on supply data, weather forecasts weigh",
903,By Investing.com,"<span>Jul 03, 2013 01:57PM ET</span>","Gold rises as dollar falls on Egypt unrest, U.S. data",
904,By Investing.com,"<span>Jul 03, 2013 11:52AM ET</span>","Crude extends gains on Egypt unrest, U.S. data support",
905,By Investing.com,"<span>Jul 03, 2013 10:48AM ET</span>",Natural gas futures tumble 2% ahead of U.S. supply report,
906,By Investing.com,"<span>Jul 03, 2013 10:36AM ET</span>",Crude oil futures remain near session high after EIA supply data,
907,By Investing.com,"<span>Jul 03, 2013 09:54AM ET</span>","Crude oil rallies 2% on U.S. jobs data, Egypt; supply report ahead",
908,By Investing.com,"<span>Jul 03, 2013 09:12AM ET</span>",Gold holds gains after flurry of U.S. jobs data,
909,By Investing.com,"<span>Jul 03, 2013 07:18AM ET</span>",Soft futures mostly lower; Coffee drops from 2-week high ,
910,By Investing.com,"<span>Jul 03, 2013 06:03AM ET</span>",Grain futures higher; Wheat rallies 2% after Egypt purchase,
911,By Investing.com,"<span>Jul 03, 2013 05:15AM ET</span>",Copper futures edge higher ahead of U.S. ADP jobs report,
912,By Investing.com,"<span>Jul 03, 2013 04:27AM ET</span>",Silver futures move higher ahead of U.S. data,
913,By Investing.com,"<span>Jul 03, 2013 04:01AM ET</span>",Gold futures decline for 2nd day on dollar strength,
914,By Investing.com,"<span>Jul 03, 2013 03:18AM ET</span>",Crude oil surges to 14-month high on Egypt turmoil,
915,By Investing.com,"<span>Jul 02, 2013 08:34PM ET</span>","Oil Moves Above USD100 on Egypt unrest, API report ",
916,By Investing.com,"<span>Jul 02, 2013 08:16PM ET</span>",Gold slightly higher after another U.S. tumble,
917,By Investing.com,"<span>Jul 02, 2013 01:36PM ET</span>", Gold drops as U.S. factory report strengthens dollar ,
918,By Investing.com,"<span>Jul 02, 2013 01:04PM ET</span>","Crude oil jumps U.S. data, Middle East unrest",
919,By Investing.com,"<span>Jul 02, 2013 12:39PM ET</span>",Natural gas shoots up as weather forecasts point to rising temperatures,
920,By Investing.com,"<span>Jul 02, 2013 10:38AM ET</span>",Crude oil futures top USD99 a barrel after upbeat U.S. factory data,
921,By Investing.com,"<span>Jul 02, 2013 09:57AM ET</span>",Natural gas futures gain 1% on warm weather forecasts,
922,By Investing.com,"<span>Jul 02, 2013 09:00AM ET</span>",Gold turns lower as dollar gains on renewed Greece fears,
923,By Investing.com,"<span>Jul 02, 2013 07:46AM ET</span>",Soft futures mixed; Coffee hits 2-week high ,
924,By Investing.com,"<span>Jul 02, 2013 06:01AM ET</span>","Grain futures higher; Wheat, corn bounce off multi-month lows",
925,By Investing.com,"<span>Jul 02, 2013 05:24AM ET</span>",Copper futures little changed after Monday’s 3% rally,
926,By Investing.com,"<span>Jul 02, 2013 04:28AM ET</span>",Silver futures track gold higher to move further off 34-month low,
927,By Investing.com,"<span>Jul 02, 2013 04:03AM ET</span>",Crude oil trades near 2-week high ahead of U.S. inventory report,
928,By Investing.com,"<span>Jul 02, 2013 03:18AM ET</span>",Gold futures rally to 1-week high as rebound continues,
929,By Investing.com,"<span>Jul 01, 2013 08:57PM ET</span>",Oil slightly higher on data points ,
930,By Investing.com,"<span>Jul 01, 2013 08:44PM ET</span>",Gold continues higher after U.S. bounce ,
931,By Investing.com,"<span>Jul 01, 2013 01:34PM ET</span>","Gold rises amid bargain hunting, talk of rising physical demand",
932,By Investing.com,"<span>Jul 01, 2013 12:54PM ET</span>","Crude oil jumps on European, U.S. manufacturing reports",
933,By Investing.com,"<span>Jul 01, 2013 12:39PM ET</span>","Natural gas gains on weather forecasts, weekly supply data weighs",
934,By Investing.com,"<span>Jul 01, 2013 10:41AM ET</span>",Natural gas holds near 4-month low with weather outlook in focus,
935,By Investing.com,"<span>Jul 01, 2013 10:05AM ET</span>",Gold futures hold gains after U.S. ISM report,
936,By Investing.com,"<span>Jul 01, 2013 09:01AM ET</span>",Crude oil futures rally 1% after upbeat euro zone manufacturing PMIs,
937,By Investing.com,"<span>Jul 01, 2013 07:39AM ET</span>",Soft futures mixed; Sugar higher ahead of July expiration ,
938,By Investing.com,"<span>Jul 01, 2013 06:03AM ET</span>",Grain futures mixed; Corn falls to 31-month low on ample supplies,
939,By Investing.com,"<span>Jul 01, 2013 05:14AM ET</span>",Copper climbs to 2-week high despite China manufacturing data,
940,By Investing.com,"<span>Jul 01, 2013 04:34AM ET</span>","Silver futures bounce off 34-month low, tracking gold higher",
941,By Investing.com,"<span>Jul 01, 2013 04:00AM ET</span>",Crude oil swings between gains and losses on China PMI data,
942,By Investing.com,"<span>Jul 01, 2013 03:22AM ET</span>","Gold, silver futures rally 2% to move further away from 3-year lows",
943,By Investing.com,"<span>Jun 30, 2013 08:46PM ET</span>",Oil down as Fed concerns linger,
944,By Investing.com,"<span>Jun 30, 2013 08:20PM ET</span>","Gold shoots higher in Asia, builds on Friday’s gains",
945,By Investing.com,"<span>Jun 30, 2013 10:41AM ET</span>",Natural gas futures - Weekly outlook: July 1 - 5,
946,By Investing.com,"<span>Jun 30, 2013 09:18AM ET</span>",Grain futures - Weekly outlook: July 1 - 5,
947,By Investing.com,"<span>Jun 30, 2013 07:30AM ET</span>",Crude oil futures - Weekly outlook: July 1 - 5,
948,By Investing.com,"<span>Jun 30, 2013 06:44AM ET</span>",Gold / Silver / Copper futures - Weekly outlook: July 1 - 5,
949,By Investing.com,"<span>Jun 28, 2013 01:52PM ET</span>",Gold shoots up in short covering on last trading day of quarter,
950,By Investing.com,"<span>Jun 28, 2013 01:10PM ET</span>",Crude oil gains on rising U.S. consumer sentiment,
951,By Investing.com,"<span>Jun 28, 2013 12:30PM ET</span>","Natural gas extends losses on rising inventories, mild weather forecasts",
952,By Investing.com,"<span>Jun 27, 2013 09:04PM ET</span>",Oil down in Asia on profit-taking,
953,By Investing.com,"<span>Jun 27, 2013 08:41PM ET</span>","Gold down again, but hovers above USD1,200 an ounce",
954,By Investing.com,"<span>Jun 27, 2013 02:38PM ET</span>",Crude oil gains as U.S. pending home sales beat expectations,
955,By Investing.com,"<span>Jun 27, 2013 01:44PM ET</span>",Natural gas plunges 4% on soaring supply levels,
956,By Investing.com,"<span>Jun 27, 2013 01:27PM ET</span>",Gold declines as U.S. housing data beats expectations,
957,By Investing.com,"<span>Jun 27, 2013 10:51AM ET</span>",Natural gas plunges 4% to hit 16-week low after U.S. supply data,
958,By Investing.com,"<span>Jun 27, 2013 09:58AM ET</span>",Crude oil futures hit 1-week high after U.S. data,
959,By Investing.com,"<span>Jun 27, 2013 09:03AM ET</span>","Gold pares gains after U.S. consumer spending, jobless data",
960,By Investing.com,"<span>Jun 27, 2013 07:40AM ET</span>",Soft futures mixed; Coffee consolidates near 3-year low,
961,By Investing.com,"<span>Jun 27, 2013 06:02AM ET</span>",Grain futures edge higher with USDA acreage report in focus,
962,By Investing.com,"<span>Jun 27, 2013 05:24AM ET</span>","Copper futures up 1% as Fed, China fears ease",
963,By Investing.com,"<span>Jun 27, 2013 04:25AM ET</span>",Silver bounces off lowest since August 2010 on Fed hopes,
964,By Investing.com,"<span>Jun 27, 2013 04:00AM ET</span>","Crude oil futures edge higher as Fed, China fears ease",
965,By Investing.com,"<span>Jun 27, 2013 03:20AM ET</span>",Gold futures rebound from 3-year low on Fed stimulus hopes,
966,By Investing.com,"<span>Jun 26, 2013 08:36PM ET</span>",Oil falls following U.S. inventories data,
967,By Investing.com,"<span>Jun 26, 2013 08:24PM ET</span>",Gold rises after touching 3-year low ,
968,By Investing.com,"<span>Jun 26, 2013 02:22PM ET</span>","Gold plummets as market overlooks growth data, bets on end to stimulus",
969,By Investing.com,"<span>Jun 26, 2013 01:27PM ET</span>",Crude oil falls as U.S. supplies rise more than expected,
970,By Investing.com,"<span>Jun 26, 2013 12:29PM ET</span>",Natural gas rebounds as market looks past mild U.S. temperatures,
971,By Investing.com,"<span>Jun 26, 2013 11:45AM ET</span>",Forex - EUR/USD edges lower as Draghi says policy will stay loose,
972,By Investing.com,"<span>Jun 26, 2013 10:44AM ET</span>",Crude oil futures fall to session low after EIA supply data,
973,By Investing.com,"<span>Jun 26, 2013 10:02AM ET</span>",Natural gas holds near 15-week low as weather outlook weighs,
974,By Investing.com,"<span>Jun 26, 2013 09:07AM ET</span>",Gold futures off the lows after U.S. GDP downward revision,
975,By Investing.com,"<span>Jun 26, 2013 07:40AM ET</span>",Soft futures edge lower; Sugar eases off to 6-week high,
976,By Investing.com,"<span>Jun 26, 2013 05:51AM ET</span>",Grain futures steady as traders look ahead to USDA acreage report,
977,By Investing.com,"<span>Jun 26, 2013 05:15AM ET</span>",Copper futures reapproach 3-year low as Fed tapering fears weigh,
978,By Investing.com,"<span>Jun 26, 2013 04:34AM ET</span>",Silver tumbles 5% to hit 34-month low on Fed tapering worries,
979,By Investing.com,"<span>Jun 26, 2013 03:58AM ET</span>",Crude oil futures down 1% ahead of inventory report,
980,By Investing.com,"<span>Jun 26, 2013 03:21AM ET</span>",Gold futures plunge 2% to hit lowest since September 2010,
981,By Investing.com,"<span>Jun 25, 2013 08:42PM ET</span>",Oil falls amid profit-taking in Asia ,
982,By Investing.com,"<span>Jun 25, 2013 08:32PM ET</span>",Gold continues to fall as U.S. data lifts riskier assets,
983,By Investing.com,"<span>Jun 25, 2013 12:48PM ET</span>",Gold dips as firming U.S. indicators bolster demand for dollar,
984,By Investing.com,"<span>Jun 25, 2013 12:35PM ET</span>",Crude oil gains on improving U.S. economic indicators,
985,By Investing.com,"<span>Jun 25, 2013 12:12PM ET</span>",Natural gas drops as weather forecasts point to cooler U.S. temperatures,
986,By Investing.com,"<span>Jun 25, 2013 10:40AM ET</span>",Natural gas tumbles 2% to hit 15-week low on mild weather outlook,
987,By Investing.com,"<span>Jun 25, 2013 10:12AM ET</span>",Gold futures trim gains to trade little changed after upbeat U.S. data,
988,By Investing.com,"<span>Jun 25, 2013 09:05AM ET</span>",Crude oil futures add to gains after upbeat durable goods data,
989,By Investing.com,"<span>Jun 25, 2013 07:34AM ET</span>",Soft futures mostly higher; Sugar rallies to 6-week top ,
990,By Investing.com,"<span>Jun 25, 2013 06:05AM ET</span>","Grain futures higher with U.S. crop prospects, weather in focus",
991,By Investing.com,"<span>Jun 25, 2013 05:53AM ET</span>",Copper futures rally off 3-year low on China central bank comments,
992,By Investing.com,"<span>Jun 25, 2013 04:41AM ET</span>","Silver prices recover from losses, up 1% as metals gain",
993,By Investing.com,"<span>Jun 25, 2013 03:59AM ET</span>",Crude oil futures hit 3-day high ahead of U.S. supply data,
994,By Investing.com,"<span>Jun 25, 2013 03:29AM ET</span>",Gold futures inch higher on Fed comments ,
995,By Investing.com,"<span>Jun 24, 2013 08:43PM ET</span>",Oil dips as stimulus concerns linger,
996,By Investing.com,"<span>Jun 24, 2013 08:34PM ET</span>",Gold rises as traders bargain hunt,
997,By Investing.com,"<span>Jun 24, 2013 04:38PM ET</span>",Crude oil dips as market looks past Canada pipeline closure,
998,By Investing.com,"<span>Jun 24, 2013 02:41PM ET</span>",Gold declines on sentiments Federal Reserve to scale back stimulus,
999,By Investing.com,"<span>Jun 24, 2013 02:13PM ET</span>",Natural gas extends losses on rising U.S. inventory levels,
1000,By Investing.com,"<span>Jun 24, 2013 10:41AM ET</span>",Natural gas futures fluctuate with weather outlook in focus,
1001,By Investing.com,"<span>Jun 24, 2013 09:58AM ET</span>","Crude oil hits 3-week low on China jitters, Fed stimulus outlook",
1002,By Investing.com,"<span>Jun 24, 2013 08:57AM ET</span>",Gold futures lower on Fed outlook; Goldman cuts price forecast,
1003,By Investing.com,"<span>Jun 24, 2013 07:49AM ET</span>",Soft futures higher; Sugar hits 5-week top on Brazil crop concerns,
1004,By Investing.com,"<span>Jun 24, 2013 05:52AM ET</span>",Grain futures lower with U.S. crop prospects in focus,
1005,By Investing.com,"<span>Jun 24, 2013 05:22AM ET</span>",Copper plunges 3% to hit lowest since July 2010 on China fears,
1006,By Investing.com,"<span>Jun 24, 2013 04:54AM ET</span>",Silver remains under pressure near 33-month low on Fed outlook,
1007,By Investing.com,"<span>Jun 24, 2013 03:55AM ET</span>","Crude oil drops to 3-week low on China growth concerns, Fed outlook",
1008,By Investing.com,"<span>Jun 24, 2013 03:30AM ET</span>",Gold futures hold near 3-year lows as stronger dollar weighs,
1009,By Investing.com,"<span>Jun 23, 2013 08:41PM ET</span>",Oil slightly higher after touching 3-week low,"Investing.com - Oil futures nudged higher in the early part of Monday’s Asian session after crude touched a three-week low last week. On the New York Mercantile Exchange, light, sweet crude futures for August delivery inched up 0.05% to USD93.74 per barrel in Asian trading Monday after settling down 1.3% last Friday to close the week at USD93.89 a barrel. Oil prices plunged 3% on Thursday after Fed Chairman Ben Bernanke said the central bank could begin slowing asset purchases by the end of 2013 and wind them down completely by the middle of 2014 if the economy picks up as the central bank expects. The central forecast 2013 U.S. economic growth of 2.3% to 2.6% while adding it expects the unemployment rate to drop to between 6.5% and 6.8% by the end of 2014. Since the U.S. is the world’s largest oil consumer, those numbers are pivotal to oil demand, but the forecasts may not be robust enough for some traders to send oil higher. China, the world’s second-largest oil consumer, is perhaps even more of a concern. Last week, China’s HSBC preliminary manufacturing purchasing managers’ index fell to 48.3 in June from 49.2 in May as new orders declined, indicating that the slowdown in manufacturing is worsening. Elsewhere, Iraq said it exported 76.9 million barrels of oil last month, or 2.48 million barrels per day, a 5% drop from April’s numbers. Iraq, an OPEC member cited poor weather and pipeline sabotage as reasons for the output decline. China’s Sinopec, that country’s second-largest oil producer, will reportedly pay USD1.52 billion for Marathon Oil’s Angolan offshore oil and gas field. Marathon is based in Texa. Meanwhile, Brent futures for August deliver fell 0.27% to USD100.66 per barrel on the ICE Futures Exchange."
1010,By Investing.com,"<span>Jun 23, 2013 08:30PM ET</span>",Gold rises to start the week after last week’s pounding,
1011,By Investing.com,"<span>Jun 23, 2013 10:38AM ET</span>",Natural gas futures - Weekly outlook: June 24 - 28,
1012,By Investing.com,"<span>Jun 23, 2013 08:24AM ET</span>",Grain futures - Weekly outlook: June 24 - 28,
1013,By Investing.com,"<span>Jun 23, 2013 07:07AM ET</span>",Crude oil futures - Weekly outlook: June 24 - 28,
1014,By Investing.com,"<span>Jun 23, 2013 06:37AM ET</span>",Gold / Silver / Copper futures - Weekly outlook: June 24 - 28,
1015,By Investing.com,"<span>Jun 21, 2013 02:45PM ET</span>",Natural gas extends losses on rising U.S. inventory levels,
1016,By Investing.com,"<span>Jun 21, 2013 01:38PM ET</span>",Crude oil extends losses as dollar gains on talk of end to stimulus ,
1017,By Investing.com,"<span>Jun 21, 2013 12:12PM ET</span>",Gold inches up amid bargain hunting after Fed-fueled selloff,
1018,By Investing.com,"<span>Jun 21, 2013 03:17AM ET</span>",Crude oil futures rise in subdued trade ,
1019,By Investing.com,"<span>Jun 20, 2013 08:50PM ET</span>",Oil falls as traders gloss over decent U.S. data,
1020,By Investing.com,"<span>Jun 20, 2013 08:44PM ET</span>",Gold continues to careen lower after U.S. plunge,
1021,By Investing.com,"<span>Jun 20, 2013 01:47PM ET</span>","Crude oil drops on soft Chinese data, talk of Fed stimulus scale back",
1022,By Investing.com,"<span>Jun 20, 2013 01:05PM ET</span>",Natural gas drops as U.S. supplies rise more than expected,
1023,By Investing.com,"<span>Jun 20, 2013 12:38PM ET</span>",Gold plunges to near 3-year lows on surging Philly Fed index,
1024,By Investing.com,"<span>Jun 20, 2013 10:59AM ET</span>",Natural gas futures tumble 2% after U.S. supply data,
1025,By Investing.com,"<span>Jun 20, 2013 09:57AM ET</span>","Crude oil sinks 3% on Fed stimulus outlook, China concerns",
1026,By Investing.com,"<span>Jun 20, 2013 09:07AM ET</span>",Gold falls to lowest since September 2010 as Fed signals slowdown,
1027,By Investing.com,"<span>Jun 20, 2013 07:34AM ET</span>",Soft futures tumble as commodities sell-off; Sugar down 2%,
1028,By Investing.com,"<span>Jun 20, 2013 06:00AM ET</span>","Gold futures extend losses, down 6% to hit USD1,290 a troy ounce",
1029,By Investing.com,"<span>Jun 20, 2013 05:45AM ET</span>",Grain futures down sharply in risk-off trade; Corn off 2-month high,
1030,By Investing.com,"<span>Jun 20, 2013 05:17AM ET</span>","Copper futures drop to 7-week low after weak China data, Bernanke",
1031,By Investing.com,"<span>Jun 20, 2013 04:41AM ET</span>","Silver futures tumble 7% to hit 33-month low, gold at 30-month low",
1032,By Investing.com,"<span>Jun 20, 2013 03:55AM ET</span>","Crude oil futures tumble to 1-week low after Fed, China PMI data",
1033,By Investing.com,"<span>Jun 20, 2013 03:25AM ET</span>",Gold futures plunge 4% to trade near 30-month low after Fed,
1034,By Investing.com,"<span>Jun 19, 2013 08:49PM ET</span>",Oil drops as traders eschew risk after Fed meeting,
1035,By Investing.com,"<span>Jun 19, 2013 08:27PM ET</span>",Gold plunges as Fed sees stimulus end in 2014,
1036,By Investing.com,"<span>Jun 19, 2013 12:51PM ET</span>",Gold edges up ahead of Federal Reserve decision,
1037,By Investing.com,"<span>Jun 19, 2013 12:15PM ET</span>",Crude oil drops as U.S. supplies make surprising gain,
1038,By Investing.com,"<span>Jun 19, 2013 11:55AM ET</span>",Natural gas extends gains as weather forecasts point to warming trend,
1039,By Investing.com,"<span>Jun 19, 2013 10:35AM ET</span>","Crude oil hits session low after EIA supply data, eyes on Fed",
1040,By Investing.com,"<span>Jun 19, 2013 10:00AM ET</span>",Natural gas futures rally to 2-week high on warm weather forecasts,
1041,By Investing.com,"<span>Jun 19, 2013 09:05AM ET</span>","Gold futures ease off 4-week low ahead of Fed statement, Bernanke",
1042,By Investing.com,"<span>Jun 19, 2013 07:45AM ET</span>",Soft futures mixed; Sugar lower for second consecutive day,
1043,By Investing.com,"<span>Jun 19, 2013 06:01AM ET</span>",Grain futures mixed; Corn retreats from 11-week high,
1044,By Investing.com,"<span>Jun 19, 2013 05:09AM ET</span>","Copper futures hold near 7-week low ahead of Fed, Bernanke",
1045,By Investing.com,"<span>Jun 19, 2013 04:30AM ET</span>",Silver futures edge lower in rangebound trade ahead of Fed,
1046,By Investing.com,"<span>Jun 19, 2013 03:56AM ET</span>","Crude oil hits 9-month high ahead of inventory report, FOMC",
1047,By Investing.com,"<span>Jun 19, 2013 03:22AM ET</span>",Gold futures little changed near 4-week low ahead of Fed decision,
1048,By Investing.com,"<span>Jun 18, 2013 08:47PM ET</span>",Oil inches down after API data ,
1049,By Investing.com,"<span>Jun 18, 2013 08:37PM ET</span>",Gold slightly higher as traders wait on Bernanke,
1050,By Investing.com,"<span>Jun 18, 2013 02:01PM ET</span>",Natural gas extends gains as weather forecasts point to warming trend,
1051,By Investing.com,"<span>Jun 18, 2013 01:37PM ET</span>","Crude oil gains on U.S. data, escalating Syrian conflict",
1052,By Investing.com,"<span>Jun 18, 2013 01:02PM ET</span>","Gold falls ahead of Federal Reserve meeting, shrugs off data",
1053,By Investing.com,"<span>Jun 18, 2013 10:41AM ET</span>",Natural gas futures extend weather-driven rally to hit 2-week high,
1054,By Investing.com,"<span>Jun 18, 2013 09:58AM ET</span>",Crude oil firms above USD98 a barrel after U.S. housing data,
1055,By Investing.com,"<span>Jun 18, 2013 09:04AM ET</span>","Gold remains lower after mixed U.S. data; Fed, Bernanke in focus",
1056,By Investing.com,"<span>Jun 18, 2013 07:44AM ET</span>",Soft futures lower; Sugar resumes decline as short cover rally ebbs,
1057,By Investing.com,"<span>Jun 18, 2013 06:05AM ET</span>",Grain futures edge higher; Corn rises to 7-day high,
1058,By Investing.com,"<span>Jun 18, 2013 05:26AM ET</span>",Copper futures trade near 7-week low with Fed stimulus in focus,
1059,By Investing.com,"<span>Jun 18, 2013 04:39AM ET</span>",Silver futures seesaw in rangebound trade ahead of Fed meeting,
1060,By Investing.com,"<span>Jun 18, 2013 03:56AM ET</span>","Crude oil steady near 9-month high ahead of supply data, Fed",
