,company,date,title,content
1108,By Investing.com,"<span>Mar 17, 2014 10:24PM ET</span>",Reserve Bank of Australia minutes show continued concern over high AUD,"Investing.com - The Reserve Bank of Australia kept its cash rate at a record low 2.5% in March and it will stay there for a ""period"" because the level continues to support economic activity and a weaker exchange rate is achieving balancing growth in the economy though it remains a worry, according to the minutes of its March 4 board meeting released on Tuesday.The RBA reiterated the exchange rate remains high by historical standards and remained a concern as it has showed little sign of staying below the $0.9000 level.""The board would continue to examine the data over the period ahead, with members noting that, if the economy was to evolve broadly as expected, then the most prudent course was likely to be period of stability in interest rates,"" the RBA said.
"
1109,By Investing.com,"<span>Mar 17, 2014 08:05PM ET</span>",Colombian industrial production 0.1% vs. 1.2% forecast,
1110,By Investing.com,"<span>Mar 17, 2014 05:00PM ET</span>",Argentina CPI 3.4% vs. 4.8% forecast,
1111,By Investing.com,"<span>Mar 17, 2014 10:05AM ET</span>",U.S. NAHB Housing Market Index rises less than forecast in March,"Investing.com - The National Association of Home Builders/Wells Fargo housing market index rose less than expected in March, industry data showed on Monday.
In a report, NAHB said that its Housing Market Index increased to 47.0 this month from 46.0 in February, missing estimates for a rise to 50.0.
A level above 50.0 indicates a favorable outlook on home sales, below indicates a negative outlook.
“The March HMI mirrors last month’s sentiment, as builders continued to be affected by poor weather and difficulties in finding lots and labor,” said NAHB Chairman Kevin Kelly.
Following the release of the data, the U.S. dollar held on to losses against the euro, with EUR/USD adding 0.2% to trade at 1.3941.
Meanwhile, U.S. stock markets were higher after the open. The Dow Jones Industrial Average climbed 1.2%, the S&P 500 rose 1.1%, while the Nasdaq 100 picked up 1.3%. "
1112,By Investing.com,"<span>Mar 17, 2014 09:16AM ET</span>",U.S. industrial production rises 0.6% in February,"Investing.com - Industrial production in the U.S. rose more-than-expected in February, easing concerns over the economic outlook, official data showed on Monday.
In a report, the U.S. Federal Reserve said that industrial production rose by a seasonally adjusted 0.6% last month, easily surpassing forecasts for a 0.1% gain. Industrial production for January was revised to a 0.2% decline from a previously reported drop of 0.3%.
The report showed that the capacity utilization rate, a measure of how fully firms are using their resources, inched up to 78.8% in February, compared to expectations for a reading of 78.6% and up from 78.5% in January.
Following the release of the data, the U.S. dollar trimmed gains against the euro, with EUR/USD shedding 0.05% to trade at 1.3907, compared to 1.3904 ahead of the data.
Meanwhile, the outlook for U.S. equity markets remained higher. The Dow Jones Industrial Average futures indicated a gain of 0.5% at the open, S&P 500 futures pointed to a rise of 0.5% and Nasdaq 100 futures indicated an increase of 0.6%."
1113,By Investing.com,"<span>Mar 17, 2014 08:38AM ET</span>",Canadian foreign securities purchases increase less-than-expected,"Investing.com - Foreign investors’ acquisitions of Canadian securities increased less-than-expected in January, official data showed on Monday.
In a report, Statistics Canada said that foreign investment increased by a seasonally adjusted C$1.09 billion in January, below expectations for purchases of C$3.24 billion.
Foreign investors sold C$4.28 billion worth of Canadian securities in December.
At the same time, Canadian investors added C$2.3 billion of foreign securities to their holdings in January, a fourth straight month of such investment.
Following the release of the data, the Canadian dollar was higher against its U.S. counterpart, with USD/CAD shedding 0.37% to trade at 1.1063."
1114,By Investing.com,"<span>Mar 17, 2014 08:34AM ET</span>",Empire State manufacturing index rises less than expected in March,"Investing.com - The New York Federal Reserve’s index of manufacturing conditions improved at a lower rate than expected in March, official data showed on Monday.
In a report, the Federal Reserve Bank of New York said that its general business conditions index increased to 5.61 this month from a reading of 4.48 in February. Analysts had expected the index to rise to 6.0 in March.
On the index, a reading above 0.0 indicates improving conditions, below indicates worsening conditions.
The new orders index climbed three points to 3.1, indicating that orders were slightly higher, and the shipments index inched up to 4.0.
Employment indexes were positive and suggested a small increase in employment levels and hours worked..
Indexes for the six-month outlook were down somewhat from last month’s levels, but continued to convey a fairly strong degree of optimism about future conditions, and the capital spending index rose to its highest level in several months.
The Empire State index is of interest to traders primarily because it is seen as an early forecast of the national Institute for Supply management factory survey.
Following the release of the data, the U.S. dollar trimmed gains against the euro, with EUR/USD shedding 0.09% to trade at 1.3902, compared to 1.3895 ahead of the data.
Meanwhile, the outlook for U.S. equity markets remained higher. The Dow Jones Industrial Average futures indicated a gain of 0.4% at the open, S&P 500 futures pointed to a rise of 0.4% and Nasdaq 100 futures indicated an increase of 0.5%."
1115,By Investing.com,"<span>Mar 17, 2014 06:04AM ET</span>",Euro zone CPI unexpectedly slows to 0.7% in February,"Investing.com - Consumer price inflation in the euro zone rose less than initially estimated in February, underlining concerns over the threat of deflation in the region, official data showed on Monday.
In a report, Eurostat said consumer price inflation rose by a seasonally adjusted 0.7% last month, down from a preliminary estimate of 0.8%. Euro zone inflation rose by 0.8% in January.
The rate remains firmly below the European Central Bank's target of near but just below 2%.
Month-over-month, consumer prices inched up 0.3% last month, below expectations for a gain of 0.4% and following a decline of 1.1% in January.
Core CPI, which excludes food, energy, alcohol, and tobacco costs rose by a seasonally adjusted 1% in February, unchanged from an initial estimate and unchanged from January.
Following the release of the data, the euro added to losses against the U.S. dollar, with EUR/USD shedding 0.17% to trade at 1.3891, compared to 1.3899 ahead of the data.
Meanwhile, European stock markets remained higher. The EURO STOXX 50 rose 0.85%, France’s CAC 40 added 0.75%, London’s FTSE 100 picked up 0.5%, while Germany's DAX gained 0.65%."
1116,By Investing.com,"<span>Mar 17, 2014 04:35AM ET</span>",Hong Kong unemployment rate 3.1% vs. 3.1% forecast,
1117,By Investing.com,"<span>Mar 14, 2014 09:55AM ET</span>",U.S. UoM consumer sentiment 79.9 vs. 82.0 forecast,
1118,By Investing.com,"<span>Mar 14, 2014 09:05AM ET</span>",Polish CPI 0.7% vs. 0.8% forecast,
1119,By Investing.com,"<span>Mar 14, 2014 08:35AM ET</span>",U.S. PPI -0.1% vs. 0.2% forecast,
1120,By Investing.com,"<span>Mar 14, 2014 08:35AM ET</span>",U.S. core PPI -0.2% vs. 0.1% forecast,
1121,By Investing.com,"<span>Mar 14, 2014 06:00AM ET</span>",Euro zone employment change 0.1% vs. 0.0% forecast,
1122,By Investing.com,"<span>Mar 14, 2014 05:30AM ET</span>",U.K. trade balance -9.79B vs. -8.60B forecast,
1123,By International Business Times,"<span>Mar 14, 2014 04:30AM ET</span>",German Inflation Slips Slightly In Feb,"By Arjun Kashyap - Germany's consumer price inflation as measured by the consumer price index, or CPI, in February grew by 1.2 percent over the same period last year, slightly lower than the readings in January and December, but in line with expectations, according to official data released Friday. The consumer price index had stood at 1.3 percent in January and at 1.4 percent in December.
The dip in inflation was mainly attributed to a drop in prices of heating oil and motor fuels, while the increase in food prices contributed to a significant portion of the overall inflation rate, according to a press release from the Federal Statistical Office. Prices were up for dairy products such as milk, yoghurt and cheese while vegetables, fruit and fish too were dearer, the release noted.

Compared with January, the consumer price index was up by 0.5 percent in February, which was attributed to seasonal factors such as a pick-up in prices of package holidays and clothing.
 "
1124,By Investing.com,"<span>Mar 14, 2014 04:15AM ET</span>",Swiss PPI -0.4% vs. -0.1% forecast,
1125,By Investing.com,"<span>Mar 14, 2014 04:00AM ET</span>",Czech Retail Sales 6.4% vs. 3.1% forecast,
1126,By Investing.com,"<span>Mar 14, 2014 03:45AM ET</span>",Singaporean retail sales 0.1% vs. -3.1% forecast,
1127,By Investing.com,"<span>Mar 14, 2014 03:00AM ET</span>",German CPI 0.5% vs. 0.5% forecast,
1128,By Investing.com,"<span>Mar 14, 2014 02:40AM ET</span>",Indian WPI 4.68% vs. 4.99% forecast,
1129,By Investing.com,"<span>Mar 14, 2014 12:35AM ET</span>",Japan’s industrial production 3.8% vs. 4.0% forecast,
1130,By Investing.com,"<span>Mar 13, 2014 10:45PM ET</span>",Singaporean unemployment rate 1.8% vs. 2.0% forecast,
1131,By Investing.com,"<span>Mar 13, 2014 02:00PM ET</span>",U.S. federal budget balance -193.5B vs. -212.0B forecast,
1132,By Investing.com,"<span>Mar 13, 2014 10:30AM ET</span>",U.S. Natural Gas Storage -195B vs. -196B forecast,
1133,By Investing.com,"<span>Mar 13, 2014 10:05AM ET</span>",Mexican industrial production 0.7% vs. 0.3% forecast,
1134,By Investing.com,"<span>Mar 13, 2014 10:01AM ET</span>",U.S. business inventories rise 0.4% in January,"Investing.com - U.S. business inventories rose in line with expectations in January, official data showed on Thursday.
In a report, the U.S. Census Bureau said that wholesale inventories increased by a seasonally adjusted 0.4% in January, matching forecasts. Business inventories rose by 0.5% in December.
Following the release of the data, the U.S. dollar held on to losses against the euro, with EUR/USD rising 0.34% to trade at 1.3951.
Meanwhile, U.S. equity markets remained higher. The Dow Jones Industrial Average rose 0.25%, the S&P 500 index inched up 0.15%, while the Nasdaq Composite index added 0.3%. "
1135,By Investing.com,"<span>Mar 13, 2014 08:39AM ET</span>",U.S. import prices gain 0.9% in February,"Investing.com - U.S. import prices rose more than expected in February, official data showed on Thursday.
In a report, the U.S. Bureau of Labor Statistics said U.S. import prices increased by a seasonally adjusted 0.9% last month, compared to forecasts for a 0.4% gain. Import prices for January were revised up to a 0.4% gain from a previously reported rise of 0.1%.
Year-over-year, U.S. import prices fell at an annualized rate of 1.1% in February, following a 1.5% drop in January.
Following the release of the data, the U.S. dollar held on to losses against the euro, with EUR/USD rising 0.27% to trade at 1.3941.
Meanwhile, U.S. stock index futures pointed to a higher open. The Dow Jones Industrial Average futures pointed to a gain of 0.15%, S&P 500 futures indicated a rise of 0.2%, while the Nasdaq 100 futures signaled an increase of 0.3%. "
1136,By Investing.com,"<span>Mar 13, 2014 08:36AM ET</span>","U.S. retail sales rise 0.3% in February, core sales up 0.3% ","Investing.com - Retail sales in the U.S. rose for the first time in three months in February, easing concerns over the strength of the economic recovery, official data showed on Thursday.
In a report, the U.S. Commerce Department said that retail sales inched up by a seasonally adjusted 0.3% last month, beating expectations for a 0.2% increase. Retail sales for January were revised down to a 0.6% decline from a previously reported fall of 0.4%.
Rising retail sales over time correlate with stronger economic growth, while weaker sales signal a declining economy.
Core retail sales, which exclude automobile sales, rose by a seasonally adjusted 0.3% in February, compared to forecasts for a 0.2% increase. Core sales in January were revised down to a fall of 0.3% from a previously reported flat reading.
Core sales correspond most closely with the consumer spending component of the government's gross domestic product report. Consumer spending accounts for as much as 70% of U.S. economic growth.
Following the release of the data, the U.S. dollar held on to losses against the euro, with EUR/USD rising 0.27% to trade at 1.3941.
Meanwhile, U.S. stock index futures pointed to a higher open. The Dow Jones Industrial Average futures pointed to a gain of 0.15%, S&P 500 futures indicated a rise of 0.2%, while the Nasdaq 100 futures signaled an increase of 0.3%. "
1137,By Investing.com,"<span>Mar 13, 2014 08:33AM ET</span>","U.S. initial jobless claims fall by 9,000 last week to 315,000","Investing.com - The number of people who filed for unemployment assistance in the U.S. last week fell unexpectedly to hit a 14-week low, easing concerns over the strength of the labor market, official data showed on Thursday.
In a report, the U.S. Department of Labor said the number of individuals filing for initial jobless benefits in the week ending March 7 fell by 9,000 to a seasonally adjusted 315,000 from the previous week’s revised total of 324,000.
Analysts had expected jobless claims to rise by 6,000 to 330,000 last week.
Continuing jobless claims in the week ended February 28 fell to 2.855 million from 2.903 million in the preceding week. Analysts had expected continuing claims to decrease to 2.900 million.
The four-week moving average was 330,500, a decline of 6,250 from the previous week’s total of 336,750. The monthly average is seen as a more accurate gauge of labor trends because it reduces volatility in the week-to-week data.
Following the release of the data, the U.S. dollar held on to losses against the euro, with EUR/USD rising 0.28% to trade at 1.3943.
Meanwhile, U.S. stock index futures pointed to a higher open. The Dow Jones Industrial Average futures pointed to a gain of 0.15%, S&P 500 futures indicated a rise of 0.2%, while the Nasdaq 100 futures signaled an increase of 0.3%. "
1138,By Investing.com,"<span>Mar 13, 2014 08:30AM ET</span>",Canada’s Capacity Utilization Rate 82.0% vs. 82.0% forecast,
1139,By Investing.com,"<span>Mar 13, 2014 08:30AM ET</span>",Canada’s New House Price Index 0.3% vs. 0.3% forecast,
1140,By Investing.com,"<span>Mar 13, 2014 08:00AM ET</span>",Brazilian retail sales 6.2% vs. 4.6% forecast,
1141,By Investing.com,"<span>Mar 13, 2014 06:40AM ET</span>",Bond yields fall to record low as Italy sells 3-year debt,"Investing.com - Italy saw borrowing costs fall to a record low at an auction of three-year government bonds on Thursday, amid easing concerns over the health of the euro zone’s third-largest economy.
Italy’s Treasury sold €3.5 billion worth of three-year government bonds at an average yield of 1.12%, down from 1.41% at a similar auction last month.
Rome also sold €2 billion of debt maturing in 2021 at an average yield of 2.71%, down from 3.02% last month, as well as €1.5 billion of debt maturing in 2028 at an average yield of 3.85%.
The yield on Italian 10-year bonds stood at 3.399% following the auction.
Meanwhile, the euro held on to gains against the U.S. dollar, with EUR/USD rising 0.38% to trade at 1.3956.
European stock markets were mostly higher. Italy FTSE MIB Index picked up 0.7%, the EURO STOXX 50 added 0.15%, France’s CAC 40 rose 0.2%, Germany’s DAX advanced 0.3%, while London’s FTSE 100 declined 0.1%."
1142,By Investing.com,"<span>Mar 13, 2014 05:15AM ET</span>",Italian CPI -0.1% vs. -0.1% forecast,
1143,By Investing.com,"<span>Mar 13, 2014 04:35AM ET</span>",Swedish unemployment rate 8.5% vs. 8.4% forecast,
1144,By Investing.com,"<span>Mar 13, 2014 04:05AM ET</span>",Spanish retail sales 0.5% vs. -0.8% forecast,
1145,By Investing.com,"<span>Mar 13, 2014 03:45AM ET</span>",French CPI 0.5% vs. 0.4% forecast,
1146,By International Business Times,"<span>Mar 13, 2014 03:15AM ET</span>","China Retail Sales, Production Data Disappoint","By Arjun Kashyap - Data on retail sales and industrial production in China came in below forecast Thursday, MarketWatch reported, citing numbers released by the National Bureau of Statistics, adding to mounting concerns that the world’s second-largest economy might be facing an overall slowdown.
Growth in industrial production in China slowed to 8.6 percent in the first two months of 2014, compared to a 9.7 percent expansion in December, and growth in retail sales narrowed to 11.8 percent from 13.1 percent in December, MarketWatch reported. A Wall Street Journal consensus estimate had pegged industrial production to expand at 9.5 percent and retail sales to grow at 13.5 percent.
Analysts at Societe Generale attributed the fall in retail sales to “anti-corruption drive and disinflation” while pinning the slowing of industrial production on rising inventories, according to MarketWatch.

Earlier, Premier Li Keqiang reportedly gave his vote of confidence to the future of the Chinese economy at a press conference to mark the conclusion of the National People’s Congress.
“The Chinese economy has great potential and resilience. We are capable of, and have the conditions to make sure the economy runs within a reasonable range,” he said, according to MarketWatch, before adding: “The situation this year is more complicated.”
The Shanghai Composite index, which had climbed to trade up 1.3 percent following Li’s comments lost some of its gains after the data release and was trading up 0.81 percent in late-afternoon trade. The Hang Seng index, which had rallied to trade up 0.5 percent subsequently fell to trade down 0.4 percent."
1147,By Investing.com,"<span>Mar 13, 2014 02:50AM ET</span>",Chinese industrial production 8.6% vs. 9.5% forecast,
1148,By Investing.com,"<span>Mar 13, 2014 01:50AM ET</span>",Chinese fixed asset investment 17.9% vs. 19.4% forecast,
1149,By Investing.com,"<span>Mar 13, 2014 01:50AM ET</span>",Chinese retail sales 11.8% vs. 13.5% forecast,
1150,By Investing.com,"<span>Mar 13, 2014 12:05AM ET</span>",Malaysian industrial production 3.7% vs. 4.1% forecast,
1151,By Investing.com,"<span>Mar 12, 2014 08:35PM ET</span>",Australian unemployment rate 6.0% vs. 6.0% forecast,
1152,By Investing.com,"<span>Mar 12, 2014 08:35PM ET</span>",Australian employment change 47.3K vs. 18.0K forecast,"Investing.com - Australian employment change rose more-than-expected last month, official data showed on Thursday.In a report, Australian Bureau of Statistics said that Australian employment change rose to a seasonally adjusted 47.3K, from 18.0K in the preceding month whose figure was revised up from -3.7K.Analysts had expected Australian employment change to rise 18.0K last month.


"
1153,By Investing.com,"<span>Mar 12, 2014 08:05PM ET</span>",U.K. RICS house price balance 45% vs. 52% forecast,
1154,By Investing.com,"<span>Mar 12, 2014 07:55PM ET</span>",Japan’s Core Machinery Orders 13.4% vs. 7.0% forecast,
1155,By Investing.com,"<span>Mar 12, 2014 04:33PM ET</span>",Reserve Bank of New Zealand hikes OCR to 2.75% from 2.50%,"Investing.com - Following is the full text of Reserve Bank of New Governor Graeme Wheeler's statement announcing the decision to raise the Official Cash Rate by 25 basis points to 2.75% Thursday:
The Reserve Bank today increased the OCR by 25 basis points to 2.75 percent.New Zealand's economic expansion has considerable momentum, and growth is becoming more broad-based. GDP is estimated to have grown by 3.3 percent in the year to March. Growth is gradually increasing in New Zealand's trading partners. However, improvements in major economies have required exceptional support from monetary policy. Global financial conditions continue to be very accommodating, with bond yields in most advanced countries low and equity markets performing strongly.Prices for New Zealand's export commodities remain very high, and especially for dairy. Domestically, the extended period of low interest rates and continued strong growth in construction sector activity have supported recovery. A rapid increase in net immigration over the past 18 months has also boosted housing and consumer demand. Confidence is very high among consumers and businesses, and hiring and investment intentions continue to increase.Growth in demand has been absorbing spare capacity, and inflationary pressures are becoming apparent, especially in the non-tradables sector. In the tradables sector, weak import price inflation and the high exchange rate have held down inflation. The high exchange rate remains a headwind to the tradables sector. The Bank does not believe the current level of the exchange rate is sustainable in the long run.There has been some moderation in the housing market. Restrictions on high loan-to-value ratio mortgage lending are starting to ease pressure, and rising interest rates will have a further moderating influence. However, the increase in net immigration flows will remain an offsetting influence.While headline inflation has been moderate, inflationary pressures are increasing and are expected to continue doing so over the next two years. In this environment it is important that inflation expectations remain contained. To achieve this it is necessary to raise interest rates towards a level at which they are no longer adding to demand. The Bank is commencing this adjustment today. The speed and extent to which the OCR will be raised will depend on economic data and our continuing assessment of emerging inflationary pressures.By increasing the OCR as needed to keep future average inflation near the 2 percent target mid-point, the Bank is seeking to ensure that the economic expansion can be sustained."""
1156,By Investing.com,"<span>Mar 12, 2014 10:30AM ET</span>",U.S. Gasoline Inventories -5.230M vs. -2.033M forecast,
1157,By Investing.com,"<span>Mar 12, 2014 10:30AM ET</span>",U.S. Crude Oil Inventories 6.180M vs. 2.150M forecast,
1158,By Investing.com,"<span>Mar 12, 2014 08:00AM ET</span>",Indian industrial production 0.1% vs. -0.6% forecast,
1159,By Investing.com,"<span>Mar 12, 2014 08:00AM ET</span>",Brazilian CPI 5.68% vs. 5.64% forecast,
1160,By Investing.com,"<span>Mar 12, 2014 06:15AM ET</span>",Bond yields fall to lowest on record as Italy sells 12-month debt,"Investing.com - Italy saw borrowing costs fall to the lowest level on record at an auction of 12-month government bonds on Wednesday, amid easing concerns over the health of the euro zone’s third-largest economy.
Italy’s Treasury sold the full-targeted amount of EUR7 billion worth of 12-month government bonds at an average yield of 0.592%, an all-time low and down from 0.676% at a similar auction last month.
The yield on Italian 10-year bonds stood at 3.402% following the auction. The euro was little changed against the U.S. dollar following the auction, with EUR/USD easing up 0.01% to trade at 1.3861.
Meanwhile, European stock markets remained sharply lower. Italy FTSE MIB Index shed 0.3%, the EURO STOXX 50 dropped 0.95%, France’s CAC 40 lost 1.2%, Germany’s DAX tumbled 1.15%, while London’s FTSE 100 slumped 0.9%."
1161,By Investing.com,"<span>Mar 12, 2014 06:02AM ET</span>",Euro zone industrial production falls 0.2% in January,"Investing.com - Industrial production in the euro zone fell unexpectedly in January, fuelling concerns over the outlook for economic growth in the single currency bloc, official data showed on Wednesday.
In a report, Eurostat, the European statistics agency said industrial production declined by a seasonally adjusted 0.2% in January, disappointing expectations for a gain of 0.5%. Industrial production in December was revised to a 0.4% drop, from a previously reported fall of 0.7%.
Year-on-year, industrial production increased at an annualized rate of 2.1% in January from a year earlier, above expectations for a 1.9% gain and after rising at a rate of 1.2% in the preceding month.
Following the release of that data, the euro was little changed against the U.S. dollar, with EUR/USD easing down 0.01% to trade at 1.3859.
Meanwhile, European stock markets were sharply lower. The EURO STOXX 50 fell 0.9%, France’s CAC 40 tumbled 1.1%, Germany's DAX dropped 1.1%, while London’s FTSE 100 lost 0.85%."
1162,By Investing.com,"<span>Mar 12, 2014 04:00AM ET</span>",Slovakian Industrial Production 12.9% vs. 8.5% forecast,
1163,By Investing.com,"<span>Mar 12, 2014 04:00AM ET</span>",Spanish CPI 0.0% vs. -0.1% forecast,
1164,By Investing.com,"<span>Mar 12, 2014 04:00AM ET</span>",Slovakian CPI -0.1% vs. 0.1% forecast,
1165,By Investing.com,"<span>Mar 12, 2014 03:50AM ET</span>",French non-farm payrolls 0.1% vs. 0.1% forecast,
1166,By Investing.com,"<span>Mar 12, 2014 02:20AM ET</span>",Japanese Household Confidence 38.3 vs. 40.3 forecast,
1167,By Investing.com,"<span>Mar 11, 2014 08:35PM ET</span>",Australian home loans 0.0% vs. -0.5% forecast,
1168,By Investing.com,"<span>Mar 11, 2014 07:55PM ET</span>",Japan’s Corporate Goods Price Index 1.8% vs. 2.1% forecast,
1169,By Investing.com,"<span>Mar 11, 2014 07:55PM ET</span>",Japan’s tertiary index 0.9% vs. 0.7% forecast,
1170,By Investing.com,"<span>Mar 11, 2014 07:55PM ET</span>",Japan’s BSI manufacturing index 12.5 vs. 11.3 forecast,
1171,By Investing.com,"<span>Mar 11, 2014 07:00PM ET</span>",South Korean unemployment rate 3.9% vs. 3.2% forecast,
