,company,date,title,content
388,By Investing.com,"<span>May 28, 2014 06:06AM ET</span>",U.K. CBI realized sales slow unexpectedly in May,"Investing.com - U.K. retail sale volumes fell unexpectedly in May, dampening optimism over the health of the country’s economy, industry data showed on Wednesday.
In a report, the Confederation of British Industry said the result of its index of U.K. retailers dropped by 14.0 points to a reading of 16.0 this month from 30.0 in April. Analysts had expected the index to increase by 5.0 point to 35.0 in May.
On the index, a reading above 0.0 indicates higher sales volume, below indicates lower.
The survey of 136 firms showed that retailers expect a faster rise in sales next month, and expect their business situation to improve over the coming quarter.
Barry Williams, Chair of the CBI Distributive Trades Survey Panel said, “Although that growth was at a slower rate than expected, the fact we’ve seen a steady increase for six consecutive months is a sign we’re heading towards sustainable growth and strengthening consumer optimism.”
Following the release of that data, the pound held on to losses against the U.S. dollar, with GBP/USD shedding 0.25% to trade at 1.6768.
Meanwhile, European stock markets remained mixed. London’s FTSE 100 declined 0.1%, the Euro Stoxx 50 rose 0.1%, France’s CAC 40 inched down 0.1%, while Germany's DAX tacked on 0.1%. 
"
389,By Investing.com,"<span>May 28, 2014 04:05AM ET</span>",Euro Zone Private Sector Lending -1.8% vs. -2.1% forecast,"Investing.com - Private sector lending in the euro zone rose more-than-expected last month, official data showed on Wednesday.In a report, European Central Bank said that Euro Zone Private Sector Lending rose to -1.8%, from -2.2% in the preceding month.Analysts had expected Euro Zone Private Sector Lending to rise to -2.1% last month."
390,By Investing.com,"<span>May 28, 2014 04:05AM ET</span>",Euro Zone M3 Money Supply 0.8% vs. 1.1% forecast,"Investing.com - The amount of domestic currency in circulation and deposited in banks in the euro zone fell unexpectedly last month, official data showed on Wednesday.In a report, European Central Bank said that Euro Zone M3 Money Supply fell to 0.8%, from 1.0% in the preceding month whose figure was revised down from 1.1%.Analysts had expected Euro Zone M3 Money Supply to remain unchanged at 1.1% last month."
391,By Investing.com,"<span>May 28, 2014 04:00AM ET</span>",Italian Business Confidence 99.7 vs. 99.6 forecast,"Investing.com - Italian business confidence remained unchanged unexpectedly last month, official data showed on Wednesday.In a report, Organisation for Economic Co-operation and Development said that Italian Business Confidence remained unchanged at a seasonally adjusted 99.7, from 99.7 in the preceding month whose figure was revised down from 99.9.Analysts had expected Italian Business Confidence to fall to 99.6 last month."
392,By Investing.com,"<span>May 28, 2014 04:00AM ET</span>",Norwegian retail sales 0.5% vs. -0.3% forecast,"Investing.com - Retail sales in Norway rose unexpectedly last month, official data showed on Wednesday.In a report, Statistics Norway said that Norwegian Retail Sales rose to a seasonally adjusted annual rate of 0.5%, from 1.0% in the preceding month.Analysts had expected Norwegian Retail Sales to fall -0.3% last month."
393,By Investing.com,"<span>May 28, 2014 03:56AM ET</span>","German jobless claims rise by 24,000 in May","Investing.com - The number of unemployed people in Germany rose for the first time in six months in May, while the country’s jobless rate held steady at a record low, official data showed on Wednesday.
In a report, Germany's Federal Statistics Office said the number of unemployed people increased by a seasonally adjusted 24,000 this month, disappointing expectations for a drop of 15,000. Jobless claims in April fell by 25,000.
The report showed that Germany’s unemployment held steady at 6.7% in May, in line with expectations and unchanged from April.
Following the release of the data, the euro added to losses against the U.S. dollar, with EUR/USD easing down 0.12% to trade at 1.3620, compared to 1.3624 ahead of the data.
Meanwhile, European stock markets remained lower. Germany's DAX shed 0.1%, the Euro Stoxx 50 fell 0.25%, France’s CAC 40 dipped 0.1%, while London’s FTSE 100 inched down 0.1%. 
"
394,By Investing.com,"<span>May 28, 2014 03:05AM ET</span>",Spanish retail sales 0.7% vs. -0.3% forecast,"Investing.com - Retail sales in Spain rose more-than-expected last month, official data showed on Wednesday.In a report, INE - National Institute of Statistics said that Spanish retail sales rose to a seasonally adjusted annual rate of 0.7%, from -0.5% in the preceding month.Analysts had expected Spanish retail sales to rise to -0.3% last month."
395,By Investing.com,"<span>May 28, 2014 03:05AM ET</span>",Danish GDP 0.9% vs. 0.8% forecast,"Investing.com - Denmark’s gross domestic product rose more-than-expected last month, official data showed on Wednesday.In a report, Danmarks Statistik said that Danish GDP rose to a seasonally adjusted 0.9%, from -0.6% in the preceding month.Analysts had expected Danish GDP to rise 0.8% last month."
396,By Investing.com,"<span>May 28, 2014 02:45AM ET</span>",French PPI -0.1% vs. -0.3% forecast,"Investing.com - French producer price inflation rose more-than-expected last month, official data showed on Wednesday.In a report, INSEE said that French PPI rose to a seasonally adjusted -0.1%, from -0.4% in the preceding month.Analysts had expected French PPI to rise to -0.3% last month."
397,By Investing.com,"<span>May 28, 2014 02:45AM ET</span>",French consumer spending -0.3% vs. 0.3% forecast,"Investing.com - Consumer spending in France fell unexpectedly last month, official data showed on Wednesday.In a report, INSEE said that French consumer spending fell to a seasonally adjusted -0.3%, from 0.6% in the preceding month whose figure was revised up from 0.4%.Analysts had expected French consumer spending to rise 0.3% last month."
398,By Investing.com,"<span>May 28, 2014 02:00AM ET</span>",German Import Price Index -0.3% vs. 0.1% forecast,"Investing.com - Germany’s import price index rose less-than-expected in the last quarter, official data showed on Wednesday.In a report, Destatis said that German Import Price Index rose to a seasonally adjusted -0.3%, from -0.6% in the preceding quarter.Analysts had expected German Import Price Index to rise to 0.1% in the last quarter."
399,By Investing.com,"<span>May 28, 2014 01:45AM ET</span>",Swiss GDP 0.5% vs. 0.6% forecast,"Investing.com - Switzerland’s gross domestic product rose less-than-expected in the last quarter, official data showed on Wednesday.In a report, Federal Statistical Office said that Swiss GDP rose to a seasonally adjusted 0.5%, from 0.2% in the preceding quarter.Analysts had expected Swiss GDP to rise 0.6% in the last quarter."
400,By Investing.com,"<span>May 27, 2014 11:00PM ET</span>",Thai industrial production -3.9% vs. -6.4% forecast,"Investing.com - Industrial production in Thailand rose more-than-expected last month, official data showed on Wednesday.In a report, Office of Industrial Economics Thailand said that Thai Industrial Production rose to a seasonally adjusted -3.9%, from -10.4% in the preceding month.Analysts had expected Thai Industrial Production to rise to -6.4% last month."
401,By Investing.com,"<span>May 27, 2014 09:35PM ET</span>",Australian construction 0.3% vs. -0.2% forecast,"Investing.com - The value of Australian construction work done rose more-than-expected in the last quarter, official data showed on Wednesday.In a report, Australian Bureau of Statistics said that Australian construction work done rose to a seasonally adjusted 0.3%, from -1.1% in the preceding quarter whose figure was revised down from -1.0%.Analysts had expected Australian construction work done to rise to -0.2% in the last quarter."
402,By Investing.com,"<span>May 27, 2014 10:35AM ET</span>",Dallas Fed Manufacturing Business Index 8.0 vs. 9.2 forecast,"Investing.com - The Federal Reserve Bank of Dallas manufacturing business index rose less-than-expected last month, official data showed on Tuesday.In a report, Dallas Fed said that Dallas Fed Mfg Business Index rose to a seasonally adjusted annual rate of 8.0, from 11.7 in the preceding month.Analysts had expected Dallas Fed Mfg Business Index to rise 9.2 last month."
403,By Investing.com,"<span>May 27, 2014 10:02AM ET</span>",U.S. CB consumer confidence rises to 83.0 in May,"Investing.com - U.S. consumer confidence improved in line with expectations in May, underlining optimism over the U.S. economic outlook, industry data showed on Tuesday.
In a report, the Conference Board, a market research group said its index of consumer confidence rose to 83.0 this month from a reading of 81.7 in April, whose figure was revised down from a previously reported 82.3.
The Present Situation Index increased to 80.4 from 78.5, while the Expectations Index edged up to 84.8 from 83.9 in April.
Commenting on the report, director of The Conference Board Consumer Research Center Lynn Franco said, “Consumer confidence improved slightly in May, as consumers assessed current conditions, in particular the labor market, more favorably.”
Following the release of the data, the U.S. dollar held on to modest gains against the euro, with EUR/USD shedding 0.08% to trade at 1.3636.
Meanwhile, U.S. equity markets were higher after the open. The Dow 30 rose 0.4%, the S&P 500 added 0.45%, while the NASDAQ Composite tacked on 0.6%.
"
404,By Investing.com,"<span>May 27, 2014 09:02AM ET</span>",S&P/Case-Shiller home price index rises 12.4% in March,"Investing.com - The S&P/Case-Shiller home price index rose more than expected in March, underlining optimism over the housing sector, industry data showed on Tuesday.
In a report, Standard & Poor’s with Case-Shiller said its house price index rose at an annualized rate of 12.4% in March from a year earlier, compared to forecasts for a gain of 11.8% and following a rise of 12.9% in February.
Month-on-month, U.S. home prices climbed by a seasonally adjusted 0.9%, above expectations for a 0.2% gain and after a flat reading in the preceding month.
Following the release of the data, the U.S. dollar held on to modest gains against the euro, with EUR/USD shedding 0.07% to trade at 1.3637, compared to 1.3640 ahead of the data.
Meanwhile, U.S. stock index futures pointed to a higher open. The Dow 30 futures pointed to a gain of 0.4%, the S&P 500 indicated a rise of 0.35%, while the Nasdaq 100 signaled an increase of 0.4%. 
"
405,By Investing.com,"<span>May 27, 2014 08:34AM ET</span>","U.S. durable goods orders rise 0.8% in April, core orders up 0.1%","Investing.com - U.S. durable goods orders rose unexpectedly in April, while core orders missed forecasts, official data showed on Tuesday.
In a report, the U.S. Commerce Department said that total durable goods orders, which include transportation items, climbed by a seasonally adjusted 0.8% last month, compared to expectations for a 0.5% decline.
Orders for durable goods in March were revised up to a 3.6% gain from a previously reported increase of 2.6%.
Durable goods are typically bulky or heavy products designed to last at three years, such as trains, computers or furniture.
Core durable goods orders, excluding volatile transportation items, rose by a seasonally adjusted 0.1% in April, missing forecasts for a 0.3% gain. Core durable goods orders rose by 2.9% in March.
Orders for core capital goods, a key barometer of private-sector business investment, fell 1.2% last month, disappointing expectations for a 0.2% increase and after rising 4.7% in March.
Shipments of core capital goods, a category used to calculate quarterly economic growth, declined 0.4% in April, worse than forecasts for a 0.2% drop, after increasing 2.1% in the preceding month.
Following the release of the data, the U.S. dollar added to gains against the euro, with EUR/USD shedding 0.12% to trade at 1.3630, compared to 1.3636 ahead of the data.
Meanwhile, U.S. stock index futures pointed to a higher open. The Dow 30 futures pointed to a gain of 0.35%, the S&P 500 indicated a rise of 0.3%, while the Nasdaq 100 signaled an increase of 0.4%. 
"
406,By Investing.com,"<span>May 27, 2014 04:40AM ET</span>",Hong Kong trade balance -55.3B vs. -46.5B forecast,"Investing.com - Hong Kong’s trade balance fell unexpectedly last month, official data showed on Tuesday.In a report, Hong Kong Census and Statistics Department said that Hong Kong Trade Balance fell to a seasonally adjusted -55.3B, from -50.4B in the preceding month.Analysts had expected Hong Kong Trade Balance to rise to -46.5B last month."
407,By Investing.com,"<span>May 27, 2014 04:34AM ET</span>",U.K. BBA mortgage approvals fall to 8-month low in April,"Investing.com - Mortgage approvals in the U.K. fell to the lowest level in eight months in April, industry data showed on Tuesday.
In a report, the British Banker's Association said that the number of new mortgages approved declined to 42,200 last month from March’s revised total of 45,000.
Analysts had expected the number of new mortgages approved to rise to 45,200 in April.
Following the release of that data, the pound held on to gains against the U.S. dollar, with GBP/USD rising 0.09% to trade at 1.6858.
Meanwhile, European stock markets remained mixed. London’s FTSE 100 tacked on 0.35%, the Euro Stoxx 50 dipped 0.1%, France’s CAC 40 shed 0.2%, while Germany's DAX inched up 0.1%. 
"
408,By Investing.com,"<span>May 27, 2014 04:00AM ET</span>",Italian Consumer Confidence 106.3 vs. 105.0 forecast,"Investing.com - Italian consumer confidence rose more-than-expected last month, official data showed on Tuesday.In a report, Italian National Institute of Statistics said that Italian Consumer Confidence rose to 106.3, from 105.5 in the preceding month whose figure was revised up from 105.4.Analysts had expected Italian Consumer Confidence to rise 105.0 last month."
409,By Investing.com,"<span>May 27, 2014 03:20AM ET</span>",Swiss employment level 4.190M vs. 4.210M forecast,"Investing.com - The number of people employed in Switzerland remained unchanged unexpectedly in the last quarter, official data showed on Tuesday.In a report, Federal Statistical Office said that Swiss employment level remained unchanged at a seasonally adjusted 4.190M, from 4.190M in the preceding quarter.Analysts had expected Swiss employment level to rise to 4.210M in the last quarter."
410,By Investing.com,"<span>May 27, 2014 02:45AM ET</span>",French Consumer Confidence 85 vs. 85 forecast,"Investing.com - French consumer confidence remained unchanged last month, official data showed on Tuesday.In a report, INSEE said that French Consumer Confidence remained unchanged at 85, from 85 in the preceding month.Analysts had expected French Consumer Confidence to remain unchanged at 85 last month."
411,By Investing.com,"<span>May 27, 2014 02:00AM ET</span>",Swiss Trade Balance 2.425B vs. 2.052B forecast,"Investing.com - Switzerland’s trade balance rose more-than-expected last month, official data showed on Tuesday.In a report, Federal Statistical Office said that Swiss Trade Balance rose to a seasonally adjusted 2.425B, from 1.996B in the preceding month whose figure was revised down from 2.050B.Analysts had expected Swiss Trade Balance to rise to 2.052B last month."
412,By Investing.com,"<span>May 26, 2014 07:55PM ET</span>",Japan’s CSPI 3.4% vs. 3.3% forecast,"Investing.com - Japan’s corporate services price index rose more-than-expected last month, official data showed on Monday.In a report, Bank Of Japan said that Japan’s CSPI rose to a seasonally adjusted annual rate of 3.4%, from 0.7% in the preceding month.Analysts had expected Japan’s CSPI to rise to 3.3% last month."
413,By Investing.com,"<span>May 26, 2014 05:00PM ET</span>",South Korean consumer confidence 105 vs. 107 forecast,"Investing.com - The current level of consumer confidence in South Korea fell more-than-expected last month, official data showed on Monday.In a report, The Bank Of KOREA said that South Korean Consumer Confidence fell to 105, from 108 in the preceding month.Analysts had expected South Korean Consumer Confidence to fall to 107 last month."
414,By Investing.com,"<span>May 26, 2014 09:05AM ET</span>",Mexican trade balance 0.510B vs. -0.758B forecast,"Investing.com - Mexico’s trade balance fell less-than-expected last month, official data showed on Monday.In a report, Insituto Nacional de Estadistica Y Geografia said that Mexican Trade Balance fell to a seasonally adjusted 0.510B, from 1.027B in the preceding month.Analysts had expected Mexican Trade Balance to fall to -0.758B last month."
415,By Investing.com,"<span>May 26, 2014 04:48AM ET</span>",Investing.com sentiment index report - S&P 500 shorts surge,"Investing.com - The Investing.com weekly sentiment index published on Monday revealed that market players aggressively shorted the S&P 500 in the week ending May 23, as it trades at record-high levels.
According to the report, only 8.0% of market participants held long positions in the S&P 500 last week, down from 38.5% in the previous week. A reading below 30% indicates oversold conditions.
Elsewhere, 49.4% of investors held long positions in EUR/USD, up from 41.0% a week earlier. Investors were also 46.4% long in GBP/USD, compared to 40.8% in the preceding week.
Meanwhile, 55.4% held long positions in USD/JPY, up slightly from 53.1% a week earlier, while 50.7% were long USD/CHF, compared to 48.8% in the preceding week.
Amongst the commodity-linked currencies, 53.1% were long USD/CAD, compared to 55.3% a week earlier, 61.6% held long positions in AUD/USD, improving from 54.0% in the preceding week, while 51.7% were long NZD/USD, up from 45.9% a week earlier.
In the commodities market, 65.4% of market players held long positions in gold, compared to 64.0% a week earlier.
The Investing.com series of indexes is developed in-house, using data from futures exchanges and OTC providers on all long and short open positions.
A reading between 50% and 70% is bullish for the instrument, a reading between 30% and 50% is bearish, a reading above 70% indicates overbought conditions and a reading below 30% indicates oversold conditions.
"
416,By Investing.com,"<span>May 26, 2014 04:00AM ET</span>",Polish retail sales 8.4% vs. 9.1% forecast,"Investing.com - Retail sales in Poland rose less-than-expected in the last quarter, official data showed on Monday.In a report, Central Statistical Office said that Polish Retail Sales rose to a seasonally adjusted annual rate of 8.4%, from 3.1% in the preceding quarter.Analysts had expected Polish Retail Sales to rise to 9.1% in the last quarter."
417,By Investing.com,"<span>May 26, 2014 04:00AM ET</span>",Spanish PPI 0.1% vs. 0.5% forecast,"Investing.com - Producer price inflation in Spain rose less-than-expected last month, industry data showed on Monday.In a report, Instituto Nacional de Estadistica said that Spanish PPI rose to a seasonally adjusted 0.1%, from -1.3% in the preceding month whose figure was revised down from -1.2%.Analysts had expected Spanish PPI to rise to 0.5% last month."
418,By Investing.com,"<span>May 26, 2014 04:00AM ET</span>",Polish unemployment rate 13.0% vs. 12.9% forecast,"Investing.com - The unemployment rate in Poland fell less-than-expected last month, official data showed on Monday.In a report, Central Statistical Office said that Polish Unemployment Rate fell to a seasonally adjusted 13.0%, from 13.5% in the preceding month.Analysts had expected Polish Unemployment Rate to fall to 12.9% last month."
419,By Investing.com,"<span>May 26, 2014 03:35AM ET</span>",Swedish retail sales 0.3% vs. -0.5% forecast,"Investing.com - Retail sales in Sweden rose unexpectedly last month, official data showed on Monday.In a report, SCB - Statistics Sweden said that Swedish Retail Sales rose to a seasonally adjusted 0.3%, from 1.0% in the preceding month whose figure was revised down from 1.1%.Analysts had expected Swedish Retail Sales to fall -0.5% last month."
420,By Investing.com,"<span>May 26, 2014 01:00AM ET</span>",Singaporean industrial production 4.6% vs. 6.5% forecast,"Investing.com - Industiral production in Singapore fell more-than-expected last month, official data showed on Monday.In a report, Statistics Singapore said that Singaporean Industrial Production fell to an annual rate of 4.6%, from 12.1% in the preceding month.Analysts had expected Singaporean Industrial Production to fall to 6.5% last month."
421,By Investing.com,"<span>May 25, 2014 08:44PM ET</span>","Bank of Japan minutes show varied dissent on 2% inflation target, growth","Investing.com - Three of the Bank of Japan's nine board members wanted to separately revise growth and inflation outlooks, including emphasizing downside risks and setting a timeframe for easing, minutes of the April 30 policy meeting released Monday showed.
Takahide Kiuchi and Takehiro Sato repeated objections to the outlook that inflation will be raised to and anchored around 2% in 2015.
Sato said that inflation ""is likely to follow a rising trend again from the second half of this fiscal year.""
Kiuchi continued to propose that the BOJ should maintain the high degree of easing only during the two-year period from April 2013. His views were rejected by the majority.
Sayuri Shirai disagreed on the timing for reaching the 2% target and proposed that the target would be achieved ""toward the end of the projection period through March 2017."" Her proposal was rejected by the majority.
"
422,By Investing.com,"<span>May 25, 2014 06:50PM ET</span>",New Zealand’s trade balance 534M vs. 667M forecast,"Investing.com - New Zealand’s trade balance fell more-than-expected last month, data showed on Sunday.In a report, Statistics New Zealand said that the trade balance fell to a seasonally adjusted 534M, from 920M in the preceding month.Analysts had expected the trade balance to fall to 667M last month."
423,By Investing.com,"<span>May 23, 2014 03:20PM ET</span>",Argentinian industrial production -4.0% vs. -6.1% forecast,"Investing.com - Industrial production in Argentina rose unexpectedly last month, official data showed on Friday.In a report, Instituto Nacional De Estadistic y Censos said that Argentinian Industrial Production rose to -4.0%, from -5.9% in the preceding month.Analysts had expected Argentinian Industrial Production to fall to -6.1% last month."
424,By Investing.com,"<span>May 23, 2014 10:00AM ET</span>",New home sales 433K vs. 425K forecast,"Investing.com - New home sales in the U.S. rose more-than-expected last month, official data showed on Friday.In a report, the Census Bureau said that new home sales rose to a seasonally adjusted annual rate of 433K, from 407K in the preceding month whose figure was revised up from 384K.Analysts had expected new home sales to rise to 425K last month."
425,By Investing.com,"<span>May 23, 2014 09:00AM ET</span>",Mexican GDP 1.8% vs. 2.0% forecast,"Investing.com - Mexico’s gross domestic product rose less-than-expected in the last quarter, official data showed on Friday.In a report, Insituto Nacional de Estadistica Y Geografia said that Mexican GDP rose to a seasonally adjusted 1.8%, from 0.7% in the preceding quarter.Analysts had expected Mexican GDP to rise to 2.0% in the last quarter."
426,By Investing.com,"<span>May 23, 2014 09:00AM ET</span>",Mexican economic activity 3.03% vs. 3.50% forecast,"Investing.com - Economic activity in Mexico rose less-than-expected last month, official data showed on Friday.In a report, Instituto Nacional de Estadistica y Geografia said that Mexican Economic Activity rose to a seasonally adjusted 3.03%, from 1.74% in the preceding month.Analysts had expected Mexican Economic Activity to rise to 3.50% last month."
427,By Investing.com,"<span>May 23, 2014 08:30AM ET</span>",Canadian consumer price inflation 0.3% vs. 0.3% forecast,"Investing.com - Consumer price inflation in Canada rose last month, official data showed on Friday.In a report, Statistics Canada said that Canadian consumer price inflation rose to a seasonally adjusted 0.3%, from 0.6% in the preceding month.Analysts had expected Canadian consumer price inflation to rise 0.3% last month."
428,By Investing.com,"<span>May 23, 2014 08:30AM ET</span>",Canadian core CPI 0.2% vs. 0.2% forecast,"Investing.com - Canadian core consumer price inflation rose last month, official data showed on Friday.In a report, Statistics Canada said that Canadian core CPI rose to a seasonally adjusted 0.2%, from 0.3% in the preceding month.Analysts had expected Canadian core CPI to rise 0.2% last month."
429,By Investing.com,"<span>May 23, 2014 06:10AM ET</span>",Taiwanese GDP 3.14% vs. 3.00% forecast,"Investing.com - Taiwan’s gross domestic product rose unexpectedly last month, official data showed on Friday.In a report, National Statistics Taiwan said that Taiwanese GDP rose to 3.14%, from 2.88% in the preceding month whose figure was revised down from 3.04%.Analysts had expected Taiwanese GDP to fall to 3.00% last month."
430,By Investing.com,"<span>May 23, 2014 04:05AM ET</span>",German Ifo business climate 110.4 vs. 110.9 forecast,"Investing.com - Germany’s Ifo business climate fell more-than-expected last month, data showed on Friday. In a report, the Ifo Institute for Economic Research said its index of German business climate fell to 110.4, from 111.2 in the preceding month . Analysts had expected the index to fall to 110.9 last month."
