,company,date,title,content
0,By Investing.com,"<span>Sep 11, 2012 07:00PM ET</span>",South Korean unemployment rate remains unchanged unexpectedly,
1,By Investing.com,"<span>Sep 11, 2012 04:35PM ET</span>",U.S. API Weekly Gasoline Stock falls unexpectedly,
2,By Investing.com,"<span>Sep 11, 2012 04:35PM ET</span>",U.S. API Weekly Crude Stock rises unexpectedly,
3,By Investing.com,"<span>Sep 11, 2012 09:00AM ET</span>",Mexican industrial production rise more-than-expected,
4,By Investing.com,"<span>Sep 11, 2012 08:39AM ET</span>",U.S. trade deficit widens 0.2% in July,
5,By Investing.com,"<span>Sep 11, 2012 08:34AM ET</span>",Canada trade deficit widens unexpectedly in July,
6,By Investing.com,"<span>Sep 11, 2012 08:16AM ET</span>",Canadian housing starts rise unexpectedly in August,
7,By Investing.com,"<span>Sep 11, 2012 06:00AM ET</span>",U.K. goods trade deficit narrows more-than-expected in July,
8,By Investing.com,"<span>Sep 11, 2012 03:00AM ET</span>",Hungarian CPI rises,
9,By Investing.com,"<span>Sep 11, 2012 02:20AM ET</span>",French non-farm payrolls fall,
10,By Investing.com,"<span>Sep 11, 2012 02:00AM ET</span>",Germany’s Wholesale Price Index rises more-than-expected,
11,By Investing.com,"<span>Sep 10, 2012 09:50PM ET</span>",U.K. RICS house price balance rises more-than-expected,
12,By Investing.com,"<span>Sep 10, 2012 07:55PM ET</span>",Japan’s BSI manufacturing index rise unexpectedly,
13,By Investing.com,"<span>Sep 10, 2012 03:00PM ET</span>",U.S. Consumer Credit falls unexpectedly,
14,By Investing.com,"<span>Sep 10, 2012 04:32AM ET</span>",Euro zone Sentix investor confidence improves significantly,
15,By Investing.com,"<span>Sep 10, 2012 04:05AM ET</span>",Norwegian CPI rises less-than-expected,
16,By Investing.com,"<span>Sep 10, 2012 04:00AM ET</span>",Italian GDP remains unchanged unexpectedly,
17,By Investing.com,"<span>Sep 10, 2012 03:35AM ET</span>",Swedish industiral production rises unexpectedly,
18,By Investing.com,"<span>Sep 10, 2012 03:05AM ET</span>",Turkish GDP falls unexpectedly,
19,By Investing.com,"<span>Sep 10, 2012 03:05AM ET</span>",Slovakian Industrial Production rises more-than-expected,
20,By Investing.com,"<span>Sep 10, 2012 03:05AM ET</span>",Danish CPI rises more-than-expected,
21,By Investing.com,"<span>Sep 10, 2012 03:05AM ET</span>",Turkish industrial production rises more-than-expected,
22,By Investing.com,"<span>Sep 10, 2012 03:05AM ET</span>",Czech Unemployment Rate remains unchanged,
23,By Investing.com,"<span>Sep 10, 2012 03:00AM ET</span>",Czech CPI falls unexpectedly,
24,By Investing.com,"<span>Sep 10, 2012 02:05AM ET</span>",Japan’s Economy Watchers Current Index falls,
25,By Investing.com,"<span>Sep 10, 2012 01:05AM ET</span>",Japanese Household Confidence rises more-than-expected,
26,By Investing.com,"<span>Sep 10, 2012 12:05AM ET</span>",Malaysian industrial production rises less-than-expected,
27,By Investing.com,"<span>Sep 09, 2012 11:05PM ET</span>",Chinese trade balance rises more-than-expected,
28,By Investing.com,"<span>Sep 09, 2012 09:35PM ET</span>",Australian home loans fall unexpectedly,
29,By Investing.com,"<span>Sep 09, 2012 07:55PM ET</span>",Japan’s Current Account rises less-than-expected,
30,By Investing.com,"<span>Sep 09, 2012 07:55PM ET</span>",Japan’s GDP rises less-than-expected,
31,By Investing.com,"<span>Sep 09, 2012 01:35AM ET</span>",Chinese fixed asset investment rise less-than-expected,
32,By Investing.com,"<span>Sep 09, 2012 01:35AM ET</span>",Chinese retail sales rises,
33,By Investing.com,"<span>Sep 09, 2012 01:35AM ET</span>",Chinese industrial production rises less-than-expected,
34,By Investing.com,"<span>Sep 08, 2012 09:35PM ET</span>",Chinese CPI rises more-than-expected,
35,By Investing.com,"<span>Sep 07, 2012 10:05AM ET</span>",Canada’s Ivey PMI falls less-than-expected,
36,By Investing.com,"<span>Sep 07, 2012 09:05AM ET</span>",Mexican CPI rises more-than-expected,
37,By Investing.com,"<span>Sep 07, 2012 08:30AM ET</span>",Canadian employment change rises more-than-expected,
38,By Investing.com,"<span>Sep 07, 2012 08:30AM ET</span>",Canadian unemployment rate remains unchanged,
39,By Investing.com,"<span>Sep 07, 2012 08:30AM ET</span>",U.S. Private Nonfarm Payrolls falls more-than-expected,
40,By Investing.com,"<span>Sep 07, 2012 08:30AM ET</span>",U.S. unemployment rate falls unexpectedly,
41,By Investing.com,"<span>Sep 07, 2012 08:30AM ET</span>",U.S. non-farm payrolls rise less-than-expected,
42,By Investing.com,"<span>Sep 07, 2012 08:30AM ET</span>",Canadian building permits rise less-than-expected,
43,By Investing.com,"<span>Sep 07, 2012 06:00AM ET</span>",German Industrial Production rises more-than-expected,
44,By Investing.com,"<span>Sep 07, 2012 04:30AM ET</span>",U.K. manufacturing production rises more-than-expected,
45,By Investing.com,"<span>Sep 07, 2012 04:30AM ET</span>",U.K. PPI input rises more-than-expected,
46,By Investing.com,"<span>Sep 07, 2012 04:05AM ET</span>",Norwegian manufacturing production rises unexpectedly,
47,By Investing.com,"<span>Sep 07, 2012 04:00AM ET</span>",Taiwan’s trade balance rises more-than-expected,
48,By Investing.com,"<span>Sep 07, 2012 03:00AM ET</span>",Spanish Industrial Production rises more-than-expected,
49,By Investing.com,"<span>Sep 07, 2012 02:45AM ET</span>",French Trade Balance rises more-than-expected,
50,By Investing.com,"<span>Sep 07, 2012 02:00AM ET</span>",Germany’s Trade Balance rises more-than-expected,
51,By Investing.com,"<span>Sep 07, 2012 01:45AM ET</span>",Switzerland’s unemployment rate remains unchanged,
52,By Investing.com,"<span>Sep 07, 2012 01:05AM ET</span>",Japan’s Leading Index rises more-than-expected,
53,By Investing.com,"<span>Sep 06, 2012 09:35PM ET</span>",Australia’s trade balance falls more-than-expected,
54,By Investing.com,"<span>Sep 06, 2012 11:00AM ET</span>",U.S. Crude Oil Inventories fall more-than-expected,
55,By Investing.com,"<span>Sep 06, 2012 11:00AM ET</span>",U.S. Gasoline Inventories falls less-than-expected,
56,By Investing.com,"<span>Sep 06, 2012 10:30AM ET</span>",U.S. Natural Gas Storage rises less-than-expected,
57,By Investing.com,"<span>Sep 06, 2012 10:04AM ET</span>",U.S. ISM non-manufacturing PMI rises to 53.7 in August,
58,By Investing.com,"<span>Sep 06, 2012 08:33AM ET</span>","U.S. initial jobless claims drop to 365,000 last week",
59,By Investing.com,"<span>Sep 06, 2012 08:18AM ET</span>","U.S. ADP non-farm payrolls increase 201,000 in August",
60,By Investing.com,"<span>Sep 06, 2012 07:45AM ET</span>",ECB holds rates at record-low 0.75%; Draghi comments eyed,
61,By Investing.com,"<span>Sep 06, 2012 07:01AM ET</span>","Bank of England holds key interest rate at 0.50%, QE unchanged",
62,By Investing.com,"<span>Sep 06, 2012 06:01AM ET</span>",German factory orders rise 0.5% in July,
63,By Investing.com,"<span>Sep 06, 2012 05:10AM ET</span>",Yields drop as France sells 5- and 10-year debt,
64,By Investing.com,"<span>Sep 06, 2012 05:01AM ET</span>",Euro zone final GDP contracts 0.2% in second quarter,
65,By Investing.com,"<span>Sep 06, 2012 04:54AM ET</span>",Borrowing costs fall as Spain sells medium-term debt; ECB eyed,
66,By Investing.com,"<span>Sep 06, 2012 03:35AM ET</span>",Dutch CPI rises,
67,By Investing.com,"<span>Sep 06, 2012 03:04AM ET</span>",Halifax U.K. HPI declines 0.4% in August,
68,By Investing.com,"<span>Sep 06, 2012 01:30AM ET</span>",French Unemployment Rate rises,
69,By Investing.com,"<span>Sep 05, 2012 09:35PM ET</span>",Australian unemployment rate falls unexpectedly,
70,By Investing.com,"<span>Sep 05, 2012 09:35PM ET</span>",Australian employment change falls unexpectedly,
71,By Investing.com,"<span>Sep 05, 2012 04:35PM ET</span>",U.S. API Weekly Gasoline Stock rises unexpectedly,
72,By Investing.com,"<span>Sep 05, 2012 04:35PM ET</span>",U.S. API Weekly Crude Stock falls more-than-expected,
73,By Investing.com,"<span>Sep 05, 2012 09:02AM ET</span>",Bank of Canada leaves interest rate unchanged at 1.00%,
74,By Investing.com,"<span>Sep 05, 2012 08:32AM ET</span>",U.S. Q2 non-farm productivity revised up to 2.2%,
75,By Investing.com,"<span>Sep 05, 2012 08:05AM ET</span>",Brazilian CPI rises more-than-expected,
76,By Investing.com,"<span>Sep 05, 2012 05:03AM ET</span>",Euro zone retail sales fall 0.2% in July,
77,By Investing.com,"<span>Sep 05, 2012 04:04AM ET</span>",Euro zone final services PMI revised lower in August,
78,By Investing.com,"<span>Sep 05, 2012 04:00AM ET</span>",German August services PMI at lowest since July 2009,
79,By Investing.com,"<span>Sep 05, 2012 03:54AM ET</span>",French services PMI contracts in August,
80,By Investing.com,"<span>Sep 05, 2012 03:19AM ET</span>",Swiss CPI flat in August,
81,By Investing.com,"<span>Sep 05, 2012 03:15AM ET</span>",Spanish services PMI rises unexpectedly,
82,By Investing.com,"<span>Sep 05, 2012 03:00AM ET</span>",Norwegian manufacturing PMI fall unexpectedly,
83,By Investing.com,"<span>Sep 04, 2012 09:35PM ET</span>",Australia’s GDP rises less-than-expected,
84,By Investing.com,"<span>Sep 04, 2012 09:05PM ET</span>",Philippines CPI rises more-than-expected,
85,By Investing.com,"<span>Sep 04, 2012 08:35PM ET</span>",Taiwanese CPI rises more-than-expected,
86,By Investing.com,"<span>Sep 04, 2012 10:05AM ET</span>",U.S. ISM manufacturing PMI falls to 49.6 in August,
87,By Investing.com,"<span>Sep 04, 2012 09:00AM ET</span>",Mexican consumer confidence rises less-than-expected,
88,By Investing.com,"<span>Sep 04, 2012 08:05AM ET</span>",Brazilian industrial production rises more-than-expected,
89,By Investing.com,"<span>Sep 04, 2012 05:02AM ET</span>",Euro zone PPI rises 0.4% in July,
90,By Investing.com,"<span>Sep 04, 2012 04:33AM ET</span>",U.K. construction PMI contracts in August,
91,By Investing.com,"<span>Sep 04, 2012 02:21AM ET</span>",Reserve Bank of Australia holds rates at 3.50%,
92,By Investing.com,"<span>Sep 04, 2012 01:45AM ET</span>",Swiss GDP falls unexpectedly,
93,By Investing.com,"<span>Sep 03, 2012 09:35PM ET</span>",Japan’s Average Cash Earnings falls more-than-expected,
94,By Investing.com,"<span>Sep 03, 2012 09:35PM ET</span>",Australia’s current account balance falls less-than-expected,
95,By Investing.com,"<span>Sep 03, 2012 07:55PM ET</span>",Japan’s Monetary Base falls unexpectedly,
96,By Investing.com,"<span>Sep 03, 2012 07:05PM ET</span>",BRC Retail Sales falls less-than-expected,
97,By Investing.com,"<span>Sep 03, 2012 02:05PM ET</span>",Brazil’s trade balance rise more-than-expected,
98,By Investing.com,"<span>Sep 03, 2012 04:33AM ET</span>",U.K. manufacturing PMI improves to 49.5 in August,
99,By Investing.com,"<span>Sep 03, 2012 04:11AM ET</span>",Euro zone final manufacturing PMI revised lower in August,
100,By Investing.com,"<span>Sep 03, 2012 04:01AM ET</span>",German manufacturing PMI revised down to 44.7 in August,
101,By Investing.com,"<span>Sep 03, 2012 03:52AM ET</span>",Italian manufacturing PMI falls to 10-month low in August,
102,By Investing.com,"<span>Sep 03, 2012 03:32AM ET</span>",Swiss SVME PMI deteriorates to 3-month low in August,
103,By Investing.com,"<span>Sep 03, 2012 03:17AM ET</span>",Swiss retail sales rise 3.2% in July,
104,By Investing.com,"<span>Sep 03, 2012 03:15AM ET</span>",Spain’s Manufacturing PMI rises more-than-expected,
105,By Investing.com,"<span>Sep 03, 2012 03:15AM ET</span>",Thailand CPI rises more-than-expected,
106,By Investing.com,"<span>Sep 03, 2012 03:05AM ET</span>",Turkish PPI rises less-than-expected,
107,By Investing.com,"<span>Sep 03, 2012 03:05AM ET</span>",Turkish CPI rises more-than-expected,
108,By Investing.com,"<span>Sep 03, 2012 02:45AM ET</span>",Indian trade balance falls more-than-expected,
109,By Investing.com,"<span>Sep 03, 2012 02:35AM ET</span>",Swedish manufacturing PMI falls more-than-expected,
110,By Investing.com,"<span>Sep 03, 2012 01:00AM ET</span>",India manufacturing PMI falls less-than-expected,
111,By Investing.com,"<span>Sep 03, 2012 12:05AM ET</span>",Indonesian trade balance fall less-than-expected,
112,By Investing.com,"<span>Sep 02, 2012 09:35PM ET</span>",Australian CGOP rises less-than-expected,
113,By Investing.com,"<span>Sep 02, 2012 09:35PM ET</span>",Australian retail sales fall unexpectedly,
114,By Investing.com,"<span>Sep 02, 2012 07:55PM ET</span>",Japanese capital spending rises less-than-expected,
115,By Investing.com,"<span>Sep 02, 2012 06:50PM ET</span>",New Zealand’s Terms of Trade Index falls less-than-expected,
116,By Investing.com,"<span>Aug 31, 2012 09:05PM ET</span>",China manufacturing PMI falls more-than-expected,
117,By Investing.com,"<span>Aug 31, 2012 10:00AM ET</span>",U.S. Factory Orders rises more-than-expected,
118,By Investing.com,"<span>Aug 31, 2012 09:55AM ET</span>",U.S. UoM consumer sentiment rises unexpectedly,
119,By Investing.com,"<span>Aug 31, 2012 09:45AM ET</span>",Chicago PMI falls more-than-expected,
120,By Investing.com,"<span>Aug 31, 2012 08:30AM ET</span>",Canadian GDP rises more-than-expected,
121,By Investing.com,"<span>Aug 31, 2012 08:05AM ET</span>",Brazilain GDP rises less-than-expected,
122,By Investing.com,"<span>Aug 31, 2012 05:00AM ET</span>",Euro zone unemployment rate remains unchanged,
123,By Investing.com,"<span>Aug 31, 2012 04:05AM ET</span>",Italian Quarterly Unemployment Rate rises,
124,By Investing.com,"<span>Aug 31, 2012 04:05AM ET</span>",Norwegian retail sales rises less-than-expected,
125,By Investing.com,"<span>Aug 31, 2012 03:30AM ET</span>",Thai trade balance rise less-than-expected,
126,By Investing.com,"<span>Aug 31, 2012 02:00AM ET</span>",German Retail Sales falls unexpectedly,
127,By Investing.com,"<span>Aug 31, 2012 02:00AM ET</span>",U.K. Nationwide HPI rises more-than-expected,
128,By Investing.com,"<span>Aug 31, 2012 01:50AM ET</span>",South Korean retail sales rises more-than-expected,
129,By Investing.com,"<span>Aug 31, 2012 01:30AM ET</span>",India GDP rises unexpectedly,
130,By Investing.com,"<span>Aug 31, 2012 01:05AM ET</span>",Japanese Housing Starts falls less-than-expected,
131,By Investing.com,"<span>Aug 30, 2012 09:35PM ET</span>",Australian Private Sector Credit rises less-than-expected,
132,By Investing.com,"<span>Aug 30, 2012 07:55PM ET</span>",Japan’s industrial production falls unexpectedly,
133,By Investing.com,"<span>Aug 30, 2012 07:35PM ET</span>",Japanese Household Spending rises unexpectedly,
134,By Investing.com,"<span>Aug 30, 2012 07:35PM ET</span>",Japan’s unemployment rate remains unchanged,
135,By Investing.com,"<span>Aug 30, 2012 07:35PM ET</span>",Tokyo’s core consumer price inflation rises unexpectedly,
136,By Investing.com,"<span>Aug 30, 2012 07:35PM ET</span>",Japan’s National Core CPI fall,
137,By Investing.com,"<span>Aug 30, 2012 07:05PM ET</span>",South Korean industrial production rises less-than-expected,
138,By Investing.com,"<span>Aug 30, 2012 07:05PM ET</span>",U.K. Gfk Consumer confidence remains unchanged unexpectedly,
139,By Investing.com,"<span>Aug 30, 2012 10:30AM ET</span>",U.S. Natural Gas Storage rises more-than-expected,
140,By Investing.com,"<span>Aug 30, 2012 08:37AM ET</span>","U.S. core PCE price index flat in July, personal spending up 0.4%",
141,By Investing.com,"<span>Aug 30, 2012 08:33AM ET</span>","U.S. initial jobless claims hold steady at 374,000 last week",
142,By Investing.com,"<span>Aug 30, 2012 08:30AM ET</span>",Canada’s current account balance falls more-than-expected,
143,By Investing.com,"<span>Aug 30, 2012 05:35AM ET</span>",South African PPI rises more-than-expected,
144,By Investing.com,"<span>Aug 30, 2012 05:25AM ET</span>",Borrowing costs ease as Italy sells 5- and 10-year debt,
145,By Investing.com,"<span>Aug 30, 2012 05:00AM ET</span>",Italian Business Confidence rises unexpectedly,
146,By Investing.com,"<span>Aug 30, 2012 04:35AM ET</span>",Hong Kong retail sales rises less-than-expected,
147,By Investing.com,"<span>Aug 30, 2012 04:34AM ET</span>",U.K. net lending to individuals rises less-than-expected,
148,By Investing.com,"<span>Aug 30, 2012 03:56AM ET</span>","German unemployment change rises 9,000 in August",
149,By Investing.com,"<span>Aug 30, 2012 03:05AM ET</span>",Danish unemployment rate rises,
150,By Investing.com,"<span>Aug 29, 2012 10:05PM ET</span>",Philippines GDP rises more-than-expected,
151,By Investing.com,"<span>Aug 29, 2012 09:35PM ET</span>",Australian private new capital expenditure rises more-than-expected,
152,By Investing.com,"<span>Aug 29, 2012 09:35PM ET</span>",Australian Building Approvals fall more-than-expected,
153,By Investing.com,"<span>Aug 29, 2012 07:55PM ET</span>",Japan’s retail sales fall more-than-expected,
154,By Investing.com,"<span>Aug 29, 2012 06:50PM ET</span>",New Zealand Building Consents falls more-than-expected,
155,By Investing.com,"<span>Aug 29, 2012 11:35AM ET</span>",U.S. Crude Oil Inventories rise unexpectedly,
156,By Investing.com,"<span>Aug 29, 2012 10:04AM ET</span>",U.S. pending home sales jump 2.4% in July,
157,By Investing.com,"<span>Aug 29, 2012 08:32AM ET</span>","U.S. Q2 GDP revised up to 1.7%, in line with expectations",
158,By Investing.com,"<span>Aug 29, 2012 08:30AM ET</span>",Canada’s Industrial Product Price Index falls unexpectedly,
159,By Investing.com,"<span>Aug 29, 2012 08:30AM ET</span>",Canada’s Raw Material Price Index rises less-than-expected,
160,By Investing.com,"<span>Aug 29, 2012 08:02AM ET</span>",German CPI rises 2.0% in August,
161,By Investing.com,"<span>Aug 29, 2012 05:16AM ET</span>",Bond yields fall to lowest since March as Italy sells 6-month debt,
162,By Investing.com,"<span>Aug 29, 2012 04:07AM ET</span>",Italian retail sales rise unexpectedly in June,
163,By Investing.com,"<span>Aug 29, 2012 03:05AM ET</span>",Danish GDP falls more-than-expected,
164,By Investing.com,"<span>Aug 29, 2012 03:05AM ET</span>",Swiss KOF economic barometer improves to 12-month high,
165,By Investing.com,"<span>Aug 28, 2012 09:35PM ET</span>",Australian construction falls more-than-expected,
166,By Investing.com,"<span>Aug 28, 2012 04:35PM ET</span>",U.S. API Weekly Gasoline Stock falls more-than-expected,
167,By Investing.com,"<span>Aug 28, 2012 04:35PM ET</span>",U.S. API Weekly Crude Stock rises unexpectedly,
168,By Investing.com,"<span>Aug 28, 2012 10:00AM ET</span>",U.S. CB consumer confidence falls unexpectedly,
169,By Investing.com,"<span>Aug 28, 2012 10:00AM ET</span>",Richmond Manufacturing Index falls less-than-expected,
170,By Investing.com,"<span>Aug 28, 2012 09:00AM ET</span>",S&P/CS HPI Composite-20 rises unexpectedly,
171,By Investing.com,"<span>Aug 28, 2012 05:30AM ET</span>",Yields decline as Italy sells 2-year debt,
172,By Investing.com,"<span>Aug 28, 2012 04:53AM ET</span>",Borrowing costs drop as Spain sells 3- and 6-month debt,
173,By Investing.com,"<span>Aug 28, 2012 04:40AM ET</span>",Hong Kong trade balance falls less-than-expected,
174,By Investing.com,"<span>Aug 28, 2012 04:03AM ET</span>",Euro zone M3 money supply grows unexpectedly in July,
175,By Investing.com,"<span>Aug 28, 2012 03:00AM ET</span>",Spanish GDP remains unchanged,
176,By Investing.com,"<span>Aug 28, 2012 02:00AM ET</span>",German Gfk consumer climate remains unchanged,
177,By Investing.com,"<span>Aug 27, 2012 10:35AM ET</span>",Dallas Fed Manufacturing Business Index fall less-than-expected,
178,By Investing.com,"<span>Aug 27, 2012 04:04AM ET</span>",German Ifo business climate deteriorates to 102.3 in August,
179,By Investing.com,"<span>Aug 27, 2012 03:35AM ET</span>",Swedish retail sales rises more-than-expected,
180,By Investing.com,"<span>Aug 27, 2012 02:00AM ET</span>",German Import Price Index rises,
181,By Investing.com,"<span>Aug 26, 2012 05:00PM ET</span>",South Korean consumer confidence falls,
182,By Investing.com,"<span>Aug 25, 2012 08:25AM ET</span>",Argentinian retail sales rises less-than-expected,
183,By Investing.com,"<span>Aug 24, 2012 09:05AM ET</span>",Mexican trade balance falls less-than-expected,
184,By Investing.com,"<span>Aug 24, 2012 09:05AM ET</span>",Mexican unemployment rate rises less-than-expected,
185,By Investing.com,"<span>Aug 24, 2012 08:30AM ET</span>",U.S. durable goods orders rise more-than-expected,
186,By Investing.com,"<span>Aug 24, 2012 04:35AM ET</span>",U.K. business investment falls unexpectedly,
187,By Investing.com,"<span>Aug 24, 2012 04:30AM ET</span>",Spanish PPI rises less-than-expected,
188,By Investing.com,"<span>Aug 24, 2012 04:30AM ET</span>",U.K. GDP falls,
189,By Investing.com,"<span>Aug 24, 2012 04:00AM ET</span>",Polish unemployment rate falls,
190,By Investing.com,"<span>Aug 24, 2012 04:00AM ET</span>",Polish retail sales rises,
191,By Investing.com,"<span>Aug 24, 2012 03:00AM ET</span>",Hungarian retail sales falls less-than-expected,
192,By Investing.com,"<span>Aug 24, 2012 01:00AM ET</span>",Singaporean industrial production rises less-than-expected,
193,By Investing.com,"<span>Aug 23, 2012 07:55PM ET</span>",Japan’s CSPI fall,
194,By Investing.com,"<span>Aug 23, 2012 06:50PM ET</span>",New Zealand’s trade balance rises less-than-expected,
195,By Investing.com,"<span>Aug 23, 2012 10:03AM ET</span>",U.S. new home sales rise 3.6% in July to 372K,
196,By Investing.com,"<span>Aug 23, 2012 09:04AM ET</span>",U.S. manufacturing PMI edges higher in August,
197,By Investing.com,"<span>Aug 23, 2012 08:32AM ET</span>","U.S. initial jobless claims rise by 4,000 to 372,000 last week",
198,By Investing.com,"<span>Aug 23, 2012 06:04AM ET</span>",U.K. CBI realized sales decline unexpectedly in August,
199,By Investing.com,"<span>Aug 23, 2012 04:34AM ET</span>",U.K. BBA mortgage approvals rise more-than-expected in July,
200,By Investing.com,"<span>Aug 23, 2012 04:05AM ET</span>",Euro zone manufacturing PMI improves in August,
201,By Investing.com,"<span>Aug 23, 2012 03:36AM ET</span>",German manufacturing PMI improves to 2-month high in August,
202,By Investing.com,"<span>Aug 23, 2012 03:35AM ET</span>",Swedish unemployment rate falls more-than-expected,
203,By Investing.com,"<span>Aug 23, 2012 03:08AM ET</span>",French manufacturing PMI rises to 4-month high in August,
204,By Investing.com,"<span>Aug 23, 2012 02:00AM ET</span>",German GDP rises,
205,By Investing.com,"<span>Aug 22, 2012 03:00PM ET</span>",Argentinian trade balance rises more-than-expected,
206,By Investing.com,"<span>Aug 22, 2012 09:39AM ET</span>",U.S. existing home sales rise 2.3% in July,
207,By Investing.com,"<span>Aug 22, 2012 08:33AM ET</span>",Canada core retail sales fall 0.4% in June,
208,By Investing.com,"<span>Aug 22, 2012 04:05AM ET</span>",Norwegian unemployment rate remains unchanged,
209,By Investing.com,"<span>Aug 21, 2012 07:55PM ET</span>",Japan’s trade balance falls less-than-expected,
210,By Investing.com,"<span>Aug 21, 2012 04:35PM ET</span>",U.S. API Weekly Gasoline Stock rises more-than-expected,
211,By Investing.com,"<span>Aug 21, 2012 04:35PM ET</span>",U.S. API Weekly Crude Stock falls unexpectedly,
212,By Investing.com,"<span>Aug 21, 2012 03:00PM ET</span>",Argentinian unemployment rate rises,
213,By Investing.com,"<span>Aug 21, 2012 08:33AM ET</span>",Canadian wholesale sales decline unexpectedly in June,
214,By Investing.com,"<span>Aug 21, 2012 06:05AM ET</span>",U.K. CBI industrial order expectations deteriorate in August,
215,By Investing.com,"<span>Aug 21, 2012 04:57AM ET</span>",Borrowing costs fall as Spain sells 12- and 18-month debt,
216,By Investing.com,"<span>Aug 21, 2012 04:34AM ET</span>",U.K. public sector net borrowing posts smaller-than-expected surplus,
217,By Investing.com,"<span>Aug 21, 2012 12:35AM ET</span>",Japan’s All Industries Activity Index rises less-than-expected,
218,By Investing.com,"<span>Aug 20, 2012 08:35AM ET</span>",Chilean GDP rise more-than-expected,
219,By Investing.com,"<span>Aug 20, 2012 08:05AM ET</span>",Polish industrial production rises more-than-expected,
220,By Investing.com,"<span>Aug 20, 2012 08:05AM ET</span>",Polish PPI falls more-than-expected,
221,By Investing.com,"<span>Aug 19, 2012 10:30PM ET</span>",Thailand GDP rises more-than-expected,
222,By Investing.com,"<span>Aug 17, 2012 03:00PM ET</span>",Argentinean economic acitivty remain unchanged unexpectedly,
223,By Investing.com,"<span>Aug 17, 2012 10:00AM ET</span>",U.S. CB Leading Index rises more-than-expected,
224,By Investing.com,"<span>Aug 17, 2012 09:55AM ET</span>",U.S. UoM consumer sentiment rises more-than-expected,
225,By Investing.com,"<span>Aug 17, 2012 08:30AM ET</span>",Canadian consumer price inflation falls unexpectedly,
226,By Investing.com,"<span>Aug 17, 2012 05:05AM ET</span>",Euro zone trade balance rises more-than-expected,
227,By Investing.com,"<span>Aug 17, 2012 04:00AM ET</span>",Euro zone current account rises more-than-expected,
228,By Investing.com,"<span>Aug 17, 2012 02:00AM ET</span>",German Producer Price Inflation remains unchanged unexpectedly,
229,By Investing.com,"<span>Aug 16, 2012 06:50PM ET</span>",N.Z. PPI input rises unexpectedly,
230,By Investing.com,"<span>Aug 16, 2012 10:03AM ET</span>",Philly Fed manufacturing index contracts again in August,
231,By Investing.com,"<span>Aug 16, 2012 09:00AM ET</span>",Mexican GDP rises,
232,By Investing.com,"<span>Aug 16, 2012 08:39AM ET</span>","U.S. housing starts fall in July, but building permits surge",
233,By Investing.com,"<span>Aug 16, 2012 08:34AM ET</span>","U.S. initial jobless claims rise to 366,000 last week",
234,By Investing.com,"<span>Aug 16, 2012 08:05AM ET</span>",Brazilian retail sales rises more-than-expected,
235,By Investing.com,"<span>Aug 16, 2012 07:05AM ET</span>",Turkish Benchmark Interest Rate rises,
236,By Investing.com,"<span>Aug 16, 2012 06:00AM ET</span>",Israeli GDP rise more-than-expected,
237,By Investing.com,"<span>Aug 16, 2012 05:05AM ET</span>",Swiss ZEW economic expectations improve to 3-month high,
238,By Investing.com,"<span>Aug 16, 2012 05:01AM ET</span>",Euro zone CPI holds steady at 2.4% in July,
