,company,date,title,content
479,By Investing.com,"<span>Jul 16, 2012 08:40AM ET</span>",Empire State manufacturing index improves in July,
480,By Investing.com,"<span>Jul 16, 2012 08:36AM ET</span>",U.S. retail sales drop 0.5% in June; core retail sales fall 0.4%,
481,By Investing.com,"<span>Jul 16, 2012 05:01AM ET</span>",Euro zone CPI holds steady at 2.4% in June,
482,By Investing.com,"<span>Jul 13, 2012 09:55AM ET</span>",U.S. UoM consumer sentiment falls unexpectedly,
483,By Investing.com,"<span>Jul 13, 2012 08:30AM ET</span>",U.S. PPI rises unexpectedly,
484,By Investing.com,"<span>Jul 13, 2012 08:30AM ET</span>",U.S. core PPI rises,
485,By Investing.com,"<span>Jul 13, 2012 03:15AM ET</span>",Swiss PPI falls less-than-expected,
486,By Investing.com,"<span>Jul 13, 2012 12:35AM ET</span>",Japan’s industrial production falls more-than-expected,
487,By Investing.com,"<span>Jul 12, 2012 02:00PM ET</span>",U.S. federal budget balance rises more-than-expected,
488,By Investing.com,"<span>Jul 12, 2012 08:39AM ET</span>",U.S. import prices decline 2.7% in June,
489,By Investing.com,"<span>Jul 12, 2012 08:34AM ET</span>","U.S. initial jobless claims drop to 350,000 last week",
490,By Investing.com,"<span>Jul 12, 2012 05:41AM ET</span>",Borrowing costs fall to record low as U.K. sells 10-year debt,
491,By Investing.com,"<span>Jul 12, 2012 05:17AM ET</span>",Yields fall to lowest since May as Italy sells 12-month debt,
492,By Investing.com,"<span>Jul 12, 2012 05:03AM ET</span>",Euro zone industrial production rises 0.6% in May,
493,By Investing.com,"<span>Jul 12, 2012 02:50AM ET</span>","Bank of Japan holds rates steady, asset purchase unchanged",
494,By Investing.com,"<span>Jul 11, 2012 09:35PM ET</span>",Australian unemployment rate rises,
495,By Investing.com,"<span>Jul 11, 2012 09:35PM ET</span>",Australian employment change falls unexpectedly,
496,By Investing.com,"<span>Jul 11, 2012 08:39AM ET</span>",Canada trade deficit widens modestly in May,
497,By Investing.com,"<span>Jul 11, 2012 08:35AM ET</span>",U.S. trade deficit narrows in line with expectations in May,
498,By Investing.com,"<span>Jul 11, 2012 05:43AM ET</span>",Yields fall to record low as Germany sells 10-year debt,
499,By Investing.com,"<span>Jul 10, 2012 09:35PM ET</span>",Australian home loans fall unexpectedly,
500,By Investing.com,"<span>Jul 10, 2012 07:55PM ET</span>",Japan’s tertiary index rises more-than-expected,
501,By Investing.com,"<span>Jul 10, 2012 08:19AM ET</span>",Canadian housing starts rise unexpectedly in June,
502,By Investing.com,"<span>Jul 10, 2012 04:42AM ET</span>",U.K. goods trade deficit narrows more-than-expected in May,
503,By Investing.com,"<span>Jul 10, 2012 04:36AM ET</span>",U.K. manufacturing production jumps 1.2% in May,
504,By Investing.com,"<span>Jul 10, 2012 04:06AM ET</span>",Italian industrial production rises unexpectedly in May,
505,By Investing.com,"<span>Jul 09, 2012 07:05PM ET</span>",U.K. RICS house price balance falls unexpectedly,
506,By Investing.com,"<span>Jul 09, 2012 04:32AM ET</span>",Euro zone Sentix investor confidence at lowest since July 2009,
507,By Investing.com,"<span>Jul 09, 2012 02:21AM ET</span>",China CPI rises slows to 2.2% in June,
508,By Investing.com,"<span>Jul 06, 2012 10:05AM ET</span>",Canada’s Ivey PMI falls more-than-expected,
509,By Investing.com,"<span>Jul 06, 2012 08:30AM ET</span>",U.S. unemployment rate remains unchanged,
510,By Investing.com,"<span>Jul 06, 2012 08:30AM ET</span>",U.S. non-farm payrolls rise less-than-expected,
511,By Investing.com,"<span>Jul 06, 2012 08:30AM ET</span>",Canadian unemployment rate falls less-than-expected,
512,By Investing.com,"<span>Jul 06, 2012 08:30AM ET</span>",Canadian employment change rises more-than-expected,
513,By Investing.com,"<span>Jul 06, 2012 08:30AM ET</span>",Canadian building permits rise more-than-expected,
514,By Investing.com,"<span>Jul 06, 2012 04:30AM ET</span>",U.K. PPI input falls more-than-expected,
515,By Investing.com,"<span>Jul 06, 2012 03:15AM ET</span>",Swiss consumer price inflation falls,
516,By Investing.com,"<span>Jul 05, 2012 10:08AM ET</span>",U.S. ISM non-manufacturing PMI falls to 52.1 in June,
517,By Investing.com,"<span>Jul 05, 2012 08:32AM ET</span>","U.S. initial jobless claims fall to 374,000 last week",
518,By Investing.com,"<span>Jul 05, 2012 08:20AM ET</span>","U.S. ADP non-farm payrolls rise 176,000 in June",
519,By Investing.com,"<span>Jul 05, 2012 07:48AM ET</span>",ECB cuts interest rate to record-low 0.75%,
520,By Investing.com,"<span>Jul 05, 2012 07:01AM ET</span>","Bank of England holds key rate at 0.50%, announces more QE",
521,By Investing.com,"<span>Jul 05, 2012 06:02AM ET</span>",German factory orders rise 0.6% in May,
522,By Investing.com,"<span>Jul 05, 2012 04:56AM ET</span>",Borrowing costs rise as Spain sells debt; 10-year yield at 6.43%,
523,By Investing.com,"<span>Jul 05, 2012 03:06AM ET</span>",Halifax U.K. HPI jumps 1% in June,
524,By Investing.com,"<span>Jul 04, 2012 05:03AM ET</span>",Euro zone retail sales rise 0.6% in May,
525,By Investing.com,"<span>Jul 04, 2012 04:32AM ET</span>",U.K. services PMI falls to 8-month low in June,
526,By Investing.com,"<span>Jul 04, 2012 04:07AM ET</span>",Euro zone final services PMI remains in contraction territory in June,
527,By Investing.com,"<span>Jul 03, 2012 09:35PM ET</span>",Australian retail sales rise more-than-expected,
528,By Investing.com,"<span>Jul 03, 2012 10:01AM ET</span>",U.S. factory orders rise 0.7% in May,
529,By Investing.com,"<span>Jul 03, 2012 05:03AM ET</span>",Euro zone PPI declines 0.5% in May,
530,By Investing.com,"<span>Jul 03, 2012 04:39AM ET</span>",U.K. net lending to individuals falls less-than-expected,
531,By Investing.com,"<span>Jul 03, 2012 04:36AM ET</span>",U.K. construction PMI contracts in June,
532,By Investing.com,"<span>Jul 03, 2012 02:22AM ET</span>",Reserve Bank of Australia holds rates at 3.50%,
533,By Investing.com,"<span>Jul 02, 2012 10:05AM ET</span>",U.S. ISM manufacturing PMI falls to 49.7 in June,
534,By Investing.com,"<span>Jul 02, 2012 05:03AM ET</span>",Euro zone unemployment rate rises to record high in May,
535,By Investing.com,"<span>Jul 02, 2012 04:34AM ET</span>",U.K. manufacturing PMI improves more-than-expected in June,
536,By Investing.com,"<span>Jul 02, 2012 03:32AM ET</span>",Swiss SVME PMI improves unexpectedly in June,
537,By Investing.com,"<span>Jul 02, 2012 03:24AM ET</span>",Swiss retail sales jump 6.2% in May,
538,By Investing.com,"<span>Jul 01, 2012 07:55PM ET</span>",Japan’s Tankan manufcaturing index rises unexpectedly,
539,By Investing.com,"<span>Jun 29, 2012 09:55AM ET</span>",U.S. UoM consumer sentiment falls unexpectedly,
540,By Investing.com,"<span>Jun 29, 2012 09:45AM ET</span>",Chicago PMI rises unexpectedly,
541,By Investing.com,"<span>Jun 29, 2012 08:30AM ET</span>",U.S. personal spending remains unchanged unexpectedly,
542,By Investing.com,"<span>Jun 29, 2012 08:30AM ET</span>",Canadian GDP rises more-than-expected,
543,By Investing.com,"<span>Jun 29, 2012 05:05AM ET</span>",Euro zone CPI rises,
544,By Investing.com,"<span>Jun 29, 2012 03:05AM ET</span>",Switzerland’s KOF economic barometer rises more-than-expected,
545,By Investing.com,"<span>Jun 29, 2012 02:45AM ET</span>",French consumer spending rises unexpectedly,
546,By Investing.com,"<span>Jun 29, 2012 01:30AM ET</span>",French GDP remains unchanged,
547,By Investing.com,"<span>Jun 28, 2012 07:55PM ET</span>",Japan’s industrial production falls more-than-expected,
548,By Investing.com,"<span>Jun 28, 2012 07:35PM ET</span>",Japan’s unemployment rate falls unexpectedly,
549,By Investing.com,"<span>Jun 28, 2012 07:35PM ET</span>",Tokyo’s core consumer price inflation rises more-than-expected,
550,By Investing.com,"<span>Jun 28, 2012 08:36AM ET</span>",U.S. final Q1 GDP unrevised at 1.9%,
551,By Investing.com,"<span>Jun 28, 2012 08:32AM ET</span>","U.S. initial jobless claims fall 6,000 to 386,000 last week",
552,By Investing.com,"<span>Jun 28, 2012 05:22AM ET</span>",Borrowing costs rise as Italy sells 5- and 10-year debt,
553,By Investing.com,"<span>Jun 28, 2012 04:38AM ET</span>",U.K. current account deficit widens in first quarter,
554,By Investing.com,"<span>Jun 28, 2012 04:35AM ET</span>",U.K. final Q1 GDP contracts 0.3%; in line with expectations,
555,By Investing.com,"<span>Jun 28, 2012 03:58AM ET</span>","German unemployment change rises, jobless rate steady",
556,By Investing.com,"<span>Jun 28, 2012 02:49AM ET</span>",U.K. Nationwide HPI drops unexpectedly in June,
557,By Investing.com,"<span>Jun 28, 2012 02:25AM ET</span>",U.K. Nationwide HPI falls unexpectedly,
558,By Investing.com,"<span>Jun 27, 2012 07:55PM ET</span>",Japan’s retail sales rise more-than-expected,
559,By Investing.com,"<span>Jun 27, 2012 10:03AM ET</span>",U.S. pending home sales jump 5.9% in May,
560,By Investing.com,"<span>Jun 27, 2012 08:35AM ET</span>",U.S. core durable goods orders rise 0.4% in May,
561,By Investing.com,"<span>Jun 27, 2012 08:05AM ET</span>",German CPI dips unexpectedly in June,
562,By Investing.com,"<span>Jun 27, 2012 06:12AM ET</span>",U.K. CBI realized sales improve significantly in June,
563,By Investing.com,"<span>Jun 27, 2012 05:14AM ET</span>",Bond yields climb to highest since December as Italy sells 6-month debt,
564,By Investing.com,"<span>Jun 27, 2012 04:34AM ET</span>",U.K. BBA mortgage approvals decline unexpectedly in May,
565,By Investing.com,"<span>Jun 26, 2012 06:45PM ET</span>",New Zealand’s trade balance rises more-than-expected,
566,By Investing.com,"<span>Jun 26, 2012 10:04AM ET</span>",U.S. CB consumer confidence falls more-than-expected in June,
567,By Investing.com,"<span>Jun 26, 2012 09:03AM ET</span>",S&P/Case-Shiller home price index falls less-than-expected,
568,By Investing.com,"<span>Jun 26, 2012 05:25AM ET</span>",Bond yields climb to six-month high as Italy sells 2-year debt,
569,By Investing.com,"<span>Jun 26, 2012 04:49AM ET</span>",Borrowing costs surge as Spain sells 3- and 6-month debt,
570,By Investing.com,"<span>Jun 26, 2012 04:35AM ET</span>",U.K. public sector net borrowing surplus widens in May,
571,By Investing.com,"<span>Jun 26, 2012 02:21AM ET</span>",German Gfk consumer climate index rises unexpectedly,
572,By Investing.com,"<span>Jun 25, 2012 10:03AM ET</span>",U.S. new home sales surge 7.6% in May to 369K,
573,By Investing.com,"<span>Jun 22, 2012 08:35AM ET</span>",Canadian consumer price inflation falls unexpectedly,
574,By Investing.com,"<span>Jun 22, 2012 04:05AM ET</span>",German Ifo business climate falls more-than-expected,
575,By Investing.com,"<span>Jun 21, 2012 10:08AM ET</span>",U.S. existing home sales fall more-than-expected in May,
576,By Investing.com,"<span>Jun 21, 2012 10:05AM ET</span>",Philly Fed manufacturing index falls to 10-month low in June,
577,By Investing.com,"<span>Jun 21, 2012 08:44AM ET</span>",Canada core retail sales decline unexpectedly in April,
578,By Investing.com,"<span>Jun 21, 2012 08:35AM ET</span>","U.S. initial jobless claims fall 2,000 to 387,000 last week",
579,By Investing.com,"<span>Jun 21, 2012 06:05AM ET</span>",U.K. CBI industrial order expectations improve in June,
580,By Investing.com,"<span>Jun 21, 2012 04:55AM ET</span>",Borrowing costs rise but Spain exceeds auction target,
581,By Investing.com,"<span>Jun 21, 2012 04:34AM ET</span>",U.K. retail sales rise 1.4% in May,
582,By Investing.com,"<span>Jun 21, 2012 04:05AM ET</span>",Euro zone manufacturing PMI shrinks at fastest pace in 36 months,
583,By Investing.com,"<span>Jun 21, 2012 03:35AM ET</span>",German manufacturing PMI falls to 36-month low in June,
584,By Investing.com,"<span>Jun 21, 2012 03:06AM ET</span>",French manufacturing PMI rises to 3-month high in June,
585,By Investing.com,"<span>Jun 21, 2012 02:10AM ET</span>",Swiss trade surplus widens more-than-expected in May,
586,By Investing.com,"<span>Jun 20, 2012 06:45PM ET</span>",New Zealand’s GDP rises more-than-expected,
587,By Investing.com,"<span>Jun 20, 2012 05:09AM ET</span>",Swiss ZEW economic expectations fall sharply in June,
588,By Investing.com,"<span>Jun 20, 2012 04:35AM ET</span>",U.K. claimant count change rises unexpectedly in May,
589,By Investing.com,"<span>Jun 20, 2012 04:08AM ET</span>",Italian industrial new orders fall 1.9% in April,
590,By Investing.com,"<span>Jun 19, 2012 08:40AM ET</span>",Canadian wholesale sales jump 1.5% in April,
591,By Investing.com,"<span>Jun 19, 2012 08:36AM ET</span>","U.S. building permits rise in May, but housing starts decline",
592,By Investing.com,"<span>Jun 19, 2012 05:08AM ET</span>",German ZEW economic sentiment turns negative in June,
593,By Investing.com,"<span>Jun 19, 2012 04:49AM ET</span>",Borrowing costs surge as Spain sells 12- and 18-month debt,
594,By Investing.com,"<span>Jun 19, 2012 04:37AM ET</span>",U.K. CPI eases to 2.8% in May,
595,By Investing.com,"<span>Jun 19, 2012 04:25AM ET</span>",Nationwide consumer confidence falls unexpectedly,
596,By Investing.com,"<span>Jun 18, 2012 08:33AM ET</span>",Canadian foreign securities purchases surge in April,
597,By Investing.com,"<span>Jun 15, 2012 09:55AM ET</span>",U.S. UoM consumer sentiment falls more-than-expected,
598,By Investing.com,"<span>Jun 15, 2012 09:15AM ET</span>",Industrial Production falls unexpectedly,
599,By Investing.com,"<span>Jun 15, 2012 09:01AM ET</span>",U.S. TIC long term purchases rise less-than-expected,
600,By Investing.com,"<span>Jun 15, 2012 08:30AM ET</span>",Empire State manufacturing activity rises less-than-expected,
601,By Investing.com,"<span>Jun 15, 2012 08:30AM ET</span>",Canadian manufacturing sales fall unexpectedly,
602,By Investing.com,"<span>Jun 15, 2012 04:35AM ET</span>",U.K. trade balance falls more-than-expected,
603,By Investing.com,"<span>Jun 14, 2012 08:43AM ET</span>",U.S. current account deficit widens more-than-expected in Q1,
604,By Investing.com,"<span>Jun 14, 2012 08:40AM ET</span>",U.S. core CPI rises 0.2% in May,
605,By Investing.com,"<span>Jun 14, 2012 08:32AM ET</span>","U.S. initial jobless claims rise to 386,000 last week",
606,By Investing.com,"<span>Jun 14, 2012 05:23AM ET</span>",Borrowing costs spike as Italy sells 3-year debt,
607,By Investing.com,"<span>Jun 14, 2012 05:02AM ET</span>",Euro zone CPI holds steady at 2.4% in May,
608,By Investing.com,"<span>Jun 14, 2012 03:36AM ET</span>","SNB leaves interest rate unchanged, maintains EUR/CHF floor",
609,By Investing.com,"<span>Jun 14, 2012 12:35AM ET</span>",Japan’s industrial production falls unexpectedly,
610,By Investing.com,"<span>Jun 13, 2012 10:03AM ET</span>",U.S. business inventories rise 0.4% in April,
611,By Investing.com,"<span>Jun 13, 2012 08:40AM ET</span>",U.S. PPI drops 1.0% in May; biggest monthly decline since July 2009,
612,By Investing.com,"<span>Jun 13, 2012 08:36AM ET</span>",U.S. retail sales fall 0.2% in May; core retail sales drop 0.4%,
613,By Investing.com,"<span>Jun 13, 2012 05:39AM ET</span>",Borrowing costs ease up as Germany sells 10-year debt,
614,By Investing.com,"<span>Jun 13, 2012 05:13AM ET</span>",Borrowing costs surge as Italy sells 12-month debt,
615,By Investing.com,"<span>Jun 13, 2012 05:02AM ET</span>",Euro zone industrial production falls 0.8% in April,
616,By Investing.com,"<span>Jun 13, 2012 03:20AM ET</span>",Swiss PPI declines 0.2% in May; in line with expectations,
617,By Investing.com,"<span>Jun 12, 2012 02:00PM ET</span>",U.S. federal budget balance falls less-than-expected,
618,By Investing.com,"<span>Jun 12, 2012 10:07AM ET</span>",U.S. IBD/TIPP economic optimism falls to 6-month low in June,
619,By Investing.com,"<span>Jun 12, 2012 08:36AM ET</span>",U.S. import prices decline 1.0% in May,
620,By Investing.com,"<span>Jun 12, 2012 04:34AM ET</span>",U.K. manufacturing production falls 0.7% in April,
621,By Investing.com,"<span>Jun 12, 2012 02:15AM ET</span>",French non-farm payrolls rise,
622,By Investing.com,"<span>Jun 11, 2012 09:25PM ET</span>",Japan’s tertiary index falls unexpectedly,
623,By Investing.com,"<span>Jun 11, 2012 07:05PM ET</span>",U.K. RICS house price balance rises more-than-expected,
624,By Investing.com,"<span>Jun 10, 2012 07:55PM ET</span>",Japan’s BSI manufacturing index rise less-than-expected,
625,By Investing.com,"<span>Jun 08, 2012 08:30AM ET</span>",Canadian employment change rises less-than-expected,
626,By Investing.com,"<span>Jun 08, 2012 08:30AM ET</span>",Canadian unemployment rate remains unchanged unexpectedly,
627,By Investing.com,"<span>Jun 08, 2012 08:30AM ET</span>",Canadian trade balance falls more-than-expected,
628,By Investing.com,"<span>Jun 08, 2012 08:30AM ET</span>",U.S. trade balance falls more-than-expected,
629,By Investing.com,"<span>Jun 08, 2012 08:15AM ET</span>",Canadian housing starts fall more-than-expected,
630,By Investing.com,"<span>Jun 08, 2012 04:30AM ET</span>",U.K. PPI input falls more-than-expected,
631,By Investing.com,"<span>Jun 07, 2012 09:35PM ET</span>",Australia’s trade balance falls less-than-expected,
632,By Investing.com,"<span>Jun 07, 2012 09:35PM ET</span>",Australian home loans rise more-than-expected,
633,By Investing.com,"<span>Jun 07, 2012 07:55PM ET</span>",Japan’s GDP rises more-than-expected,
634,By Investing.com,"<span>Jun 07, 2012 08:33AM ET</span>","U.S. initial jobless claims fall to 377,000 last week",
635,By Investing.com,"<span>Jun 07, 2012 07:02AM ET</span>","Bank of England holds key interest rate at 0.50%, QE unchanged",
636,By Investing.com,"<span>Jun 07, 2012 04:55AM ET</span>","Spanish debt auction sees strong demand, borrowing costs rise",
637,By Investing.com,"<span>Jun 07, 2012 04:34AM ET</span>",U.K. services PMI holds steady at 53.3 in May,
638,By Investing.com,"<span>Jun 07, 2012 03:17AM ET</span>",Swiss CPI flat in May,
639,By Investing.com,"<span>Jun 07, 2012 03:08AM ET</span>",Halifax U.K. HPI rises 0.5% in May,
640,By Investing.com,"<span>Jun 06, 2012 09:35PM ET</span>",Australian employment change rises unexpectedly,
641,By Investing.com,"<span>Jun 06, 2012 09:35PM ET</span>",Australian unemployment rate rises,
642,By Investing.com,"<span>Jun 06, 2012 08:31AM ET</span>",U.S. Q1 non-farm productivity revised down to 0.9% drop,
643,By Investing.com,"<span>Jun 06, 2012 07:47AM ET</span>",European Central Bank leaves rates at 1%; Draghi comments eyed,
644,By Investing.com,"<span>Jun 06, 2012 06:03AM ET</span>",German industrial production drops 2.2% in April,
645,By Investing.com,"<span>Jun 06, 2012 05:44AM ET</span>",Borrowing costs fall to record low as Germany sells 5-year debt,
646,By Investing.com,"<span>Jun 06, 2012 05:06AM ET</span>",Euro zone Q1 GDP unchanged from initial estimate,
647,By Investing.com,"<span>Jun 06, 2012 04:37AM ET</span>",U.K. construction PMI slows to 54.4 in May,
648,By Investing.com,"<span>Jun 06, 2012 03:10AM ET</span>",Spanish industrial production tumbles 8.3% in April,
649,By Investing.com,"<span>Jun 05, 2012 09:35PM ET</span>",Australia’s GDP rises more-than-expected,
650,By Investing.com,"<span>Jun 05, 2012 10:05AM ET</span>",U.S. ISM non-manufacturing PMI inches up to 53.7 in May,
651,By Investing.com,"<span>Jun 05, 2012 09:02AM ET</span>",Bank of Canada leaves interest rate unchanged at 1.00%,
652,By Investing.com,"<span>Jun 05, 2012 08:33AM ET</span>",Canadian building permits drop 5.2% in April,
653,By Investing.com,"<span>Jun 05, 2012 06:03AM ET</span>",German factory orders drop 1.9% in April; March figure revised up,
654,By Investing.com,"<span>Jun 05, 2012 05:02AM ET</span>",Euro zone retail sales fall 1% in April,
655,By Investing.com,"<span>Jun 05, 2012 04:09AM ET</span>",Euro zone final services PMI hits near 3-year low in May,
656,By Investing.com,"<span>Jun 05, 2012 04:01AM ET</span>",German final services PMI falls to 6-month low in May,
657,By Investing.com,"<span>Jun 05, 2012 02:22AM ET</span>",Reserve Bank of Australia cuts rates to 3.50%,
658,By Investing.com,"<span>Jun 04, 2012 09:35PM ET</span>",Australia’s current account balance falls more-than-expected,
659,By Investing.com,"<span>Jun 04, 2012 10:04AM ET</span>",U.S. factory orders slump 0.6% in April,
660,By Investing.com,"<span>Jun 04, 2012 05:02AM ET</span>",Euro zone PPI flat in April,
661,By Investing.com,"<span>Jun 04, 2012 04:33AM ET</span>",Euro zone Sentix investor confidence at lowest since July 2009,
662,By Investing.com,"<span>Jun 03, 2012 09:35PM ET</span>",Australian CGOP rises less-than-expected,
663,By Investing.com,"<span>Jun 01, 2012 10:00AM ET</span>",ISM manufacturing PMI falls more-than-expected,
664,By Investing.com,"<span>Jun 01, 2012 08:35AM ET</span>",U.S. personal spending rises,
665,By Investing.com,"<span>Jun 01, 2012 08:30AM ET</span>",U.S. unemployment rate rises unexpectedly,
666,By Investing.com,"<span>Jun 01, 2012 08:30AM ET</span>",Canadian GDP rises less-than-expected,
667,By Investing.com,"<span>Jun 01, 2012 08:30AM ET</span>",U.S. non-farm payrolls rise less-than-expected,
668,By Investing.com,"<span>Jun 01, 2012 05:00AM ET</span>",Euro zone unemployment rate remains unchanged,
669,By Investing.com,"<span>Jun 01, 2012 04:35AM ET</span>",U.K. manufacturing PMI falls more-than-expected,
670,By Investing.com,"<span>Jun 01, 2012 04:05AM ET</span>",Euro zone manufacturing PMI rises unexpectedly,
671,By Investing.com,"<span>Jun 01, 2012 04:00AM ET</span>",German manufacturing PMI rises unexpectedly,
672,By Investing.com,"<span>Jun 01, 2012 03:55AM ET</span>",French manufacturing PMI rises unexpectedly,
673,By Investing.com,"<span>Jun 01, 2012 03:30AM ET</span>",Swiss SVME PMI falls more-than-expected,
674,By Investing.com,"<span>Jun 01, 2012 03:15AM ET</span>",Switzerland’s retail sales fall more-than-expected,
675,By Investing.com,"<span>May 31, 2012 07:55PM ET</span>",Japanese capital spending falls less-than-expected,
676,By Investing.com,"<span>May 31, 2012 09:49AM ET</span>",Chicago PMI falls to lowest since September 2009,
677,By Investing.com,"<span>May 31, 2012 08:37AM ET</span>","U.S. Q1 GDP revised down to 1.9%, in line with expectations",
678,By Investing.com,"<span>May 31, 2012 08:33AM ET</span>","U.S. initial jobless claims rise by 10,000 last week",
679,By Investing.com,"<span>May 31, 2012 08:19AM ET</span>",U.S. ADP non-farm payrolls rise less-than-expected in May,
680,By Investing.com,"<span>May 31, 2012 05:04AM ET</span>",Euro zone flash CPI eases to 2.4% in May,
681,By Investing.com,"<span>May 31, 2012 04:00AM ET</span>","German unemployment change flat, jobless rate at record low",
682,By Investing.com,"<span>May 31, 2012 02:14AM ET</span>",German retail sales gain 0.6% in April,
683,By Investing.com,"<span>May 31, 2012 02:00AM ET</span>",U.K. Nationwide HPI rises more-than-expected,
684,By Investing.com,"<span>May 31, 2012 01:45AM ET</span>",Swiss GDP rises more-than-expected,
685,By Investing.com,"<span>May 30, 2012 09:35PM ET</span>",Australian private new capital expenditure rises more-than-expected,
686,By Investing.com,"<span>May 30, 2012 07:55PM ET</span>",Japan’s industrial production rises less-than-expected,
687,By Investing.com,"<span>May 30, 2012 10:05AM ET</span>",U.S. pending home sales tumble 5.5% in April,
688,By Investing.com,"<span>May 30, 2012 08:35AM ET</span>","Canadian RMPI drops 2%, in line with expectations, in April",
689,By Investing.com,"<span>May 30, 2012 05:26AM ET</span>",Borrowing costs surge as Italy sells 5- and 10-year debt,
690,By Investing.com,"<span>May 30, 2012 04:38AM ET</span>",U.K. net lending to individuals rises more-than-expected,
691,By Investing.com,"<span>May 30, 2012 04:05AM ET</span>",Euro zone M3 money supply grows less-than-expected in April,
692,By Investing.com,"<span>May 30, 2012 03:07AM ET</span>",Swiss KOF economic barometer improves to 7-month high,
693,By Investing.com,"<span>May 29, 2012 09:35PM ET</span>",Australian construction rises more-than-expected,
694,By Investing.com,"<span>May 29, 2012 09:35PM ET</span>",Australian retail sales fall unexpectedly,
695,By Investing.com,"<span>May 29, 2012 10:08AM ET</span>",U.S. CB consumer confidence declines unexpectedly in May,
696,By Investing.com,"<span>May 29, 2012 09:09AM ET</span>",S&P/Case-Shiller home price index falls in line with expectations,
697,By Investing.com,"<span>May 29, 2012 08:03AM ET</span>",German CPI eases more-than-expected in May,
698,By Investing.com,"<span>May 29, 2012 06:18AM ET</span>",U.K. CBI realized sales improve significantly in May,
699,By Investing.com,"<span>May 29, 2012 05:13AM ET</span>",Borrowing costs rise as Italy sells 6-month debt,
700,By Investing.com,"<span>May 28, 2012 07:55PM ET</span>",Japan’s retail sales rise less-than-expected,
701,By Investing.com,"<span>May 28, 2012 07:35PM ET</span>",Japan’s unemployment rate rises unexpectedly,
702,By Investing.com,"<span>May 25, 2012 10:00AM ET</span>",U.S. UoM consumer sentiment rises unexpectedly,
703,By Investing.com,"<span>May 25, 2012 03:15AM ET</span>",Swiss employment level rises unexpectedly,
704,By Investing.com,"<span>May 25, 2012 02:00AM ET</span>",German Gfk consumer climate remains unchanged unexpectedly,
705,By Investing.com,"<span>May 24, 2012 07:35PM ET</span>",Tokyo’s core consumer price inflation falls more-than-expected,
706,By Investing.com,"<span>May 24, 2012 08:40AM ET</span>",U.S. core durable goods orders drop unexpectedly in April,
707,By Investing.com,"<span>May 24, 2012 08:33AM ET</span>","U.S. initial jobless claims fall by 2,000 last week",
708,By Investing.com,"<span>May 24, 2012 04:41AM ET</span>",U.K. Q1 GDP contracts 0.3%; recession deeper-than-expected,
709,By Investing.com,"<span>May 24, 2012 04:11AM ET</span>",German Ifo business climate deteriorates in May,
710,By Investing.com,"<span>May 24, 2012 04:06AM ET</span>",Euro zone manufacturing PMI shrinks at fastest pace in 35 months,
711,By Investing.com,"<span>May 24, 2012 03:37AM ET</span>",German manufacturing PMI falls to lowest since June 2009 in May,
