,company,date,title,content
715,By Investing.com,"<span>Apr 29, 2014 09:35PM ET</span>",Australian Private Sector Credit 0.4% vs. 0.4% forecast,"Investing.com - The total amount of new credit issued to consumers and businesses in Australia rose last month, official data showed on Wednesday.In a report, Reserve Bank of Australia said that Australian Private Sector Credit rose to a seasonally adjusted 0.4%, from 0.4% in the preceding month.Analysts had expected Australian Private Sector Credit to rise 0.4% last month."
716,By Investing.com,"<span>Apr 29, 2014 09:35PM ET</span>",Japan’s Average Cash Earnings 0.7% vs. 0.2% forecast,"Investing.com - Japan’s average cash earnings rose more-than-expected in the last quarter, official data showed on Wednesday.In a report, Japanese Ministry of Health, Labour and Welfare said that Japan’s Average Cash Earnings rose to a seasonally adjusted 0.7%, from -0.1% in the preceding quarter whose figure was revised down from 0.0%.Analysts had expected Japan’s Average Cash Earnings to rise to 0.2% in the last quarter."
717,By Investing.com,"<span>Apr 29, 2014 08:30PM ET</span>",Taiwanese GDP 3.04% vs. 3.00% forecast,"Investing.com - Taiwan’s gross domestic product rose more-than-expected last month, official data showed on Wednesday.In a report, National Statistics Taiwan said that Taiwanese GDP rose to 3.04%, from 2.95% in the preceding month.Analysts had expected Taiwanese GDP to rise to 3.00% last month."
718,By Investing.com,"<span>Apr 29, 2014 07:55PM ET</span>",Japan’s industrial production 0.3% vs. 0.5% forecast,"Investing.com - Industrial production in Japan rose less-than-expected last month, preliminary data showed on Tuesday.In a report, the Ministry of Economy, Trade and Industry said that industrial production rose to a seasonally adjusted 0.3%, from -2.3% in the preceding month.Analysts had expected industrial production to rise 0.5% last month."
719,By Investing.com,"<span>Apr 29, 2014 07:05PM ET</span>",U.K. Gfk Consumer confidence -3 vs. -4 forecast,"Investing.com - The U.K. Gfk index of consumer confidence rose more-than-expected last month, industry data showed on Tuesday.In a report, GfK NOP said that U.K. Gfk Consumer confidence rose to a seasonally adjusted -3, from -5 in the preceding month.Analysts had expected U.K. Gfk Consumer confidence to rise to -4 last month."
720,By Investing.com,"<span>Apr 29, 2014 07:00PM ET</span>",South Korean industrial production 0.9% vs. 1.5% forecast,"Investing.com - Industrial production in South Korea rose less-than-expected last month, official data showed on Tuesday.In a report, Korea National Statistical Office said that South Korean industrial production rose to a seasonally adjusted annual rate of 0.9%, from -1.9% in the preceding month whose figure was revised down from -1.8%.Analysts had expected South Korean industrial production to rise 1.5% last month."
721,By Investing.com,"<span>Apr 29, 2014 06:50PM ET</span>",New Zealand Building Consents 8.3% vs. 2.0% forecast,"Investing.com - The number of new building consents issued in New Zealand rose more-than-expected last month, official data showed on Tuesday.In a report, Statistics New Zealand said that New Zealand Building Consents rose to a seasonally adjusted 8.3%, from -1.7% in the preceding month.Analysts had expected New Zealand Building Consents to rise to 2.0% last month."
722,By Investing.com,"<span>Apr 29, 2014 10:03AM ET</span>",U.S. CB consumer confidence falls to 82.3 in April,"Investing.com - U.S. consumer confidence fell more than expected in April, dampening optimism over the U.S. economic outlook, industry data showed on Tuesday.
In a report, the Conference Board, a market research group said its index of consumer confidence declined to 82.3 this month from a reading of 83.9 in March, whose figure was revised up from a previously reported 82.3.
Analysts had expected the index to inch down to 83.0 in April.
The Present Situation Index decreased to 78.3 from 82.5, while the Expectations Index was virtually unchanged at 84.9 versus 84.8 in March.
Commenting on the report, director of The Conference Board Consumer Research Center Lynn Franco said, “Consumer confidence declined slightly in April, as consumers assessed current business and labor market conditions less favorably than in March.”
Following the release of the data, the U.S. dollar held on to gains against the euro, with EUR/USD shedding 0.2% to trade at 1.3822.
Meanwhile, U.S. equity markets were higher after the open. The Dow Jones Composite rose 0.55%, the S&P 500 added 0.5%, while the NASDAQ Composite tacked on 0.4%.
"
723,By Investing.com,"<span>Apr 29, 2014 09:03AM ET</span>",S&P/Case-Shiller home price index rises 12.9% in February,"Investing.com - The S&P/Case-Shiller home price index rose less than expected in February, underlining concerns over the housing sector, industry data showed on Tuesday.
In a report, Standard & Poor’s with Case-Shiller said its house price index rose at an annualized rate of 12.9% in February from a year earlier, compared to forecasts for a 13% gain and following a rise of 13.2% in January.
Month-on-month, U.S. home prices were little changed in February after dipping 0.1% in the preceding month.
“The annual rates cooled the most we've seen in some time,” says David Blitzer, chairman of the index committee.
Following the release of the data, the U.S. dollar held on to gains against the euro, with EUR/USD shedding 0.17% to trade at 1.3827.
Meanwhile, U.S. stock index futures pointed to a higher open. The Dow pointed to a rise of 0.55%, S&P 500 futures indicated a gain of 0.35%, while the Nasdaq 100 signaled an increase of 0.35%.
"
724,By Investing.com,"<span>Apr 29, 2014 08:02AM ET</span>",German CPI rises to 1.3% in April,"Investing.com - Consumer price inflation in Germany rose less than expected in April, underlining concerns over the risk of deflation in the euro area, official preliminary data showed on Tuesday.
In a report, the German Federal Statistics Bureau said consumer price inflation accelerated at an annualized rate of 1.3% this month, up from 1% in March. Analysts had expected German consumer prices to rise by 1.4% in April.
Month-over-month, German consumer prices declined 0.2% this month, compared to forecasts for a drop of 0.1%, after rising 0.3% in the preceding month.
Following the release of the data, the euro turned lower against the U.S. dollar, with EUR/USD shedding 0.08% to trade at 1.3839, compared to 1.3857 ahead of the data.
Meanwhile, European stock markets remained higher. Germany's DAX rallied 1.3%, the Euro Stoxx 50 advanced 1.1%, France’s CAC 40 added 0.5%, while London’s FTSE 100 picked up 0.75%.
"
725,By Investing.com,"<span>Apr 29, 2014 05:39AM ET</span>",Bond yields fall to record low as Italy sells 10-year debt,"Investing.com - Italy saw borrowing costs fall to the lowest levels on record at an auction of ten-year government bonds on Tuesday, as investors continued to gauge the health of the euro zone’s third-largest economy.
Italy’s Treasury sold €3 billion worth of ten-year debt at an average yield of 3.22%, down from 3.29% at a similar auction last month.
The yield on Italy's 10-Year bond stood at 3.178% following the auction, the lowest since January 2006.
Rome also sold €3.5 billion of five-year debt at an average yield of 1.84%, compared to a yield of 1.88% in March.
Following the auction, the euro held on to gains against the U.S. dollar, with EUR/USD rising 0.13% to trade at 1.3868.
Meanwhile, European stock markets remained higher. Italy FTSE MIB advanced 1.2%, the Euro Stoxx 50 rose 0.55%, France’s CAC 40 inched up 0.1%, Germany's DAX climbed 0.65%, while London’s FTSE 100 tacked on 0.5%. 
"
726,By Investing.com,"<span>Apr 29, 2014 05:00AM ET</span>",Italian Business Confidence 99.9 vs. 99.5 forecast,"Investing.com - Italian business confidence rose more-than-expected last month, official data showed on Tuesday.In a report, Organisation for Economic Co-operation and Development said that Italian Business Confidence rose to a seasonally adjusted 99.9, from 99.3 in the preceding month whose figure was revised up from 99.2.Analysts had expected Italian Business Confidence to rise to 99.5 last month."
727,By Investing.com,"<span>Apr 29, 2014 04:35AM ET</span>",U.K. Index of Services 0.9% vs. 0.9% forecast,"Investing.com - The U.K. index of services rose last month, official data showed on Tuesday.In a report, National Statistics said that U.K. Index of Services rose to 0.9%, from 0.9% in the preceding month.Analysts had expected U.K. Index of Services to rise 0.9% last month."
728,By Investing.com,"<span>Apr 29, 2014 04:32AM ET</span>",U.K. GDP grows 0.8% in first quarter; pound trims gains,"Investing.com - The U.K. economy grew less than expected in the first quarter of 2014, dampening optimism over the country’s economic outlook, preliminary official data showed on Tuesday.
In a report, the Office for National Statistics said gross domestic product expanded by a seasonally adjusted 0.8% in the three months ended March 31, below forecasts for growth of 0.9%. The U.K.’s economy grew by 0.7% in the preceding quarter.
Year-over-year, U.K. economic growth grew 3.1% in the first quarter, missing expectations for a gain of 3.2%. The U.K. economy expanded at an annualized rate of 2.7% in the fourth quarter of 2013.
Following the release of that data, the pound trimmed gains against the U.S. dollar, with GBP/USD rising 0.03% to trade at 1.6812, compared to 1.6841 ahead of the data.
Meanwhile, European stock markets remained mixed. The Euro Stoxx 50 inched up 0.4%, France's CAC 40 dipped 0.1%, the FTSE 100 advanced 0.4%, while Germany's DAX tacked on 0.6%.
"
729,By Investing.com,"<span>Apr 29, 2014 04:06AM ET</span>",﻿Euro zone M3 money supply grows 1.1% in March,"Investing.com - The euro zone's M3 money supply grew less than expected in March, while private loans declined for the 23rd consecutive month, official data showed on Tuesday.
In a report, the European Central Bank said M3 money supply in the single currency bloc rose at annualized rate of 1.1% last month, below forecasts for a 1.4% gain. M3 money supply in the euro zone rose 1.3% in the preceding month.
Loans to private sector declined at a pace of 2.2% annually in March, compared to expectations for a 2.1% drop, after falling 2.2% in February.
Following the release of the data, the euro held on to gains against the U.S. dollar, with EUR/USD rising 0.09% to trade at 1.3862.
Meanwhile, European stock markets were mixed. The Euro Stoxx 50 advanced 0.45%, France’s CAC 40 dipped 0.1%, Germany's DAX picked up 0.65%, while London’s FTSE 100 tacked on 0.3%."
730,By Investing.com,"<span>Apr 29, 2014 04:05AM ET</span>",Euro Zone Private Sector Lending -2.2% vs. -2.1% forecast,"Investing.com - Private sector lending in the euro zone remained unchanged unexpectedly last month, official data showed on Tuesday.In a report, European Central Bank said that Euro Zone Private Sector Lending remained unchanged at -2.2%, from -2.2% in the preceding month.Analysts had expected Euro Zone Private Sector Lending to rise to -2.1% last month."
731,By Investing.com,"<span>Apr 29, 2014 04:00AM ET</span>",Italian Retail Sales -0.2% vs. 0.4% forecast,"Investing.com - Italian retail sales fell unexpectedly last month, official data showed on Tuesday.In a report, Istat said that Italian Retail Sales fell to -0.2%, from 0.0% in the preceding month.Analysts had expected Italian Retail Sales to rise 0.4% last month."
732,By Investing.com,"<span>Apr 29, 2014 03:00AM ET</span>",Spanish unemployment rate 25.93% vs. 25.85% forecast,"Investing.com - The unemployment rate in Spain rose unexpectedly last month, official data showed on Tuesday.In a report, Ministry of Labour and Immigration said that Spanish unemployment rate rose to an annual rate of 25.93%, from 25.73% in the preceding month whose figure was revised down from 26.03%.Analysts had expected Spanish unemployment rate to fall to 25.85% last month."
733,By Investing.com,"<span>Apr 29, 2014 02:45AM ET</span>",French Consumer Confidence 85 vs. 88 forecast,"Investing.com - French consumer confidence fell unexpectedly last month, official data showed on Tuesday.In a report, INSEE said that French Consumer Confidence fell to 85, from 88 in the preceding month.Analysts had expected French Consumer Confidence to remain unchanged at 88 last month."
734,By Investing.com,"<span>Apr 29, 2014 02:00AM ET</span>",German Gfk consumer climate 8.5 vs. 8.5 forecast,"Investing.com - Germany’s Gfk consumer climate remained unchanged last month, data showed on Tuesday.In a report, research group Gfk said that its index of Germany’s consumer climate remained unchanged at 8.5, from 8.5 in the preceding month.Analysts had expected Gfk consumer climate to remain unchanged at 8.5 last month."
735,By Investing.com,"<span>Apr 29, 2014 01:25AM ET</span>",Argentinian retail sales 29.4% vs. 27.0% forecast,"Investing.com - Retail sales in Argentina fell less-than-expected last month, official data showed on Monday.In a report, Instituto Nacional De Estadistic y Censos said that Argentinian Retail Sales fell to a seasonally adjusted 29.4%, from 32.3% in the preceding month whose figure was revised up from 30.3%.Analysts had expected Argentinian Retail Sales to fall to 27.0% last month."
736,By Investing.com,"<span>Apr 28, 2014 06:50PM ET</span>",New Zealand’s trade balance 920M vs. 937M forecast,"Investing.com - New Zealand’s trade balance rose less-than-expected last month, data showed on Monday.In a report, Statistics New Zealand said that the trade balance rose to a seasonally adjusted 920M, from 818M in the preceding month.Analysts had expected the trade balance to rise to 937M last month."
737,By Investing.com,"<span>Apr 28, 2014 10:35AM ET</span>",Dallas Fed Manufacturing Business Index 11.7 vs. 6.0 forecast,
738,By Investing.com,"<span>Apr 28, 2014 10:02AM ET</span>",U.S. pending home sales jump 3.4% in March ,"Investing.com - Pending home sales in the U.S. rose significantly more than expected in March, easing concerns over the housing sector, industry data showed on Monday.
In a report, the National Association of Realtors said its pending home sales index jumped by a seasonally adjusted 3.4% last month, easily surpassing expectations for a 1% gain.
Pending home sales for February were revised to a 0.5% drop from a previously reported decline of 0.8%.
Year-on-year, pending home sales fell at annualized rate of 7.4% in March, better than expectations for a 10.3% decline.
Following the release of the data, the euro held on to gains against the U.S. dollar, with EUR/USD rising 0.23% to trade at 1.3866.
Meanwhile, U.S. equity markets were higher after the open. The Dow Jones Composite rose 0.55%, the S&P 500 advanced 0.35%, while the NASDAQ Composite inched up 0.5%. "
739,By Investing.com,"<span>Apr 28, 2014 09:00AM ET</span>",Mexican trade balance 1.027B vs. 1.600B forecast,"Investing.com - Mexico’s trade balance rose less-than-expected last month, official data showed on Monday.In a report, Insituto Nacional de Estadistica Y Geografia said that Mexican Trade Balance rose to a seasonally adjusted 1.027B, from 0.976B in the preceding month.Analysts had expected Mexican Trade Balance to rise to 1.600B last month."
740,By Investing.com,"<span>Apr 28, 2014 04:35AM ET</span>",Hong Kong trade balance -50.4B vs. -42.9B forecast,"Investing.com - Hong Kong’s trade balance rose less-than-expected last month, official data showed on Monday.In a report, Hong Kong Census and Statistics Department said that Hong Kong Trade Balance rose to a seasonally adjusted -50.4B, from -53.7B in the preceding month.Analysts had expected Hong Kong Trade Balance to rise to -42.9B last month."
741,By Investing.com,"<span>Apr 28, 2014 04:00AM ET</span>",Italian Consumer Confidence 105.4 vs. 101.5 forecast,"Investing.com - Italian consumer confidence rose more-than-expected last month, official data showed on Monday.In a report, Italian National Institute of Statistics said that Italian Consumer Confidence rose to 105.4, from 101.9 in the preceding month whose figure was revised up from 101.7.Analysts had expected Italian Consumer Confidence to rise 101.5 last month."
742,By Investing.com,"<span>Apr 28, 2014 03:30AM ET</span>",Swedish retail sales 1.1% vs. 0.3% forecast,"Investing.com - Retail sales in Sweden rose more-than-expected last month, official data showed on Monday.In a report, SCB - Statistics Sweden said that Swedish Retail Sales rose to a seasonally adjusted 1.1%, from 0.4% in the preceding month.Analysts had expected Swedish Retail Sales to rise 0.3% last month."
743,By Investing.com,"<span>Apr 28, 2014 02:00AM ET</span>",German Import Price Index -0.6% vs. -0.2% forecast,"Investing.com - Germany’s import price index fell more-than-expected in the last quarter, official data showed on Monday.In a report, Destatis said that German Import Price Index fell to a seasonally adjusted -0.6%, from -0.1% in the preceding quarter.Analysts had expected German Import Price Index to fall to -0.2% in the last quarter."
744,By Investing.com,"<span>Apr 27, 2014 11:00PM ET</span>",Thai industrial production -10.4% vs. -8.2% forecast,"Investing.com - Industrial production in Thailand fell more-than-expected last month, official data showed on Monday.In a report, Office of Industrial Economics Thailand said that Thai Industrial Production fell to a seasonally adjusted -10.4%, from -4.4% in the preceding month.Analysts had expected Thai Industrial Production to fall to -8.2% last month."
745,By Investing.com,"<span>Apr 27, 2014 07:55PM ET</span>",Japan’s retail sales 11.0% vs. 11.0% forecast,"Investing.com - Japanese retail sales rose last month, official data showed on Sunday.In a report, the Ministry of Economy Trade and Industry said that retail sales rose to a seasonally adjusted annual rate of 11.0%, from 3.6% in the preceding month.Analysts had expected retail sales to rise at annual rate of to 11.0% last month."
746,By Investing.com,"<span>Apr 25, 2014 05:10PM ET</span>",Colombia’s Benchmark Interest Rate 3.50% vs. 3.25% forecast,"Investing.com - Colombia’s benchmark interest rate rose unexpectedly, official data showed on Friday.Colombia's central bank increased interest rates to 3.50% after 12 months on hold, due to higher inflation and an improving economyAnalysts had expected Colombian Interest Rate to remain unchanged at 3.25%."
747,By Investing.com,"<span>Apr 25, 2014 09:55AM ET</span>",U.S. UoM consumer sentiment 84.1 vs. 83.0 forecast,"Investing.com - U.S. UoM consumer sentiment rose more-than-expected last month, data showed on Friday.In a report, the University of Michigan said that consumer sentiment rose to a seasonally adjusted 84.1, from 82.6 in the preceding month.Analysts had expected UoM consumer sentiment to rise to 83.0 last month."
748,By Investing.com,"<span>Apr 25, 2014 09:00AM ET</span>",Belgium NBB Business Climate -4.6 vs. -4.2 forecast,"Investing.com - Confidence among Belgian business leaders fell unexpectedly in the last quarter, official data showed on Friday.In a report, National Bank of Belgium said that Belgium NBB Business Climate fell to -4.6, from -4.4 in the preceding quarter.Analysts had expected Belgium NBB Business Climate to rise to -4.2 in the last quarter."
749,By Investing.com,"<span>Apr 25, 2014 09:00AM ET</span>",Mexican economic activity 1.74% vs. 1.25% forecast,"Investing.com - Economic activity in Mexico rose more-than-expected last month, official data showed on Friday.In a report, Instituto Nacional de Estadistica y Geografia said that Mexican Economic Activity rose to a seasonally adjusted 1.74%, from 0.83% in the preceding month.Analysts had expected Mexican Economic Activity to rise to 1.25% last month."
750,By International Business Times,"<span>Apr 25, 2014 08:00AM ET</span>",Russia Hikes Rates Following S&P Ruble Downgrade,"By Reuters - Russia's central bank unexpectedly raised its key lending rate at a regular meeting on Friday, hiking the key one-week minimum auction repo rate by 50 basis points to 7.5 percent in response to inflationary risks.
""The Bank of Russia does not intend to lower the key rate in the coming months,"" the bank said in an accompanying statement.   The central bank had been expected to keep rates on hold this month, having raised its key rate by 150 bps in March in response to financial instability linked to the political crisis in Ukraine. 
The March hike came after Russian President Vladimir Putin received parliamentary authorisation to use military force in Ukraine prior to its annexation of Ukraine's Crimea region.   Russia launched army drills near the Ukrainian border on Thursday after Ukrainian forces killed five pro-Moscow rebels.   The central bank said its decision on Friday was due to inflationary risks linked to the weakening rouble.   ""The probability of inflation exceeding the 5.0 percent target at the end of 2014 has increased substantially. This has been caused by more pronounced than expected pass-through effect of the exchange rate dynamics on consumer prices,"" it said.   The bank added that inflation stood at 7.2 percent on April 21. Although the bank is formally allowed to deviate by 1.5 percentage points either side of its 5 percent, it has forecast inflation at between 5 and 6 percent by year-end.   On Friday, it said inflation was likely to end the year at the upper end of that range.   ""The Bank of Russia estimates that the adopted decision (on the key rate) would ensure the decline in inflation to no more than 6.0 percent by the end of 2014,"" it said in its statement.   The surprise rate hike comes despite a severe economic slowdown which saw Russia's economy grow by only 0.8 percent year-on-year in the first quarter.   ""The current economic slowdown is predominantly structural by nature and thus does not exert any noticeable downward pressure on inflation,"" the bank said.   The rouble strengthened immediately after the decision, but then weakened towards its levels before the rate hike.   At 1015 GMT the rouble was at 35.96 against the dollar , down 0.5 percent on the day. (Reporting by Oksana Kobzeva and Lidia Kelly, writing by Jason Bush; Editing by Nigel Stephenson)
"
751,By Investing.com,"<span>Apr 25, 2014 04:35AM ET</span>",BBA mortgage approvals 45.9K vs. 48.9K forecast,"Investing.com - The number of mortgages approved by the British Banker’s Association fell unexpectedly last month, industry data showed on Friday.In a report, British Bankers’ Association said that BAA mortgage approvals fell to a seasonally adjusted 45.9K, from 47.2K in the preceding month whose figure was revised down from 47.6K.Analysts had expected BAA mortgage approvals to rise to 48.9K last month."
752,By Investing.com,"<span>Apr 25, 2014 01:00AM ET</span>",Singaporean industrial production 12.1% vs. 6.3% forecast,"Investing.com - Industiral production in Singapore fell less-than-expected last month, official data showed on Friday.In a report, Statistics Singapore said that Singaporean Industrial Production fell to an annual rate of 12.1%, from 13.1% in the preceding month whose figure was revised up from 12.8%.Analysts had expected Singaporean Industrial Production to fall to 6.3% last month."
753,By Investing.com,"<span>Apr 24, 2014 07:35PM ET</span>",Japan’s National Core CPI 1.3% vs. 1.4% forecast,"Investing.com - Japan’s national core rate of consumer price inflation remained unchanged unexpectedly last month, official data showed on Thursday.In a report, Statistics Bureau said that Japan’s National Core CPI remained unchanged at a seasonally adjusted 1.3%, from 1.3% in the preceding month.Analysts had expected Japan’s National Core CPI to rise to 1.4% last month."
754,By Investing.com,"<span>Apr 24, 2014 07:35PM ET</span>",Tokyo’s core consumer price inflation 2.7% vs. 2.8% forecast,"Investing.com - Tokyo’s core consumer price inflation rose less-than-expected last month, official data showed on Thursday.In a report, the Statistics Bureau said that Tokyo’s core CPI, which excludes fresh food costs rose to at an annualized rate of 2.7%, from 1.0% in the preceding month.Analysts had expected Tokyo’s core CPI to rise to 2.8% last month."
755,By Investing.com,"<span>Apr 24, 2014 10:35AM ET</span>",U.S. Natural Gas Storage 49B vs. 42B forecast,"Investing.com - U.S. natural gas storage rose more-than-expected last month, official data showed on Thursday.In a report, Energy Information Administration said that U.S. Natural Gas Storage rose to a seasonally adjusted annual rate of 49B, from 24B in the preceding month.Analysts had expected U.S. Natural Gas Storage to rise 42B last month."
