,company,date,title,content
943,By Investing.com,"<span>Mar 27, 2012 03:18AM ET</span>",German Gfk consumer climate index dips unexpectedly,
944,By Investing.com,"<span>Mar 26, 2012 10:05AM ET</span>",U.S. pending home sales drop unexpectedly in February,
945,By Investing.com,"<span>Mar 26, 2012 04:06AM ET</span>",German Ifo business climate improves in March,
946,By Investing.com,"<span>Mar 25, 2012 06:00PM ET</span>",New Zealand’s trade balance rises more-than-expected,
947,By Investing.com,"<span>Mar 23, 2012 11:05AM ET</span>",New home sales fall unexpectedly,
948,By Investing.com,"<span>Mar 23, 2012 07:10AM ET</span>",Canadian consumer price inflation rises less-than-expected,
949,By Investing.com,"<span>Mar 23, 2012 05:40AM ET</span>",BBA mortgage approvals fall unexpectedly,
950,By Investing.com,"<span>Mar 22, 2012 08:20PM ET</span>",Nationwide consumer confidence falls unexpectedly,
951,By Investing.com,"<span>Mar 22, 2012 10:08AM ET</span>",Belgium NBB business climate declines unexpectedly,
952,By Investing.com,"<span>Mar 22, 2012 08:45AM ET</span>",Canada core retail sales decline unexpectedly in January,
953,By Investing.com,"<span>Mar 22, 2012 08:36AM ET</span>",U.S. initial jobless claims fall to lowest since February 2008,
954,By Investing.com,"<span>Mar 22, 2012 06:17AM ET</span>",Euro zone industrial new orders drop more-than-expected,
955,By Investing.com,"<span>Mar 22, 2012 05:35AM ET</span>",U.K. retail sales drop more-than-expected in February,
956,By Investing.com,"<span>Mar 22, 2012 05:08AM ET</span>",Euro zone manufacturing PMI slumps to 3-month low in March,
957,By Investing.com,"<span>Mar 22, 2012 04:37AM ET</span>",German manufacturing PMI falls to 4-month low in March,
958,By Investing.com,"<span>Mar 22, 2012 04:05AM ET</span>",French manufacturing PMI drops to 4-month low in March,
959,By Investing.com,"<span>Mar 22, 2012 03:24AM ET</span>",Swiss trade surplus widens more-than-expected,
960,By Investing.com,"<span>Mar 21, 2012 10:07AM ET</span>",U.S. existing home sales decline more-than-expected in February,
961,By Investing.com,"<span>Mar 21, 2012 05:46AM ET</span>",U.K. public sector net borrowing swings to deficit in February,
962,By Investing.com,"<span>Mar 20, 2012 08:41AM ET</span>",U.S. building permits rise to highest since October 2008,
963,By Investing.com,"<span>Mar 20, 2012 07:07AM ET</span>",U.K. CBI industrial order expectations decline more-than-expected,
964,By Investing.com,"<span>Mar 20, 2012 05:37AM ET</span>",U.K. CPI eases to lowest since November 2010,
965,By Investing.com,"<span>Mar 20, 2012 04:25AM ET</span>",Swiss industrial production surges in fourth quarter,
966,By Investing.com,"<span>Mar 20, 2012 03:15AM ET</span>",German PPI rises less-than-expected in February,
967,By Investing.com,"<span>Mar 19, 2012 08:36AM ET</span>",Canadian wholesale sales decline unexpectedly,
968,By Investing.com,"<span>Mar 19, 2012 05:51AM ET</span>",Italian industrial new orders tumble in January,
969,By Investing.com,"<span>Mar 19, 2012 05:08AM ET</span>",Euro zone current account surplus widens in January,
970,By Investing.com,"<span>Mar 16, 2012 10:05AM ET</span>",U.S. UoM consumer sentiment falls unexpectedly,
971,By Investing.com,"<span>Mar 16, 2012 09:25AM ET</span>",Industrial Production remains unchanged unexpectedly,
972,By Investing.com,"<span>Mar 16, 2012 08:40AM ET</span>",U.S. consumer price inflation rises,
973,By Investing.com,"<span>Mar 15, 2012 10:05AM ET</span>",Philly Fed manufacturing index rises to 11-month high,
974,By Investing.com,"<span>Mar 15, 2012 09:23AM ET</span>",U.S. TIC long term purchases rise more-than-expected,
975,By Investing.com,"<span>Mar 15, 2012 08:45AM ET</span>",Empire State manufacturing index jumps to 21-month high,
976,By Investing.com,"<span>Mar 15, 2012 08:41AM ET</span>",U.S. initial jobless claims fall more-than-expected last week,
977,By Investing.com,"<span>Mar 15, 2012 08:36AM ET</span>",U.S. core PPI rises in line with expectations,
978,By Investing.com,"<span>Mar 15, 2012 04:38AM ET</span>",Swiss National Bank leaves interest rate unchanged,
979,By Investing.com,"<span>Mar 14, 2012 08:38AM ET</span>",U.S. import prices rise less-than-expected in February,
980,By Investing.com,"<span>Mar 14, 2012 08:34AM ET</span>",U.S. current account deficit widens more-than-expected in Q4,
981,By Investing.com,"<span>Mar 14, 2012 06:15AM ET</span>",Swiss ZEW economic expectations improve in March,
982,By Investing.com,"<span>Mar 14, 2012 06:05AM ET</span>",Euro zone CPI holds steady in line with expectations,
983,By Investing.com,"<span>Mar 14, 2012 05:35AM ET</span>",U.K. claimant count change rises more-than-expected,
984,By Investing.com,"<span>Mar 13, 2012 10:10AM ET</span>",U.S. IBD/TIPP economic optimism declines unexpectedly,
985,By Investing.com,"<span>Mar 13, 2012 10:06AM ET</span>",U.S. business inventories rise more-than-expected in January,
986,By Investing.com,"<span>Mar 13, 2012 08:35AM ET</span>",U.S. retail sales rise to 5-month high in February,
987,By Investing.com,"<span>Mar 13, 2012 06:08AM ET</span>",German ZEW economic sentiment soars to highest since June 2010,
988,By Investing.com,"<span>Mar 13, 2012 05:39AM ET</span>",U.K. goods trade deficit widens less-than-expected in January,
989,By Investing.com,"<span>Mar 13, 2012 04:19AM ET</span>",Swiss PPI rises more-than-expected in February,
990,By Investing.com,"<span>Mar 13, 2012 03:30AM ET</span>",Australian home loans drop more-than-expected,
991,By Investing.com,"<span>Mar 13, 2012 03:24AM ET</span>","Bank of Japan holds rates steady, asset purchase unchanged",
992,By Investing.com,"<span>Mar 12, 2012 02:35PM ET</span>",U.S. federal budget balance falls more-than-expected,
993,By Investing.com,"<span>Mar 12, 2012 05:04AM ET</span>",Italian GDP contracts in line with expectations in Q4,
994,By Investing.com,"<span>Mar 12, 2012 03:21AM ET</span>",Japanese core machinery orders rise more-than-expected,
995,By Investing.com,"<span>Mar 09, 2012 08:35AM ET</span>",U.S. non-farm payrolls rise more-than-expected,
996,By Investing.com,"<span>Mar 09, 2012 07:10AM ET</span>",Canadian employment change falls unexpectedly,
997,By Investing.com,"<span>Mar 09, 2012 04:40AM ET</span>",U.K. industrial production falls unexpectedly,
998,By Investing.com,"<span>Mar 09, 2012 02:10AM ET</span>",German CPI rises,
999,By Investing.com,"<span>Mar 08, 2012 07:40PM ET</span>",Australia’s trade balance falls unexpectedly,
1000,By Investing.com,"<span>Mar 08, 2012 09:06AM ET</span>",Bank of Canada leaves interest rate unchanged at 1.00%,
1001,By Investing.com,"<span>Mar 08, 2012 08:42AM ET</span>",U.S. initial jobless claims rise unexpectedly last week,
1002,By Investing.com,"<span>Mar 08, 2012 08:17AM ET</span>",Canadian housing starts rise more-than-expected,
1003,By Investing.com,"<span>Mar 08, 2012 07:45AM ET</span>",European Central Bank leaves interest rate at record-low 1%,
1004,By Investing.com,"<span>Mar 08, 2012 07:13AM ET</span>",Bank of England holds key interest rate at 0.50%,
1005,By Investing.com,"<span>Mar 08, 2012 06:04AM ET</span>",German industrial production rises more-than-expected,
1006,By Investing.com,"<span>Mar 08, 2012 03:18AM ET</span>",Swiss CPI rises more-than-expected in February,
1007,By Investing.com,"<span>Mar 08, 2012 02:24AM ET</span>",Reserve Bank of New Zealand holds rates steady,
1008,By Investing.com,"<span>Mar 08, 2012 02:19AM ET</span>",Australian employment change drops unexpectedly,
1009,By Investing.com,"<span>Mar 07, 2012 08:42AM ET</span>",U.S. fourth quarter non-farm productivity revised higher,
1010,By Investing.com,"<span>Mar 07, 2012 08:37AM ET</span>",Canadian building permits plunge in January,
1011,By Investing.com,"<span>Mar 07, 2012 08:19AM ET</span>",U.S. ADP non-farm payrolls rise more-than-expected in February,
1012,By Investing.com,"<span>Mar 07, 2012 06:05AM ET</span>",German factory orders tumble unexpectedly in January,
1013,By Investing.com,"<span>Mar 07, 2012 02:47AM ET</span>",Swiss unemployment rate stable in February,
1014,By Investing.com,"<span>Mar 07, 2012 02:18AM ET</span>",Australia fourth quarter GDP rises less-than-expected,
1015,By Investing.com,"<span>Mar 06, 2012 10:06AM ET</span>",Canadian Ivey PMI rises unexpectedly in February,
1016,By Investing.com,"<span>Mar 06, 2012 05:04AM ET</span>",Euro zone GDP contracts in line with expectations in Q4,
1017,By Investing.com,"<span>Mar 06, 2012 03:37AM ET</span>",Halifax U.K. HPI declines unexpectedly in February,
1018,By Investing.com,"<span>Mar 06, 2012 02:20AM ET</span>",Reserve Bank of Australia holds rates steady,
1019,By Investing.com,"<span>Mar 05, 2012 10:12AM ET</span>",U.S. factory orders fall less-than-expected in January,
1020,By Investing.com,"<span>Mar 05, 2012 10:08AM ET</span>",U.S. ISM non-manufacturing PMI rises unexpectedly,
1021,By Investing.com,"<span>Mar 05, 2012 05:06AM ET</span>",Euro zone retail sales rebound in January,
1022,By Investing.com,"<span>Mar 05, 2012 04:43AM ET</span>",U.K. services PMI falls to 3-month low in February,
1023,By Investing.com,"<span>Mar 05, 2012 04:35AM ET</span>",Euro zone Sentix investor confidence improves less-than-expected,
1024,By Investing.com,"<span>Mar 05, 2012 04:08AM ET</span>",Euro zone final services PMI contracts in February,
1025,By Investing.com,"<span>Mar 05, 2012 03:20AM ET</span>",Swiss retail sales surge in January,
1026,By Investing.com,"<span>Mar 02, 2012 08:40AM ET</span>",Canadian GDP rises more-than-expected,
1027,By Investing.com,"<span>Mar 02, 2012 05:10AM ET</span>",Euro zone PPI rises more-than-expected,
1028,By Investing.com,"<span>Mar 01, 2012 06:45PM ET</span>",Tokyo’s core consumer price inflation rises unexpectedly,
1029,By Investing.com,"<span>Mar 01, 2012 06:40PM ET</span>",Japan’s unemployment rate remains unchanged unexpectedly,
1030,By Investing.com,"<span>Mar 01, 2012 10:09AM ET</span>",U.S. ISM manufacturing PMI declines unexpectedly,
1031,By Investing.com,"<span>Mar 01, 2012 08:41AM ET</span>",U.S. core PCE price index rises in line with expectations,
1032,By Investing.com,"<span>Mar 01, 2012 08:36AM ET</span>",U.S. initial jobless claims decline modestly last week,
1033,By Investing.com,"<span>Mar 01, 2012 05:13AM ET</span>",Euro zone unemployment rate rises to record high,
1034,By Investing.com,"<span>Mar 01, 2012 05:09AM ET</span>",Euro zone flash CPI rises unexpectedly in February,
1035,By Investing.com,"<span>Mar 01, 2012 04:38AM ET</span>",U.K. manufacturing PMI declines unexpectedly in February,
1036,By Investing.com,"<span>Mar 01, 2012 03:39AM ET</span>",Swiss SVME PMI improves more-than-expected in February,
1037,By Investing.com,"<span>Mar 01, 2012 02:22AM ET</span>",U.K. Nationwide HPI rises more-than-expected in February,
1038,By Investing.com,"<span>Mar 01, 2012 02:16AM ET</span>",Swiss fourth quarter GDP rises unexpectedly,
1039,By Investing.com,"<span>Feb 29, 2012 09:54AM ET</span>",Chicago PMI rises to highest since April 2011,
1040,By Investing.com,"<span>Feb 29, 2012 08:36AM ET</span>",U.S. Q4 GDP revised up to 3%,
1041,By Investing.com,"<span>Feb 29, 2012 05:06AM ET</span>",Euro zone CPI eases unexpectedly in January,
1042,By Investing.com,"<span>Feb 29, 2012 04:38AM ET</span>",U.K. net lending to individuals rises less-than-expected,
1043,By Investing.com,"<span>Feb 29, 2012 04:00AM ET</span>",German unemployment change steady in February,
1044,By Investing.com,"<span>Feb 29, 2012 03:07AM ET</span>",Swiss KOF economic barometer improves less-than-expected,
1045,By Investing.com,"<span>Feb 29, 2012 02:19AM ET</span>",Australian retail sales rise in line with expectations,
1046,By Investing.com,"<span>Feb 28, 2012 10:10AM ET</span>",U.S. CB consumer confidence rises to 12-month high,
1047,By Investing.com,"<span>Feb 28, 2012 09:05AM ET</span>",S&P/Case-Shiller home price index falls more-than-expected,
1048,By Investing.com,"<span>Feb 28, 2012 08:43AM ET</span>",German CPI rises more-than-expected in February,
1049,By Investing.com,"<span>Feb 28, 2012 08:38AM ET</span>",U.S. core durable goods orders tumble in January,
1050,By Investing.com,"<span>Feb 28, 2012 06:12AM ET</span>",U.K. CBI realized sales improve significantly in February,
1051,By Investing.com,"<span>Feb 28, 2012 03:19AM ET</span>",Swiss employment level declines less-than-expected in Q4,
1052,By Investing.com,"<span>Feb 28, 2012 02:57AM ET</span>",Swiss UBS consumption indicator dips slightly in January,
1053,By Investing.com,"<span>Feb 28, 2012 02:26AM ET</span>",German Gfk consumer climate index improves slightly,
1054,By Investing.com,"<span>Feb 27, 2012 07:05PM ET</span>",Japan’s retail sales rise unexpectedly,
1055,By Investing.com,"<span>Feb 27, 2012 10:06AM ET</span>",U.S. pending home sales rise more-than-expected in January,
1056,By Investing.com,"<span>Feb 27, 2012 04:19AM ET</span>",Euro zone M3 money supply grows more-than-expected,
1057,By Investing.com,"<span>Feb 27, 2012 02:21AM ET</span>",New Zealand trade balance swings to deficit in January,
1058,By Investing.com,"<span>Feb 26, 2012 04:55PM ET</span>",New Zealand’s trade balance falls unexpectedly,
1059,By Investing.com,"<span>Feb 24, 2012 10:10AM ET</span>",New home sales fall unexpectedly,
1060,By Investing.com,"<span>Feb 24, 2012 10:00AM ET</span>",U.S. UoM consumer sentiment rises unexpectedly,
1061,By Investing.com,"<span>Feb 24, 2012 04:40AM ET</span>",U.K. GDP falls,
1062,By Investing.com,"<span>Feb 24, 2012 02:10AM ET</span>",German GDP falls,
1063,By Investing.com,"<span>Feb 23, 2012 08:37AM ET</span>",U.S. initial jobless claims unchanged last week,
1064,By Investing.com,"<span>Feb 23, 2012 06:05AM ET</span>",U.K. CBI industrial order expectations improve more-than-expected,
1065,By Investing.com,"<span>Feb 23, 2012 04:34AM ET</span>",U.K. BBA mortgage approvals rise more-than-expected,
1066,By Investing.com,"<span>Feb 23, 2012 04:05AM ET</span>",German Ifo business climate improves more-than-expected,
1067,By Investing.com,"<span>Feb 22, 2012 10:06AM ET</span>",U.S. existing home sales rise less-than-expected in January,
1068,By Investing.com,"<span>Feb 22, 2012 09:12AM ET</span>",Belgium NBB business climate improves in February,
1069,By Investing.com,"<span>Feb 22, 2012 05:07AM ET</span>",Euro zone industrial new orders jump more-than-expected,
1070,By Investing.com,"<span>Feb 22, 2012 04:11AM ET</span>",Euro zone manufacturing PMI improves less-than-expected,
1071,By Investing.com,"<span>Feb 22, 2012 03:43AM ET</span>",German manufacturing PMI falls to 2-month low,
1072,By Investing.com,"<span>Feb 22, 2012 03:06AM ET</span>",French manufacturing PMI rises to 7-month high,
1073,By Investing.com,"<span>Feb 21, 2012 08:46AM ET</span>",Canadian wholesale sales rise more-than-expected,
1074,By Investing.com,"<span>Feb 21, 2012 08:38AM ET</span>",Canada core retail sales unexpectedly flat in December,
1075,By Investing.com,"<span>Feb 21, 2012 04:43AM ET</span>",U.K. public sector net borrowing swings to surplus,
1076,By Investing.com,"<span>Feb 21, 2012 02:21AM ET</span>",Swiss trade surplus narrows unexpectedly in January,
1077,By Investing.com,"<span>Feb 19, 2012 04:50PM ET</span>",N.Z. PPI input rises more-than-expected,
1078,By Investing.com,"<span>Feb 17, 2012 08:40AM ET</span>",U.S. consumer price inflation rises less-than-expected,
1079,By Investing.com,"<span>Feb 17, 2012 07:10AM ET</span>",Canadian consumer price inflation rises more-than-expected,
1080,By Investing.com,"<span>Feb 17, 2012 04:35AM ET</span>",U.K. retail sales rise unexpectedly,
1081,By Investing.com,"<span>Feb 16, 2012 10:05AM ET</span>",Philly Fed manufacturing index rises to 4-month high,
1082,By Investing.com,"<span>Feb 16, 2012 08:48AM ET</span>",U.S. initial jobless claims fall to lowest since March 2008 last week,
1083,By Investing.com,"<span>Feb 16, 2012 08:44AM ET</span>",U.S. core PPI rises more-than-expected in January,
1084,By Investing.com,"<span>Feb 16, 2012 08:38AM ET</span>",U.S. building permits rise in line with expectations in January,
1085,By Investing.com,"<span>Feb 16, 2012 03:28AM ET</span>",Spain GDP contracts in line with expectations in Q4,
1086,By Investing.com,"<span>Feb 15, 2012 07:40PM ET</span>",Australian employment change rises more-than-expected,
1087,By Investing.com,"<span>Feb 15, 2012 09:20AM ET</span>",U.S. industrial production unexpectedly flat in January,
1088,By Investing.com,"<span>Feb 15, 2012 09:11AM ET</span>",U.S. TIC long term purchases decline significantly in December,
1089,By Investing.com,"<span>Feb 15, 2012 08:38AM ET</span>",Empire State manufacturing index jumps to 20-month high,
1090,By Investing.com,"<span>Feb 15, 2012 05:26AM ET</span>",Swiss ZEW economic expectations improve significantly,
1091,By Investing.com,"<span>Feb 15, 2012 05:06AM ET</span>",Euro zone Q4 GDP contracts less-than-expected,
1092,By Investing.com,"<span>Feb 15, 2012 04:38AM ET</span>",U.K. claimant count change rises more-than-expected,
1093,By Investing.com,"<span>Feb 15, 2012 04:09AM ET</span>",Italian GDP contracts more-than-expected in Q4,
1094,By Investing.com,"<span>Feb 15, 2012 02:29AM ET</span>",French GDP increases unexpectedly in fourth quarter,
1095,By Investing.com,"<span>Feb 15, 2012 02:21AM ET</span>",German GDP contracts less-than-expected in Q4,
1096,By Investing.com,"<span>Feb 14, 2012 04:55PM ET</span>",N.Z. retail sales rise more-than-expected,
1097,By Investing.com,"<span>Feb 14, 2012 10:04AM ET</span>",U.S. business inventories rise in line with expectations,
1098,By Investing.com,"<span>Feb 14, 2012 08:41AM ET</span>",U.S. import prices rise in line with expectations,
1099,By Investing.com,"<span>Feb 14, 2012 08:39AM ET</span>",U.S. retail sales rise less-than-expected in January,
1100,By Investing.com,"<span>Feb 14, 2012 05:48AM ET</span>",Portugal’s economy shrinks more-than-expected in Q4,
1101,By Investing.com,"<span>Feb 14, 2012 05:41AM ET</span>",Greek GDP contracts more-than-expected in Q4,
1102,By Investing.com,"<span>Feb 14, 2012 05:14AM ET</span>",German ZEW economic sentiment improves to 9-month high,
1103,By Investing.com,"<span>Feb 14, 2012 05:09AM ET</span>",Euro zone industrial production declines in December,
1104,By Investing.com,"<span>Feb 14, 2012 04:35AM ET</span>",U.K. consumer price inflation eases in line with expectations,
1105,By Investing.com,"<span>Feb 14, 2012 02:29AM ET</span>",Bank of Japan unexpectedly announces more easing,
1106,By Investing.com,"<span>Feb 13, 2012 11:45PM ET</span>",Japan’s industrial production rises less-than-expected,
1107,By Investing.com,"<span>Feb 13, 2012 03:20AM ET</span>",Swiss PPI unexpectedly flat in January,
1108,By Investing.com,"<span>Feb 12, 2012 07:40PM ET</span>",Australian home loans rise more-than-expected,
1109,By Investing.com,"<span>Feb 12, 2012 07:00PM ET</span>",Japan’s GDP falls more-than-expected,
1110,By Investing.com,"<span>Feb 12, 2012 07:00PM ET</span>",Japan’s tertiary index rises more-than-expected,
1111,By Investing.com,"<span>Feb 10, 2012 02:10PM ET</span>",U.S. federal budget balance rises more-than-expected,
1112,By Investing.com,"<span>Feb 10, 2012 10:05AM ET</span>",U.S. UoM consumer sentiment falls more-than-expected,
1113,By Investing.com,"<span>Feb 10, 2012 08:40AM ET</span>",U.S. trade balance falls more-than-expected,
1114,By Investing.com,"<span>Feb 10, 2012 04:40AM ET</span>",U.K. PPI input rises more-than-expected,
1115,By Investing.com,"<span>Feb 10, 2012 03:40AM ET</span>",Swiss consumer price inflation falls more-than-expected,
1116,By Investing.com,"<span>Feb 09, 2012 08:34AM ET</span>",U.S. initial jobless claims fall more-than-expected last week,
1117,By Investing.com,"<span>Feb 09, 2012 07:48AM ET</span>",European Central Bank leaves interest rate at record-low 1%,
1118,By Investing.com,"<span>Feb 09, 2012 07:02AM ET</span>","Bank of England holds key rate at 0.50%, announces more QE",
1119,By Investing.com,"<span>Feb 09, 2012 04:43AM ET</span>",U.K. goods trade deficit narrows more-than-expected,
1120,By Investing.com,"<span>Feb 09, 2012 04:38AM ET</span>",U.K. manufacturing production rises more-than-expected,
1121,By Investing.com,"<span>Feb 09, 2012 02:54AM ET</span>",Swiss SECO consumer climate index improves in January,
1122,By Investing.com,"<span>Feb 09, 2012 02:19AM ET</span>",China CPI rises to 3-month high in January,
1123,By Investing.com,"<span>Feb 08, 2012 04:55PM ET</span>",N.Z. unemployment rate falls more-than-expected,
1124,By Investing.com,"<span>Feb 08, 2012 08:34AM ET</span>",Canadian housing starts fall less-than-expected,
1125,By Investing.com,"<span>Feb 08, 2012 03:11AM ET</span>",Spanish industrial production tumbles in December,
1126,By Investing.com,"<span>Feb 08, 2012 02:58AM ET</span>",Swiss unemployment rate stable in January,
1127,By Investing.com,"<span>Feb 08, 2012 02:53AM ET</span>",German trade surplus narrows more-than-expected,
1128,By Investing.com,"<span>Feb 07, 2012 10:04AM ET</span>",U.S. IBD/TIPP economic optimism rises more-than-expected,
1129,By Investing.com,"<span>Feb 07, 2012 08:36AM ET</span>",Canadian building permits soar in December,
1130,By Investing.com,"<span>Feb 07, 2012 06:06AM ET</span>",German industrial production drops significantly in December,
1131,By Investing.com,"<span>Feb 07, 2012 02:29AM ET</span>",Reserve Bank of Australia keeps rates unchanged,
1132,By Investing.com,"<span>Feb 06, 2012 10:17AM ET</span>",Canada’s Ivey PMI jumps in January,
1133,By Investing.com,"<span>Feb 06, 2012 06:23AM ET</span>",German factory orders rebound in December,
1134,By Investing.com,"<span>Feb 06, 2012 04:49AM ET</span>",Euro zone Sentix investor confidence rises more-than-expected,
1135,By Investing.com,"<span>Feb 05, 2012 07:40PM ET</span>",Australian retail sales fall unexpectedly,
1136,By Investing.com,"<span>Feb 03, 2012 08:40AM ET</span>",U.S. unemployment rate falls unexpectedly,
1137,By Investing.com,"<span>Feb 03, 2012 08:35AM ET</span>",U.S. non-farm payrolls rise more-than-expected,
1138,By Investing.com,"<span>Feb 03, 2012 07:10AM ET</span>",Canadian employment change rises less-than-expected,
1139,By Investing.com,"<span>Feb 02, 2012 08:43AM ET</span>",U.S. non-farm productivity rises less-than-expected in Q4,
1140,By Investing.com,"<span>Feb 02, 2012 08:37AM ET</span>",U.S. initial jobless claims fall more-than-expected last week,
1141,By Investing.com,"<span>Feb 02, 2012 05:05AM ET</span>",Euro zone PPI declines more-than-expected in December,
1142,By Investing.com,"<span>Feb 02, 2012 04:40AM ET</span>",U.K. January construction PMI falls to 4-month low,
1143,By Investing.com,"<span>Feb 02, 2012 02:32AM ET</span>",Swiss trade surplus narrows more-than-expected,
1144,By Investing.com,"<span>Feb 02, 2012 02:29AM ET</span>",Australia trade surplus widens unexpectedly in December,
1145,By Investing.com,"<span>Feb 02, 2012 02:24AM ET</span>",Australia building approvals fall unexpectedly in December,
1146,By Investing.com,"<span>Feb 01, 2012 10:08AM ET</span>",U.S. ISM manufacturing PMI rises less-than-expected in January,
1147,By Investing.com,"<span>Feb 01, 2012 08:20AM ET</span>",U.S. ADP non-farm payrolls rise less-than-expected in January,
1148,By Investing.com,"<span>Feb 01, 2012 05:03AM ET</span>",Euro zone flash CPI eases in line with expectations,
1149,By Investing.com,"<span>Feb 01, 2012 04:37AM ET</span>",U.K. manufacturing PMI rises to 8-month high in January,
1150,By Investing.com,"<span>Feb 01, 2012 03:40AM ET</span>",Swiss SVME PMI contracts in January,
1151,By Investing.com,"<span>Feb 01, 2012 03:24AM ET</span>",Swiss retail sales rise less-than-expected in December,
1152,By Investing.com,"<span>Feb 01, 2012 02:19AM ET</span>",U.K. Nationwide HPI declines more-than-expected,
1153,By Investing.com,"<span>Jan 31, 2012 07:45PM ET</span>",Australian HPI falls more-than-expected,
1154,By Investing.com,"<span>Jan 31, 2012 10:05AM ET</span>",U.S. CB consumer confidence declines unexpectedly,
1155,By Investing.com,"<span>Jan 31, 2012 09:57AM ET</span>",Chicago PMI falls unexpectedly in January,
1156,By Investing.com,"<span>Jan 31, 2012 09:38AM ET</span>",S&P/Case-Shiller home price index falls more-than-expected,
1157,By Investing.com,"<span>Jan 31, 2012 08:46AM ET</span>",U.S. employment cost index rises in line with expectations in Q4,
1158,By Investing.com,"<span>Jan 31, 2012 08:38AM ET</span>",Canadian GDP contracts unexpectedly in November,
1159,By Investing.com,"<span>Jan 31, 2012 05:13AM ET</span>",Euro zone unemployment rate holds steady at record high,
1160,By Investing.com,"<span>Jan 31, 2012 04:39AM ET</span>",U.K. net lending to individuals rises less-than-expected,
1161,By Investing.com,"<span>Jan 31, 2012 03:59AM ET</span>",German unemployment change falls more-than-expected,
1162,By Investing.com,"<span>Jan 31, 2012 02:52AM ET</span>",Swiss UBS consumption indicator improves in December,
1163,By Investing.com,"<span>Jan 31, 2012 02:20AM ET</span>",German retail sales drop unexpectedly in December,
1164,By Investing.com,"<span>Jan 30, 2012 07:05PM ET</span>",Japan’s industrial production rises more-than-expected,
1165,By Investing.com,"<span>Jan 30, 2012 06:45PM ET</span>",Japan’s unemployment rate rises unexpectedly,
1166,By Investing.com,"<span>Jan 30, 2012 08:38AM ET</span>","U.S. core PCE price index up in December, personal spending flat",
1167,By Investing.com,"<span>Jan 30, 2012 08:13AM ET</span>",German CPI eases less-than-expected in January,
1168,By Investing.com,"<span>Jan 30, 2012 03:51AM ET</span>",Spain GDP contracts in line with expectations in Q4,
1169,By Investing.com,"<span>Jan 27, 2012 10:05AM ET</span>",U.S. UoM consumer sentiment rises more-than-expected,
1170,By Investing.com,"<span>Jan 27, 2012 08:40AM ET</span>",U.S. GDP rises less-than-expected,
1171,By Investing.com,"<span>Jan 27, 2012 03:20AM ET</span>",Switzerland’s KOF economic barometer falls more-than-expected,
