,company,date,title,content
0,By Investing.com,"<span>Jul 02, 2014 10:02AM ET</span>",U.S. factory orders fall 0.5% in May,"Investing.com - U.S. factory orders fell more-than-expected in May, underlining concerns over the U.S. economic outlook, official data showed on Wednesday.
In a report, the U.S. Census Bureau said factory orders dropped by a seasonally adjusted 0.5% in May, worse than forecasts for a 0.3% decline.
Factory orders for April were revised up to a gain of 0.8% from a previously reported increase of 0.7%.
Following the release of the data, the U.S. dollar held on to gains against the euro, with EUR/USD shedding 0.18% to trade at 1.3654.
Meanwhile, U.S. stock markets were modestly higher after the open. The Dow picked up 0.1%, the S&P 500 tacked on 0.1%, while the Nasdaq 100 increased 0.2%.
"
1,By Investing.com,"<span>Jul 02, 2014 08:17AM ET</span>","U.S. ADP non-farm payrolls rise by 281,000 in June","Investing.com - U.S. non-farm private employment rose significantly more-than-expected in June, easing concern over the strength of the U.S. labor market, industry data showed on Wednesday.
In a report, payroll processing firm ADP said non-farm private employment rose by a seasonally adjusted 281,000 last month, the highest since November 2012 and easily surpassing expectations for an increase of 200,000.
The economy created 179,000 jobs in May.
While not viewed as a reliable guide for the government jobs report due on Thursday, July 3, it does give guidance on private-sector hiring.
Following the release of the data, the U.S. dollar added to gains against the euro, with EUR/USD shedding 0.18% to trade at 1.3654, compared to 1.3659 ahead of the data.
Meanwhile, U.S. stock index futures remained higher. The Dow indicated a gain of 0.1% at the open, the S&P 500 pointed to a rise of 0.1%, while the Nasdaq 100 indicated an increase of 0.1%.
"
2,By Investing.com,"<span>Jul 02, 2014 08:00AM ET</span>",Brazilian industrial production -3.2% vs. -3.2% forecast,"Investing.com - Industrial production in Brazil rose last month, official data showed on Wednesday.In a report, Instituto Brasiliero de Geografia e Estatistica said that Brazilian Industrial Production rose to -3.2%, from -5.8% in the preceding month.Analysts had expected Brazilian Industrial Production to rise to -3.2% last month."
3,By Investing.com,"<span>Jul 02, 2014 05:04AM ET</span>",Euro zone PPI falls 0.1% in May,"Investing.com - Producer price inflation in the euro zone fell for the fifth consecutive month in May, underlining concerns over deflation, official data showed on Wednesday.
In a report, Eurostat said that its producer price index eased down by a seasonally adjusted 0.1% in May, in line with expectations. Producer prices inched down 0.1% in April.
Year-over-year, the producer price index declined at an annualized rate of 1% in May, meeting forecasts and after falling at a rate of 1.2% in April.
Following the release of the data, the euro held on to losses against the U.S. dollar, with EUR/USD shedding 0.17% to trade at 1.3656.
Meanwhile, European stock markets remained mixed. The DJ Euro Stoxx 50 rose 0.15%, France’s CAC 40 dipped 0.1%, Germany's DAX tacked on 0.25%, while London’s FTSE 100 inched up 0.1%. 
"
4,By Investing.com,"<span>Jul 02, 2014 04:34AM ET</span>",U.K. construction PMI rises to 4-month high of 62.6 in June,"Investing.com - U.K. construction sector activity expanded at the fastest pace in four months in June, fuelling optimism over the country’s economic outlook, industry data showed on Wednesday.
In a report, market research firm Markit and the Chartered Institute of Purchasing & Supply said that their U.K. construction purchasing managers' index improved to a seasonally adjusted 62.6 last month from a reading of 60.0 in May. Economists had expected the index to decline to 59.5 in June.
The headline index has now posted above the 50.0 no-change threshold for 14 months running and the latest reading signaled the strongest pace of overall output growth since February.
Stronger new order volumes and ongoing efforts to boost operating capacity contributed to the steepest rise in employment levels since the survey began in April 1997.
Commenting on the report, Time Moore, senior economist at Markit and author the report, said, “The latest survey suggests that the U.K. construction sector has expanded by more than 1% over the second quarter of 2014, driven by improvements in the underlying health of the economy, favorable funding conditions and robust increases in new housing starts.”
Following the release of the data, the pound added to gains against the U.S. dollar, with GBP/USD rising 0.14% to trade at 1.7173, compared to 1.7151 ahead of the data.
Meanwhile, European stock markets remained mixed. London’s FTSE 100 tacked on 0.2%, the DJ Euro Stoxx 50 rose 0.2%, France’s CAC 40 shed 0.1%, while Germany's DAX advanced 0.25%. 
"
5,By Investing.com,"<span>Jul 02, 2014 03:07AM ET</span>","Spanish jobless claims fall by 122,700 in June, euro little changed","Investing.com - The number of unemployed people in Spain declined more than expected in June, easing concerns over the health of the euro zone’s fourth largest economy, official data showed on Wednesday.
In a report, Spain’s Employment Ministry said the number of unemployed people fell by a seasonally adjusted 122,700 last month, compared to expectations for a decline of 97,300. The number of unemployed people fell by 111,900 in May.
Following the release of the data, the euro was little changed against the U.S. dollar, with EUR/USD inching up 0.01% to trade at 1.3681.
Meanwhile, European stock markets were mixed after the open. Spain’s IBEX 35 climbed 0.1%, the DJ Euro Stoxx 50 rose 0.1%, France’s CAC 40 fell 0.1%, Germany’s DAX picked up 0.2%, while London’s FTSE 100 tacked on 0.1%.
"
6,By Investing.com,"<span>Jul 02, 2014 02:00AM ET</span>",U.K. Nationwide HPI 1.0% vs. 0.6% forecast,"Investing.com - The U.K.’s Nationwide house price index rose more-than-expected last month, data showed on Wednesday.In a report, , Nationwide Building Society said that said its index of U.K. house prices rose to 1.0%, from 0.7% in the preceding month.Analysts had expected the Nationwide HPI to rise 0.6% last month."
7,By Investing.com,"<span>Jul 01, 2014 09:35PM ET</span>",Australia’s trade balance -1.911B vs. -0.120B forecast,"Investing.com - Australia’s trade balance fell unexpectedly last month, official data showed on Wednesday.In a report, Australian Bureau of Statistics said that Australia’s trade balance fell to a seasonally adjusted -1.911B, from -0.780B in the preceding month whose figure was revised down from -0.122B.Analysts had expected Australia’s trade balance to rise to -0.120B last month."
8,By Investing.com,"<span>Jul 01, 2014 04:45PM ET</span>",U.S. API Weekly Crude Stock -0.876M vs. -2.000M forecast,"Investing.com - U.S. API weekly crude stocks fell less-than-expected last week, official data showed on Tuesday.In a report, American Petroleum Institute said that U.S. API Weekly Crude Stock fell to -0.876M, from 4.000M in the preceding week.Analysts had expected U.S. API Weekly Crude Stock to fall -2.000M last week."
9,By Investing.com,"<span>Jul 01, 2014 04:40PM ET</span>",U.S. Total Vehicle Sales 16.98M vs. 16.40M forecast,"Investing.com - U.S. total vehicle sales rose more-than-expected last month, official data showed on Tuesday.In a report, Autodata Corp. said that U.S. Total Vehicle Sales rose to a seasonally adjusted 16.98M, from 16.77M in the preceding month.Analysts had expected U.S. Total Vehicle Sales to rise 16.40M last month."
10,By Investing.com,"<span>Jul 01, 2014 02:00PM ET</span>",Brazil’s trade balance 2.37B vs. 2.85B forecast,"Investing.com - Brazil’s trade balance rose less-than-expected last week, official data showed on Tuesday.In a report, Instituto Brasiliero de Geografia e Estatistica said that Brazilian Trade Balance rose to 2.37B, from 0.71B in the preceding week.Analysts had expected Brazilian Trade Balance to rise to 2.85B last week."
11,By Reuters,"<span>Jul 01, 2014 11:10AM ET</span>",Global manufacturing activity accelerated in June: PMI,"LONDON (Reuters) - Global manufacturing activity accelerated in June, and with new orders coming in faster output is likely to pick up in the coming months, a business survey showed on Tuesday.
JPMorgan's Global Manufacturing Purchasing Managers' Index (PMI) rose to a four-month high of 52.7 in June from May's 52.1, holding above the 50 mark indicating growth for the 19th month in a row.
""The global PMI suggests the growth of manufacturing output strengthened further into midyear,"" said David Hensley, a director at JPMorgan.
""With new order inflows strengthening and inventories of finished goods indicated to be declining, the stage is set for robust output gains in the coming months.""

New orders came in at their fastest rate since February while firms ran down stocks for the third month, the survey showed.
The United States, Britain and much of Asia recorded solid increases in activity last month but factories in the euro zone lost momentum.
(Reporting by Jonathan Cable; Editing by Hugh Lawson)"
12,By Investing.com,"<span>Jul 01, 2014 10:02AM ET</span>",U.S. ISM manufacturing PMI falls to 55.3 in June,"Investing.com - Manufacturing activity in the U.S. expanded at a slower rate than expected in June, dampening optimism over the health of the economy, industry data showed on Tuesday.
In a report, the Institute for Supply Management said its index of purchasing managers fell to 55.3 last month from a reading of 55.4 in May. Analysts had expected the manufacturing PMI to increase to 55.8 in June.
The New Orders Index registered 58.9, an increase of 2.0 points from the 56.9 reading in May, indicating growth in new orders for the 13th consecutive month. The Production Index registered 60.0, 1.0 point below the May reading of 61.0.
Employment grew for the 12th consecutive month, registering 52.8, the same level of growth as reported in May.
On the index, a reading above 50.0 indicates industry expansion, below indicates contraction.
Following the release of the data, the U.S. dollar was lower against the euro, with EUR/USD rising 0.03% to trade at 1.3697.
Meanwhile, U.S. equity markets were higher after the open. The Dow rose 0.6%, the S&P 500 advanced 0.4%, while the Nasdaq 100 tacked on 0.7%.
"
13,By Investing.com,"<span>Jul 01, 2014 05:03AM ET</span>",Euro zone unemployment rate holds steady at 11.6% in May,"Investing.com - The euro zone’s unemployment rate held steady at a 20-month low in May, amid easing concerns over the region’s growth prospects, official data showed on Tuesday.
In a report, Eurostat said that the euro zone’s unemployment rate held steady at a seasonally adjusted 11.6% in May, unchanged from April and compared to expectations for an increase to 11.7%.
The data showed that among the member states, the lowest unemployment rates were recorded in Austria (4.7%), Germany (5.1%) and Malta (5.7%), and the highest in Greece (26.8% in March 2014) and Spain (25.1%).
Following the release of the data, the euro held on to losses against the U.S. dollar, with EUR/USD shedding 0.04% to trade at 1.3687.
Meanwhile, European stock markets remained higher. The DJ Euro Stoxx 50 rose 0.2%, France’s CAC 40 tacked on 0.6%, Germany's DAX inched up 0.25%, while London’s FTSE 100 advanced 0.45%.
"
14,By Investing.com,"<span>Jul 01, 2014 04:35AM ET</span>",U.K. manufacturing PMI rises to 7-month high of 57.5 in June,"Investing.com - Manufacturing activity in the U.K. expanded at the fastest pace in seven months in June, fuelling optimism over the country’s economic outlook, industry data showed on Tuesday.
In a report, market research group Markit said that its U.K. manufacturing PMI improved to a seasonally adjusted 57.5 last month from a reading of 57.0 in May. Analysts had expected the index to dip to 56.8 in June.
On the index, a reading above 50.0 indicates industry expansion, below indicates contraction.
The PMI has now signaled expansion throughout the past 16 months. Furthermore, the average index reading during the second quarter is the highest since the first quarter of 2011.  Commenting on the report, Rob Dobson, senior economist at survey compiler Markit, said, “We expect official manufacturing production to have expanded in the second quarter at a pace above the 1.5% registered in the first quarter, making further headway into recovering pre-crisis output levels.”
Following the release of the data, the pound turned higher against the U.S. dollar, with GBP/USD rising 0.15% to trade at 1.7131, compared to 1.7103 ahead of the data.
Meanwhile, European stock markets were higher. London’s FTSE 100 eased up 0.4%, the DJ Euro Stoxx 50 increased 0.1%, France’s CAC 40 tacked on 0.4%, while Germany's DAX edged 0.2% higher.
"
15,By Investing.com,"<span>Jul 01, 2014 04:00AM ET</span>",Euro zone manufacturing PMI 51.8 vs. 51.9 forecast,"Investing.com - The euro zone’s manufacturing PMI fell unexpectedly last month, data showed on Tuesday. In a report, research group Markit said the euro zone’s manufacturing PMI fell to 51.8, from 51.9 in the preceding month. Analysts had expected the euro zone’s manufacturing PMI to remain unchanged at 51.9 last month."
16,By Investing.com,"<span>Jul 01, 2014 03:57AM ET</span>","German jobless claims rise by 9,000 in June","Investing.com - The number of unemployed people in Germany rose for the second consecutive month in June, while the country’s jobless rate held steady at a record low, official data showed on Tuesday.
In a report, Germany's Federal Statistics Office said the number of unemployed people increased by a seasonally adjusted 9,000 last month, disappointing expectations for a drop of 10,000. Jobless claims in May rose by 25,000.
The report showed that Germany’s unemployment held steady at 6.7% in June, in line with expectations and unchanged from May.
Following the release of the data, the euro was lower against the U.S. dollar, with EUR/USD shedding 0.02% to trade at 1.3690.
Meanwhile, European stock markets remained higher. Germany's DAX eased up 0.1%, the DJ Euro Stoxx 50 tacked on 0.1%, France’s CAC 40 advanced 0.35%, while London’s FTSE 100 added 0.35%.
"
17,By Investing.com,"<span>Jul 01, 2014 03:55AM ET</span>",German manufacturing PMI 52.0 vs. 52.4 forecast,"Investing.com - Germany’s manufacturing PMI fell unexpectedly last month, data showed on Tuesday.In a report, Markit Economics said that German manufacturing PMI fell to a seasonally adjusted 52.0, from 52.4 in the preceding month.Analysts had expected German manufacturing PMI to remain unchanged at 52.4 last month."
18,By Investing.com,"<span>Jul 01, 2014 03:55AM ET</span>",French manufacturing PMI 48.2 vs. 47.8 forecast,"Investing.com - France’s manufacturing PMI rose unexpectedly last month, data showed on Tuesday.In a report, Markit Economics said that French manufacturing PMI rose to a seasonally adjusted 48.2, from 47.8 in the preceding month.Analysts had expected French manufacturing PMI to remain unchanged at 47.8 last month."
19,By Investing.com,"<span>Jul 01, 2014 03:54AM ET</span>",Italian manufacturing PMI falls to 3-month low of 52.6 in June,"Investing.com - Manufacturing activity in Italy expanded at a slower pace than expected in June, dampening optimism over the economic outlook of the euro zone’s third largest economy, data showed on Tuesday.
In a report, market research group Markit said that its Italian manufacturing purchasing managers’ index inched down to a seasonally adjusted 52.6 last month from a reading of 53.2 in May. Analysts had expected the index to hold steady at 53.2 in June.
A reading above 50.0 on the index indicates industry expansion, below indicates contraction.
Commenting on the report, Phil Smith, economist at Markit, said, “Output growth eased in June but was nevertheless solid and led businesses to raise employment again, with the current run of jobs growth in the sector the longest since 2007.”
Following the release of the data, the euro was lower against the U.S. dollar, with EUR/USD shedding 0.01% to trade at 1.3692.
Meanwhile, European stock markets were mixed. Italy FTSE MIB rose 0.1%, the DJ Euro Stoxx 50 increased 0.1%, France’s CAC 40 added 0.3%, London’s FTSE 100 inched up 0.35%, while Germany's DAX edged 0.15% higher.
"
20,By Investing.com,"<span>Jul 01, 2014 03:34AM ET</span>",Swiss SVME PMI rises to 2-month high in June,"Investing.com - Manufacturing activity in Switzerland grew at a faster than expected rate in June, industry data showed on Tuesday.
In a report, the Swiss SVME purchasing managers' association and Credit Suisse said that its purchasing managers’ index improved to a seasonally adjusted 54.0 last month from a reading of 52.5 in May.
Analysts had expected the index to rise to 52.8 in June.
On the index, a reading above 50.0 indicates expansion, below indicates contraction.
Following the release of the data, the Swiss franc was lower against the U.S. dollar, with USD/CHF easing up 0.02% to trade at 0.8871.
"
21,By Investing.com,"<span>Jul 01, 2014 03:15AM ET</span>",Spain’s Manufacturing PMI 54.6 vs. 52.9 forecast,"Investing.com - Spanish manufacturing sector activity rose unexpectedly last month, official data showed on Tuesday.In a report, Markit Finacial Information Services said that Spain’s Manufacturing PMI rose to 54.6, from 52.9 in the preceding month.Analysts had expected Spain’s Manufacturing PMI to remain unchanged at 52.9 last month."
22,By Investing.com,"<span>Jul 01, 2014 03:15AM ET</span>",Czech GDP 0.8% vs. 0.4% forecast,"Investing.com - The Czech Republic’s gross domestic product rose more-than-expected in the last quarter, official data showed on Tuesday.In a report, Cesky Statisticky Urad said that Czech GDP rose to a seasonally adjusted 0.8%, from 0.4% in the preceding quarter.Analysts had expected Czech GDP to rise 0.4% in the last quarter."
23,By Investing.com,"<span>Jul 01, 2014 03:15AM ET</span>",South Korean trade balance 5.29B vs. 6.40B forecast,"Investing.com - South Korea’s trade balance fell unexpectedly in the last quarter, official data showed on Tuesday.In a report, Korea National Statistical Office said that South Korean Trade Balance fell to a seasonally adjusted 5.29B, from 5.30B in the preceding quarter.Analysts had expected South Korean Trade Balance to rise to 6.40B in the last quarter."
24,By Investing.com,"<span>Jul 01, 2014 03:05AM ET</span>",Norwegian manufacturing PMI 49.6 vs. 50.9 forecast,"Investing.com - Manufacturing activity in Norway remained unchanged unexpectedly last month, official data showed on Tuesday.In a report, Statistics Norway said that Norwegian Manufacturing PMI remained unchanged at a seasonally adjusted annual rate of 49.6, from 49.6 in the preceding month whose figure was revised down from 49.8.Analysts had expected Norwegian Manufacturing PMI to rise to 50.9 last month."
25,By Investing.com,"<span>Jul 01, 2014 02:35AM ET</span>",Swedish manufacturing PMI 54.8 vs. 54.3 forecast,"Investing.com - Manufacturing activity in Swede rose more-than-expected last month, official data showed on Tuesday.In a report, Silf and Förenings Sparbanken said that Swedish Manufacturing PMI rose to a seasonally adjusted 54.8, from 54.1 in the preceding month.Analysts had expected Swedish Manufacturing PMI to rise to 54.3 last month."
26,By Investing.com,"<span>Jul 01, 2014 01:00AM ET</span>",India manufacturing PMI 51.50 vs. 51.50 forecast,"Investing.com - Manufacturing activity in India rose in the last quarter, official data showed on Tuesday.In a report, Markit said that HSBC Markit Manufacturing PMI rose to a seasonally adjusted annual rate of 51.50, from 51.40 in the preceding quarter.Analysts had expected HSBC Markit Manufacturing PMI to rise to 51.50 in the last quarter."
27,By Investing.com,"<span>Jul 01, 2014 12:32AM ET</span>",Reserve Bank of Australia cash rate unchanged at 2.5%,"Investing.com - Following is the full test statement from the Reserve Bank of Australia's Tuesday board meeting to review monetary policy.
Statement by Glenn Stevens, Governor: Monetary Policy Decision:
At its meeting today, the Board decided to leave the cash rate unchanged at 2.5 per cent.
Growth in the global economy is continuing at a moderate pace, helped by firmer conditions in the advanced countries. China's growth slowed a little earlier in the year but remains generally in line with policymakers' objectives. Commodity prices in historical terms remain high, but some of those important to Australia have declined.
Financial conditions overall remain very accommodative. Long-term interest rates and risk spreads remain low. Emerging market economies are once again receiving capital inflows. Volatility in many financial prices is currently unusually low. Markets appear to be attaching a very low probability to any rise in global interest rates over the period ahead.
In Australia, recent data indicate somewhat firmer growth around the turn of the year, but this resulted mainly from very strong increases in resource exports as new capacity came on stream; smaller increases in such exports are likely in coming quarters. Moderate growth has been occurring in consumer demand. A strong expansion in housing construction is now under way. At the same time, resources sector investment spending is starting to decline significantly. Signs of improvement in investment intentions in some other sectors are emerging, but these plans remain tentative as firms wait for more evidence of improved conditions before committing to significant expansion. Public spending is scheduled to be subdued. Overall, the Bank still expects growth to be a little below trend over the year ahead.
There has been some improvement in indicators for the labour market in recent months, but it will probably be some time yet before unemployment declines consistently. Growth in wages has declined noticeably. If these and other domestic costs remain contained, inflation should remain consistent with the target over the next one to two years, even with lower levels of the exchange rate.
Monetary policy remains accommodative. Interest rates are very low and for some borrowers have edged lower over recent months. Savers continue to look for higher returns in response to low rates on safe instruments. Credit growth has picked up a little, including most recently to businesses. Dwelling prices have increased significantly over the past year, though there have been some signs of a moderation in the pace of increase recently. The exchange rate remains high by historical standards, particularly given the declines in key commodity prices, and hence is offering less assistance than it might in achieving balanced growth in the economy.
Looking ahead, continued accommodative monetary policy should provide support to demand and help growth to strengthen over time. Inflation is expected to be consistent with the 2–3 per cent target over the next two years.
In the Board's judgement, monetary policy is appropriately configured to foster sustainable growth in demand and inflation outcomes consistent with the target. On present indications, the most prudent course is likely to be a period of stability in interest rates.
"
28,By Investing.com,"<span>Jul 01, 2014 12:30AM ET</span>",Thailand CPI 2.35% vs. 2.60% forecast,"Investing.com - Consumer price inflation in Thailand fell more-than-expected last month, official data showed on Tuesday.In a report, Ministry of Commerce Thailand said that Thai CPI fell to a seasonally adjusted annual rate of 2.35%, from 2.62% in the preceding month.Analysts had expected Thai CPI to fall to 2.60% last month."
29,By Investing.com,"<span>Jul 01, 2014 12:20AM ET</span>",Indonesian trade balance 0.07B vs. 0.41B forecast,"Investing.com - Indonesia’s trade balance rose less-than-expected last month, official data showed on Tuesday.In a report, Badan Pusat Statistik said that Indonesian Trade Balance rose to a seasonally adjusted 0.07B, from -1.97B in the preceding month.Analysts had expected Indonesian Trade Balance to rise to 0.41B last month."
30,By Investing.com,"<span>Jul 01, 2014 12:10AM ET</span>",Indonesian CPI 6.70% vs. 6.76% forecast,"Investing.com - Consumer price inflation in Indonesia fell more-than-expected last month, industry data showed on Tuesday.In a report, Statistics Indonesia said that Indonesian Inflation fell to a seasonally adjusted 6.70%, from 7.32% in the preceding month.Analysts had expected Indonesian Inflation to fall to 6.76% last month."
31,By Investing.com,"<span>Jun 30, 2014 09:35PM ET</span>",Japan’s Average Cash Earnings 0.8% vs. 0.8% forecast,"Investing.com - Japan’s average cash earnings rose in the last quarter, official data showed on Tuesday.In a report, Japanese Ministry of Health, Labour and Welfare said that Japan’s Average Cash Earnings rose to a seasonally adjusted 0.8%, from 0.7% in the preceding quarter whose figure was revised down from 0.9%.Analysts had expected Japan’s Average Cash Earnings to fall to 0.8% in the last quarter."
32,By Investing.com,"<span>Jun 30, 2014 09:05PM ET</span>",China manufacturing PMI 51.0 vs. 51.0 forecast,"Investing.com - Manufacturing activity in China rose last month, official data showed on Tuesday.In a report, China Logistics Information Center said that Chinese Manufacturing PMI rose to an annual rate of 51.0, from 50.8 in the preceding month.Analysts had expected Chinese Manufacturing PMI to rise to 51.0 last month."
