,title,date,content
46,Commerce secretary on boosting U.S. semiconductor production: ‘We’re going to get it done’,2021-05-25T23:27:19+0000,"['Commerce Secretary Gina Raimondo on Tuesday expressed confidence around the Biden administration’s efforts to increase semiconductor manufacturing in the U.S.', 'In an interview on CNBC’s “Mad Money,” Raimondo said the global chip shortage that’s rattled a range of industries demonstrates the need for America to boost domestic production capacity and once again become a leader. Asian countries, particularly Taiwan, have come to dominate the industry.', '“We are going to get it done. There’s no option,” Raimondo told host Jim Cramer. “When the semiconductor supply chain is disrupted, the economy is disrupted.”', '“They’re in your dishwasher, your car, your computer, your headset, your phone, military equipment. So, yes, we’re going to get it done,” she added, describing it as both an economic and national security imperative.', 'Senate Majority Leader Chuck Schumer, D-N.Y, has put together the United States Innovation and Competition Act of 2021 that would allocate $52 billion to support semiconductor manufacturing in the country, among other provisions.', 'While Democrats and Republicans are still hashing out disagreements over certain components of the bill, there is bipartisan support for tackling the set of issues it covers.', 'Raimondo said she hopes it passes the upper chamber “in the coming days,” offering an optimistic timeline similar to Schumer. “This cannot wait,” said Raimondo, who served as governor of Rhode Island before leading the Commerce Department.', '“This requires emergency appropriation ... and I believe that there is the will in the Congress to make that happen,” she added.', 'Raimondo also weighed in on the potential infrastructure proposal a group of Senate Republicans plan to offer as a counter to President Joe Biden’s plan. Raimondo has taken part in some of the negotiations in Washington.', '“I don’t know what’s in the offer. We have to see if it’s real, but the very fact that we’re still talking and they’re coming back with, potentially, a $1 trillion deal is progress for sure,” she said.']"
47,"Shortage of semiconductors, dubbed the ‘new oil,’ could dent GDP growth, boost inflation",2021-04-22T20:55:41+0000,"['Economic growth could slow and inflation is likely to see at least a momentary bump higher as the semiconductor shortage worsens, economists say.', 'A variety of factors have converged to make the coveted computer chips scarce. Soaring demand coupled with supply bottlenecks have led to a situation in which orders for everything from cars to televisions to touch-screen computers and more are on backup for six months or more.', 'With semis at the core of so much U.S. economic activity, the ongoing supply problems are likely to have ripples.', 'Goldman Sachs economists say that for the bulk of 2021, the shortage will translate into an inflationary tax that could result in prices rising as much as 3% for affected goods. That would boost inflation as much as 0.4 percentage points through the rest of the year, the firm said.', '“Taken together, while we see relatively modest implications of the semiconductor shortage for GDP growth and the industrial sector, it represents another reason to expect core goods inflation to remain firm this year,” Goldman economist Spencer Hill said in a note.', 'Even though the hit won’t cause a dramatic slowdown to an economy expected to roar in 2021, the impact could still be noticeable. Goldman said the impact could reach as high as a 1% subtraction from activity, but likely will be closer to 0.5%.', '“While semiconductors account for only 0.3% of US output, they are an important production input to 12% of GDP,” Hill said, nothing that the shortage could cut auto production by 2% to 6% this year.', 'Indeed, multiple automakers have curtailed production due to lack of chips vital to their vehicles.', 'Stellantis NV said it will be temporarily laying off workers at its Detroit Jeep plant, while Volvo also has said the chip issues will cause it to shut some plants until the situation is resolved.', 'The knock-on impacts of any disruptions in the semiconductor industry are becoming increasingly apparent.', '“As the world becomes more interconnected, more automated and greener, each unit of GDP growth will contain a higher content of semiconductors. Integrated circuits are becoming the key commodity input for economic activity,” wrote TS Lombard economist Rory Green.', 'Green calls semis the “new oil” for the global impact that disruptions can cause.', '“The current severe shortage of semiconductors, which is halting automotive production worldwide, underscores the speed and scale of the changes under way,” he said. “Chips have always been an important part for manufacturing and consumer electronics, but their use will broaden to transport and digital services.”', 'Still, Goldman’s Hill said the inflationary impact likely won’t last far as supply increases later this year and into 2022. But the shortage now “represents another reason to expect core goods inflation to remain firm this year,” he said.']"
48,"Indie Semiconductor is profiting from auto chip shortage, CEO says",2021-04-01T00:55:37+0000,"['The global chip shortage that’s been a headache for auto manufacturers has actually been a boon for Indie Semiconductor, CEO Donald McClymont told CNBC Wednesday.', '“Whereas others are struggling, we’ve actually really profited,” he said in a “Mad Money” interview.', 'McClymont’s comments came after Ford Motor announced earlier in the day it would cut back on car production at multiple North American plants as the industry grapples with a global chip shortage. Demand for semiconductors has spiked during the Covid-19 pandemic as consumers buy more electronics for their homes. Semiconductors are used in a range of consumer products, including phones, computers and increasingly electrified automobiles.', 'Indie Semiconductor, which is based in Aliso Viejo, California, makes next-generation chips and software for the automobile industry. It supplies chips for applications including advanced driver-assistance and autonomous systems, connected driving, user experience and vehicle electrification.', 'But while companies like have Ford struggled, Indie Semiconductor reports having a $2 billion backlog for orders.', '“We developed our supply chain kind of in our own image. We’re wholly focused on the automotive market,” McClymont said. “We picked suppliers who are also much the same and to that end, they make the right decisions for the auto market.”', 'The private company is expected to turn into a public one within weeks after its blank-check merger with Thunder Bridge Acquisition II closes. Shares of the SPAC, or special purpose acquisition company, rose 3.37% to $10.42 per share on Wednesday.', 'The merger, which was announced in December, values Indie Semiconductor at about $1.4 billion. Indie Semiconductor wants to grow its reach in a $16 billion market for auto semiconductors, the company said citing IHS figures.']"
49,"BMO upgrades Micron to outperform, says semiconductor stock can rise more than 30%",2021-06-30T11:53:46+0000,"['BMO Capital Markets upgraded shares of semiconductor maker Micron Technology on Wednesday, saying the continuing chip shortage should have a positive effect on pricing.']"
50,"Semiconductor stocks surge even during chipmaker shortage, but the charts hold a warning",2021-03-29T11:09:22+0000,"['A global chip shortage is roiling the auto industry.', 'Ford announced plans last week to temporarily idle production of its F-150 at a Michigan plant, and Chinese EV start-up Nio announced a five-day shutdown of a factory. These automakers joined a growing list of companies halting production, including GM and Jeep automaker Stellantis.', 'The semiconductor stocks are rallying undeterred, though. The SMH semiconductor ETF has gained nearly 11% this year, almost double the gains on the broader S&P 500.', 'Craig Johnson, chief market technician at Piper Sandler, says the coast is not clear for semiconductors.', '“We’ve violated the uptrend support line coming off of those March lows, and now you’re starting to see some sort of sideways price action, possibly a little head-and-shoulders top in the making here in the charts,” Johnson told CNBC’s “Trading Nation” on Friday.', 'A head-and-shoulders pattern – formed by a high, a higher high and a lower high – suggests a failed attempt to break out and indicates possible downside ahead.  ', 'Johnson recommends caution when it came to buying the group.', '“Semiconductors have done very well, but I’m in this cautionary phase with these names given some of these things that I’m starting to see play out in the charts,” said Johnson.  ', 'Danielle Shay, director of operation of Simpler Trading, is more bullish on the semis space and says pullbacks could be a buying opportunity.', '“We’ve seen so much volatility when it comes to the semiconductors. Think back to the trade war. Every time that ramped up, we had huge volatility in the semiconductors, but we’re significantly higher than we were at that point. I think that this chip shortage is just going to be a little blip, and I think it’s a great buying opportunity particularly for Taiwan Semiconductor,” Shay said during the same interview.', 'Taiwan Semiconductor has pulled back sharply recently, down 18% from a February peak. The SMH ETF, by comparison, is down 6% from its own February peak.', 'Disclosure: Simpler Trading holds TSM.', 'Disclaimer']"
51,"The boom in autonomous driving will lift these semiconductor names, says Goldman Sachs",2021-04-20T15:32:11+0000,"['Electric vehicle manufacturers aren’t the only beneficiaries from the boom in autonomous vehicles. ', 'Semiconductor companies – the firms behind the technology used for these safety features – may also outperform, according to Goldman Sachs.']"
52,CEO of largest U.S. chip foundry explains why semiconductor shortage could last through 2022,2021-04-02T12:34:08+0000,"['GlobalFoundries, the third-largest foundry, is planning to invest $1.4 billion in its chip factories this year, and will likely double that investment next year, CEO Tom Caulfield told CNBC in an interview.', 'Caufield said the company’s manufacturing capacity is completely booked and that industrywide semiconductor supply could lag behind demand until 2022 or later.', '“Right now all our fabs are not only more than 100% utilized, we are adding capacity as fast as we can,” Caulfield said.', 'A shortage of semiconductor microchips is causing havoc around the world, delaying car production and affecting the operations of some of the largest consumer electronics manufacturers.', 'The shortage has highlighted the role of a handful of foundries, which are the factories contracted by semiconductor firms to build chips. Many, like GlobalFoundries, are investing billions in new production lines and upgraded equipment to keep up with the surge in demand and shortfalls in supply.', 'GlobalFoundries is the largest U.S.-headquartered “pure” foundry, with factories in the U.S., Germany and Singapore. It manufactures semiconductors designed by companies like AMD, Qualcomm and Broadcom. It’s currently a private company owned by the government of Abu Dhabi. The company is considering an IPO in the first half of 2022 or sooner, Caulfield said.', 'GlobalFoundries is still a relatively small player, with only a 7% share of the foundry market according to Trendforce. Other foundries are investing big dollars too.', 'Taiwan-based TSMC, the biggest company in the space with a 54% market share, said on Thursday it plans to invest $100 billion over the next three years to increase its capacity to meet demand.', 'Intel, which designs and manufactures its chips, announced on March 23 it plans to become a foundry and manufacture chips for other companies. It’s investing $20 billion U.S. chipmaking plants.', 'Caulfield said he welcomes Intel’s shift and doesn’t see the company as a new competitor. One key difference is Intel is skilled at “bleeding edge” manufacturing or making chips with the smallest and most dense transistors, which are required for powerful CPU chips at the heart of a computer or smartphone.', 'But Caulfield says the industry shortages, specifically for the automotive world, aren’t because of demand for leading node chips. The shortages are for other parts cars need, like radar chips, which don’t necessarily require the most advanced manufacturing available at the time.', '“The auto industry is not having a chip shortage because it doesn’t have CPUs. No one’s saying I can’t build enough computers, it’s all the other chips,” Caulfield said.', 'Chips that are designed to enable specific features are what GlobalFoundries specializes in.', 'GlobalFoundries manufactures secure chips for contactless payments, battery power management and touch display drivers. These chips first were used in large quantities for smartphones, but are now included in a wide range of products from cars to appliances, which has created a surge in demand.', 'However, most of the investments in the foundry world have been for building bleeding-edge, high-speed chips. That all changed last year when the pandemic hit, and sales of electronics including laptops, monitors, and game consoles rose when people bought equipment to work or go to school from home.', 'Those products require a lot of additional chips beyond the CPU, seeding the start of the chip shortage and highlighting the need for more capacity to build what Caulfield calls “feature-rich” chips. Smartphones and computers also increasingly need non-leading node chips to connect to 5G networks or add additional cameras.', 'GlobalFoundries warned it will take months before it can increase the number of chips on the market, but that the capacity boost makes sense for long-term investments. “The minute you say, I want to make more capacity, it’s a 12-month cycle,” Caulfield said.', '“The semi industry going into Covid was projecting a 5% annual growth rate for five years. We’re projecting that to almost double now,” Caulfield said. “It’s not a one-time thing. It’s a structural shift, that the pervasive need for semiconductors is accelerating.”']"
53,ON Semiconductor CEO expects auto chip backlog to end by third quarter,2021-02-23T00:00:04+0000,"['ON Semiconductor, a chipmaker scrambling to meet the high demand for automotive components, expects to relieve a bottleneck in auto chip production by the second half of the year at the latest.', 'In an interview Monday with CNBC’s Jim Cramer, CEO Hassane El-Khoury said the company is experiencing a rush in orders for its products amid an industrywide shortage in chips.', 'The shortage, which began when demand for electronic products such as computers surged during the pandemic, has forced carmakers including General Motors and Ford to cut back on manufacturing some vehicles.', '“The orders came on so strong that we’re not able to keep up, but we do have the capacity,” El-Khoury said in an appearance on “Mad Money.” “For our chips, we are able to support the capacity. We started the new demand, and we’re going to be through this in one or two quarters.”', 'Serving multiple end markets, ON Semiconductor began warning customers about tight inventories in the later parts of the summer as homebound consumers loaded up on electronics. Many businesses at the time remained uncertain about the future due to economic fallout from coronavirus lockdowns as executives cut back on or refrained from placing orders for components.', 'The latest cars, increasingly equipped with connected technologies and other capabilities, need numerous tiny chips for functions such as power management, power steering and infotainment systems.', 'The auto market is the biggest driver of all ON Semiconductor end markets, El-Khoury said.', '“Driven primarily by the automotive industry, we’re very well positioned,” he said. “We’re not just going to grow at market. We’re going to grow above market, same with industrial, same really across the strength in every single one of our end markets, which is a great place to be.”', 'Among the five segments ON Semiconductor serves, automotive makes up nearly a third of revenues. The company is also a supplier to industrial and military, communications, computing and consumer markets.', 'After total revenues declined about 8% in the first half of 2020 at the onset of coronavirus lockdowns, the computing segment was the first to rebound in the second quarter. Automotive revenue would not increase until the fourth quarter, when the figure grew 6% from the year prior.', 'For the full year, ON Semiconductor revenues declined 4.8% to about $5.26 billion. Revenues fell 6% to roughly $5.52 billion in 2019.', 'Citing order trends and backlog, ON Semiconductor projects revenue in the range of $1.41 billion to $1.51 billion in the current quarter. If it meets the short end of guidance, business would grow at least 10% from what it reported in the first quarter last year.', 'ON Semiconductor shares sold off more than 3% on Monday, exceeding declines in the overall market. Despite a negative start to the week, the stock is up more than 23% to $40.44.']"
54,"Biden’s infrastructure plan will bolster the U.S. semiconductor industry, Commerce Secretary says",2021-04-01T00:06:12+0000,"['The White House’s infrastructure plan will put the U.S. on more equal footing with China as it bolsters the American semiconductor industry, Commerce Secretary Gina Raimondo said Wednesday.', '“This is about out-competing China,” Raimondo told CNBC’s Jim Cramer in a “Mad Money” interview. “If we act now … we will compete with China. There is time to do that, to rebuild, to build in semiconductors in particular, but we have to get to the business of doing it.”', 'The comments came moments after President Joe Biden unveiled a $2 trillion package primarily tailored to bridges, roads and other transportation initiatives. The proposal also calls for a $50 billion investment in semiconductor manufacturing and research.', 'A global chip shortage, heightened by high demand for computers and other technological products during the coronavirus pandemic, has pressured American manufacturers. For instance, Ford announced Wednesday it will reduce car production at multiple North American plants due to the low supply for semiconductors.', 'Raimondo, who left the Rhode Island governor’s house to join the Biden administration, said semiconductors are the “building blocks of a future economy and a digital economy.” With investments in semiconductor manufacturing, it will pave a way for basic research, more jobs in foundries, job training and advanced manufacturing, she said.', '“I am hopeful that when the business community, large and small, has an opportunity to look into this package, they’ll see this is about competing and winning now and into the future, and that’s good for business and good for workers,” she said.', 'The Biden administration is aiming to get an infrastructure bill passed by this summer. Named “The American Jobs Plan,” it includes spending to combat climate change, improve drinking-water infrastructure, expand broadband access and lay the groundwork for electric vehicle capabilities.', 'The package could face some hurdles in Congress, despite Democrats’ power advantage. Democrats hold a slight majority in the House and a 50-50 tiebreaker in the Senate. However, Republicans are gearing up to object over the package’s size and the White House’s plan to pay for it.']"
55,China’s most important chipmaker SMIC could be a big winner from the global semiconductor shortage,2021-03-02T02:58:28+0000,"['GUANGZHOU, China — Chinese chipmaker SMIC could be a beneficiary of the global chip shortage, according to one analyst, giving the firm a respite from some of the negative effects of U.S. sanctions.', 'The chip shortage started as demand surged for consumer electronics as countries locked down to fight the coronavirus pandemic. That demand for products requiring advanced semiconductors has led to shortages in other industries like automobiles.', 'Chips are made by companies known as foundries which do the actual manufacturing. The two leading ones are Taiwan’s TSMC as well as South Korean technology giant Samsung. That means there are very few companies able to make leading edge semiconductors.', 'But not all products, in particular in the auto industry, require the most cutting-edge chips. In fact, they need a lot of semiconductors built on older technology which is where China’s SMIC could step in.', 'SMIC is China’s largest contract semiconductor manufacturer. It makes chips that other companies design.', 'But its technology is far behind the likes of TSMC and Samsung and it is not able to manufacture the most cutting-edge components.', 'SMIC is China’s best bet at creating a rival to TSMC and Samsung and is key part of the country’s ambitions to boost its domestic industry and bring some self-reliance in semiconductors.', 'In December, the U.S. government added SMIC to an export blacklist called the Entity List. That restricts American firms for exporting technology to SMIC, a move which could hurt the Chinese firm’s ability to manufacture the most advanced chips.', 'The semiconductor supply chain and manufacturing process is complex. While TSMC, Samsung and SMIC manufacture chips, they rely on software and machinery from U.S. and European firms to do so. If SMIC can’t access those tools, it becomes incredibly hard for it to catch up to rivals.', 'For now, SMIC is able to produce semiconductors based on older technology. And that could work to its advantage because cars and other products don’t require cutting-edge chips at the moment.', '“Autos are not demanding a lot of leading edge chips. A lot are still on peripheral chips ... built on legacy nodes,” Sze Ho Ng, analyst at China Renaissance said.', 'These include chips used for power management to regulate the battery use of a device, for example.', 'Node refers to a semiconductor manufacturing process. The most advanced is called a 5 nanometer process. But SMIC cannot produce these kinds of chips. Instead, the company is looking at 28 nanometers and above, which are much older technologies, but are good enough for many industries beyond consumer electronics.', 'Ng said that SMIC has also been raising prices for its customers which should benefit the firm. Last month, SMIC said its revenue target for 2021 is “mid-to-high single digit percentage growth.” Ng said he sees “upside” to that.', 'The analyst has a “buy” rating and a 43 Hong Kong dollar price target on shares of SMIC listed in the city. If realized, that would be a 60% rise from Monday close of 26.75 Hong Kong dollars.']"
56,How Covid-19 caused a global shortage of semiconductors and computer chips,2021-03-02T13:00:01+0000,"['It’s not an overstatement to say that semiconductors power the modern world.', 'They’re not only a key component of nearly every electronic device we buy and use, they also power the factories that make the electronic devices we buy and use. And now, there aren’t enough of them being made.', 'To find a long-term fix, President Joe Biden just ordered economic and national security experts to look for gaps in the semiconductor supply chain in the United States. They want to see how reliant the U.S. has become on other countries to manufacture semiconductors. ', 'In the short-term, however, semiconductor company CEOs and analysts say the chip shortage will persist well into 2021. Here’s how the global semiconductor chip shortage got so bad and what’s being done to fix it.', '']"
