,title,date,content
69,China wants its semiconductor industry to catch up with the U.S. — but that won’t be easy,2020-09-14T02:00:58+0000,"['GUANGZHOU, China — China has been trying to ramp up its domestic semiconductor industry as the U.S. increases pressure on the country’s technology giants.  ', 'But Beijing will face significant challenges strengthening its homegrown chip sector, analysts told CNBC. ', 'Semiconductors are extremely important components of consumer electronics. As an increasing number of devices become “smart” and connected to the internet, they will become more and more crucial in new areas, such as automobiles. That’s why China wants to be a powerful player.', 'However, China is also facing a situation where its companies’ access to important chip components, as well as its domestic chipmakers’ ability to procure technology to make those semiconductors, might be hampered.', '“So without semiconductors, China cannot be a very meaningful technological power, and its own technology companies including a major company like Huawei may not necessarily be able to maintain operation if China does not have substantial capability to actually maintain and manufacture semiconductors,” Dan Wang, technology analyst at Gavekal Dragonomics, a Beijing-based research firm, told CNBC’s “Beyond the Valley” podcast.', 'The trade war has exposed China’s reliance on foreign chips, the United States’ central role to the supply chain, and ultimately how complicated that supply chain is.', 'Earlier this year, Washington amended a rule which requires foreign manufacturers using U.S. chipmaking equipment to get a license before selling semiconductors to Huawei. There is no indication that the U.S. will grant those licenses, either. ', 'While Huawei, currently the world’s largest smartphone maker, designs its own chips via a subsidiary called HiSilicon, those components are actually manufactured by Taiwanese firm TSMC. In the process, TSMC uses chipmaking gear that is made by American firms. So Huawei will be cut off from TSMC’s chips after September 15 and has very few options globally to procure more, because of U.S. sanctions. ', 'The U.S. government is also considering whether to add Semiconductor Manufacturing International Corp (SMIC), China’s biggest contract chipmaker, to a blacklist known as the Entity List. That would restrict American firms exporting technology to the company. In effect, SMIC may not be able to get access to the gear it needs to make more advanced chips. Its technology is already several years behind TSMC and South Korea’s Samsung Electronics. ', 'The semiconductor industry has an extraordinarily complicated supply chain. It’s not just about companies that manufacture the chips —there are also design companies involved, as well as firms that make tools that enable manufacturing in the first place.', 'Taiwan through TSMC and South Korea via Samsung are at the leading edge of manufacturing. When it comes to the tools for design, the United States dominates. Meanwhile, Dutch firm ASML makes a machine that uses so-called extreme ultraviolet (EUV) and is required to make the most advanced chips such as those manufactured by TSMC and Samsung. Reuters reported earlier this year that the U.S. pressured the Netherlands government to stop the sale of an ASML machine to SMIC. That shipment has not made it to China.', 'Last month, ASML told CNBC it was waiting for an export license from the Dutch government in order to ship its machinery to China.', 'The problem for China is its reliance on the foreign gear that is actually required to the do the end-to-end production of chips. ', 'With the United States increasing pressure on China’s technology sector, bringing its domestic chip industry on par with the U.S. will be a tough task for China. ', '“Without these tools, China is very far behind. And even when it had mostly unfettered access to the leading tools and materials on the market, China hasn’t really been able to catch up,” Wang said', '“If the U.S. knocks out a lot of the ability of Chinese firms to actually have leading tools, then they’re going to fall even further behind because they will need the rest of the industry to catch up before they can make very substantial progress again.”', 'It’s not all doom and gloom for China’s semiconductor sector. Over the long term, the country could catch the U.S. in chip manufacturing. ', 'One factor potentially in China’s favor is that it has a very big market, in terms of both a large population and a vast number of devices.', '“China is a huge market … so serving China alone, that provides lots of opportunities for the domestic vendors given the fact that lots of the supplies right now are still coming from overseas,” Sze Ho Ng, analyst at investment bank China Renaissance, told CNBC.', 'Also, the number of products with chips in them will certainly increase. Wang cited the so-called “internet of things,” or devices such as traffic lights connected to the internet in ways that will make them better coordinated to control cities’ automobile traffic. The chips in those don’t necessarily need to be the most advanced chips, and that could become an area where Chinese firms dominate. ', '“A lot of these things do not need to be leading edge, iPhone-level processors in, say, a traffic light,” Wang said. “A lot of trailing edge technology is good enough, and this is where Chinese firms are.” ']"
70,Semiconductors and value stocks: Traders pick top trends for 2021,2021-01-05T17:56:47+0000,"['As markets struggle at the start of 2021, two traders share the top trends that they’re banking on for the new year.', 'Todd Gordon, founder of TradingAnalysis.com, sees continued outperformance for one corner of the technology sector.', '“If I was to select one group [or] industry within a sector, it is semiconductors,” Gordon told CNBC’s “Trading Nation” on Monday. “It’s fairly insulated from Covid’s impact on the economy as the semiconductor evolution was in play before Covid hit and I think whether the pandemic rages on next year or if it’s managed in 2021, they should do well.”', 'Gordon points to semiconductor use in gaming, mobile phones, PC, crypto mining and data centers as reasons to be bullish – those trends accelerated during the pandemic due to increased remote work and online entertainment.', 'He specifically points to Nvidia and AMD as two picks that could benefit from the digital acceleration. Gordon said AMD needs to break through consolidation at around $98 to continue to rally – should it do that, he sees upside to $140. It traded Tuesday just below $92.', 'Nvidia, too, needs to rally through its holding pattern, according to Gordon.', '“It’s taken a bit of a backseat in the second half of last year, big old triangle consolidation. If we can break through $580, the party gets started there,” he said.', 'Nvidia traded Tuesday at $529. It has rallied 192% off its March low.', 'It’s not just the high-flying tech stocks that have caught traders’ attention. Boris Schlossberg, managing director of FX strategy at BK Asset Management, sees a return to value in the next 12 months.', '“This may be the year where value finally becomes valuable,” Schlossberg said during the same segment. “For the last couple of years, the absolute easiest money has been to go long Nasdaq, short Russell 2000 and Nasdaq has outperformed by a mile because basically we’ve been in a winner-take-all economy where the largest high-tech companies have been able to essentially enjoy monopoly profits.”', 'Now, he predicts Big Tech undergoing harsher regulatory scrutiny under a Biden administration which could put a crimp on their outperformance.', '“More importantly, it’s valuation. It’s really never different anytime. And I think when you look at valuation basically at any kind of historical precedent especially the ’99 run-up …  anytime you are enjoying triple digit P/E, it always ends,” said Schlossberg.', 'Cost-cutting during the pandemic should also give the Russell 2000 companies that have survived greater operational leverage.', '“They’re going to outperform on that basis. So when you look at it from every possible angle, I think this may be the year where value finally does come back,” Schlossberg said.', 'The small cap-focused IWM Russell 2000 ETF has rallied 25% in the past three months.', 'Disclosure: Gordon holds AMD and NVDA.', 'Disclaimer']"
71,"These 12 manufacturers can help investors capitalize on the U.S. ‘industrial renaissance,’ Cramer says",2022-04-21T22:20:11+0000,"['CNBC’s Jim Cramer on Thursday named 12 American manufacturers investors should keep an eye on to take advantage of what he calls the country’s “industrial renaissance.”', '“The United States has been reclaiming its industrial preeminence in sector after sector after sector. It just was obscured by Wall Street’s now-defunct love affair with high-growth tech stocks. Now that we’ve fallen out of love with tech, the industrial renaissance has become the key to picking winners in this market,” the “Mad Money” host said.', '“If you want leadership, if you want companies that make things and sell them at a profit while returning capital to shareholders, look no further than our great American manufacturers. Their stocks are fantastic places to be,” he added.', 'Cramer’s comments come after a tumultuous day in the market — the Dow Jones Industrial Average slid 1.05% on Thursday, while the S&P 500 dropped 1.48%. The tech-heavy Nasdaq Composite tumbled 2.07%.', 'Here is Cramer’s list of American manufacturers investors should have on their radar:', 'Cramer acquiesced that the semiconductor sector in the U.S could be better.', '“I don’t want to slight software, the crown jewel of American economy, but tech companies … they don’t make it here, with the exception of some semiconductor capital equipment plays like Lam Research,” he said. “Otherwise, it’s best to go to Taiwan Semi, where the actual chips are made.”', 'Disclosure: Cramer’s Charitable Trust owns shares of Chevron and Procter & Gamble.', 'Sign up now for the CNBC Investing Club to follow Jim Cramer’s every move in the market.', 'Disclaimer']"
72,"Semiconductor equipment stocks could have a lot more upside, Jim Cramer says",2020-11-18T00:06:02+0000,"['CNBC’s Jim Cramer on Tuesday presented three potential buying opportunities connected to the chipmaking industry.', 'After reviewing chart analysis from a trusted technician, the “Mad Money” host is recommending investors keep an eye on two semiconductor equipment makers in particular.', '“The charts, as interpreted by Bob Lang, suggest that the semiconductor capital equipment names could give you a lot more upside, even though they already have, especially Lam and Applied Materials,” the “Mad Money” host said.', 'Lam Research, KLA Corp and Applied Materials have all surged higher in recent weeks, boosted by strong quarterly reports and demand for products. Wall Street is betting that chipmakers will spend heavily on production capacity next year and that their exposure to China will serve well under a Biden administration, after a tense trade war between the world’s largest economies, Cramer said.', 'The question is if the stocks will be able to maintain the momentum. Lang, a technician who founded ExplosiveOptions.net and contributes to TheStreet.com, sees scenarios where it is likely.', '“This is one of those bull markets that works, regardless of how long it takes for us to roll out a Covid vaccine,” Cramer said. “If he’s right [that] this is the beginning of a new cycle ... then this move, as implausible as it may be, could just be getting started.”', 'Lam has grown 18% in the past month. Lang, Cramer said, highlighted that the stock has traded in a bullish pattern, producing higher highs and lower lows on high volume. Since falling in late October to its 50-day moving average, a key trading indicator used by analysts, the stock has surged nearly 100 points, a positive sign for Cramer.', 'Lang sees the stock going through an ephemeral pullback, potentially down to 400, about 7% from its current levels.', '“After that pit stop, he’s thinking it’s smooth sailing to $500. That is some serious upside,” Cramer said. “If he’s right, you have to be prepared to buy the dip, and I think that business is going to be very good.”', 'As for Applied Materials and KLA, their stocks are up 18% and 16%, respectively, in the past month. Applied Materials has been trading higher on strong volume, a sign of conviction, and broke through its August highs, creating a new floor of support, Cramer noted.', '“As Lang sees it, this is a $74 stock that could be headed to $100 a share,” he said.', 'Disclaimer']"
73,"‘Semiconductors and software are really the future of cars,’ Analog Devices CEO says",2020-08-20T00:09:36+0000,"['Technology is shaping the future of the automotive industry and it’s creating a big opportunity in the semiconductor space, Vincent Roche, chief executive of chipmaker Analog Devices, told CNBC Wednesday.', '“Semiconductors and software are really the future of cars. That’s the way to think about it,” he said in a “Mad Money” interview with Jim Cramer, who said he believes the auto industry will be the “next leg” of the market.', '“All of the intelligence — the whole bedrock of what’s in the car in terms of the user experience, the intelligence, the driving experience – that is all being, if you like, enabled by semiconductors and software these days, so that content is increasing year by year,” Roche explained.', 'Carmakers have spent recent years investing in new forms of mobility, including electric, connected and self-driving vehicles. The shift in focus is being driven in part by consumer desires for more environmentally friendly products.', 'One area where Analog Device sees opportunity is in new automotive technologies like audio connectivity and infotainment. The company in January announced a deal with Hyundai Motor to supply the automaker with all-digital road noise cancellation systems. Since then, Analog has added five new customers, executives said on its earnings call Wednesday. The audio technology reduces car weight by about 100 pounds and energy use by roughly 3%, the company said.', '“We play at the interface between the physical world and digital world. There are more and more sensors being used,” Roche said. “We see it as a great opportunity for ADI, and a great intersection between the technologies we have and the needs of the car companies.”', 'Analog Devices on Wednesday reported better-than-expected results from its fiscal 2020 third quarter, though revenue slipped by 1.6% year over year. The company posted revenue of $1.46 billion, compared to a $1.44 estimate, and adjusted earnings per share of $1.36.', 'Autos was one of the weaker parts of the company’s quarter as revenue plunged 29% from a year ago, due to factory closures during the coronavirus pandemic. Analog, however, reported seeing a pick up in the segment as factories went back online.', 'Analog, which also has battery management devices powering the electric vehicle market, is also in good position to benefit from the growing interest in EVs, according to Roche.', '“I think we have a long way to go,” he said. “We’re in the very early innings of the electric car, but my sense is over the next 10 years, perhaps 20% of vehicles will be electric up from kind of 1% or 2% today.”', 'Analog Devices shares ticked up 0.23% Wednesday to close at $118.15 per share. The stock is off 0.58% this year.']"
74,"Stocks making the biggest moves in the premarket: Xilinx, NXP Semiconductors, Apple, Disney & more",2020-10-09T11:42:49+0000,"['Take a look at some of the biggest movers in the premarket:', 'Xilinx (XLNX) – Advanced Micro Devices (AMD) is in advanced talks to buy the specialty chipmaker, according to The Wall Street Journal. People familiar with the matter say such a deal could be worth more than $30 billion, with a transaction possibly coming together as early as next week.', 'NXP Semiconductors (NXPI) – NXP raised its outlook for the just-ended quarter, saying it had seen “material” improvement in demand across all its markets with particular strength in the automotive and mobile segments.', 'Apple (AAPL) – Apple will extend some free one-year trial subscriptions to its Apple TV+ service through February. It had issued those free trials with the purchase of Apple products when it launched the service a year ago.', 'Walt Disney (DIS) – Disney will release the Pixar movie “Soul” directly to its Disney+ TV service on Christmas Day, deciding to forego both movie theaters and the previously planned November 20th release date.', 'Gilead Sciences (GILD) –  Gilead released final data from a study of its remdesivir anti-viral treatment, which showed that the drug cut recovery time by five days compared to patients who received a placebo.', 'General Electric (GE) – Goldman Sachs resumed coverage of GE with a “buy” rating and a 12-month price target of $10 per share. Goldman said CEO Larry Culp has moved to make GE a “leaner, structurally more productive” company during his two years on the job.', 'HCA Healthcare (HCA) –  HCA will return about $6 billion in government aid it had received as part of coronavirus relief funding. The hospital operator said the initial emergency had passed and that available cash from operations would be sufficient to repay the money. HCA also issued better-than-expected third-quarter revenue guidance.', 'AT&T (T) – AT&T is planning thousands of job cuts in its WarnerMedia unit as it seeks to cut costs by up to 20 percent, according to The Wall Street Journal. WarnerMedia did not confirm those numbers, but the operator of HBO, TBS and other TV channels did issue a statement saying it was implementing a restructuring in response to the impact of the Covid-19 pandemic.', 'Exelon (EXC) – Exelon was noted as a “favorite idea” by Corvex Management’s Keith Meister, who said the utility company is cheap and well-positioned and that the stock could rise by 30%. Meister said he had added Exelon to his portfolio during the second quarter.', 'Zoom Video (ZM) – Mizuho began coverage of Zoom with a “buy” rating, saying it had the “best-of-breed” video conferencing tools and that it believes Zoom can continue to deliver “outsized revenue growth.” Mizuho also believes that Zoom’s Oct. 14 Analyst Day will serve as a catalyst for the stock.', 'Sunrun (RUN) – Tiger Global Management reports a 12% passive stake in the solar installation company as of October 8, according to a Securities and Exchange Commission filing. The news comes a day after Sunrun completed its acquisition of rival installer Vivint Solar.', 'Aurora Cannabis (ACB), Tilray (TLRY), Hexo Corp. (HEXO) – Stocks of cannabis producers are rising once again, after vice presidential nominee Sen. Kamala Harris vowed during the Wednesday debate with Vice President Mike Pence that a Joe Biden administration would decriminalize marijuana at the federal level.']"
75,Cramer’s lightning round: On Semiconductor ‘finally got its mojo’,2020-12-22T00:42:13+0000,"['Chimera Investment: “CIM is not a stock that I’ve been recommending. It’s got that big yield but that doesn’t necessarily, obviously, protect you. I would like you to be in something much more aggressive. ... You’re 17. ... If you bought a Snowflake, I would think it’s much better ... [or] buy a much more super-charged Airbnb, too.”', 'Zscaler: “I genuinely believe that if that hack that happened, if it had been up against Zscaler and Okta, then the Russians would have met their match.”', 'On Semiconductor: “That’s a great company, and I think you’re in good hands with On Semiconductor. It’s finally got its mojo.”', 'Co-Diagnostics: “I like the diagnostics, but remember, I always default when I do diagnostics to Thermo Fisher.”', 'U.S. Steel: “You want to own Nucor.”', 'Disclaimer']"
76,"Earnings: Semiconductors and telemedicine killing it, buying online exploding",2020-07-30T16:09:42+0000,"['Earnings reports are coming in fast and furiously, and with a large percentage of companies declining to provide guidance, reporters and analysts are combing through corporate press releases and earnings calls for signs of how business is doing. ', 'Equipment maker Lam Research highlighted the explosion in work-from-home, e-learning, telehealth, online gaming, and streaming that is driving demand for semiconductors. CEO Timothy Archer: “While COVID-19 has created volatility for the semiconductor industry, in a larger sense, it has underscored the rapidly growing reliance of individuals and businesses on semiconductors and the products and technologies they enable. ”', 'Teladoc Health CEO Jason Gorevic says they are raising guidance: “We provided approximately 2.8 million visits in the second quarter, representing growth of over 200% compared to the second quarter of 2019.”', 'Paypal CEO Daniel H. Schulman said this was the strongest quarter the company has had since going public: “I think it’s clear that we’ve tipped into a digital-first economy.”', 'Fortune Brands Home & Security CEO: “Our home products market was clearly stronger than many other industries. The very nature of the pandemic and the shelter-at-home orders have led to a resurgence of interest in housing.”', 'Same with At Home, where comparable store sales were up 42%. CEO Lewis Bird: ”[C]onsumers are spending more time at home, they’re also spending more money on decorating their homes, creating a home workspace and organizing their kitchens. As a home decor category killer, we are in the sweet spot.” ', 'But Dine Brands (Applebee’s, IHOP), said sales were slowly improving. CEO Stephen Joyce: ”[B]oth Applebee’s and IHOP posted steady improvement in weekly comp sales and traffic during the quarter. Our off-premise business continued to deliver substantial growth as guests became more familiar with the to-go service.”', 'If you want a good example of the bad-but-getting better story, look at Anheuser Bush Inbev. April volumes were down 32%, May down 21%, June up 0.7%. That’s what the Street wants to hear. The second quarter was likely the bottom, and it may be uneven but it’s slowly getting better.', ' - Transcripts provided by Sentieo']"
