,title,date,content
0,India’s $62 billion sanitation economy is fueling entrepreneurs in renewable energy,2019-12-15T14:10:24+0000,"['Several large multinational companies, including Kimberly Clark, Unilever and Lixil, recently gathered in India with the World Bank, various NGOs and government officials to meet with sanitation entrepreneurs, or sanipreneurs, to address the worldwide sanitation crisis. Their goal: to come up with new ways to turn human waste into valuable resources, including renewable energy.', 'While toilets and indoor plumbing are taken for granted in developed countries, in the developing world — India, parts of Africa or Southeast Asia — it’s not a given.', 'According to the Toilet Board Coalition — a business-led partnership created to address the global sanitation crisis — an estimated 2.3 billion people around the world lack access to toilets, which traditionally has been financed by taxes, well-intentioned nonprofits or corporate largesse.', 'The coalition plans to change that by accelerating the Sanitation Economy, a marketplace of products and services, renewable resource flows, data and information that they claim could transform future cities, communities and businesses.', 'This crisis has fueled a growing number of companies and sanipreneurs to come up with ways to turn human waste into a profitable business — and a big one at that. In India alone the sanitation economy could be worth $62 billion by 2021, the Toilet Board Coalition estimates.', 'Creating and maintaining sanitation systems is typically an expensive proposition, but by creating new models for sanitation, companies see a chance to turn what was once an unaffordable cost for governments into a profitable and scalable business opportunity. Typical sanitation systems cost an average of $200 per person, but the Toilet Board Coalition sees a chance to transform that cost to a net value of $10 per person.', 'To create a business, companies are finding ways to use and reuse resources, in this case human waste.', '“What goes down the toilet … it’s a combination of biological materials, water — all resources — provided you can treat the waste,” said Sandy Rodger, chief operations officer at the Toilet Board Coalition, calling it a toilet resource, adding, “As long as you can use it, creating valuable materials, that brings a revenue stream.”', 'So what does a profitable business look like when it comes to toilets?', 'First, cut down on infrastructure. Companies have come up with sanitation systems with limited pipes that run to a small, local processing plant, or no pipes at all. Next, create a source of revenue. In the “circular sanitation economy,” what goes in the toilet eventually becomes a finished product such as fertilizer or gas. There are even companies that are exploring ways to use digital technology and data collection to provide real-time monitoring of sanitation systems or even insights on health and consumer behavior.', 'At the recent Sanitation Economy Summit in India, the Toilet Board Coalition brought together large companies such as Unilever, Kimberly-Clark and Lixil with sanitation start-ups on specific projects through its toilet accelerator program.', '“Sanitation is an underdeveloped space for social enterprises, so the creativity and commitment of the entrepreneurs working with the toilet accelerator is particularly inspiring,” Lisa Hawkes, sustainable behavior change manager for Unilever, said in a statement released by the Toilet Board Coalition. Unilever worked with Garv Toilets, which manufactures stainless-steel toilets that are powered by solar panels and equipped with bio-digester tanks.', 'Another company in the accelerator, Tiger Toilets, is working with Lixil, owner of American Standard and Grohe, to create toilets that use tiger worms to break down human waste. The worms feed on human waste and convert it to almost potable water and fertilizer.', 'Toilets need very little maintenance and need to be emptied only every eight to 10 years — less than conventional pit latrines, which need emptying every two to three years. Through the accelerator program, Tiger Toilets has been working with Lixil for help with product design, supply chain, marketing and business development. The toilets are available in India now and are sold to charities as well as direct to households. A toilet package, which includes the toilet structure as well as the worms needed to break down the waste, costs between $300 and $390.', '“Lixil believes in supporting new innovations that can contribute to the global goals, particularly in sanitation. Partnership is essential to getting these innovations into the homes and communities of those who need it most,” said Erin McCusker, chief strategy officer of SATO, Lixil, and chairwoman of the Toilet Board Coalition.', 'Another company, Ti Bus in India, is converting old buses into toilets. It costs about $18,000 to convert one unit and an additional $800 a month to maintain, including paying the salary of a full-time attendant. The buses, painted bright pink, are a much needed facility for low-income women and children who might otherwise walk miles to find a safe, quiet spot outdoors to do their business. There are now 10 buses in India. About 70 to 100 women and children use the buses on a daily basis.', 'Through the accelerator, Ti Bus is working with Swiss fragrance company Firmenich to learn about consumer marketing. “We now have a greater understanding of who our customers are, how they behave and how best to engage them,” said Ulka Sadalkar, co-founder of Ti Bus.', 'It costs 5 rupees to use the Ti Bus. The buses also have additional revenue streams — some have a cafe, laundromat or offer health services. Buses may also get revenue for advertising on or in the buses. Sadalkar said that while the company is not making a profit yet, four of the buses are breaking even.', 'It’s still early days for sanitation as a business, but Venugopal Gupta, director of the Toilet Board Coalition’s accelerator program, says he is seeing a shift away from grants or donations to more commercial-grade investment in the space.', '“Those changes are welcome. These are not grants or donations. Now you are seeing impact investments with return expectations,” Gupta said.', 'What’s driving these investments is a huge market opportunity. Increasing urbanization worldwide is aggravating sanitation issues, which in turn creates environmental degradation that pose a threat to public health. There are large pockets of demand for the likes of Tiger Toilets or Ti Buses in Africa and India.', 'Not only that, but with sanitation the market is steady. “The demand is recession-proof and not prone to volatility or recessions or booms. It is quite a stable demand, and it’s a huge market,” said Gupta.']"
1,"Elon Musk’s biggest challenge yet: Recharging Buffalo, NY",2015-06-11T14:30:00+0000,"['  Elon Musk has earned a reputation as a man not afraid to take big risks and tackle big challenges. But is the touch Musk has shown in building a manufacturing empire for the 21st century—from SpaceX rockets to Tesla Motors electric cars and batteries—ready to help put a shine back on a depressed U.S. manufacturing city?', 'We’ll soon find out. ', 'SolarCity, the nation’s largest seller of residential solar-power systems—of which Musk is chairman—is  building a giant plant in Buffalo, New York, to make rooftop solar panels at a long-shuttered  Republic Steel plant.', 'Henry Ford had River Rouge; Musk and SolarCity have a Buffalo solar panel manufacturing plant named Riverbend.', '  As the factory rises, a promised 5,000 jobs are just beginning to  materialize. But it’s not just a bet on Buffalo. How far the  solar panel plant can go will also determine how well the  domestic solar manufacturing industry can reclaim share after much of it was unable to survive the first half of this decade in a market  roiled by steep price cuts and a trade war against Chinese solar  panel makers. ', '  SolarCity, like many of the rooftop solar installers, grew its business for years by using cost-effective panels, including those made in Asia. The Buffalo plant is set to open next year and will employ at least 1,900 people once  operating at full capacity in 2017.', '“You have a brownfield that has had no meaningful activity for years and you put in 3,000 jobs, not counting [its impact on] the local dry cleaner and mini-mart owner,” said Peter Cutler, director of communications and special projects at Empire State Development in Buffalo.', 'Read MoreThe cover-up involving a big loss of US jobs', 'Roughly 1,400 people are  expected to work for suppliers, and another 2,000 supplier jobs  are estimated to be generated in the rest of New York, said Alain Kaloyeros,  president of the State University of New York Polytechnic  Institute, who led the New York side of negotiations for the  SolarCity incentive package.', '  “For [local] manufacturing, this is a gain of more than 5  percent, and Buffalo still has an outsized concentration of jobs  in manufacturing,″ said Adam Kamins, a regional economist at  Moody’s Analytics. “To boost that with a modern industry is  significant. If Buffalo can become a leader, which it’s  positioned to do, an investment like this can pay off.″\u2063      ', '  About 400 construction workers are building the plant now, a  total expected to approach 1,500 late this year as the interior  gets built out, said Frank Ciminelli, senior executive vice  president of construction firm LPCiminelli, which is building it. ', '  “Something a tenth of this size would be noteworthy,” Ciminelli  said. “For a city whose psyche has been battered for as long as  I’ve been alive, the site of multiple cranes on the skyline  changes people’s perspective. Even before it’s been realized, it  has changed the psyche of the city.″', '  The plant will make enough panels each year to produce a gigawatt  of electricity, or a little more than 1 percent of the nation’s  power. That’s slightly more than all the panels SolarCity buys  now from outside manufacturers, but if the company maintains its  historical 80 percent annual growth rate, the demand will be  there by the time the plant hits full capacity, said SolarCity CEO  Lyndon Rive, who is also Musk’s cousin.', 'Read MoreRobot war is coming to US—on the manufacturing floor', '  “My goal would be to do five gigawatts after this one,” said  Rive, a goal New York officials say he and Musk share.  Rive said the expansion would have to be at a bigger site than  the Republic plant, but likely in the same area. “It sets up the  state to be the solar capital of the country. It creates  manufacturing, it creates a market, and it creates infrastructure  for how clean-energy companies will work together.″', '  The panels will be based on new technology innovated by Silevo, a  company SolarCity bought last June for $200 million, plus  incentives tied to how many panels the company can produce. The  panels work by adding more layers of semiconductor material to  existing technology and should be about 30 percent more  efficient than most of what the company uses now, SolarCity  spokeswoman Kady Cooper said.', '  As aging Rust Belt cities go, Buffalo has been in better shape  than many.', '  Despite losing 10,000 manufacturing jobs in the last decade, the  metro unemployment rate is 5.5 percent, exactly the national average.  (By contrast, Detroit is at 6.2 percent.) But the city is part of a relatively  depressed upstate belt New York Gov. Andrew Cuomo wanted to help  out when he came to office in 2011. By 2012 the governor  announced the so-called Buffalo Billion plan to pour $1 billion  into economic development plans that now include an IBM  500-worker software research facility and offices for biotech  contract researcher Albany Molecular Research.', '  SolarCity’s plant is part of a construction push in the Nickel  City unlike any in memory, as money from the state and from  natural-gas fracking baron and Buffalo Bills and Sabres owner  Terry Pegula drives new and coming developments, including a  children’s hospital and a medical school complex.', '  Silevo became the linchpin of the plan after New York officials  spoke with more than 50 companies, said Kaloyeros, a  nanotechnology expert who has run New York’s push to attract  semiconductor-related businesses to the Albany area. Silevo, it  turned out, was for sale: The winning bidder was SolarCity, who  turned what had been contemplated as a plant making enough panels  to generate 30 megawatts of power per year into something much  larger.', '  In return for its large investment, New York wanted  guarantees—and protection—built into the incentive  deal. Instead of giving SolarCity cash, New York is paying for  the $350 million factory and an estimated $400 million of  equipment.', '  The state is keeping ownership of both plant and machinery to  discourage SolarCity from moving, even at the end of the 10-year  deal. SolarCity is expected  to invest $6 billion locally, including operating costs, over the  term of the deal, Kaloyeros said. Cutler said the deal requires  at least $5 billion in investment from SolarCity.', ' Read MoreWhy ‘Made in USA’  labeling is so complicated', '  Subsidies received by Musk-affiliated companies were  recentlynegatively  highlighted in a Los Angeles  Times piece. Musk fired back in an interview with  CNBC that incentives are helpful, but not necessary, and  that the incentives his firms receive pale in comparison to  subsidies given to other industries, including the oil and gas  industry. ', '  The deal also requires that SolarCity pay New York $42 million  for every year that the target of 5,000 jobs—including local  supplier jobs and solar installer jobs across the  state—isn’t met, Kaloyeros said. If it is met within the  four-year deadline and maintained for a decade as required by the  deal, the $750 million incentive package works out to roughly $150,000 per job,  or $15,000 per year, according to David Doyle, a spokesman for  Kaloyeros at SUNY Polytechnic. ', '  Since most of the positions are expected to pay from about  $50,000 to $150,000 (Erie County’s median family income is just  over $50,000), New York state income taxes on workers’ salaries  alone are likely to recover less than half of that money over the  initial term of the deal.', '  Doyle said SolarCity’s package does not exclude the company from  applicable state corporate income taxes. Personal and corporate  income taxes will recover some of the cost of the incentives over  the 10-year term of the initial deal. ', '  “Isn’t it worth it to revive Buffalo, to have the premier  facility of its kind in the world, and to retain ownership [of  the plant and equipment]?” Kaloyeros said. “I’d say yes.”', '  The plant is demanding enough specialized workers that  construction companies began alerting local unions a year ago,  giving them time to coordinate training, Ciminelli said. The  construction industry employs only about 15,000 people in metro  Buffalo, so a job this size demands preparation, he said. ', '  “We’ll empty the benches,” Ciminelli said. “In certain specialty  trades, we’re already importing workers.”', '  In addition, local community colleges are reworking job-training  programs to nurture the development of the hoped-for solar  manufacturing cluster, Kaloyeros said.', ' Read MoreHow Washington is really  hindering job growth', '  The state hopes it sets off a rush of other solar-industry  companies setting up shop in upstate New York looking to supply  Solar City. Whether New York made a good deal will depend on how  successful SolarCity is at convincing suppliers, and whether the  company expands its own plant beyond the 1-gigawatt production  target, said Kamins, the economist at Moody’s Analytics.', '  That’s going to happen, Kaloyeros insisted. In the Albany area,  about 350 chip companies have opened offices, drawn partly by the  presence of Sematech, a global consortium of semiconductor firms  that moved from Texas in 2010 and was merged into the Polytechnic  Institute this year. ', '  “The same thing will happen with SolarCity,″ he said. “If we’re  going to spend $1 billion, Andrew Cuomo is not going to spend it  for nothing.″\u2063', '  Two SolarCity partners are already in talks to move to Buffalo,  Kaloyeros said. And just this week, upstate New York-based  mechanical contracting company John W. Danforth said it plans to  spend $1 million to buy 26.6 acres of land across from the  SolarCity factory as part of a broader site that could include  SolarCity suppliers.', '  —By Tim Mullaney, special to CNBC.com']"
2,Trump tariffs would barely raise Boeing’s prices but could hurt sales,2018-03-07T12:25:32+0000,"['President Donald Trump’s plan to slap tariffs on imported steel and aluminum would barely budge the price of a Boeing jetliner or fighter plane, belying fears of a big blow to U.S. industry, aerospace analysts said.', 'What could have an impact is retaliation by countries such as China, one of Boeing’s biggest customers, if the United States goes through with threats to tax imported steel by 25 percent and aluminum by 10 percent, they said.', 'As one of the world’s largest manufacturers, Boeing provides a window into how double-digit tariffs on raw materials would translate into just a fractional uptick in the cost of finished goods. Boeing makes its planes exclusively in the United States, but nearly 70 percent of the 763 jetliners delivered last year went to customers outside the United States and 22 percent went to China.', 'Aluminum makes up 80 percent of the weight of older model planes such as the 737 and 777 but only about 12 percent of the cost, according to several experts with direct knowledge of Boeing. The rest is labor, overhead and other expenses.', 'A 10 percent aluminum tariff would increase the cost of a plane by about 1.2 percent if all of the aluminum is imported. But most of the aluminum Boeing uses is domestically produced, experts said.', '“These are big chunks of aluminum that are expensive to transport,” said Eric Redifer, a director in the aerospace practice of industry consulting firm AlixPartners.', 'He and others estimate only 25 percent to 30 percent is imported, leaving a net impact of about 0.3 percent of a plane’s cost.', 'Prices of domestic aluminum are likely to rise if tariffs are imposed, although it is unclear how much.', 'On a mid-sized 737, with a list price of $117.1 million, the cost increase could be less than $200,000, because airlines often receive discounts of 40 percent off list price, and Boeing’s profit margin is about 10 percent.', 'Boeing declined to comment.', 'The net effect for steel is similar, even though it makes up less of a typical Boeing plane, said Kevin Michaels, aerospace manufacturing expert at AeroDynamic Advisory, a consulting firm in Ann Arbor, Michigan.', 'He estimated Trump’s 25 percent tariff on relatively pricey steel would cost U.S. aerospace companies less than $100 million, roughly on par with the overall impact on aluminum. That means the two tariffs would add $150 million to $200 million in cost, or at most about 0.2 percent of $100 billion worth of business jets, jetliners and military aircraft U.S. companies make each year.', 'For Boeing’s newer 787, which uses carbon-fiber composite for wings and fuselage, the impact is even less. Aluminum makes up 10 percent of the cost, Redifer said. The result: Trump’s aluminum tariff would increase 787 costs about 0.09 percent.', '“What will have a material impact is if China retaliates,” said Richard Aboulafia, aerospace analyst at the Teal Group in Fairfax, Virginia. “They are openly searching for ways to express their displeasure and apply leverage. And it doesn’t get any more obvious than going from Boeing to Airbus.”', 'The country’s thirst for jets is so great, however, that it likely will need planes from both Boeing and European rival Airbus to keep up with demand, analysts said.']"
3,CCTV Script 20/07/17,2017-07-26T06:49:24+0000,"['– This is the script of CNBC’s news report for China’s CCTV on July 20, Thursday.', 'Trade talks between U.S and Chinese officials have concluded, however, last night it was announced that the scheduled news conference was cancelled, causing even more people to anticipate what could possibly be the outcome between U.S and China’s trade relations.', 'Let’s take a closer look at some of the several stances that have emerged since last night with the first one being U.S seeking to ease U.S-China’s trade imbalance, in hopes of making it more equal.', 'According to Wilbur Ross, the United States Secretary of Commerce, there is indeed some progress that came out of the 100 days trade talk, such as the return of U.S beef to China. He considered these small gains as a good start. Yet, at the same time, Ross also expressed that there exists a serious trade imbalance between U.S and China that needs to be dealt with.', 'According to National Bureau of Statistics in 2016, the  U.S. trade deficit with  China stood at $347 billion which accounted for 47% of the total goods trade deficit. However, in a report by China’s Ministry of Commerce, the 2016′s trade deficit was actually at $254 billion. It also cited that the American’s figures were exaggerated.', 'At the same time, the report also emphasized that in terms of service trade with China in 2016, the U.S. had a surplus that reached 55.7 billion dollars As such, what we see here is that there are clear differences between the statistics coming from America and China. Despite these differences, one thing that we can be sure of is that both countries reported data that recorded a decline from 2015′s and this downward trend has continued since the start of this year. For example, the data from the U.S Chamber of Commerce in February showed that US trade deficit with China went down by 26% but its China’s exports went up by 22%.', 'Besides, another point of discussion is the mutual opening up of various markets. Currently, China is the biggest US importer of aircraft and soybean and also the second biggest for cars, electronic integrated circuits and cotton. Here are some data. 62% of the total American soybean exports and 17% of American car exports are going into China. Furthermore, 15% of the total electronic integrated circuits, 14% of total American cotton and 25% of the total number of American speakers are also going into China.', 'However, China’s imports of high-tech products from the U.S only make up 8.2% of China’s total imports of similar products. Therefore, China does hope that there can be deeper discussion with regards to import products like aeroplanes, cotton, electronic beds and other high-tech products. Furthermore, stronger cooperation can be achieved between China and America in areas like energy, beef and agricultural products, manufacturing, films, tourism and even student exchange programs.', 'Looking forwards, analysts have expressed that discussion between the U.S and China is set to continue in the second half of this year and an important thing to be noted is impending tariff measures that are going to be imposed, especially on steel imports. Recently, Trump had expressed information on limitations and tariffs of steel imports will soon be unveiled. Last night, he once also expressed that tariffs on steel imports could happen and this might result in some uncertainty in the relations between U.S and China.', '[Nicholas Consonery, Senior Director&Head of Asia Political Risk, FTI Consulting] “The question is whats coming next. There is a sense that the two sides are going to agree to some kind of one year framework for further negotiations about trade. It is very clear that the Trump administration is looking to push over-capacity industries including steel, so I think we will see more trade tensions in the second half, manageable but more tension.”']"
