,title,date,content
39,"U.S. officially the top destination for bitcoin miners, beating out China for the first time",2021-10-13T07:10:05+0000,"['The U.S. is now the number one destination for bitcoin miners, eclipsing China for the first time ever. While it was already trending in that direction, new data from Cambridge University released early Wednesday makes it official.', 'As of July, 35.4% of bitcoin’s hashrate – an industry term used to describe the collective computing power of miners – is in the United States, according to the Cambridge Centre for Alternative Finance. That’s a 428% increase from September 2020.', 'America partly has China to thank for its newfound dominance in the mining industry.', 'Twelve months ago, China was the market leader in terms of hashrate – by a long shot. But Beijing’s crypto crackdown in the spring took half the world’s bitcoin miners offline practically overnight.', 'Miners started fleeing China en masse, heading to the cheapest energy sources on the planet in what was dubbed “the great mining migration.” A whole lot of them ended up in America.', 'The newly-released Cambridge data zeroes out China’s average monthly share of the global hashrate in July – a major reversal from September 2020, when China captured about 67% of the market.', '“The whole narrative of China controls bitcoin is now completely destroyed,” said Boaz Sobrado, a London-based fintech data analyst.', 'The U.S. ticks a lot of boxes for migrant bitcoin miners searching for a new home.', 'For one, states like Texas boast some of the world’s lowest energy prices, which is a major incentive to miners who compete in a low-margin industry, where their only variable cost is typically energy.', 'The U.S. is also flush with renewable power sources.', 'Washington state is a mecca for hydropowered mining farms. New York produces more hydroelectric power than any other state east of the Rocky Mountains, and it counts its nuclear power plants toward its 100% carbon-free electricity goal. Meanwhile, Texas’ share of renewables is growing over time, with 20% of its power coming from wind as of 2019. The Texas grid also continues to rapidly add more wind and solar power.', 'Miners across the country have also harnessed nuclear power. Some are latching their rigs to otherwise stranded energy, like natural gas going to waste in oil fields across Texas. This reduces greenhouse gas emissions and generates money for the gas providers and miners.', 'This shift toward zero-emission, clean energy sources has already begun to recast the narrative among skeptics that bitcoin is bad for the environment. ', '“Mining is price sensitive, so as to seek out the lowest-cost power and the lowest-cost power tends to be renewable because if you’re burning fossil fuels ... it has extraction, refinement and transport costs,” Blockstream CEO Adam Back said. ', 'Besides lower electricity costs, some U.S. states like Texas also have crypto-friendly policymakers and an adequate supply of hosting infrastructure.', 'The state has a deregulated power grid with real-time spot pricing that lets customers choose between power providers, and crucially, its political leaders are pro-crypto. Those are dream conditions for miners who want a kind welcome and cheap energy sources.', '“If you’re looking to relocate hundreds of millions of dollars of miners out of China, you want to make sure you have geographic, political, and jurisdictional stability. You also want to make sure there are private property rights protections for the assets that you are relocating,” said Darin Feinstein, co-founder of Core Scientific. ', 'America’s rise to the top is also a case of luck meeting preparation. The U.S. has been quietly boosting its hosting capacity for years.', 'Before bitcoin miners started coming to America, companies across the country made a gamble that eventually, if adequate infrastructure were in place, they would set up shop in the U.S. ', 'That gamble is paying off.', 'When bitcoin crashed in late 2017 and the wider market entered a multi-year crypto winter, there wasn’t much demand for big bitcoin farms. U.S. mining operators saw their opening and jumped at the chance to deploy cheap money to build up the mining ecosystem in the States. ', '“The large, publicly-traded miners were able to raise capital to go make big purchases,” said Mike Colyer, CEO of digital currency company Foundry, which helped bring over $300 million of mining equipment into North America.', 'Feinstein says that in the last 18 months, there has been a serious growth of mining infrastructure in America. “We’ve noticed a massive uptick in mining operations looking to relocate to North America, mostly in the U.S.,” continued Feinstein.', 'Companies like North American crypto mining operator Core Scientific kept building out hosting space all through the crypto winter to ensure the capacity to plug in new gear, according to Colyer. ', '“A majority of the new equipment manufactured from May 2020 through December 2020 was shipped to the U.S. and Canada,” he said.', 'Alex Brammer of Luxor Mining, a cryptocurrency pool built for advanced miners, points out that maturing capital markets and financial instruments around the mining industry also played a big role in the industry’s quick ascent in the U.S. Brammer says many of these American operators were able to start rapidly expanding once they secured financing by leveraging a multi-year track record of profitability and existing capital as collateral.', 'Covid also played a role.', 'Though the global pandemic shut down large swaths of the economy, the ensuing stimulus payments proved a boon for U.S. mining companies.', '“All the money printing during the pandemic meant that more capital needed to be deployed,” explained bitcoin mining engineer Brandon Arvanaghi. ', '“People were looking for places to park their cash. The appetite for large-scale investments had never been bigger. A lot of that likely found its way into bitcoin mining operations in places outside of China,” continued Arvanaghi.', 'Not all miners, however, are headed to renewable destinations.', 'Kazakhstan is just behind the U.S. in terms of its share of the global bitcoin mining market, with 18.1% of all crypto mining. It’s home to coal mines that provide a cheap and abundant supply of energy — but also ample carbon dioxide emissions.', 'However, several mining experts tell CNBC they think that Kazakhstan, which neighbors China, is just a temporary stopover on a longer migration west.', 'Brammer sees large miners going there in the short-term with older-generation equipment. “But as older-generation machines reach the end of their service lives, those companies will likely deploy new machines into more stable and energy efficient and renewable jurisdictions,” he said.', 'Also likely to put a damper on Kazakhstan’s popularity is a law newly signed by the president that will introduce extra taxes for crypto miners starting in 2022.', '“This will significantly change the incentives for people to deploy capital in Kazakhstan,” said Brammer.']"
40,"FedEx, UPS jockey with Amazon as tech giant expands into shipping",2019-09-01T13:00:26+0000,"['The years-long battle between Amazon and retail companies has spilled over into the shipping industry, with FedEx and UPS adjusting their strategies as the tech giant, once simply a customer, is now a major competitor.', 'FedEx has announced two changes to its relationship to Amazon in recent months, including ending the ground delivery contract with the e-commerce pioneer. Meanwhile, UPS is exploring new technologies, such as drones and self-driving trucks, to modernize its delivery services.', 'The moves come as Amazon is building up its delivery fleet, renting planes and offering $10,000 to its employees to leave the company and start their own local delivery business.', '“I think they have stated that they are now a competitor to the transport industry,” said Ken Hoexter, a research analyst at Bank of America Merrill Lynch. “And FedEx has clearly viewed them now in their recent moves as an increasing competitor.”', 'Just as some retail companies are uneasy about working with Amazon, which can be both a partner and a competitor, transportation companies are facing a similar dilemma. And with their customers facing off against Amazon in other industries, shipping companies may need to take sides.', 'Dan Neiweem, co-founder and principal of digital services and solutions provider Avionos, said that by ditching Amazon, FedEx may make itself more attractive to Amazon’s competitors in the retail space.', 'He compared it to reports that WalMart is pressuring some of its partners to use Microsoft’s Azure for cloud computing instead of Amazon Web Services. WalMart said “there are a small number of cases involving our most sensitive sales data that we’d prefer not sit on a competitor’s platform” but its vendors can choose the cloud service they prefer.', '“I think that what you’ll see is that a lot of the shipments that Amazon was going into the USPS and FedEx with are now going to be transitioned from other retailers who are saying ‘hey I don’t anybody in my space who works with Amazon,’” Neiweem said. “And you see that parallel very, very tightly with AWS and Azure.”', 'FedEx never relied on Amazon for a huge portion of its business. In a June statement announcing that Amazon would no longer be served by FedEx Express, the shipping company said Amazon accounted for 1.3% of its total revenues in 2018, or roughly $900 million.', 'From that perspective, FedEx’s decision to cut ties with Amazon makes sense, Hoexter said.', '“When you go to their sort centers, you can see that Walmart and Jet are a major customer of FedEx’s, so certainly that relationship is as important if not more important than Amazon,” Hoexter said.', '“So if you have to choose one, if UPS is larger with Amazon and you’re larger with Walmart, you’re going to kind of work closer with that candidate.”', 'Throughout its rise, Amazon has relied on UPS for a large portion of its shipping needs. UPS is still more exposed to Amazon than FedEx was. David Ross, transportation research analyst at Stifel, said he estimates that UPS gets between 7% and 9% of its total revenue from Amazon.', '“If you go back 10, 15 years UPS was the chosen parcel carrier by Amazon, and when they started their prime two-day offering it was a lot of UPS,” Ross said.', 'Amazon started using the U.S. Postal Service more after the delivery companies struggled to deliver packages on time during the 2013 holiday season, Ross said.', 'Online shopping has continued to grow since then. According to the U.S. Census Bureau, e-commerce has grown from roughly 4% of total retails sales in 2010 to more than 10% earlier this year. FedEx said it expects e-commerce to grow to 100 million packages per day in the U.S. by 2026.', 'As e-commerce has boomed, Amazon has struck out more on its own and built a sizable delivery network. The tech giant may not be delivering many third-party packages right now, but Neiweem said that’s “sort of the last stand or threshold that they haven’t crossed yet.”', 'UPS and FedEx are also investing in their businesses, with both companies expanding delivery to 7 days per week.', 'FedEx, which said it has “a strong relationship with retailers of all sizes,” has started offering retailers extended hours for package pickup, partners with stores such as Dollar General to create customer pick up areas and is experimenting with a delivery robot.', 'UPS, which saw demand for next day air shipping increase 30% in the second quarter, has invested in TuSimple, an autonomous shipping business, and is forming a drone subsidiary called UPS Flight Forward. The company is also expanding its air fleet and is scheduled to add 11 cargo planes this year.', 'The growing demand for fast shipping has weighed on the financial results for large shipping companies. More home deliveries means shipping companies make less per stop than if they delivered a lot of packages to one spot, like a convenience store.', 'Hoexter said that domestic margins at UPS have been under pressure for the past several years, and that is where analysts will look to see if its new investments and increased leverage with Amazon are working.', '“As we get into peak season, have they found a way to stabilize those margins despite the growth of e-commerce? That’s going to be the key for the stock. When you ask what do we look for its the margin side and pricing if we start to see that improving or stabilizing. That’s the first step,” Hoexter said.', 'With FedEx now out of the picture, UPS may also be able to gain some short-term leverage on pricing, Hoexter said. That opportunity may not last for long, as Amazon continues to expand its own delivery network and expects to have 70 planes in its fleet by 2021.', 'For FedEx, the separation means the company can show that its e-commerce success is not tied to Amazon.', '“FedEx is just showing people that they don’t need Amazon to be a good business, and they feel that they can continue to grow without Amazon. I think they wanted to just distance themselves from Amazon in a way that made their own growth story a little more clear to people,” Ross said.']"
41,Project to develop hydrogen-powered ferry moves forward after contract for design awarded,2021-06-04T14:32:06+0000,"['Plans to build a sea-going ferry powered using hydrogen-fuel cells advanced on Friday after it was announced that a commercial contract for the development of a concept design had been awarded.', 'Caledonian Maritime Assets Ltd, which is owned by the Scottish government, said in a statement that the contract had been given to the London-headquartered Aqualisbraemar LOC Group.', 'The two parties will collaborate on the concept, which CMAL said would be based around the needs of a “double-ended sea-going passenger and car ferry, with capacity for 120 passengers and 16 cars or two trucks.”', 'The idea is that the ferry would be designed to travel between Kirkwall and Shapinsay in Orkney, an archipelago located north of mainland Scotland.', 'It represents the latest development for the HySeas III project, which has received funding from the European Union.', 'The goal of Hyseas III is to show that fuel cells can be integrated into a “marine hybrid electric drive system” consisting of tech such as batteries and electric propulsion.', 'To this end, the project aims to develop, build, test and validate “a full sized drive train on land.” Alongside CMAL, other partners in the consortium include the University of St. Andrews, Orkney Island Council and Kongsberg Maritime.', 'John Salton, fleet manager and projects director at CMAL, said the contract award constitutes “a significant step forward in establishing a new, innovative vessel concept, and marks an important shift towards entirely emissions-free marine transport.”', '“If successful, the next step will be to take the knowledge and know-how into building a ferry,” Salton said.', 'Other hydrogen ships have already been developed and put into use. Back in 2008, for example, a fuel cell ship capable of carrying passengers entered into service on a lake in Hamburg, Germany.', 'In March of this year Linde, a firm specializing in engineering and industrial gases, said it had been chosen by Norwegian firm Norled to provide liquid hydrogen and associated infrastructure for a hydrogen-powered ferry. The MF Hydra, as it’s known, will be able to carry both passengers and cars.', 'In a statement at the time Norled’s CEO, Heidi Wolden, said the firm believed hydrogen would “play a significant role in the future of zero-emission ships.”', 'Described by the International Energy Agency as a “versatile energy carrier,” hydrogen has a diverse range of applications and can be deployed in sectors such as industry and transport.', 'Ferries are not the only mode of transportation where hydrogen fuel cells could have a role to play.', 'Hydrogen buses have been used in cities such as London and Aberdeen, for example, while hydrogen fuel cell airplanes have also taken flight in recent years.', 'Major automobile manufacturers that have dipped into the hydrogen fuel cell market include Toyota and Honda, while smaller firms such as Riversimple are also working on hydrogen powered cars.']"
42,Amazon expands its streaming TV lineup with a slew of new products,2019-09-04T18:43:13+0000,"['Amazon’s Alexa and FireTV software are expanding to even more products.', 'Amazon on Wednesday announced a slew of new products with its Alexa voice assistant and Fire TV software built-in. Some, like a new version of last year’s Fire TV Cube, are made by Amazon. And several third-party manufacturers announced their own living room devices running Amazon’s services.', 'At the CES 2019 trade show, Amazon began to demonstrate how it’s working with other companies to put Alexa into other smart devices, and now it’s showing it can do the same with its Fire TV software as it expands partnerships to companies who will build and sell Fire TV devices in Germany, Austria and the United Kingdom.', 'The new version of the Fire TV Cube is up to two times faster than last year’s model. The first Fire TV Cube launched last July. Like its predecessor, the new model lets you control your TV, cable box and other inputs using just your voice. That means you can walk into the room and say “Alexa, tune to ESPN on cable” and the Fire TV Cube will pull up ESPN on cable TV. It also works with streaming services like Hulu, Netflix, Sling TV and more.', 'The new Fire TV Cube’s performance boost is thanks to a new processor, which should help cut down on lag when moving between apps. It also now locally processes basic Alexa requests for things like increasing the volume or returning to the home screen, instead of sending those requests to the cloud first. That should make those responses up to four times faster, Amazon says. The design is the same as last year’s model.', '“The design is the same because it’s worked well in terms of microphone array and layout,” Amazon’s vice president of product development for Fire TV Sandeep Gupta told CNBC, referring to the box’s ability to listen to voice commands. “Local voice control has a subset of commands that are critical and cut out the cloud part so if we recognize [a command] it can just execute it immediately,” he said.', 'Gupta told CNBC that Amazon has found Fire TV Cube owners are much more likely to interact using voice than other Fire TV product owners.', '“We get eight times the usage of voice than we do in other devices,” he said. “We see almost 80% of Fire TV Cube users using it for device automation and smart home devices,” he said.', 'The new Fire TV Cube costs $119.99 in the U.S., the same price as the original model. Pre-orders open on Wednesday in the U.S. and, for the first time, in Germany, the United Kingdom and Japan. It will ship on Oct. 10 in the U.S., United Kingdom and Germany and on Nov. 5 in Japan.', 'Amazon also announced a slew of products with Fire TV software and Amazon Alexa built-in, which will be sold by its partners.', 'That includes Anker’s new Nebula soundbar, which has support for Fire TV built-in so you don’t need a separate device to stream video. Like the Fire TV Cube, it includes voice support, so you can ask Alexa to control your device. It sounds a lot like a similar product announced by Roku Wednesday morning. The Nebula Soundbar from Anker will cost $229.99 in the U.S. and ships Nov. 21, but customers can pre-order it now. It will also be available in Canada, the United Kingdom and Germany.', 'Amazon also said that it is partnering with Dixons Carphone, MediaMarktSaturn’s IMTRON and Grundig, which will all begin to sell new Fire TV Edition smart TVs. Prior to Wednesday, Amazon sold Fire TV Edition televisions with Toshiba and Best Buy’s Insignia brand in the U.S.', 'IMTRON’s Fire TV Edition smart TVs will be sold under the private label brand “ok” in Germany and Austria. Grundig will sell a total of 11 models including two OLED model TVs under the “Fire OLED TV - Fire TV Edition Hands-Free with Alexa” branding and two without hands-free support. Hands-free offers Alexa for voice controls without the need for a remote. It will also sell the Grundig Vision 7 with 4K Ultra HD and Vision 6 TVs with 1080p support. Those will also be sold in Germany and Austria. Pricing and release will vary by model and size.', 'Finally, Amazon is partnering with Dixon’s Carphone and JVC to sell JVC Fire TV Edition Smart Ultra HD HDR LED TVs in the United Kingdom in 40-inch, 49-inch and 55-inch screen sizes. They will ship with a voice remote that includes Alexa for controlling the TV, but they don’t have microphones built-in like the Fire TV Cube or the sets from Grundig.', 'Follow @CNBCtech on Twitter for the latest tech product news.']"
