,title,date,content
69,"China will someday be the largest cruise market in the world, Carnival Corp CEO says",2018-05-23T22:35:38+0000,"['From the deck of the Carnival Horizon, docked at New York City’s Pier 88, Carnival Corp. CEO Arnold Donald told CNBC that, eventually, his cruise line’s U.S. business would shy in comparison to China.', '“China, someday, will be the largest cruise market in the world,” the CEO told “Mad Money” host Jim Cramer on Wednesday. “It’s in their five-year plan, so if cruising is in their five-year plan, ... they’re going to make it happen.”', 'Passenger volume from China has been increasing sharply over the last five years, with cruise capacity increasing across all metrics, according to a 2017 report from Cruise Lines International Association and Chart Management Consultants.', 'The same report pegged China as the “main driver of passenger growth in Asia,” with Chinese customers accounting for two-thirds of the region’s passenger volume in 2016.', '“We just want to be a part of that,” Donald said about China’s anticipated growth. “We partnered ... with [the China State Shipbuilding Corporation] and the sovereign front, [China Investment Corporation], to establish a domestic cruise line there and to build the first ship in a Chinese ship yard, so that’s in 2023.”', 'The non-binding agreement establishes a joint venture between Carnival, CSSC and CIC to help build two new cruise ships in China, with the option of building two additional ships.', '“Meanwhile, we have a number of ships home-ported there, and our ships are doing well. It’s a challenging market, but it’s embryonic,” Donald told Cramer on Wednesday. “We are teeny-tiny in terms of accessing the total number of travelers that are from China.”', 'Conservative estimates from a  2017 report by Cruise Industry News, an independent news and research organization, predicted that China would deliver more than 5.6 million domestic cruise passengers by 2024.', 'For context, Cruise Lines International Association estimates that 27.2 million passengers around the globe will go on a cruise in 2018.', '“Every market in the world, Jim, is underpenetrated, including the United States,” Donald said, adding that all of the ship cabins in the world add up to less than 2 percent of total hotel rooms.', '“One of every two people who cruise cruise on one of our nine world-leading cruise line brands, so our competition ... is actually land-based vacations,” he continued. “It’s not other cruise lines. Because we’re chasing the other 98 percent, not the 1 percent we don’t have of the 2 percent penetration.”']"
70,Lockheed Martin makes its combat ship more lethal as new Navy competition heats up,2017-11-18T19:00:00+0000,"['On the Wisconsin shore of the Menominee River a new 3,000-ton Freedom-class Littoral Combat Ship sits docked in the water. It’s already been delivered to the Navy by Lockheed Martin and it’s already active.', 'A crew of 50 live aboard and have been conducting tests for six months on nearby Lake Michigan. Next month, the warship will be commissioned the USS Little Rock before deploying to Florida.', 'In addition to automation that has cut crew size in half versus more traditional ships of this size, interchangeable “mission packages,” and a top speed of 40 knots, the close-to-shore warship will tout something else: the ability to vertically launch Hellfire missiles (also made by Lockheed) to target threats on land, sea and in the air.', 'It’s one of the ways Lockheed is looking to make the controversial ship more lethal. It’s a strategy meant to not only silence critics and snag more orders, but better position the top defense contractor for one of the biggest, most-anticipated new Navy contracts.', '“This is a warship,” says Michele Evans, Lockheed’s vice president and general manager of integrated warfare systems and sensors, a multibillion dollar Naval systems portfolio that includes LCS and the Aegis Ballistic Missile Defense system.', '“It really looks to bring vertical launching systems, take advantage of a lot of what we develop with Aegis, and eventually, we could even look at having a laser-based system on this.', '“So, we see the growth potential and I think there’s a desire as the Navy looks toward a future frigate.”', 'That future frigate is the Navy’s “future guided missile frigate” or FFG(X), a competition for a next-generation small combatant ship to be based off of an existing small surface combatant (like for example, LCS).', 'Last week the Navy released a design request for proposal that’s expected to be awarded next year, the last step before selected contractors build their concepts. Officials met with industry on Friday to review the hundreds of pages of guidelines.', 'The final contract is set to be awarded in 2020, with the program likely to be worth about $15 billion, according to Roman Schweizer, a defense analyst at Cowen. It’s expected to span at least 20 ships.', 'For the Littoral Combat Ship, Lockheed, an LCS co-prime, partners with shipbuilder Fincantieri Marinette Marine and ship designer Gibbs & Cox for its Freedom-class variant.', 'Lockheed says it will “absolutely” bid for the frigate, but with the competition still in early stages and many details unknown, it says potential partners are yet-to-be-determined.', 'It already has company. LCS co-prime Austal has also said it will compete. An Australian company, Austal has a shipyard in Alabama where it currently makes the Independence-class Littoral Combat Ship. Of the 29 ships under contract, Lockheed has 14 and Austal has the rest. (Based on the fiscal 2018 defense bill, three more are expected to be procured, though the breakdown of those orders is unknown.)', 'General Dynamics’ Bath Iron Works has also said it will participate, and analysts expect others like Huntington Ingalls to bid as well.', 'Lockheed and Austal may have some hurdles to mount. The Littoral Combat Ship has seen no shortage of critics, including Senate Armed Services Committee chair John McCain, who has repeatedly slammed it as an example of defense-related waste and inefficiency.', '“Initial cost overruns more than doubled the cost of each LCS, development costs for the ships and their modules now exceed $6 billion dollars, and they keep rising,” the senator said at a hearing in June. “Meanwhile, key warfighting capabilities of the LCS including key mine counter measures and antisubmarine warfare have fallen years, I repeat years, behind schedule and remain unproven.”', 'Responsibility can go around for those challenges, to the contractors but also the Navy itself, which changed criteria even as the earliest ships were being built.', 'For its part, Lockheed Martin says those growing pains are behind it, as production has ramped to full-rate. It now takes about three years from start of fabrication to delivery, explains Joe DePietro, Lockheed’s vice president of small combatants and ship systems, compared to “in excess” of five years for the very first Lockheed LCS called USS Freedom.', 'Also worth noting, while price varies per contract and vessel, a LCS still only costs about $500 million — double the initial target price set in the early 2000s — but still a fraction of the billions spent on a Navy destroyer or cruiser.']"
71,Musk: ‘Dream come true’ to see fully stacked SpaceX Starship rocket during prep for orbital launch,2021-08-06T17:10:59+0000,"['Elon Musk’s SpaceX stacked a Starship prototype rocket on top of a Super Heavy rocket booster for the first time Friday morning, giving a look at the scale of the combined nearly 400-foot-tall vehicle.', 'Musk, asked by CNBC what he thought of witnessing the milestone at the company’s facility in Boca Chica, Texas, responded simply.', '“Dream come true,” Musk replied in a tweet.', 'SpaceX is developing Starship to launch cargo and people on missions to the moon and Mars. Starship prototypes stand at about 160 feet tall, or around the size of a 16-story building, and are built of stainless steel — representing the early version of the rocket that Musk unveiled in 2019. ', 'The rocket lifts off on top of a Super Heavy booster, which makes up the bottom half of the rocket and stands about 230 feet tall. Together, Starship and Super Heavy are nearly 400 feet tall when stacked for launch.', 'The company rolled out Super Heavy Booster 4 on Tuesday.', 'SpaceX has conducted multiple short test flights of Starship prototypes over the past year, but reaching orbit represents the next step in testing the rocket. The company in May revealed its plan for the first orbital flight, which would launch from the company’s facility in Texas and aim to splash down off the coast of Hawaii.', 'The company has been working rapidly to ready Starship and the Super Heavy booster for the orbital flight test, although a local environmental review by the Federal Aviation Administration needs to be completed before the launch happens.', 'Musk outlined four “significant items” that SpaceX aims to complete over the next two weeks in preparing Starship 20 for launch.', 'He said SpaceX needs to add the “final heat shield tiles” to the ship, add “thermal protection” to the Raptor rocket engines in Booster 4, complete work on “ground propellant storage tanks” and add a quick disconnect arm to the top of the recently built launch tower. The quick disconnect arm connects power and fuel lines to the rocket before launch.', 'While SpaceX’s fleet of Falcon 9 and Falcon Heavy rockets are partially reusable, Musk’s goal is to make Starship fully reusable — a rocket that is more akin to a commercial airplane, with short turnaround times between flights such that the only major cost is fuel.', 'One important piece of making Starship fully reusable is improving its durability to survive the intense process of reentering the Earth’s atmosphere. Small hexagonal heat shield tiles are SpaceX’s answer to that problem, with the previously shiny Starship 20 rocket now covered in thousands of the tiles.', 'Musk noted that work on the tiles is about “98% done” for Starship 20, as “the remaining tiles are unique shapes requiring machining.”', 'NASA has been paying close attention to Starship’s development, especially as the U.S. space agency earlier this year awarded SpaceX a controversial $2.9 billion contract to deliver astronauts to the surface of the moon using the rockets.', 'Thomas Zurbuchen, NASA’s top official for science missions, told CNBC that he continues to watch progress on Starship.', '“Yes, I have been following this all along and am excited for @SpaceX achieving this milestone! Can’t wait to see it fly!” Zurbuchen wrote in a tweet.', 'Musk replied to Zurbuchen in another tweet, touting the projected capabilities of Starship.', '“Due to its size & ability to return science instruments even from deep space, Starship will enable a whole new class of science missions,” Musk wrote.']"
72,The race to roll out ‘super-sized’ wind turbines is on,2022-04-13T05:24:20+0000,"['In the not too distant future, waters 15 miles off Martha’s Vineyard will be home to a potentially crucial part of America’s energy future: the 800-megawatt Vineyard Wind 1, a project that’s been described as “the nation’s first commercial-scale offshore wind farm.”', 'Construction of Vineyard Wind 1 started last year, and the facility will use 13 MW versions of GE Renewable Energy’s Haliade-X turbines. With a height of up to 260 meters (853 feet), a rotor diameter of 220 meters and 107-meter blades, the Haliade-X is part of a new generation of turbines set to be installed in the years ahead.', 'In addition to GE, other companies are getting in on the big turbine act. In Aug. 2021, China’s MingYang Smart Energy released details of a 264-meter tall design that will use 118-meter blades.', 'Elsewhere, Danish firm Vestas is working on a 15-megawatt turbine that will have a rotor diameter of 236 meters and 115.5-meter blades while Siemens Gamesa Renewable Energy is developing a turbine that incorporates 108-meter blades and a rotor diameter of 222 meters.', 'The reasons for these increases in size are clear. When it comes to height, the U.S. Department of Energy says the towers of turbines “are becoming taller to capture more energy, since winds generally increase as altitudes increase.”', 'A bigger rotor diameter isn’t just for show either, with the DOE noting that they “allow wind turbines to sweep more area, capture more wind, and produce more electricity.”', 'It’s much the same with blades. The DOE says longer blades can “capture more of the available wind than shorter blades—even in areas with relatively less wind.”', 'Having huge turbines arrive on the market is all well and good, but their sheer scale may pose a number of mid-to-long term challenges for the sector, creating pinch points that could cause headaches.', 'Take installations. In February, research from Rystad Energy honed in on some of the possible issues related to the ships used to install offshore wind turbines out at sea.', 'Not counting China, it said wind turbines had seen what it called “a growth spurt in recent years, rising from an average of 3 megawatts (MW) in 2010 to 6.5 MW today.”', 'This shift, it explained, was likely to be sustained. “Turbines larger than 8 MW accounted for just 3% of global installations between 2010 and 2021, but that percentage is forecast to surge to 53% by 2030.”', 'The above data relates to offshore wind turbines only. According to the energy research and business intelligence firm, demand for vessels able to install larger offshore turbines is set to outstrip supply by the year 2024.', 'Operators, it said, “will have to invest in new vessels or upgrade existing ones to install the super-sized turbines that are expected to become the norm by the end of the decade, or the pace of offshore wind installations could slow down.”', '“When turbines were smaller, installation could be handled by the first-generation fleet of offshore wind vessels or converted jackups from the oil and gas industry,” Martin Lysne, senior analyst for rigs and vessels at Rystad Energy, said in a statement at the time.', 'With operators continuing to favor bigger turbines, Lysne said a “new generation of purpose-built vessels” would be needed to satisfy demand.', 'These specialized vessels don’t come cheap. U.S. firm Dominion Energy, for example, is heading up a consortium building the 472-foot Charybdis, which will cost around $500 million and be able to install current turbines and next-generation ones of 12 MW or greater. More vessels like the Charybdis will be needed in the future as turbines grow.', '“Out of the current fleet of purpose-built vessels, only a handful of units can install 10 MW+ turbines, and none are currently able to install 14 MW+ turbines,” according to Rystad Energy’s analysis. “This will change towards 2025 as newbuilds start to be delivered and existing vessels get crane upgrades.” ', 'The ships that transport and install turbines will be important in the years ahead, but the ports where they dock are another area where investment and upgrades will likely be needed to cater to wind energy’s growth.', 'In a comment sent to CNBC via email, Rystad Energy’s Lysne described port infrastructure as being “very important” from a vessel perspective.', 'Going forward, it would appear that a lot of money will be needed. Last May, a report from industry body WindEurope said Europe’s ports would have to invest 6.5 billion euros (around $7.07 billion) by 2030 in order “to support the expansion of offshore wind.”', 'The report addressed the new reality of bigger turbines and the effect this could have in relation to ports and infrastructure. “Upgraded or entirely new facilities are needed to host larger turbines and a larger market,” it said.', 'Ports, WindEurope said, would also need to “expand their land, reinforce quays, enhance their deep-sea harbours and carry out other civil works.”', 'More recently, a report from the Global Wind Energy Council also reinforced the importance of ports.', '“As offshore wind projects expand and commercial-scale floating wind projects proliferate, port upgrades will be critical for the future success of the industry,” it said.', 'The Brussels-based organization said turbine sizes had “increased dramatically” over the past decade, noting that 15 MW turbines were available on the market.', '“Experts now predict turbines with a 17 MW rating will be commonplace by 2035,” it said, before adding that projects centered around floating offshore wind were being developed “at huge volumes.”', 'These “floating projects” needed “significant quayside storage and assembly, necessitating more spacious facilities, on-land connective transport links within port areas and deeper-water ports.”', '“Several governments have identified port upgrades as vital to progressing offshore wind, from Taiwan to New York State.”', 'In relation to ports, Rystad Energy’s Lysne told CNBC that the U.S. — whose current offshore wind market is small — would “require more work as they do not have the same infrastructure in place as Europe.”', 'Change on that front does appear to be forthcoming. At the beginning of March, BP and Equinor — two businesses better known as oil and gas producers — signed an agreement to convert the South Brooklyn Marine Terminal into an offshore wind port.', 'In an announcement, Equinor said the port would become “a cutting-edge staging facility for Equinor and bp’s Empire Wind and Beacon Wind projects.” The site, it claimed, would be “a go-to destination for future offshore wind projects in the region.” Investment in infrastructure upgrades is expected to come in at $200 to $250 million.', 'All of the above feeds into the importance of infrastructure and logistics. Shashi Barla, who is global head of wind supply chain and technology at Wood Mackenzie, told CNBC that while companies had the technological capabilities, logistical challenges were proving to be “very difficult.”', '“It’s not that it is something new … we have been talking about logistics challenges since day one of the industry,” Barla said. “It’s that ... we are kind of now, today, approaching the tipping point.”', 'Around the world, major economies are announcing plans to ramp up wind energy capacity in a bid to reduce our reliance on fossil fuels.', 'While these goals are ambitious, it’s clear they face a number of hurdles. Notwithstanding the issues related to turbine size, it will require a gargantuan effort to bring all these installations online. There’s work to be done.   ', '“Increasingly, a lack of facilitating infrastructure is seen as a major limiting factor in the wind industry’s growth,” the GWEC’s report noted.', '“In many countries,” it added, “lack of infrastructure, such as grid and transmission networks, logistics highways and ports, is curtailing the expansion of wind power and stifling the very innovation needed to transform the energy system.”', 'Alongside these issues, wind turbines’ interaction with wildlife is likely to be another area of major debate and discussion going forward.', 'Only last week, the U.S. Department of Justice announced that a firm called ESI Energy Inc had “pled guilty to three counts of violating the MBTA,” or Migratory Bird Treaty Act.', 'As the 21st century progresses, wind energy is set for a massive expansion, but the road ahead looks far from smooth. With the U.N. secretary-general recently warning the planet was “sleepwalking to climate catastrophe,” the stakes couldn’t be much higher.']"
73,Fed takes first steps toward tightening policy without setting off a major market panic,2021-06-16T22:57:01+0000,"['The Federal Reserve’s hawkish tone sent stocks lower and bond yields higher, but for now, the central bank has managed to inch closer toward tighter policy without triggering massive market angst.', 'Even so, concerns remain about whether inflation is really just fleeting, and whether the central bank can continue to manage the path away from its extraordinary policies smoothly.', 'The Fed surprised investors Wednesday by including two interest rate hikes in its economic forecast for 2023 after having none in its last forecast in March. But it did not give any time frame on how long it will be before it begins to trim its bond purchases.', '“You’ve got an oil tanker. You’ve got to turn the wheel way before, and then the ship starts turning well down the way. That’s what we saw,” said Vincent Reinhart, chief economist at Mellon.']"
74,"Indian eyewear start-up Lenskart plans to go public in the next three years, CEO says",2021-07-23T09:29:26+0000,"['Indian start-up Lenskart plans to go public within the next three years, CEO and founder Peyush Bansal told CNBC on Friday.', 'The company, which sells eyewear online and via retail outlets, this week announced it received $220 million in funds, led by Singapore state investor Temasek and Falcon Edge Capital. Earlier this year, Lenskart raised $95 million from global investment firm KKR. It also counts SoftBank as one of its investors.', '“I think we would do an IPO in the next 24 to 36 months latest,” Bansal told CNBC’s “Street Signs Asia.”', '“We still want to achieve a little bit more scale and grow our business in India as well as Southeast Asia. Then, we’ll be ready to do IPO,” he said, adding that the plan is to grow revenue to more than $500 million.', 'Lenskart expanded into Singapore in 2019. Bansal said Friday that he is confident the start-up can become the top player in the city-state over the next 12 to 18 months.', 'The company, which is reportedly valued at $2.5 billion, plans to use the newly raised funds to expand its presence in India and grow its operations in Southeast Asia and the Middle East in the next three to four years.', 'Some of the capital would also be deployed as investments into artificial intelligence and other technologies.', '“There’s a huge demand for high-quality, affordable eyewear,” Bansal said about the Indian market. He claimed consumers buy on average four pairs of eyewear from Lenskart every two years, compared to a pair of eyewear every two-and-a-half years from other companies.', 'The biggest hurdle for Lenskart is creating a supply chain, according to Bansal. He explained that the company is in the process of building a manufacturing plant in India from which, it plans to ship about 150,000 prescription glasses a day.', '“A lot of this capital actually goes in long-term investment in technology and building the supply chain infrastructure,” he said.', 'Indian start-ups are entering what some investors have described as the “beginning of a new era,” where the prominent names are going public. Food delivery firm Zomato made its stock market debut on Friday, and its shares jumped over 70% at the open.']"
