,title,date,content
55,"Apple reports earnings in a hectic week for markets, with a Fed meeting and jobs report also on tap  ",2018-07-27T21:16:46+0000,"['Tech bellwether Apple leads the earnings parade in the week ahead, as market focus also shifts to the Fed’s mid-week meeting and Friday’s jobs report.', 'About a quarter of S&P 500 companies report in what will be the last big week for second-quarter earnings. Earnings are up about 22.6 percent over last year and are beating estimates at a pace of 4-to-1.', 'Caterpillar, Procter and Gamble, DowDuPont, Pfizer and Tesla are among the names reporting, but Apple will be the most widely watched. According to analytics firm Kensho, Apple in the past 12 quarters has had an average move of 4 percent, in either direction, on the day after its report. Apple follows a string of tech earnings that have been largely positive, with the glaring exceptions of Facebook and Twitter, which both had massive sell-offs after disappointing forecasts.', '“Obviously, you’ve got Facebook and Twitter on one side of the ledger, and you have Amazon on the other. Apple doesn’t have privacy issues, and I think Apple is generally going to be in pretty good shape,” said Jack Ablin, chief investment officer at Cresset Wealth Management. “Obviously the question is about trade issues. Is there any upset with their supply chain?”', 'Ablin said Apple could influence the market overall because “it has tentacles all over the economy and [market] indices.”', 'July’s employment report is released Friday, and 195,000 jobs are expected ,while the unemployment rate is expected to fall to 3.9 percent from 4 percent, according to Thomson Reuters. The key number to watch — average hourly earnings — is expected to continue its slow creep higher, rising 0.3 percent or 2.7 percent on an annual basis.', '“There’s a package of data, but I think the Fed statement is going to be important,” said Quincy Krosby, chief market strategist at Prudential Financial. “The market is trying to assess. Right now, September is a done deal. ... Do they see something in the tariff issues and in the economic data that perhaps softens their stance?”', 'The Fed meets Tuesday and Wednesday, but little is expected from the meeting, and it does not include a press conference. The next interest-rate hike is not expected until September, and the Fed is unlikely to give much in the way of new guidance about policy. Krosby said the question is whether the Fed offers any guidance that will provide clues about whether they are on track for another rate hike in December.', 'Concerns about trade wars faded somewhat in the past week, after President Donald Trump and European Commission President Jean-Claude Juncker said they would discuss trade issues and not implement any more tariffs during the talks. The Trump administration was also making progress with Mexico toward a revision of the NAFTA trade agreement.', 'But trade will be a focus Wednesday when $16 billion in tariffs on Chinese goods are expected to be implemented, and China is expected to put tariffs on U.S. goods in return. Administration officials have said talks with China have basically stalled, which is another reason analysts expect progress with Europe and on revising the North American Free Trade Agreement with Mexico and Canada.', '“I think the market is basically putting it on the back burner now, until new information comes in. I think the fact the president did come up with that truce with the EU was helpful, and then he made a comment that Mexico is next. Something big is going to happen with Mexico,” Krosby said. “The market realizes he does seem under pressure to ease these strident comments, [from] having business plans put on hold, and it was clear also the farmers are not crazy about the bailout.”', 'Bond traders are watching Tokyo next week after rumblings about a Bank of Japan policy change have been sending yields sharply higher. The 10-year Treasury rose to 2.98 percent Friday ahead of the second-quarter GDP report but was back to about 2.96 percent after the report of solid 4.1 percent growth failed to match the loftiest forecasts above 5 percent.', 'Yields move opposite price, and the U.S. 10-year yield has long been kept artificially depressed by the easy policies of global central banks. The last time the 10-year yield was at 3 percent was June 13, the day of the last FOMC meeting, when the Fed raised interest rates by 25 basis points.', 'The 10-year yield reached the year high of 3.12 percent on May 18.', '“The BOJ is probably more important than the Fed next week,” said Lee Ferridge, head of macro strategy, North America at State Street. He said the Bank of Japan could consider changing its policy of ending its targeting of the 10-year yield at zero, but more likely it could just hint at a change later on.', '“If the JGBs (Japanese government bond yields) move up, we could see the 10-year yield pushing back above 3 percent, certainly. If the BOJ does this, it’s bad for risk generally, including stocks,” he said. Ferridge noted that the European Central Bank is winding down its asset purchases, moving away from the easy stance it adopted during the European debt crisis.', 'Art Hogan, chief market strategist at B. Riley FBR, said if the 10-year yield, which moves opposite price, does hit 3 percent, it should not be a problem for stocks unless it continues to shoot higher. A continued flattening of the yield curve would be a bigger concern.', '“We get more scared if the 10-year doesn’t move up as much in yield as the 2-year does,” he said. The spread between the two yields, at 27 Friday, has been closely watched by the markets, since a flattening curve can be a warning about the economy, and one that actually inverts is viewed as a recession warning.', '“In an ultimate move in the 10-year yield back over 3 percent, equities don’t get sold on that unless the 2-year moves up higher and faster,” said Hogan. “If we get a new high on the yield, that’s also a new flavor.”', '“The last time it happened, the market freaked out. Then it calmed down again,” Hogan said. The stock market will take a 3-percent 10-year in stride “unless we break out to a new cycle high or the increase in the 10-year is matched by a faster pace and yield in the 2-year,” he said.', 'Monday', 'Earnings: Caterpillar, CNA Financial, Diamond Offshore, Seagate Technology, Bloomin’ Brands, Booz Allen Hamilton, Simon Property Group, AK Steel, KLA Tencor', '10:00 a.m. Pending home sales', 'Tuesday', 'Earnings: Apple, Procter and Gamble, Pfizer, Archer Daniels Midland, Arconic, Credit Suisse, Baidu, Cheesecake Factory, Pandora, Ralph Lauren, Nintendo, Cummins, Sanofi, Charter Communications, Samsung Electronics, Shire, Masco, Sony, BP, Honda Motor, Anadarko Petroleum, Devon Energy, Tanger Factory Outlet', 'FOMC begins two-day meeting', '8:30 a.m. Personal income', '8:30 a.m. Employment cost index', '9:00 a.m. S&P/Case-Shiller home prices', '9:45 a.m. Chicago PMI', 'Wednesday', 'Earnings: Humana, Autonation, Tesla, TripAdvisor, Yum China, Wynn Resorts, U.S. Steel, Sturm Roger, FireEye, Square, Encana, Spring, Genreac, Cedar Fair, Chesapeake Energy, Fitbit, Prudential Financial, MetLife, Arcelor Mittal, Bunge, Dominion Energy, Entergy, Allstate, American Water Works, Molson Coors Brewing, Automatic Data, Volkswagen, BNP Paribas, Public Service', 'Monthly vehicle sales', '8:15 a.m. ADP employment', '9:45 a.m. Manufacturing PMI', '10:00 a.m. ISM manufacturing', '10:00 a.m. Vehicle sales', '2:00 p.m. Fed rate decision, statement', 'Thursday', 'Earnings: Barclays, DowDuPont, Siemens, Aetna, AmerisourceBergen, Becton Dickinson, Cigna, Duke Energy, CBS, AIG, Kellogg, Clorox, Activision Blizzard, Tableau Software, Wingstop, El Pollo Loco, Shake Shack, GoPro, AMC Networks, TreeHouse, Wayfair, Regeneron, Teva Pharma, TransCanada, Yum Brands, Blue Apron, Allscripts Healthcare', '8:30 a.m. Jobless claims', '10:00 a.m. Factory orders', 'Friday', 'Earnings: Kraft Heinz, Petrobras, Allianz, Ameren, Buckeye Partners, Pinnacle West, LyondellBasell, CBOE Holdings, Toyota Motors', '8:30 a.m. Employment report', '9:45 a.m. Services PMI', '10:00 a.m. ISM nonmanufacturing']"
56,Treasury Secretary says Harley-Davidson’s decision to move jobs likely planned before Trump’s tariffs,2018-07-12T16:12:28+0000,"['Treasury Secretary Steven Mnuchin cast doubt Thursday over Harley-Davidson’s claim that new tariffs are forcing the company to shift jobs overseas.', '“My sense is that Harley-Davidson has previously planned on moving some of this manufacturing and it’s not just a result,” Mnuchin said, speaking at a Congressional testimony.', 'The motorcycle manufacturer said in a regulatory filing June 25 that President Donald Trump’s administration placing tariffs on European steel and aluminium would “significantly” hurt motorcycle sales, raising the cost of each bike by an average of $2,200. Harley-Davidson said it would be moving production of motorcycles shipped to the European Union, instead of increasing the price of the motorcycles for its dealers in order to cover the costs of the tariffs. The company’s release said 19 percent of its sales were to Europe in the first fiscal quarter of 2018.', '“Harley-Davidson believes the tremendous cost increase, if passed onto its dealers and retail customers, would have an immediate and lasting detrimental impact to its business in the region,” the company said at the time.', 'Mnuchin said that he has “not spoken to the Harley-Davidson people direct” but noted that the President has. Trump initially said in a tweet that he was “surprised,” before later going on the offensive, blasting Harley-Davidson and saying that his administration is now “working with other” motorcycle companies.', 'Pressed by Congressional representatives about the broader scope of Trump’s escalating trade war with China, Europe, Canada and Mexico, Mnuchin said he could “assure” them that he is “monitoring” the situation.', '“We have not yet seen any negative impact,” Mnuchin said. “We are monitoring the impact on the economy of all these different issues.”', 'Mnuchin also addressed the possibility of a global economic recession and the rise in yields, as the so-called yield curve between two-year Treasury note yields and 10-year note yields moves closer and closer to zero.', '“We don’t have an inverted yield curve. There’s a flattening of the yield curve that somewhat reflects people’s future view of rates and where rates will be. I don’t think that’s indicative in any way of recession concerns,” Mnuchin.', 'The declining yield curve means there is less payoff for investors willing to hold debt for a longer period of time. At the latest reading, the spread between the yield on the 10-year note and the two-year note was 26.19 basis points, down from above 90 basis points early in the year.']"
57,Weiss: Here’s your hedge fund investment setup for the week ahead,2016-11-21T00:57:46+0000,"['A record nine consecutive trading-day decline in the  pre-election. Then, President-elect Trump, catalyzing an  upside breakout of an 18-month trading range in equities,  decimating sovereign debt globally, including one of the fastest  backup in 10-year yields ever experienced, threatening a  multi-decade bull market in bonds, and threatening to stoke the  near moribund flames of tepid inflation, a task that trillions in  monetary stimulus and millions of words and phrases too carefully  uttered by central bankers have been unable to accomplish. And  the First Twitter account going virtually silent on November 9th! ', 'All surprises – just like a child’s first visit to the Fun  House, a new surprise has accompanied each day of trading, a  continuation of Brexit and its aftermath, the lesson being that  George Santayana is definitively out of style and the only  condemnation is accorded to those who ignore the money flows  rather than those who ignore the past because there is no  playbook to refer to, no Yoda to consult, and no three-year period of  underperformance to rely upon before your assets go  elsewhere. ', 'Unquestionably, the market has had a very strong, very bullish  tone to it since Trump took the election, but underneath the  headlines investors have been making choices. The more dollar=sensitive index, the S&P 500, stands alone in not making a  new high and sector performance, away from financials and  industrials, has averaged about plust 2 percent except for the yield stocks,  including consumer staples with exposure to both the dollar and  yield, have been hit hard. The smaller cap, more domestically  focused Russell 2000 has been a meteor shot. ', 'Then there is tech.  In the immediate aftermath of the election, the tech sector was  the ATM for healthcare, banks and industrials, but has since  recovered and is essentially flat since November 8th. ', 'What I find frightening about all this newfound positivity  driving markets higher is that it actually makes a lot of sense  to me – and not just in retrospect. ']"
58,IMF says Asian economies will account for most of global growth,2016-05-03T02:30:00+0000,"['  Asia’s economies may have been dragged by a slowdown in China,  but they’ll still power most of the world’s growth, the  International Monetary Fund (IMF) said Tuesday. ', '  “Asia is impacted by the still weak global recovery, and by the  ongoing and necessary rebalancing in China,” said Changyong Rhee,  director of the Asia-Pacific Department at the IMF, in a  statement.', '  “But domestic demand has remained remarkably resilient throughout  most of the region, supported by rising real incomes, especially  in commodity importers, and supportive macroeconomic policies in  many countries.”', '  The Asia Pacific region is expected to grow at a strong 5.3  percent this year, accounting for nearly two-thirds of global  growth, the IMF said in its Regional Economic Outlook. That would  still mark a tick down from last year’s 5.4 percent growth.   ', '  The IMF is forecasting India will remain the world’s  fastest-growing large economy, set to grow 7.5 percent this year  and next as it benefits from lower oil prices. Last year, India’s  economy grew 7.3 percent. ', '  It expects Vietnam will be among the region’s fastest growing  economies, while domestic demand will remain resilient in the  Philippines and Malaysia.  The IMF forecasts Vietnam’s  economy will grow 6.3 percent this year, down from 6.7 percent  last year. ', 'It expects Malaysia’s growth will slow to 4.4 percent  this year from 5.0 percent last year and it forecasts the  Philippines’ economy will expand 6.0 percent this year, up from  5.8 percent last year. ', '  The IMF noted the region’s downside risks loom large, ranging  from slowing growth in developed markets and weak global trade,  to low commodity prices and high domestic debt in certain  countries. ', 'At a press conference on Tuesday, Rhee noted that in the wake of the global financial crisis, Asia relied heavily on fiscal policy and now leverage levels in the region were much more severe than in other regions, especially levels of corporate and household debt. ', 'At the same time, he noted that the region’s corporate profitability levels were relatively low, marking a potential vulnerability if not addressed urgently. ', '  But in the report, the IMF noted that outcomes could be more positive than its  forecasts. ', '  “Low commodity prices could be a bigger boost to the region’s  economies than expected; and regional and multilateral trade  agreements, such as the Trans-Pacific Partnership, could benefit  Asia-Pacific even before they are ratified,” the IMF said. ', '  But the outlook for individual countries varied widely. ', '  China, which is rebalancing its economy away from a dependence on  manufacturing and toward consumption, is expected to see its  economic growth slow to 6.5 percent this year and 6.2 percent in  2017, from 6.9 percent last year, the report said. ', '  “While this transition to slower but more sustainable growth is  desirable for both China and the global economy, it is causing  changes in the manufacturing sector over the medium-term, as  heavy industries, such as steel and shipbuilding, face major  consolidation to reduce excess capacity,” the IMF said. ', '  But it also noted that not all of the regional spillovers from  China’s economy are negative. While there are larger costs  short-term from exposure to China’s slowdown, Asia also reaps  medium-term benefits from that greater exposure, the IMF report  said. ', '  “While ongoing rebalancing in China will weigh more heavily on  Asian countries with higher exposure to China’s domestic  investment, exposure to China’s consumption will provide a buffer  and may boost exports of some countries,” it said, citing in  particular Chinese consumers’ interest in higher-quality,  high-protein foodstuffs. An increase in outbound Chinese tourists  will also benefit countries that attract them, the IMF said.', 'In the press conference on Tuesday, Rhee said countries such as New Zealand and India, which sell consumption goods, would will likely benefit, while countries such as South Korea or Taiwan that sell intermediate or investment materials, which may need assembly within China, will likely face headwinds. ', '  The multi-lateral lender also expects a marked slowdown in  Japan’s economic growth ahead. While Japan’s GDP is forecast to  grow at 0.5 percent this year, in-line with last year, the IMF  expects it will contract 0.1 percent in 2017, hit by a widely  expected increase in the consumption tax set for next year. ', '  “This forecast does not take into account likely  growth-supporting policies to offset the increase,” the report  noted, but it added “an ageing population and high public debt  remain major drags on Japan’s long-term growth.”', 'Rhee said in the press conference that the IMF would incorporate Japan’s likely introduction of growth-supporting policies into its forecasts once it knew what kind of package the country would use. ', 'He also expressed some concern over Japan’s public debt, which exceeds 200 percent of GDP, adding that the country’s ability to maintain those debt levels “beats textbook economics,” and that it  wasn’t clear how long that could continue.', '  Follow CNBC International on Twitter and Facebook.', ' —By CNBC.Com’s Leslie Shaffer; Follow her on  Twitter @LeslieShaffer1']"
59,This chart shows jobs in industries like mining and construction are thriving under Trump,2018-06-01T19:18:50+0000,"['One of President Donald Trump’s top priorities has been creating new jobs in the United States.', 'CNBC analyzed the cumulative job growth in each industry since the president’s November 2016 election to help gauge which industries are growing at the fastest pace.', 'Source: Bureau of Labor Statistics, Microsoft Excel', 'At the top of the list, jobs in the mining and logging industry are up 13.5 percent since the election, well above the gains in construction and transportation, which made second and third place, respectively. To be sure, job growth in oil and gas extraction — which are included in the category — typically provide a boost to the headline number.', 'In the No. 2 spot, the construction industry is one of the hottest in the American economy in terms of employment and has been explicitly cited by the Bureau of Labor Statistics as an area of better-than-average growth.', 'While explanations for the growth range from increased capital investments from the private sector to a swell in oil rig building, the number of workers in the construction industry has grown nearly 6 percent since Trump’s victory.', 'Employment in construction and extraction occupations is expected to grow 11 percent from 2016 to 2026, according to the Labor Department.', 'A persistent shortage of truck drivers in the transportation industry has kept companies scrambling to hire workers to move their wares. Several companies, including chipmaker Nvidia and toymaker Hasbro have recently reported how the scarcity is affecting their business.', 'Further, multiple signs of inflation in freight-related industries are at or near historical highs, a phenomenon that could spell price pressures for the rest of the economy. Jobs in the industry have climbed 4.6 percent since Trump’s election.', 'The president has also lauded the manufacturing industry as essential to the health of the American economy as well as crucial to national security.', 'Perhaps the most notable manifestation of Trump’s “American First” policy in the economic sphere is the administration’s consistent use of tariffs on foreign goods like steel and aluminum.', 'tweet', 'Based on government data, jobs in the manufacturing industry have grown 2.7 percent since November 2016, just shy of the average growth rate.']"
60,Billionaire Todd Wagner is trying to do for charities what Amazon did for retail,2016-10-04T14:00:00+0000,"[' In 1995, Todd Wagner and his business partner Mark Cuban  pioneered streaming audio and then video over the  internet.', ' AudioNet, which they eventually renamed to  Broadcast.com, went public in 1998 and was sold to Yahoo for $5.7  billion in 1999. It made Wagner  and Cuban billionaires.', ' In the wake of the sale, Wagner was twice offered the  role of chief operating officer of Yahoo, which, in the 1990s,  had the cachet that Google does today. He passed up the  opportunity twice because he wanted to figure out a way to give  back.', '  Wagner is from Gary, IN, a small town a couple dozen miles  south of Chicago that was founded in 1906 by The United  States Steel Corporation as home for the Gary Works, the manufacturing  company’s largest plant.', '  The Midwestern town’s seal calls it the “City of the Century,” but today blight and poverty  have filled in gaps vacated by changing industry. Once  called “Magic City” for the hope and  opportunity available, the town’s own Department of Commerce  doesn’t deny the city’s misfortune. “Gary  Department of Commerce will be used as a tool to mount a full  assault on record unemployment and a stalled local business  environment,” the website  reads.', '  Becoming an overnight billionaire compelled Wagner to contribute  some of his wealth to those less fortunate. “I had grown up in  Gary, Indiana. I’d seen a steel mill, blue-collar kind of town  and the decay that that can create,” Wagner told CNBC at the  Iconic conference in Boston in September.', '  “I wanted the opportunity for me to try to give back, to try to  figure out a way to maybe use some of this treasure, some of, hopefully, my talents and time to figure out how to make a  difference,” said Wagner. His first efforts were all focused on  empowering disadvantaged kids, especially through his namesake  foundation. Early on, he would swoop in and write checks.', '  Then he got to a point where he determined that charity was  operating less efficiently than it could or should. If he could  use some of his technology background to help charities, they  would be able to raise significantly more money.  ', '  “The entrepreneur rises again,” said Wagner. He told himself,  “I’m going to put something together that helps transition these  companies from a very analog way of doing things to a digital way  of doing things. So all of the platforms we’ve built are to do  just that — to take them just like we hopefully did for  streaming media, like Amazon did for retail, I’m trying to do the  same thing for charities.”', ' And he did just that. Wagner is the founder and CEO of the Charity Network,  which is the umbrella for three tech-driven fundraising  platforms. Charitybuzz is an online auction  for experiences and meetings with celebrities to benefit  charity. Prizeo is an online sweepstakes to  benefit charity. And Chideo bills itself as  YouTube for charity. Online content from celebrities and industry  insiders is made available for a fee to benefit charity. Together, the three online charity platforms have raised  over $200 million.', '  Wagner’s work giving back validates his claim that while becoming  wealthy will change your life, it won’t change who you are.', '  “What wealth does is amplifies what’s inside,” he said. “So if you’re  instinctively somebody who’s passionate or cares about others, you’re going to do that. If you’re instinctively someone who  maybe doesn’t, then you’re not going to really take that path.”', ' More from iCONIC:  Billionaire Todd Wagner says aspiring entrepreneurs  should ask themselves 2 questions A  self-made billionaire describes what it feels like when you  suddenly get rich  KIND CEO, a Mexican immigrant, on one of Trump’s favorite  issues']"
