,title,date,content
39,Who wins and loses in ’21st century trade agreement’,2015-11-13T19:07:53+0000,"['  Governments released the full text of the Trans-Pacific  Partnership earlier this month, and experts are beginning to  weigh in on the divisive trade pact that seeks to connect countries  representing more than 40 percent of global GDP.', '  Industry groups and unions have voiced strident opposition to the  TPP — frequently called the “21st century trade agreement” — and U.S. presidential candidates in both parties have bashed the  agreement. Republican front-runner Donald Trump, for instance, has  called the trade pact “an attack on America’s business,” but  experts say many businesses will likely benefit from the  deal.', '  “For some sectors it’s a good agreement, for others I have  concerns,” said Tim Brightbill, a partner at Wiley Rein  specializing in international trade law and policy.', 'Brightbill, who also serves as vice chair of the U.S. government-administrated Industry  Trade Advisory Committee on Services and Finance Industries,  pointed to the tech and telecommunications sectors as likely  beneficiaries of the deal.', 'The “electronic  commerce” section of the TPP text, in particular, lays  out explicit agreements that will remove barriers to entry for  Silicon Valley companies and others. These include clauses on  reasonably comprehensive consumer and personal identification  protection, and an agreement that a country cannot force  companies to use computing facilities within its borders.', '  For many tech firms, the most attractive piece of the deal may be  that it says that “No Party shall require the transfer of, or  access to, source code of software owned by a person of another  Party, as a condition for the import, distribution, sale or use  of such software, or of products containing such software, in its  territory.” ', '  In other words, companies will never be forced to hand over their  code — a topic currently sparking fears in Silicon Valley as  China (not a TPP member) seeks a peek at software’s code before it can be used in  key sectors. Any fears that TPP countries could enact similar  mandates would become moot if the deal were approved, likely  spurring increased entrance into those markets.', ' Read More China may  try to force US tech firms to give up code', '  Another apparent winner from the deal is U.S. agriculture. Derek  Scissors, a scholar for the American Enterprise Institute, wrote  in a Thursday analysis that  “American agriculture producers will be understandably happy” by  the increased access for their products abroad. This includes  soybeans and many other foodstuffs, but, Scissors noted, some  barriers still remain.', '  On the other side of the equation are U.S. manufacturers —  “I’m having a much harder time seeing how TPP helps them increase  exports or compete around the world,” Brightbill reflected.', '  One element of this is the lack of any real provision about  currency manipulation, experts and industry groups have said, as  the relative strength of the dollar accounts for much of U.S.  manufacturing’s woes. There remains considerable debate, however,  on whether manipulation is even a major problem with which  Washington should be grappling.', '  But another, less discussed, piece of the puzzle is the rules of  origin. These rules dictate what percentage of a good’s  components need to be manufactured in TPP member countries for those  products to qualify for duty-free status. As a 2013 Heritage Foundation  brief recognized, these rules “can make or break the  Trans-Pacific Partnership.”', '  American manufacturers (and certainly workers) generally want  higher percentage rules so that component competitors in nonpact  countries can’t benefit from decreased tariffs. On the other  hand, too stringent rules risk distributing the deal’s benefits  to few — or none — as nearly every company uses an  increasingly global supply chain.', '  While the North American Free Trade Agreement requires an auto to  include 62.5 percent of its content value in order to qualify for  the deal, TPP will only need 45 percent.', ' Read More Trans-Pacific Partnership: GOP candidates split on  deal', '  “If you’re a U.S. steel manufacturer, for example ... there’s a  scenario now where China can supply the steel or make more than  half the input, and if the rest is done in Malaysia or Vietnam,  it’s now a product of TPP and eligible for duty-free treatment,”  Brightbill said. “It’s hard for me to see how that will help U.S.  manufacturing in general.”', '  Another rules of origin problem for U.S. firms may be their  complexity, as the TPP “risks rendering firms uncertain how to  take advantage of treaty terms and confusing customs agents  charged with administering those terms,” according to Scissors.', '  Other parts of the TPP deal are less easy to grade before their  implementation. Experts have alternately praised and criticized  the rules governing state-owned enterprises. The  first-of-their-kind agreements make key headway in an important  issue facing American companies, but some, including Scissors,  worry that they don’t go far enough, and therefore establish a  loose precedent.', 'Read More  TPP: Why it’s too early to pop the champagne', '  All in all, Brightbill said many of his corporate clients are  concerned about how the TPP would shake out if approved.', '  “They are great companies that are world-class competitive, and  yet they struggle to export around the world because of trade  barriers in many other countries, including TPP countries,” he  said. “For them, if they can get their products into these  markets it would be a big win, but they are very concerned that  we are simply opening our market ... and we won’t see real  market opening from countries like Korea, Japan, Malaysia and  Vietnam.”', '  In fact, he said, while the U.S. remains a relatively easy market  to enter, some countries have barriers —regulatory and  otherwise — that trade agreements have difficulty  addressing.']"
40,The Murky Future of Nuclear Power in the United States,2017-02-18T17:33:43+0000,"['This was supposed to be America’s nuclear century.', 'The Three Mile Island meltdown was two generations ago. Since then, engineers have developed innovative designs to avoid the kinds of failures that devastated Fukushima in Japan. The U.S. government was earmarking billions of dollars for a new atomic age, in part to help tame a warming global climate.', 'But a remarkable confluence of events is bringing that to an end, capped in recent days by Toshiba’s decision to take a $6 billion loss and pull Westinghouse, its American nuclear power subsidiary, out of the construction business.', 'The reasons are wide-ranging. Against expectations, demand for electricity has slowed. Natural-gas prices have tumbled, eroding nuclear power’s economic rationale. Alternative-energy sources like wind and solar power have come into their own.', 'And, perhaps most significantly, attempts to square two often-conflicting forces — the desire for greater safety, and the need to contain costs — while bringing to life complex new designs have blocked or delayed nearly all of the projects planned in the United States.', '“You can make it go fast, and you can make it be cheap — but not if you adhere to the standard of care that we do,” said Mark Cooper of the Institute for Energy and the Environment at Vermont Law School, referring to the U.S. regulatory body, which is considered one of the most meticulous in the world. “Nuclear safety always undermines nuclear economics. Inherently, it’s a technology whose time never comes.”', 'In the process, the U.S. could lose considerable influence over standards governing safety and waste management, nuclear experts say. And the world may show less willingness to move toward potentially safer designs.', 'More from The New York Times:', ' A Bee Mogul Confronts the Crisis in His Field', ' Greeks Turn to the Black Market as Another Bailout Showdown Looms', ' Once Again, the Estate Tax May Die', '“I’m concerned that if the U.S. is not seen as a big player, and doesn’t have that kind of market presence, that we won’t be in a competitive position to bring those standards back up,” said Richard Nephew, a senior research scholar at the Center on Global Energy Policy at Columbia. “If you’ve got more lax safety standards worldwide, I think that’s a problem from an industry perspective as well as just a human standard.”', 'This may be an advantage for state-owned nuclear industries worldwide. Often they benefit from long-term national policies in places like Eastern Europe, Asia and the Middle East.', 'By contrast, the Toshiba-Westinghouse withdrawal from nuclear construction shows how daunting it can be for the private sector to build these plants, even with generous government subsidies like loan guarantees and tax credits. Projects take decades to complete. Safety concerns change along the way, leading to new regulations, thousands of design alterations, delays and spiraling costs for every element.', 'In one case, even the dirt used to backfill excavated holes at the Westinghouse project in Georgia became a point of contention when it did not measure up to Nuclear Regulatory Commission standards, leading to increased costs and a lawsuit.', 'Thus far in the U.S., only the Tennessee Valley Authority, itself a government corporation, has been able to bring a new nuclear reactor into operation in the last 20 years.', 'Of the dozens of new reactors once up for licensing with the Nuclear Regulatory Commission, only four are actively under construction. Two are at the Alvin W. Vogtle generating station in Georgia, and two at the Virgil C. Summer plant in South Carolina. Both projects, which plan to use a novel reactor from Westinghouse, have been plagued by delays and cost overruns, some stemming, paradoxically, from an untested regulatory system intended to simplify and accelerate their development.', 'The projects, more than three years late and billions over budget, are what pushed Westinghouse — one of the last private companies building nuclear reactors — and its parent, Toshiba, to the brink of financial ruin, resulting in Toshiba’s chairman stepping down.', 'The company has said that Westinghouse will complete the reactors for the projects it already has underway, including two in China. But the fate of other projects in the United States and abroad that plan to use the Westinghouse reactor, known as the AP1000, are in doubt, along with the role of the United States in the future of nuclear energy. It is also unclear how President Trump will approach nuclear energy development, which has broad and overlapping implications for tax and trade policies, economic development and national security.', 'The AP1000 is considered one of the world’s most advanced reactors, with simplified structures and safety equipment which were intended to make it easier and less expensive to install, operate and maintain. It has been designed with an improved ability to withstand earthquakes and plane crashes and is less vulnerable to a cutoff of electricity, which is what set off the triple meltdown at Fukushima.', 'The industry has lurched through boom and bust cycles before.', 'Nuclear construction had all but disappeared in the United States, particularly after the partial meltdown at Three Mile Island in Pennsylvania in 1979. Concerns over climate change led to renewed interest in building new plants under the administration of George W. Bush, however. The Bush-era energy policy acts authorized $18.5 billion in loan guarantees, plus tax credits like those available for wind and solar.', 'Determined to avoid the delays and ballooning costs that were common as plants were built in the 1970s and ’80s, federal regulators had devised a new licensing process.', 'Under the old system, companies received construction permits based on incomplete plans and then applied for an operating license, often leading to rebuilding and lengthy delays. The idea for the new system was that companies would submit much more complete design plans for approval, and then receive their operating licenses as construction started. That way, as long as they built exactly what they said they would, the process could move more quickly.', 'In the meantime, companies like Westinghouse and General Electric were developing a new generation of reactors intended to operate more safely. With the AP1000, for instance, emergency cooling for the reactor mainly relies on natural forces, like gravity, to propel the coolant, rather than relying on mechanical pumps powered by electricity. The problem is that electricity can fail, as it did at Fukushima, which can lead to disastrous overheating in a damaged reactor of an older design.', 'In addition, Westinghouse was engineering its equipment so that large components of the plants could be made in sections at factories, then welded together and lifted into place with cranes at the construction site. In theory, this approach would save money and time, requiring far less skilled labor than the old, bespoke approach, in which workers assembled more parts onsite.', 'By 2008, Westinghouse had deals to expand two existing plants with the electric utilities Georgia Power and South Carolina Electric & Gas. Little went as hoped.', 'Because nuclear construction had been dormant for so long, American companies lacked the equipment and expertise needed to make some of the biggest components, like the 300-ton reactor vessels. Instead, they were manufactured overseas, adding to expense and delays.', 'One reactor vessel, headed for Georgia Power’s Vogtle plant from the Port of Savannah, almost slipped off a specialized rail car. That led to a weeks-long delay before a second attempt was made to deliver it.', 'And, in a separate snafu, while working on the plant’s basement contractors installed 1,200 tons of steel reinforcing bar in a way that differed from the approved design. That triggered a seven-and-a-half month delay to get a license amendment.', 'To some extent, the unexpected delays were to be, well, expected, given the novelty of the design and the fact that builders were decades out of practice. Any large undertaking involving so many first-of-a-kind complexities would be likely get tripped up somewhere, said Daniel S. Lipman, vice president of supplier and international programs at the Nuclear Energy Institute, which represents the industry.', '“Whether you’re building a nuclear power plant or providing a new locomotive or a new fighter jet complex for the Defense Department, the first of a kind almost always takes longer to be deployed,” he said.', 'And then there was Fukushima, when an earthquake and tsunami knocked out both grid and backup emergency power at the plant, disabling its cooling systems and leading to the meltdown of three reactors. The plant remains shut down, and the decommissioning and cleanup process is projected to take as long as 40 years.', 'The Japan disaster prompted regulators to revisit safety standards, slowing approval of the Westinghouse designs and resulting in new requirements even after the Nuclear Regulatory Commission gave the go-ahead for the Georgia and South Carolina projects. That led to more costly delays as manufacturing orders had to be changed.', 'As all of that unfolded, Westinghouse was having troubles with the contractor it chose to complete the projects, a company that struggled to meet the strict demands of nuclear construction and was undergoing its own internal difficulties after a merger. As part of an effort to get the delays and escalating costs under control, Westinghouse acquired part of the construction company, which set off a series of still-unresolved disputes over who should absorb the cost overruns and how Westinghouse accounted for and reported values in the transaction.', 'Toshiba, which would like to sell all or part of its controlling interest in Westinghouse, has said it will continue to look into Westinghouse’s handling of the purchase.', '“Certainly they underestimated the amount of liability or cost overruns that these projects were in,” Robert Norfleet, a managing director at Alembic Global Advisors who has followed the machinations, said of Westinghouse. “I don’t really know how they can’t take the blame for that. That’s something within their own due diligence that they needed to do.”', 'In the meantime, the main stage for nuclear development will move overseas to places like China, Russia, India, Korea and a handful of countries in the Middle East, where Westinghouse will have to find partners to build its designs.', 'In China, plants using an earlier model of the AP1000 are moving toward completion. If they are successful, that may stir up more interest in the technology, and future installations may go more smoothly. But Toshiba’s ambitions of installing 45 new reactors worldwide by 2030 no longer look feasible.', 'Indeed, despite the much-ballyhooed ingenuity of a new generation of reactors designed by the likes of Westinghouse and G.E., countries may stick with older technologies that they can produce and install more quickly and cheaply. “Until several of these new designs — including the AP1000 from Westinghouse — come online on time and on budget,” said Brent Wanner, an analyst at the International Energy Agency, “it will be an uphill battle.”']"
41,"Apple, Amazon and the Fed all compete for attention in the week ahead",2017-01-27T23:59:35+0000,"['Markets will be busy with economic reports and earnings, but Washington could continue to overshadow even the monthly jobs report and the Fed in the week ahead.', 'Earnings from Apple, Amazon.com, Facebook and major drug companies Merck and Pfizer are among the dozens of companies reporting earnings. The Fed meets Tuesday and Wednesday and while no action is expected, the statement is expected to sound a little more hawkish as it looks forward to rate hikes.', 'The January employment report Friday is the highlight of a heavy data calendar, which also includes personal income and spending Monday, the employment cost index Tuesday and car sales and ISM manufacturing data Wednesday.', 'President Donald Trump wrapped his first week in office with a flurry of executive orders, tackling everything the Affordable Care Act to energy infrastructure to immigration. He met with U.K. Prime Minister Theresa May in his first official meeting with a head of state. ', 'Trump did rattle Mexico over the $60 billion annual trade deficit the U.S. has with Mexico, and as the administration engaged in talks with Mexican officials, the president got into an exchange with the president of Mexico over who would pay for a wall along the southern U.S. border. After an awkward diplomatic moment, the two presidents talked and then issued a conciliatory joint statement about how they will continue to talk. ', 'Markets took all of it in stride, and stocks ended the week with gains. The Dow, over 20,000 for the first time, ended the week at 20,093, up 1.3 percent for the week, while the , above 2,300 briefly, ended the week at 2,294, up 1 percent. ', '  Sixty-six percent of the S&P 500 companies reporting earnings  so far have beaten estimates, and profit growth is coming in at  about 6.8 percent, according to Thomson Reuters.', ' “The Fed, I think will be a reminder that the Fed is still  going to be an important ingredient in the market’s performance  this year. Next week, there’s no press conference and I would  expect the language in the statement that comes out after the  meeting to sound roughly balanced. That’s what we were left with  last time,” said Leo Grohowski, chief investment  officer at BNY Mellon Wealth Management. Grohowski said there’s a  low chance of a hike even at the Fed’s March meeting but he does  see two to three rate hikes this year.', '  “Nothing [on rate hikes] until June, but therein lies the  potential risk. Most of the focus next week will be on employment  but over the course of the week I’m watching inflation. That’s  something we have to keep an eye on,” Grohowski said. ', '  Wages have begun to rise, and CPI headline inflation crossed 2  percent last month for the first time in two years. “We get a  couple of important reports. There’s a PCE report [Monday] and  the wage report in the employment report” on Friday, he said.', '  Amherst Pierpont chief economist Stephen Stanley  said he’s also watching the inflation data, and expects to see  average hourly wages rise by about 0.3 percent in Friday’s  employment report. He expects 165,000 nonfarm payrolls.', '  “165,00 is pretty similar to what we’ve seen in the last two to  three months of 2016. I think the labor markets have gotten tight  so it’s going to be difficult to see big gains at this point,”  said Stanley. “The wage numbers are going to be trending higher.  They moved in a pretty definitive way last year. We’re at the  point in my view, where we’re past full employment. We’ve seen  wages rising.”', '  Traders say Washington will be the big focus again next week, and  markets are looking for information on the Trump programs that  have driven stocks higher. They are also cautiously watching for  any developments on trade that could seem protectionist. They  will also be watching for any news from Trump’s separate  weekend phone calls with Russian President Vladimir Putin and  the leaders of Germany and France.', '  “I’m amazed at how under control the volatility has been in the  face of these daily headlines,” said Grohowski. “In the bigger  picture, that’s been one surprise ... how the market broadly speaking  has remained calm when you think of measures like the VIX. When I  think of the year unfolding it could be extremely dangerous to  extrapolate out anything resembling a calm, low volatility  environment.”', '  The VIX, the CBOE’s volatility index, declined 8 percent in the  past week to end at 10.58, hitting a three-year low Friday.', '  “I sense there’s still an awful lot of cash sitting on the  sidelines,” said Grohowski. “There’s as much anxiety about  missing the next leg higher, as there is about protecting for a  downside scenario.” Grohowski is targeting 2,350 for the S&P  500, not much higher this year. ', '  Opposite 2016, he said the market could perform better in the  first part of the year, rather than the last. He said the  market is focused on policy, particularly tax reform, and there  could be a misstep a long the way that drives it lower.   Analysts have been concerned that the trade talk could  begin to sound protectionist and result in tariffs. The White  House, in fact, raised the idea of a 20 percent import tax on  Mexican goods as one idea on Thursday.', '  “While we feel better about the earnings outlook, I do feel  creeping into sentiment, more expectations. I’m calling this year,  it’s going to be a ‘show me.’ I think there’s still expectations  driving this market higher,” he said. “It’s going to be show me  the tax reform, show me the regulatory ease. There’s a lot of  expectations building up.” ', ' What to Watch', ' Monday', ' Earnings:  Enterprise Products, Booz Allen  Hamilton, General Growth Properties, Leggett &  Platt, Reinsurance Group of America, Crane, Graco', '  8:30 a.m. Personal income', '  8:30  a.m. Consumer spending', '  10:00 a.m. Pending home sales', '  10:30 a.m.  Dallas Fed manufacturing', '  Tuesday ', '  Earnings:  Apple, Eli Lilly, Exxon Mobil, MasterCard, Pfizer,  Simon Property Group, UPS,  Aetna, AmerisourceBergen,  CIT  Group, Coach, Danaher, Harley-Davidson, HCA, Nasdaq OMX,   Nomura Holdings, Nucor, Paccar, Pentair, Sprint, Thermo  Fisher, Under Armour, Aflac, Valero Energy, Xerox,  Anadarko, Advanced Micro, Fortune Brands, Chubb,  U.S. Steel, WR Berkley ', '  8:30 a.m.  Q4 Employment cost index', '  9:00 a.m.  S&P Case-Shiller HPI', '  9:45 a.m. Chicago PMI', '  10:00 a.m. Consumer confidence', '  10:00 a.m. Housing vacancies', ' Wednesday ', ' Earnings:  Facebook, Allstate, Ameriprise,  Unum Group, Ameriprise, MetLife, Siemens, Anthem, Tupperware,  Baxter, Johnson Controls, Symantec, IAC/Interactive, American  Financial Group, Cabot, Legg Mason,  Automatic Data, Baxter,  Celanese, Dominion, Ingersoll-Rand, Marathon Petroleum,  WEC Energy, Pitney Bowes, Owens-Illinois, Torchmark, Cirrus Logic,  Altria', '  8:15 a.m.  ADP payrolls', '  9:45 a.m. Manufacturing PMI', '  10:00 a.m. ISM manufacturing', '  10:00 a.m. Construction spending', '  2:00 p.m. Fed decision', ' Thursday', ' Earnings: Merck, Amazon.com, Amgen,  Visa, Chipotle Mexican Grill, Estee Lauder,  ConocoPhillips, Deutsche Bank, Philip Morris, Royal  Dutch Shell, AutoLiv, Ball Corp, Cigna, NYTimes, AstraZeneca,  Daimler, Novo Nordisk, Becton Dickinson,  Boston Scientific, CME Group, Delphi Automotive, Marsh and  McLennan, Ralph Lauren, Parker Hannifin, Sony, Sirius XM  Radio, International Paper, A.O. Smith, Virtu Financial,  Ryder System, Lazard, CMS Energy, Eaton, Estee Lauder, Kimco  Realty, Motorola Solutions, athenahealth, Decker’s Outdoor, DeVry  Education, FireEye, GoPro', '  8:30 a.m. Jobless claims', '  8:30 a.m. Productivity', '  8:30 a.m. Unit labor costs', ' Friday', ' Earnings: Hershey, Honda Motor, AutoNation, Clorox, Philips 66, Apollo Global Management, LyondellBasell, Weyerhaeuser, Madison Square Garden', '8:30 a.m. Nonfarm payrolls', '  9:15 a.m. Chicago Fed President Charles Evans', '  9:45 a.m. Services PMI', '  10:00 a.m. ISM non-mfg.', '  10:00 a.m. Factory orders', ' Correction: this update fixes level of the Dow']"
