,title,date,content
0,Old Hummer plant now builds China-bound Mercedes SUVs,2015-08-11T17:07:21+0000,"['  Lamar Ashford has been waiting a long time to see  this.', '  Five years after General  Motors shut down production of the Hummer at the AM General  assembly plant in Mishawaka, Indiana, the assembly line that once  built the H2 is cranking out another SUV.', '  This time, it’s the Mercedes-Benz R Class.', '  “With this R series coming in, it is good for the community, good  for everyone’s family,” said Ashford, who has worked 14 years for  AM General.', '  Mercedes-Benz has contracted AM General to build the R Class  because the luxury automaker no longer has the space to build the  SUV at its plant in Vance, Alabama.  ', '  That plant, where Mercedes manufactures most of its SUVs, is  running at close to capacity. To keep up with demand, the German  automaker is cranking up production of popular models like the  GLK and M Class.  ', '  So it’s moved production of the R Class to northwest Indiana and  hired AM General to build models that will be shipped to China,  the only market where the SUV is sold.  ', '  Demand for SUVs in China has been strong, but the market overall  is pulling back.', '  On Tuesday, the China Association of Automobile Manufacturers  said retail sales of passenger vehicles dropped 6.6 percent in  July. It was the third time in four months auto sales have  dropped in China, the world’s largest auto market. In addition,  China on Tuesday devalued its currency by nearly 2 percent, a move that  could cut Chinese luxury consumption.', '  But Mercedes-Benz is confident it can ride out any impact the  devaluation action in China may have on its business.', '  “Let’s wait and see what happens,” said Jason Hoff of Mercedes-Benz. “You know we do a lot of hedging too. We protect  ourselves obviously for different currency changes so we will  just have to wait and see. But so far it has been a good year for  us.”', '  AM General President Howard Glaser maintains his  enthusiasm.', '  After five long years, the R Class is helping Mishawaka heal from  losing the Hummer.', '  “We are not just focused on the past, the Hummer and the H2. We  are looking to the future, we are looking to the front windshield  not the rearview mirror and we think it is going to be a great  ride,” said Glaser.', '  Mercedes’ hiring AM General to build the R Class is the latest  sign automakers are close to running at peak capacity.', '  After cutting U.S. auto production to 5.6 million vehicles in  2009, the auto industry has staged a huge recovery.  ', '  According to the consulting firm LMC Automotive, which tracks  auto production around the world,  U.S. auto plants will  build more than 11.8 million vehicles this year.', '  “We are seeing some pretty serious capacity constraints,” said  Jeff Schuster, senior vice president for forecasting with LMC  Automotive. “There are a few places where automakers have some  room, but in many plants they are pushing capacity.”', '  Right now, U.S. auto plants are utilizing 93 percent of their  capacity, with some plants running over 100 percent, according to  LMC.', '  “We’re seeing some plants where they have added weekend shifts or  they’ve increased the line speed in order to squeeze out a few  more vehicles,” said Schuster.', '  At the AM General facility in Mishawaka, there’s plenty of  capacity, and a skilled workforce ready to build the R Class.', '  Eventually, several hundred more workers are expected to be hired  as R Class production ramps up.', '  For Ashford, it’s welcome news that eases the pain of losing the  Hummer during the recession. “We were just ready to get back into  the plant. We love to work here,” he said.', ' Questions? Comments? BehindTheWheel@cnbc.com.']"
1,"‘Green’ fuels will cost the consumer — but we need to think long term, Maersk CEO says",2022-01-13T15:28:47+0000,"['The CEO of shipping giant Moller-Maersk admitted to CNBC Thursday that shifting to “green” fuels would come at a cost, but emphasized the importance of focusing on the bigger picture rather than short-term pain.  ', 'Soren Skou’s comments come a day after his company said it wanted the entire business to reach net-zero greenhouse gas emissions in the year 2040, 10 years ahead of its previous goal.', '“When we embark on this carbon neutrality journey, we are going to use … green fuels,” Skou, who was speaking to CNBC’s “Squawk Box Europe,” said. As a starting point, these fuels were “probably two to three times … much more expensive,” Skou said.', '“But we’re looking at this over a 20 year horizon and therefore, we think that the inflationary impact will be very modest when it comes out to the consumer.”', '“As an example, we are spending around $400 per container on fuels today,” Skou said. “If it triples we need to spend another $800 per container.”', '“That’s of course a lot, but … inside the container you have 8,000 pairs of sneakers, for instance, so it’s 10 cents per pair of sneakers. So that’s why I think … for the consumer, it will be manageable.”', 'According to the International Energy Agency, international shipping — a crucial cog in the world’s economy — was responsible for approximately 2% of “global energy-related CO2 emissions in 2020.”', 'With concerns about sustainability mounting and major economies and businesses around the world looking to cut emissions and meet net-zero targets, the sector will need to find new ways of reducing the environmental footprint of its operations.', 'Back in August, Maersk said it was ordering a number of large, ocean-going vessels able to run on what it called “carbon neutral methanol.” The firm said the vessels would be built by South Korea’s Hyundai Heavy Industries and have the capacity to carry around 16,000 containers.', 'Maersk said the ships would have a dual fuel engine set up, a feature which increases costs.', '“Additional capital expenditure … for the dual fuel capability, which enables operation on methanol as well as conventional low Sulphur fuel, will be in the range of 10-15% of the total price,” it said.', 'Shipping is not unique in attempting to find more sustainable ways of powering operations. In aviation, for example, a lot of discussions have taken place about the potential of sustainable aviation fuel, or SAF.', 'Last October the CEO of Ryanair, Michael O’Leary, acknowledged the need for ambitious sustainable aviation fuel targets but also expressed concerns about how food prices could be affected.', 'During a discussion at CNBC’s “Sustainable Future Forum,” O’Leary said his firm was investing “a lot of money” with Trinity College Dublin on research into SAF.  ', 'In April 2021, the two organizations launched a sustainable aviation research center backed by a 1.5 million euro ($1.72 million) donation from the airline. As well as focusing on SAF, the center will look at noise mapping and zero-carbon propulsion systems for aircraft.', 'Ryanair has itself set a target of powering 12.5% of its flights with SAF by the year 2030. But speaking to CNBC’s Steve Sedgwick, O’Leary said he thought it was “a very ambitious target — I’m not sure we’ll get there.” ', 'He went on to articulate his feelings about the wider effects of increasing SAF usage. “I do worry over the longer term, though, on sustainable aviation fuels … what’s that going to do to food prices going forward?”', '“I think we’re going to reach a point in the next 10 or 20 years where there will be challenges posed not just for the airline industry, but for industry in general, around sustainable aviation fuels where it may have an upward impact on food prices.” ', ' ']"
2,"Elon Musk says SpaceX has shipped 100,000 Starlink terminals",2021-08-23T23:36:55+0000,"['Elon Musk said in a series of tweets on Monday that his aerospace venture, SpaceX, has shipped 100,000 Starlink terminals so far, and is now serving 14 countries with license applications pending in others.', 'The tweets imply that Starlink added 10,000 subscribers in about 3 weeks. In late July, the company said it had about 90,000 users of its internet service, CNBC reported.', 'Starlink is an initiative of SpaceX to create a network of tens of thousands of satellites, known in the space industry as a constellation, to deliver high-speed internet to customers anywhere on Earth.', 'SpaceX rolled out its Starlink beta internet service at the end of 2020 with a program that allowed some customers to try it for $99 a month, not including up-front costs for shipping, taxes, installation and equipment like roof mounts to hold the terminals in place.', 'A Starlink Kit includes a satellite antenna dish, a stand, a power supply, and WiFi router.', 'More recently, SpaceX has indicated it plans to expand the service to work for in-flight internet, or on moving ships and in trucks.', 'SpaceX President and COO Gwynne Shotwell announced in February 2020 that the company would likely spin off its Starlink satellite business and may have an IPO for the unit in coming years.', 'The initiative has been a capital-intensive one for SpaceX already. In 2018, Shotwell predicted it would cost SpaceX about $10 billion or more to build the Starlink network.', 'Last week, federal filings revealed that SpaceX intends to use its Starship rocket as a primary vehicle to deliver its Starlink Gen2 satellites to orbit. SpaceX has already launched 1,740 satellites as part of Starlink, and is aiming for its Gen2 Starlink system to add around 30,000 internet satellites.']"
3,Amazon increases the price of Prime nearly 17% to $139 per year,2022-02-03T21:09:15+0000,"['Amazon is raising the price of its annual Prime membership to $139 from $119, the company announced on Thursday as part of its fourth-quarter earnings results.', 'Amazon last hiked the price of Prime in 2018, when it increased to $119 from $99. Four years before that, it raised the subscription fee to $99 from $79.', 'Amazon’s annual increase amounts to about a 17% rise in price. Amazon also raised the monthly price of a Prime membership from $12.99 to $14.99, the company said. New members will see the increased prices on Feb. 18, and current members will be billed at the higher rate after March 25.', 'Amazon stock rose more than 14% at one point on Thursday in extended trading.', 'Launched in 2005, Amazon Prime gives members access to free two-day shipping, as well as access to exclusive movies and TV shows, among other perks. As of last April, the service had more than 200 million subscribers worldwide. ', 'The membership program remains one of the biggest growth levers for Amazon’s core retail business. Prime members spend considerably more on Amazon than non-Prime customers, and they also shop more often.', 'Amazon is raising the price of Prime as it navigates the dual challenges of continued supply chain disruptions and labor constraints. The company raised wages and offered generous signing bonuses to attract workers in a tight labor market. To avoid delivery disruptions, it rerouted packages over longer and costlier distances to get them to facilities with enough staff to handle them.', 'The cost of keeping Prime members hooked on the service has also become more expensive for Amazon. The company spends billions of dollars annually to add more compelling video and music content to its streaming service. And, in recent years, Amazon has poured money into building out its logistics and fulfillment network to make one-day shipping the default nationwide.']"
4,"Norway’s Statkraft lined up to provide green hydrogen for 88-meter long, zero-emission ship",2021-06-24T10:15:58+0000,"['Energy firm Statkraft and its subsidiary Skagerak Energi have been awarded a contract to supply so-called green hydrogen to an 88-meter long, zero-emission ship planned to run between locations in Norway.', 'In a statement Wednesday, Statkraft — which is owned by the Norwegian state — claimed the vessel was the “world’s first hydrogen-powered cargo ship.” ', 'The contract was awarded by cement giant HeidelbergCement and Felleskjøpet, an agricultural cooperative. The two organizations are working with one another to develop the project.', 'The idea is for the ship — which will also have two rotor sails — to take grain from the east of Norway to the west of the country, carrying gravel back on the return journey. According to Norwegian Ship Design, a firm involved in the concept’s development, it could commence operations in 2024.', 'Those behind the initiative planned for Norway may describe it as a world first, but the field they operate in is becoming an increasingly crowded one.', 'In April, Flagships, a project that’s received funding from Horizon 2020, a research and innovation program from the EU, said it would “deploy the world’s first commercial cargo transport vessel operating on hydrogen.”', 'The inland cargo vessel will travel on the River Seine, in France, and commercial operations are expected to start this year.', 'While the project involving Statkraft is still a few years off from being fully realized, hydrogen ships have already been developed and put into use. Back in 2008, for example, a fuel cell ship capable of carrying passengers entered into service on a lake in Hamburg, Germany.', 'More recently, a number of projects focused on the development of hydrogen-powered maritime transportation have taken shape. Earlier this month, plans to build a sea-going ferry powered using hydrogen-fuel cells advanced after it was announced that a commercial contract for the development of a concept design had been awarded.', 'In March of this year Linde, a firm specializing in engineering and industrial gases, said it had been chosen by Norwegian firm Norled to provide liquid hydrogen and associated infrastructure for a hydrogen-powered ferry. The MF Hydra, as it’s known, will be able to carry both passengers and cars.', 'Described by the International Energy Agency as a “versatile energy carrier,” hydrogen has a diverse range of applications and can be deployed in sectors such as industry and transport.', 'It can be produced in a number of ways. One method includes using electrolysis, with an electric current splitting water into oxygen and hydrogen. If the electricity used in the process comes from a renewable source, such as wind or solar, then some call it green or renewable hydrogen.', 'Currently, the vast majority of hydrogen generation is based on fossil fuels, and green hydrogen is expensive to produce. Efforts are being made to drive costs down, however. The U.S. Department of Energy recently launched its Energy Earthshots Initiative and said the first of these would focus on cutting the cost of “clean” hydrogen to $1 per kilogram (2.2 lbs) in a decade.', 'According to the DOE, hydrogen from renewables is priced at around $5 a kilogram today. “Clean hydrogen is a game-changer,” U.S. Energy Secretary Jennifer M. Granholm said at the time, adding that it would help to “decarbonize high-polluting heavy-duty and industrial sectors.”']"
5,Miami-Dade mayor signs order to demolish rest of partially collapsed Florida condo building,2021-07-02T15:47:42+0000,"['Miami-Dade County Mayor Daniella Levine Cava signed an emergency order Friday authorizing the demolition of a 12-story condominium building in Surfside, Florida, that partially collapsed more than a week ago.', 'However, it will likely take weeks before the building, Champlain Towers South, is demolished as engineers evaluate all possible impacts of bringing the rest of the structure down, Levine Cava said.', '“The building poses a threat to public health and safety, and bringing it down as quickly as possible is critical to protect our community,” Levine Cava said during a Friday evening press conference.', 'The mayor said search-and-rescue operations remain the first priority of authorities even as they plan for the demolition. The death toll rose to at least 22 Friday evening, while 126 people are still unaccounted for.', 'Levine Cava and Miami Mayor Francis Suarez noted earlier Friday that one of the bodies recovered is of a seven-year-old child whose father works for the Miami fire department. ', '“It was truly different and more difficult for our first responders,” Levine Cava told reporters.', '“These men and women are paying an enormous human toll each and every day, and I ask that all of you, please keep all of them in your thoughts and prayers. They truly represent the very best in all of us, and we need to be there for them as they are here for us.”', 'Levine Cava also announced that a building in North Miami was found to be unsafe after it was reviewed by authorities, noting that it has not been recertified. Authorities have ordered an evacuation of the building, according to the Associated Press.', 'President Joe Biden, following his visit to Surfside yesterday, formally authorized the federal government on Friday to cover 100% of the cost of debris removal and emergency protective measures at the collapse site under the Public Assistance program for 30 days, beginning June 24.', 'Florida Division of Emergency Management Director Kevin Guthrie thanked the federal government and private-sector vendors for their support.', 'The Royal Caribbean Group is providing free housing and resources to search-and-rescue teams at one of its ships docked at the Port of Miami. Amazon has also aided search-and-rescue teams by donating 500 laundry bags, 2,000 laundry pods and 2,000 dryer sheets, Guthrie added.', '“The support that we have seen for our first responders has been absolutely incredible,” he said.', 'Gov. Ron DeSantis provided additional updates on Hurricane Elsa, noting that southern Florida could see tropical storm-force winds as early as Sunday night. Authorities are paying “special attention” to any potential impacts on Miami-Dade County.', 'DeSantis said search-and-rescue teams from Virginia, Indiana, Ohio, Pennsylvania and New Jersey will assist the state’s emergency response teams and preparations for Hurricane Elsa. ', 'Charles Cyrille, division director at the Miami-Dade County Office of Emergency Management, urged citizens to begin preparing evacuation plans, including three to seven days of supplies for each member of a household. Cyrille added that homes should also be prepared for impact by securing objects, such as garbage cans and patio furniture, that can be easily blown away by a hurricane. ', '“It is critically important that these preparatory activities begin today,” Cyrille said. ', 'Surfside Mayor Charles Burkett provided updates earlier Friday on Champlain Towers North, the sister property of the collapsed condo building. Burkett said arrangements have been made to relocate residents while experts prepare to conduct a forensic study into the structure to evaluate its safety.', 'Search-and-rescue operations resumed Thursday night after a daylong halt, with authorities hoping to expand the search area safely. The halt was due to structural concerns identified by subject matter experts, according to Miami-Dade Fire Rescue Chief Alan Cominsky. ', 'Investigations are still being conducted on the cause of the collapse. ', 'Recent evidence indicates that the 40-year-old condominium building had shown signs of major structural damage as far back as 2018, with a report citing issues with waterproofing beneath the pool and cracking in the underground parking garage. ', 'A video taken on the night of the collapse has also come to light, showing water pouring into the parking garage of the building. ', 'The National Institute of Standards and Technology announced Wednesday evening that it had launched a federal investigation into the cause of the collapse and to develop improved building codes. ', 'Former NIST Director Dr. Walter Copan, who led the agency under then-President Donald Trump until January 2021, told the Miami Herald that it could be a matter of months before NIST provides new facts from the probe. ', '“Generally, there will be an initial summary within three to six months to provide a status update to the public,” said Copan, according to the Herald. ', '“NIST’s job, first and foremost, is to brief the public regularly within NIST’s lane of technical analysis and root cause of the failure,” he said.']"
