,title,date,content
5,House competition bill aims to boost minorities in science and technology,2022-02-04T14:26:22+0000,"['Congress is aiming to reshape America’s workforce through new legislation that would direct more than $1 billion toward increasing diversity of the scientists, researchers and technologists who drive the innovation economy.', 'The measure includes $900 million for grants and partnerships with historically Black colleges and universities, $164 million to study barriers for people of color in the field and $17.5 million to combat sexual harassment. They’re part of a expansive package of bills known as the America Competes Act, which lawmakers hope will ensure the United States continues to lead the global economy.', '“We cannot compete internationally without having the available talent,” House Science Committee Chairwoman Eddie Bernice Johnson, D-Texas, told CNBC. “We’ve got to make sure we build in the mechanism … to get that talent.”', 'The House passed the package Friday. It includes signature items such as funding for the domestic semiconductor industry and efforts to tackle supply chain shortages. Speaker Nancy Pelosi had enough support to pass the legislation despite opposition from House Republicans who want to take a tougher stance against China. ', 'A version of the bill passed the Senate last summer with strong bipartisan support. The two chambers will have to negotiate a compromise version of the legislation. The White House has made getting the bill to the president’s desk one of the administration’s top priorities as its social spending plan and other legislative initiatives languish.', '“Our red line is doing nothing or taking too long,” Commerce Secretary Gina Raimondo told reporters Friday. She added: “My message to everyone is to find common ground, quickly. This should take weeks not months.”', 'A report from the National Academies of Sciences, Engineering and Medicine estimated the United States will need 1 million more people employed in those sectors over the next decade than it is currently on track to produce. The group said the country will not reach that goal without substantially increasing diversity in the labor force.', '“A clear takeaway from the projected demographic profile of the nation is that the educational outcomes and STEM readiness of students of color will have direct implications on America’s economic growth, national security, and global prosperity,” the report said.', 'The bill would also authorize new investments for colleges and universities that primarily serve students of color through research funding and enhanced engagement. About 18% of Black college graduates in science and technology come from historically Black colleges and universities, according to the National Science Foundation.', '“We’ve got to build the opportunity,” Johnson said. “We’ve got to invest in building talent from this level, which means if they’re at HBCUs, then we’ve got to invest in HBCUs.”', 'At Spelman College in Atlanta, more Black women have graduated with doctoral degrees than at any other school in the country. The historically Black college is planning to build a new innovation lab over the next two years thanks to a $10 million gift from the foundation named after Arthur Blank, co-founder of Home Depot.', 'The school’s president, Mary Schmidt Campbell, told CNBC that Washington also plays an important role by setting the national agenda. She said the new legislation could  “democratize” innovation and ultimately benefit businesses’ bottom line.', '“There’s of course the altruistic mission of making sure that everybody is included,” Campbell said. “But there is a self-interested reason why companies should be interested in diversity: It’s because it makes them better companies.”', 'Correction: This story was updated to correct the spelling of the Spelman College president’s name.']"
6,How to invest behind the smart car of the future,2021-09-05T12:17:48+0000,"['These stocks are poised to benefit as cars become more and more like tech devices, presenting a big opportunity for technology suppliers, according to Citi.']"
7,5 things to know before the stock market opens Friday,2022-02-04T12:56:16+0000,"['Here are the most important news, trends and analysis that investors need to start their trading day:', 'Dow futures fell nearly 200 points and the 10-year Treasury yield rose to 1.9% after Friday’s jobs report showed strong gains last month. Nasdaq futures rose early Friday, boosted by Amazon’s 11% premarket surge on strong cloud-led earnings after the bell Thursday. But Nasdaq futures went negative after the jobs data. Snap rocketed more than 40% higher in the premarket, the morning after delivering better-than-expected quarterly results and rosy forward guidance.', 'The U.S. economy created 467,000 jobs in January, the Labor Department reported Friday. That was much better than estimates for a 150,000 nonfarm payrolls gain. Expectations were all over the place coming into the print on worries the spike in Covid cases due to the raging omicron variant could jolt the data. In fact, many economists — such as those at PNC, Jefferies, Morgan Stanley and Goldman Sachs — had expected sharp declines in jobs last month. That clearly didn’t happen. The U.S. unemployment rate ticked up to 4% in January, slightly higher than estimates.', 'Amazon’s strong fourth quarter was carried entirely by its cloud business. In fact, North America and International e-commerce operations actually delivered losses. Amazon also reported a gain of almost $12 billion from its investment in electric vehicle marker Rivian Automotive. A Refinitiv analysis stripping out one-time items put adjusted earnings at $5.80 per share compared with estimates for $3.57. Revenue of $137.4 billion in Q4 slightly missed expectations. Amazon guided lower for first-quarter earnings and revenue.', 'Snap’s fourth-quarter adjusted earnings more than doubled estimates. Revenue and user growth also exceeded expectations. The Snapchat parent also issued an upbeat outlook. While saying it’s making progress adjusting to Apple’s new privacy policies that affect ad tracking, Snap has to contend with similar headwinds as Meta, which warned the Apple changes would result in a $10 billion revenue hit this year. On the post-earnings call, Snap’s CFO said, “It will take at least a couple more quarters for our advertising partners to build full confidence in our new measurement solutions.”', 'Shares of Ford, which have soared roughly 78% in the past 12 months, were tracking for an over 7% drop at Friday’s open. The automaker’s adjusted fourth-quarter earnings were well below estimates, while revenue also missed expectations. Ford’s stake in Rivian pumped up full-year net income. While hitting its annual earnings guidance for 2021, Ford fell short of production target estimates due to supply chain problems, including an ongoing shortage of semiconductor chips, the company’s CFO said on the post-earnings call. The company released solid guidance for 2022.', '— Reuters contributed to this report. Sign up now for the CNBC Investing Club to follow Jim Cramer’s every stock move. Follow the broader market action like a pro on CNBC Pro.']"
8,"Here are Friday’s biggest analyst calls of the day: Nvidia, Joann Stores, Broadcom and more",2021-09-03T12:16:50+0000,"['Here are the biggest calls from Wall Street analysts for Friday, Sept. 3.']"
9,UBS says these stocks could climb if Congress passes Biden’s infrastructure plan,2021-04-01T16:48:51+0000,"['President Joe Biden’s ambitious infrastructure package could spell big upside for a handful of stocks in the semiconductor, broadband and industrials industries, UBS told clients Thursday.', 'Chief U.S. equity strategist Keith Parker screened the broad Russell 3000 to arrive at about 200 U.S. stocks with significant revenue exposure to Biden’s $2 trillion infrastructure plan.', 'Based on that analysis, UBS recommends investors stay overweight industrials across most subindustries and metals. The brokerage likes the technology space, especially relevant semiconductor stocks that could be beneficiaries of a wide broadband rollout under the Biden plan.']"
10,UBS says these stocks could climb if Congress passes Biden’s infrastructure plan,2021-04-01T16:48:51+0000,"['President Joe Biden’s ambitious infrastructure package could spell big upside for a handful of stocks in the semiconductor, broadband and industrials industries, UBS told clients Thursday.', 'Chief U.S. equity strategist Keith Parker screened the broad Russell 3000 to arrive at about 200 U.S. stocks with significant revenue exposure to Biden’s $2 trillion infrastructure plan.', 'Based on that analysis, UBS recommends investors stay overweight industrials across most subindustries and metals. The brokerage likes the technology space, especially relevant semiconductor stocks that could be beneficiaries of a wide broadband rollout under the Biden plan.']"
11,China’s fastest growing city wants to be the next Silicon Valley — local systems may get in the way,2021-04-02T02:00:45+0000,"['BEIJING — As growing pressure from the U.S. pushes Beijing to build up its own technology, local systems are getting in the way.', 'Over the past forty years, experimentation with business-friendly policies in the southern Chinese city of Shenzhen helped turn it into the equivalent of Silicon Valley with homegrown tech giants such as Tencent and Huawei. But so far, other cities have yet to repeat Shenzhen’s success.', 'Meanwhile, national urgency for self-sufficiency in tech is central to a five-year development plan announced in March, with ambitious goals for research and development in seven “frontier” technologies such as semiconductors.', 'The central directive has local governments striving to do their part.', 'A 4.5-hour flight north from Shenzhen, the city of Xi’an has many of the right elements for tech innovation: research or manufacturing centers for semiconductors, aerospace and other high-tech industries; talent from local universities; and significant foreign investment. Both Samsung and U.S. chipmaker Micron have major operations in Xi’an, which was also the fastest growing major city in China last year.', 'Xi’an Mayor Li Mingyuan said in a statement last month to CNBC that tech innovation is at the top of his list for high quality development under Beijing’s five-year plan. He said that by 2025, Xi’an aims to achieve output in advanced manufacturing of more than 1 trillion yuan ($153.85 billion) and support more than 10,000 high-tech businesses, for total GDP of more than 1.4 trillion yuan. That’s about 40% growth from Xi’an’s GDP in 2020.', 'But analysts say the state is stifling Xi’an’s potential.', 'The biggest difference between Shenzhen and Xi’an is that businesses form the major part of Shenzhen, while Xi’an needs to reduce the role of the government, said Qu Jian, vice-director of the Shenzhen-based think tank China Development Institute.', 'While each city has to determine its own path, if Xi’an wants to follow that of Shenzhen, then the market needs to play a bigger role, Qu said. Innovation is also difficult for a country to complete on its own and is more efficient with international cooperation, he added.', 'A rough comparison of the two cities’ companies listed on the mainland A share market reflects the disparity in state dominance. About a third of roughly 40 Xi’an-based stocks were privately run, versus about two-thirds for well over 300 Shenzhen-based ones, according to data from Wind Information.', 'When describing Xi’an’s push for technological innovation, Mayor Li pointed to contributions from the city’s non-state and foreign businesses. He noted how last year a local solar company named Longi Green Energy Technology became the largest publicly listed company in Western China, and claimed it is the world’s largest manufacturer of monocrystalline silicon wafers.', 'Li added that Micron has invested a total $1 billion in its Xi’an facility, which accounts for 90% of the company’s global production capacity. Micron did not immediately respond to a request for comment.', 'However, looking more generally at China’s national history, multiple state-led efforts to build up the local semiconductor industry have struggled to take off, McKinsey analysts wrote back in 2014.', 'As an ancient capital of China, Xi’an also faces physical restrictions on urban expansion due to historical structures and artifacts, said Perry Wong, managing director of research at the Milken Institute. He expects the Chengdu-Chongqing urban area in southwestern China has a better chance at becoming a center for tech innovation.', 'Shenzhen is “also enjoying (a) high degree of policy freedom that no other city in China has,” Wong said, noting Xi’an would need to think creatively to mimic that kind of growth. “You cannot make a duplication of Shenzhen.”', 'One benefit Shenzhen has had is its proximity to Hong Kong, a semi-autonomous region just over the border that has enjoyed greater democratic freedoms and alignment with international business standards than the mainland.', 'As Beijing strengthens its control of the region, an inevitable choice for Hong Kong companies will be to work more with the mainland.', 'Hong Kong’s businesses can share their experience and talent to contribute to China’s development, said Tu Haiming, a Hong Kong member for a national political advisory body, called the National Committee of the Chinese People’s Political Consultative Conference. Tu spoke broadly of greater integration with the mainland in areas such as finance and academia.', 'When it comes to tech, that talent doesn’t need to look as far as Xi’an. Chinese semiconductor giant SMIC announced last month it was building a new $2.35 billion factory — in Shenzhen.']"
12,What investors should know ahead of Ford’s fourth-quarter earnings Thursday,2022-02-03T15:43:47+0000,"['DETROIT – Shares of Ford Motor led the automotive sector in growth last year, soaring by about 140% thanks to a restructuring plan led by CEO Jim Farley. But the stock has stalled so far this year, down by less than 1%.', 'Investors will decide Thursday whether Ford can get any of that momentum back when the Detroit automaker reports its fourth-quarter results and gives guidance for this year after the markets close.', 'Wall Street analysts estimate Ford will post a profit of 45 cents a share in adjusted earnings and a 6% rise in revenue from the previous year to $35.5 billion, according to Refinitiv estimates.', 'While investors will be monitoring Ford’s quarterly results, they’re more interested in the automaker’s guidance for this year as well as any progress or setbacks in Farley’s Ford+ turnaround plan.', 'Here’s more on those issues and other things investors should know about ahead of Ford’s fourth-quarter results after the markets close Thursday.', 'Much of Wall Street’s focus for Ford, like other automakers, will be on the company’s guidance for 2022.', 'Automakers continue to manage through a global shortage of semiconductor chips, which some experts don’t expect to return to normal levels until late this year, if not 2023. Ford and other automakers were forced to sporadically shutter plants and depleted vehicle inventories due to the lack of chips.', 'Ford’s crosstown rival General Motors surprised Wall Street by saying it expects its global production to increase by 25% to 30% in 2022 over last year. In October, Ford said it expected an increase in wholesale volumes, which are closely correlated with production, of just 10% in 2022.', 'GM reported full-year adjusted earnings of $14.3 billion, or $7.07 earnings per share, on revenue of $127 billion in 2021. ', 'Analysts estimate Ford this year will earn between $1.54 and $2.35 earnings per share on revenue of $147.5 billion, according to Refinitiv. That compares with expectations of between $1.72 and $2.05 EPS and revenue of $126.3 billion in 2021.', 'Ford announced several special items and financing adjustments last month for the fourth quarter that could skew earnings if analysts didn’t adjust their forecasts.', 'The most notable item was a fourth-quarter gain of $8.2 billion on Ford’s equity investment when EV start-up Rivian went public.', 'The company also reclassified a $900 million profit on its equity investment in Rivian to a special item that will impact the company’s full-year adjusted earnings guidance. It was previously between $10.5 billion and $11.5 billion. Excluding that gain, the company’s 2021 guidance would be between $9.6 billion and $10.6 billion.', 'Ford owns about 12% of Rivian. It also bought $415 million in Rivian’s convertible notes in July that become common stock in June 2022.', 'Ford has not announced plans to sell its stake in Rivian. It’s something being closely monitored by Wall Street.', 'Several analysts downgraded the shares ahead of the earnings release.', 'RBC Capital Markets analyst Joseph Spak said it would be “more challenging” for the shares after the significant runup last year when he downgraded the stock from outperform to sector perform on Jan. 14.', 'Jefferies analyst Philippe Houchois also downgraded the stock in mid-January with similar comments.', '“Ford is back, with strong earnings and a repaired balance sheet. Shares have also rerated on recovered earnings that now approach cyclical highs,” Houchois wrote in an investor note, adding “all that leaves limited scope for positive surprises.”', 'Ford is rated at overweight with a price target of $22.62 a share, according to average analyst ratings compiled by FactSet.', 'Ford’s EV plans could come with some surprises for investors in 2022.', 'Ford is reportedly spending an additional $10 billion to $20 billion over the next five to 10 years converting factories worldwide to electric-vehicle production from making gasoline-powered cars, Bloomberg News wrote Tuesday.', 'Adding another $10 billion to $20 billion over the next decade wouldn’t be outlandish given automakers across the globe are pledging billions of dollars for such efforts through 2025.', 'An increasingly important number being watched by Wall Street is Ford’s vehicle order bank, which was at 139,454 orders when the company reported its third-quarter earnings in October. That does not include its popular Bronco SUV, which has reservations in the tens of thousands, an official told CNBC last month.', 'Farley has said the company plans to move more toward an order-based system rather than the traditional buying process of dealers having large inventories of vehicles that customers choose from and drive off the lot.', 'Farley has said the change assists Ford’s profits, reduces costs and ensures customers get the vehicle they want.', '— CNBC’s Michael Bloom contributed to this report.']"
13,AWS growth accelerates in quarter marred by outages,2022-02-03T21:12:49+0000,"['Amazon said Thursday that growth accelerated at its cloud division, Amazon Web Services, in the fourth quarter, outperforming analysts’ predictions.', 'The performance at the 15-year-old market-leading provider of remote computing, storage and database services highlights a continuing shift away from traditional data center infrastructure at corporations, schools and governments.', 'The AWS business generated $17.78 billion in revenue in the quarter, according to a statement. That works out to a 39.5% year-over-year increase, and it’s more than the $17.37 billion consensus among analysts polled by StreetAccount. AWS revenue grew almost 39% in the third quarter.', 'The unit ended the quarter with $5.29 billion in operating income, up almost 49% and well above the $4.84 billion StreetAccount consensus.', '“On the growth rate, I think it’s a combination of things. We’ve been adding resources in sales and marketing over the last two years, and that is starting to pay off,” Brian Olsavsky, Amazon’s finance chief, said of revenue growth during a conference call with analysts.', 'While almost 13% of Amazon’s total revenue was derived from AWS, some 153% of the company’s overall operating income is attributable to cloud, partly because of operating losses in Amazon’s international segment.', 'It’s possible that more than half of AWS revenue comes from EC2, one of the first offerings and the one that provides fundamental virtual machines in the form of instances that third-party developers use. On Thursday Amazon revealed a new indicator of adoption of EC2 instances running on semiconductors it developed in-house, as opposed to instances sitting atop AMD or Intel silicon. The company said 48 of the top 50 EC2 customers by usage are drawing on AWS’ Arm-based Graviton2 chips, which first became available for preview in December 2019.', 'In the quarter AWS introduced a slew of new services at its Reinvent conference in Las Vegas, including a tool customers can use to manage private 5G networks. It also launched a region of data centers in Indonesia. But a series of AWS outages in December triggered issues for Coinbase, Disney+, Slack and other online services.', 'WATCH: AWS CEO: We see almost insatiable demand for new chips with even better price performance']"
14,"$25 billion wiped off Sony this year as chip crunch hits PlayStation 5, Microsoft competition heats up",2022-02-03T14:44:50+0000,"['Sony has faced a challenging start to the year with the Japanese giant cutting its sales forecasts for its flagship PlayStation 5 console and facing a bigger challenge from rival Microsoft.', 'Shares of the company are down about 13% since the beginning of the year with about $25.71 billion of value wiped off the company, according to Refinitiv data.', 'On Wednesday, Sony cut its full-year sales target for the PS5 from 14.8 million units to 11.5 million units. Sony sold 3.9 million PS5 consoles in the December quarter down from 4.5 million in the same quarter in 2020.', 'Sony, like many other consumer electronics companies and even automakers, is struggling with a global semiconductor shortage. While demand remains strong, Sony cannot produce enough consoles.', '“There is no demand issue whatsoever, only in the sense that demand is hopelessly above supply,” said Serkan Toto, CEO of Tokyo-based consultancy Kantan Games.', 'However, the downgrade prompted a 6% drop in Sony’s Japan-listed shares on Thursday. Sony’s gaming division posted revenue of 813.3 billion Japanese yen ($7.08 billion), a 8% year-on-year decline. The company also cut its sales forecast for the gaming division in its current fiscal year, which ends in March, by 170 billion yen to 2.73 trillion yen.', '“Sony didn’t release any big games in Q3 (December quarter). The company shifted all its firepower to this year. The market once again overreacts, the swings in stock price are way too harsh,” Toto said.', 'Sony is not the only company struggling with console production. On Thursday, Nintendo cut its forecast for sales of its Switch console.', 'Thursday’s stock drop came despite Sony posting an overall rise in revenue and operating profit in the entire quarter which was buoyed by success of its “Spider-Man: No Way Home” movie and its image sensor business.', 'Increasing competition with Microsoft in particular has also weighed on Sony’s stock this year. Last month, Microsoft announced plans to buy Call of Duty maker Activision for more than $68 billion in a bid to bolster its Xbox gaming unit.', 'Sony’s stock fell more than 12% after Microsoft’s proposal on fears the U.S. giant, which has trailed its Japanese rival for a long time, will now mount a serious challenge.', 'Days later, Sony agreed to buy Destiny and Halo developer Bungie for $3.6 billion.', 'Sony has been investing in so-called first-party content for several years, building out its own studios and acquiring other developers. That has allowed it to stay ahead of Microsoft.', 'Even though rising competition is clouding the stock however, Toto said that it doesn’t change Sony’s leadership position.', '“Even after the Activision announcement, Sony’s PlayStation 5 is still king in the ring, and there is no indication this will change anytime soon,” Toto said.', '“My outlook for Sony is they will be in much better shape going forward, looking at their product pipeline over the next weeks and their bullish plans for first-party as well as live-service games.”', 'Live-service games are those that have a long life span because developers continuously push new updates and content to players. Sony said this week that it plans to launch 10 new live-service games by March 2026.']"
15," These companies could benefit from Biden’s infrastructure push, Bank of America says",2021-03-30T13:28:22+0000,"['The expected multi-trillion infrastructure plan from President Joe Biden could provide another tailwind to semiconductor stocks, Bank of America said in a note to clients.', 'Biden is expected to unveil the first of a two-part spending proposal Wednesday, focused on infrastructure upgrades. That topic has been a major theme of Biden’s campaign and early presidency and the “Build Back Better” approach/']"
